,Unnamed: 0,divisions,title,abstract,subjects,publication,publisher,date,keywords,keyword,lang,text_stemmed
12259,12259,['FP11'],konservasi biodiversitas burung air studikasus di divisi i pt gunung madu plantations kabupaten lampung tengah provinsi lampung,"pt gunung madu plantations gmp merupakan perkebunanan yang memiliki banyak keanekaragaman hayati salah satunya yaitu burung air yang dijaga atau dilindungi oleh perusahaan divisi itebu merupakan salah satu areal yang di dalamnya terdapat berbagai jenis burung air pt gmp belum memiliki data base tentang keanekaragaman burung air pada areal tersebut sehingga penelitian ini penting dilaksanakan untuk menganalisis keanekaragaman jenis burung air pada areal divisi i pt gmp penelitian ini dilakukan pada bulan oktobernovember 2015 menggunakan metode kombinasititikhitung point count berdasarkan hasil penelitian ditemukan 9 spesies burung air dengan totalindividu 2138 individu yang berasal dari 4 famili yaitu ardeidae alcedinidae anatidae dan rallidae indekskeanekaragaman diversity index sebesar h 2,052 maka dari hasil tersebut tergolong dalam keanekaragaman yang sedang 1 h 3 serta dalam kondisi yang stabil dengan indekskesamarataan evenness index sebesar j 0,934 berarti 0,75 j 1 kata kunci burung air keanekaragaman titik hitung",['SD'],,,2016-10-08,,,id,konservasi biodiversitas burung air studikasus di divisi i pt gunung madu plantations kabupaten lampung tengah provinsi lampung pt gunung madu plantations gmp rupa perkebunanan yang milik banyak keanekaragaman hayati salah satu yaitu burung air yang jaga atau lindung oleh usaha divisi itebu rupa salah satu areal yang di dalam dapat bagai jenis burung air pt gmp belum milik data base tentang keanekaragaman burung air pada areal sebut sehingga teliti ini penting laksana untuk analis keanekaragaman jenis burung air pada areal divisi i pt gmp teliti ini laku pada bulan oktobernovember 2015 guna metode kombinasititikhitung point count dasar hasil teliti temu 9 spesies burung air dengan totalindividu 2138 individu yang asal dari 4 famili yaitu ardeidae alcedinidae anatidae dan rallidae indekskeanekaragaman diversity index besar h 2 052 maka dari hasil sebut golong dalam keanekaragaman yang sedang 1 h 3 serta dalam kondisi yang stabil dengan indekskesamarataan evenness index besar j 0 934 arti 0 75 j 1 kata kunci burung air keanekaragaman titik hitung
12260,12260,['FP5'],konservasi biodiversitas burung air studi kasus di divisi i pt gunung madu plantations kabupaten lampung tengah provinsi lampung,"pt gunung madu plantations gmp merupakan perkebunanan yang memiliki banyak keanekaragaman hayati salah satunya yaitu burung air yang dijaga atau dilindungi oleh perusahaan divisi itebu merupakan salah satu areal yang di dalamnya terdapat berbagai jenis burung air pt gmp belum memiliki data base tentang keanekaragaman burung air pada areal tersebut sehingga penelitian ini penting dilaksanakan untuk menganalisis keanekaragaman jenis burung air pada areal divisi i pt gmp penelitian ini dilakukan pada bulan oktobernovember 2015 menggunakan metode kombinasititikhitung point count berdasarkan hasil penelitian ditemukan 9 spesies burung air dengan totalindividu 2138 individu yang berasal dari 4 famili yaitu ardeidae alcedinidae anatidae dan rallidae indekskeanekaragaman diversity index sebesar h 2,052 maka dari hasil tersebut tergolong dalam keanekaragaman yang sedang 1 h 3 serta dalam kondisi yang stabil dengan indekskesamarataan evenness index sebesar j 0,934 berarti 0,75 j l",['SD'],,,2016-10-08,,,id,konservasi biodiversitas burung air studi kasus di divisi i pt gunung madu plantations kabupaten lampung tengah provinsi lampung pt gunung madu plantations gmp rupa perkebunanan yang milik banyak keanekaragaman hayati salah satu yaitu burung air yang jaga atau lindung oleh usaha divisi itebu rupa salah satu areal yang di dalam dapat bagai jenis burung air pt gmp belum milik data base tentang keanekaragaman burung air pada areal sebut sehingga teliti ini penting laksana untuk analis keanekaragaman jenis burung air pada areal divisi i pt gmp teliti ini laku pada bulan oktobernovember 2015 guna metode kombinasititikhitung point count dasar hasil teliti temu 9 spesies burung air dengan totalindividu 2138 individu yang asal dari 4 famili yaitu ardeidae alcedinidae anatidae dan rallidae indekskeanekaragaman diversity index besar h 2 052 maka dari hasil sebut golong dalam keanekaragaman yang sedang 1 h 3 serta dalam kondisi yang stabil dengan indekskesamarataan evenness index besar j 0 934 arti 0 75 j l
12261,12261,['FP5'],characterization of heat treated wood from korean white pine pinus koraiensis and royal paulownia paulownia tomentosa,,['SD'],,,2016-12-01,,,?,characterization of heat treated wood from korean white pine pinus koraiensis and royal paulownia paulownia tomentosa
12262,12262,['FP5'],potential application of juvenile woods from some tropical trees planted in indonesia,,['SD'],,,2016-10-20,,,?,potential application of juvenile woods from some tropical trees planted in indonesia
12263,12263,['FP5'],the physical and mechanical properties of sapwood and heartwood of okan wood treated at 160 180 200 and 220,,"['SD', 'TA']",,,2016-07-15,,,?,the physical and mechanical properties of sapwood and heartwood of okan wood treated at 160 180 200 and 220
12264,12264,['FP5'],effect of treatment duration and clamping on the properties of heattreated okan wood,lembar hasil penilaian sejawat sebidang peer review karya ilmiah jurnal ilmiah internasional,"['S1', 'SD']",BioResources,"North Carolina State University, USA",2016-10-07,,,id,effect of treatment duration and clamping on the properties of heattreated okan wood lembar hasil nilai jawat bidang peer review karya ilmiah jurnal ilmiah internasional
12265,12265,['FP5'],effect of treatment duration and clamping on the properties of heattreated okan wood,hasil pengecekan similarity index,['SD'],BioResources,"North Carolina State University, USA",2016-10-07,,,id,effect of treatment duration and clamping on the properties of heattreated okan wood hasil kece similarity index
12266,12266,['FP5'],heat treatment of okan wood cylicodiscus gabunensis effect of treatment duration and clamping on the color change physical and mechanical properties,,['SD'],,,2016-10-22,,,?,heat treatment of okan wood cylicodiscus gabunensis effect of treatment duration and clamping on the color change physical and mechanical properties
12267,12267,['FP5'],charcoal properties of four tropical woods in indonesia,,['SD'],,,2016-04-20,,,?,charcoal properties of four tropical woods in indonesia
12268,12268,['FP19'],laporan penelitian 2016 isolasi dan karakterisasi lignin dengan metode asam dan basa pada liquor tandan kosong kelapa sawit hasil pulping formacell tahun 1,penelitian dibiayai dikti dengan dana sebesar 60 juta,['S1'],,,2016,,,id,lapor teliti 2016 isolasi dan karakterisasi lignin dengan metode asam dan basa pada liquor tandan kosong kelapa sawit hasil pulping formacell tahun 1 teliti biaya dikti dengan dana besar 60 juta
12269,12269,['FP19'],laporan penelitian optimasi produksi surfaktan dari cpo parit dan minyak jelantah dari sawitdan uji efektifitasnya terhadap pendesakan minyak bumi tahun iii,"penelitian yang dibiayai tahun ke 3 hibah fundamental dari ristekdikti dengan biaya 67,5 juta",['S1'],,Ristekdikti,2016,,,id,lapor teliti optimasi produksi surfaktan dari cpo parit dan minyak jelantah dari sawitdan uji efektifitasnya hadap desa minyak bumi tahun iii teliti yang biaya tahun ke 3 hibah fundamental dari ristekdikti dengan biaya 67 5 juta
12270,12270,['FP19'],laporan penelitin isolasi dan karakterisasi lignin dengan metode asam dan basa pada liquor tandan kosong kelapa sawit hasil pulping formacell tahun 1,penelitian yang dibiayai ristek dikti dengan dana 60 juta,['S1'],,Ristekdikti,2016,,,id,lapor penelitin isolasi dan karakterisasi lignin dengan metode asam dan basa pada liquor tandan kosong kelapa sawit hasil pulping formacell tahun 1 teliti yang biaya ristek dikti dengan dana 60 juta
12271,12271,['FP19'],similarity pengaruh rasio mol reaktan dan lama sulfonasi terhadap karakteristik methyl ester sulfonic mes darimetil ester minyak sawit,"sebuah penelitian tentang proses produksi metil ester sulfonat menggunakan bahan baku metil ester minyak kelapa sawit dilakukan secara faktorial menggunakan nahso sebagai agen pensulfonasi dengan variasi rasio mol nahso 1 1,25 1 1,5 1 1,75 dan 1 2 dan lama sulfonasi dengan variasi 3 45 dan 6 jam hasil penelitian menunjukkan bahwa kondisi proses sulfonasi terbaik terdapat pada rasio metil ester dan mol reaktan 1 1,5 dan lama reaksi 4,5 jam dan suhu reaksi loooc yang menghasilkan nilai stabilitas emulsi 68,25% bilangan asam 2,57 mg koh g sampel bilangan iod 10,91 g 1od 100 g sampel konsentrasi metil ester sulfonat mes terbaik untuk menghasilkan 1ft terendah adalah 1% b b yaitu 1,806 dyne cm salinitas optimal terjadi pada 20.000 ppm nacl dengan nilai 1ft 0,0055 dyne cm 0,098 dyne cm",['S1'],,"Faculty of Agricultural Technology, Universitas Gadjah Mada, Yogyakarta",2016-02,,,id,similarity pengaruh rasio mol reaktan dan lama sulfonasi hadap karakteristik methyl ester sulfonic mes darimetil ester minyak sawit buah teliti tentang proses produksi metil ester sulfonat guna bahan baku metil ester minyak kelapa sawit laku cara faktorial guna nahso bagai agen pensulfonasi dengan variasi rasio mol nahso 1 1 25 1 1 5 1 1 75 dan 1 2 dan lama sulfonasi dengan variasi 3 45 dan 6 jam hasil teliti tunjuk bahwa kondisi proses sulfonasi baik dapat pada rasio metil ester dan mol reaktan 1 1 5 dan lama reaksi 4 5 jam dan suhu reaksi loooc yang hasil nilai stabilitas emulsi 68 25 bilang asam 2 57 mg koh g sampel bilang iod 10 91 g 1od 100 g sampel konsentrasi metil ester sulfonat mes baik untuk hasil 1ft rendah adalah 1 b b yaitu 1 806 dyne cm salinitas optimal jadi pada 20 000 ppm nacl dengan nilai 1ft 0 0055 dyne cm 0 098 dyne cm
12272,12272,['FP19'],formulasi surfaktan berbasis mes untuk aplikasi eor,"abstrak invensi ini berhubungan dengan produk dan metode pembuatan surfaktan metil ester sulfonat khususnya berhubungan dengan proses pembuatan metil ester sulfonat mes dari minyak cpo dan formulasinya sebagai surfaktan untuk eor surfaktan mes dipilih karena mempunyai nilai ift yang memadai dan indonesia kaya akan cpo sebagai bahan baku pembuatnya formulas dilakukan untuk meningkatkan kinerja surfaktan sehingga memenuhi kriteria pembuatan surfaktan mes menggunakan bahan baku metil ester dari cpo yang diperoleh dari minyak curah pada invensi ini dilakukan uji pengaruh suhu reaksi lama reaksi dan rasio mol pereaksi dengan menggunakan nahso3 sebagai bahan pensulfonasi proses formulasi menghasilkan formula surfaktan rpe811 dengan kinerja mampu menurunkan tegangan antar muka mencapai 10 3 dyne cm kompatibel dengan air formulasi nilai filtration ratio fr lebih kecil dari 1,2 dan stabil sampai 30 hari pada suhu 60 c pada uji core flooding dengan batuan standar bentheimer mampu menghasilkan minyak sebesar 16,51%",['S1'],,,2016-08,,,id,formulasi surfaktan bas mes untuk aplikasi eor abstrak invensi ini hubung dengan produk dan metode buat surfaktan metil ester sulfonat khusus hubung dengan proses buat metil ester sulfonat mes dari minyak cpo dan formulasi bagai surfaktan untuk eor surfaktan mes pilih karena punya nilai ift yang pada dan indonesia kaya akan cpo bagai bahan baku buat formulas laku untuk tingkat kerja surfaktan sehingga penuh kriteria buat surfaktan mes guna bahan baku metil ester dari cpo yang oleh dari minyak curah pada invensi ini laku uji pengaruh suhu reaksi lama reaksi dan rasio mol reaksi dengan guna nahso3 bagai bahan pensulfonasi proses formulasi hasil formula surfaktan rpe811 dengan kerja mampu turun tegang antar muka capai 10 3 dyne cm kompatibel dengan air formulasi nilai filtration ratio fr lebih kecil dari 1 2 dan stabil sampai 30 hari pada suhu 60 c pada uji core flooding dengan batu standar bentheimer mampu hasil minyak besar 16 51
12273,12273,['FP19'],aktivitas antioksidan dan sifat sensori dari nasi instan hasil hidrolisis pati yang diperkaya dengan ekstrak pegagan centella asiatica,"penelitian ini bertujuan mendapatkan konsentrasi optimal ekstrak pegagan yang ditambahkan dalam pembuatan nasi instan agar didapatkan tingkat hidrolisis pati rendah dengan aktivitas antioksidan yang tinggi dan sifat sensoriter baik hasil penelitian menunjukkan bahwa perlakuan terbaik yaitu beras instant dengan penambahan ekstrak daun pegagan sebesar 15% dengan karakteristik yaitu tingkat hidrolisis pati 15,50% aktivitas antioksidan 67,88% total fenol 0,27 ppm gae dan persentase uji sensori panelis suka terhadap aroma 12,22% rasa 24 44% warna 13,33% dan kepulenan 22,22%",['S1'],Jurnal Teknologi Industri & Hasil Pertanian,Jurusan Teknologi Hasil Pertanian Unila,2016-09,,,id,aktivitas antioksidan dan sifat sensor dari nasi instan hasil hidrolisis pati yang kaya dengan ekstrak pegagan centella asiatica teliti ini tuju dapat konsentrasi optimal ekstrak pegagan yang tambah dalam buat nasi instan agar dapat tingkat hidrolisis pati rendah dengan aktivitas antioksidan yang tinggi dan sifat sensoriter baik hasil teliti tunjuk bahwa laku baik yaitu beras instant dengan tambah ekstrak daun pegagan besar 15 dengan karakteristik yaitu tingkat hidrolisis pati 15 50 aktivitas antioksidan 67 88 total fenol 0 27 ppm gae dan persentase uji sensor panelis suka hadap aroma 12 22 rasa 24 44 warna 13 33 dan pulen 22 22
12274,12274,['FP15'],optimasi produksi pulp formacell dari tandan kosong kelapa sawit tkks dengan metode permukaan respon,"tandan kosong kelapa sawit tkks mengandung kadar selulosa yang cukup tinggi sehingga dapat dijadikan sebagai bahan baku alternatif produksi pulp salah satu proses produksi pulp ramah lingkungan yaitu dengan menggunakan campuran pelarut asam asetat dan asam formiat sebagai bahan pemasak yang disebut proses formacell penelitian ini bertujuan untuk mendapatkan model optimasi dari konsentrasi asam formiat konsentrasi hcl dan lama pemasakan untuk produksi pulp tkks konsentrasi pemasakan optimum terjadi pada konsentrasi asam formiat 32,74% konsentrasi hcl 0,079% dan lama pemasakan selama 1,71 jam dengan hasil optimum untuk produksi pulp tkks yaitu 78,37% selulosa 7,59% hemiselulosa 10,71% lignin dan 67,31% rendemen",['S1'],Reaktor,Departemen teknik Kimia Undip,2016-12,,,id,optimasi produksi pulp formacell dari tandan kosong kelapa sawit tkks dengan metode muka respon tandan kosong kelapa sawit tkks kandung kadar selulosa yang cukup tinggi sehingga dapat jadi bagai bahan baku alternatif produksi pulp salah satu proses produksi pulp ramah lingkung yaitu dengan guna campur larut asam asetat dan asam formiat bagai bahan masak yang sebut proses formacell teliti ini tuju untuk dapat model optimasi dari konsentrasi asam formiat konsentrasi hcl dan lama masa untuk produksi pulp tkks konsentrasi masa optimum jadi pada konsentrasi asam formiat 32 74 konsentrasi hcl 0 079 dan lama masa lama 1 71 jam dengan hasil optimum untuk produksi pulp tkks yaitu 78 37 selulosa 7 59 hemiselulosa 10 71 lignin dan 67 31 rendemen
12275,12275,['FKIP25'],dasardasar musik,buku ini terdiri atas 8 bab yaitu 1 elemen dasar musik 2 nada dan notasi 3 durasi dan ritme 4 teknik abaaba 5 paranada kunci dan aksidental 6 harmonisasi 7 nada dasar tonalitas dan 8 akor setiap bab dari buku ini terdiri dari 1 pendahuluan 2 penyajian materi 3 rangkuman 4 tugas dan pelatihan dan 5 rujukan setiap bab dalam buku ini bersifat teoritis dan operasional para pengampu matakuliah dasardasar musik dapat memberikan materi dan langsung memberikan praktik untuk lebih mengoptimalkan pemahaman mahasiswa istilah musik yang digunakan dalam buku ini mengacu pada istilah musik barat dan pengadaptasian dari gramatika musik barat yang berbahasa inggris musik barat sangat identik dengan gaya musik klasik yang dimulai dari gregorian sampai pada musik modern saat ini pembelajaran musik lebih dominant pada praktik dan pengaplikasian teori pada instrument musik melalui pembelajaran musik menggunakan kaidahkaidah yang benar dan terstruktur diharapkan mampu menumbuhkan nilainilai karakter misalnya kedisiplinan dalam membaca notasi,"['M1', 'ML', 'MT']",,Arttex,2016-08-08,Teori musik,,id,dasardasar musik buku ini diri atas 8 bab yaitu 1 elemen dasar musik 2 nada dan notasi 3 durasi dan ritme 4 teknik abaaba 5 paranada kunci dan aksidental 6 harmonisasi 7 nada dasar tonalitas dan 8 akor tiap bab dari buku ini diri dari 1 dahulu 2 saji materi 3 rangkum 4 tugas dan latih dan 5 rujuk tiap bab dalam buku ini sifat teoritis dan operasional para ampu matakuliah dasardasar musik dapat beri materi dan langsung beri praktik untuk lebih optimal paham mahasiswa istilah musik yang guna dalam buku ini acu pada istilah musik barat dan adaptasi dari gramatika musik barat yang bahasa inggris musik barat sangat identik dengan gaya musik klasik yang mulai dari gregorian sampai pada musik modern saat ini ajar musik lebih dominant pada praktik dan aplikasi teori pada instrument musik lalu ajar musik guna kaidahkaidah yang benar dan struktur harap mampu tumbuh nilainilai karakter misal disiplin dalam baca notasi
12276,12276,['FKIP25'],estetika seni,buku ini berisi tentang pemahaman estetika seni dari berbagai sudut pandang dan filsafat seni nilainilai keindahan konsep estetika teori perkembangan seni unsurunsur estetis dan orientasi seni di berbagai negara berdasarkan periodisasi substansi yang terdapat dalam buku ini diharapkan mampu menjawab persoalan akan kebutuhan referensi literatur baik dalam bidang kajian perkuliahan pengembangan keilmuwan maupun dalam penelitian seni dan pendidikan seni konten seni dalam buku ini juga dapat dikonsumsi secara luas oleh masyarakat umum pembuat kebijakan dan praktisi seni sebagai landasan berpikir orientasi estetika seni secara khusus dipaparkan dalam buku ini untuk mengetahui dan sekaligus memahami nilainilai estetis dalam sebuah karya seni pemahaman akan nilainilai estetis ini sangatlah penting karena sebuah pemahaman estetis yang baik akan mampu menghasilkan produk seni yang baik kritik seni juga sangat berkaitan erat dengan pengalaman estetis seseorang dalam berkarya sebuah produk seni yang baik berasal dari sebuah pemahaman estetis dan nilainilai estetis yang terkandung dalam sebuah seni baik itu seni musik seni btari seni rupa dan teater pertunjukan keseluruhan konsep pemahaman nilai tersebut harus dikaji secara mendalam sesuai dengan porsinya dalam penulisan buku ini isi dikaji sesuai dengan rantai perkembangan seni secara periodik penulis menggunakan gaya pemaparan yang sistematis dimulai dari ruang lingkup sampai kepada orientasi dan perkembangannya esensi dalam buku terlihat agak pragmatis namun tetap mengedepankan aspek seni dalam kacamata tekstual maupun kontekstual semoga buku ini dapat menjawab persoalan kebutuhan keilmuwan seni dan bermanfaat bagi seluruh mahasiswa pendidikan seni khususnya di wilayah provinsi lampung,"['N1', 'NX']",,Arttex,2016-09-13,Estetika seni,,id,estetika seni buku ini isi tentang paham estetika seni dari bagai sudut pandang dan filsafat seni nilainilai indah konsep estetika teori kembang seni unsurunsur estetis dan orientasi seni di bagai negara dasar periodisasi substansi yang dapat dalam buku ini harap mampu jawab soal akan butuh referensi literatur baik dalam bidang kaji kuliah kembang keilmuwan maupun dalam teliti seni dan didik seni konten seni dalam buku ini juga dapat konsumsi cara luas oleh masyarakat umum buat bijak dan praktisi seni bagai landas pikir orientasi estetika seni cara khusus papar dalam buku ini untuk tahu dan sekaligus paham nilainilai estetis dalam buah karya seni paham akan nilainilai estetis ini sangat penting karena buah paham estetis yang baik akan mampu hasil produk seni yang baik kritik seni juga sangat kait erat dengan alam estetis orang dalam karya buah produk seni yang baik asal dari buah paham estetis dan nilainilai estetis yang kandung dalam buah seni baik itu seni musik seni btari seni rupa dan teater tunjuk seluruh konsep paham nilai sebut harus kaji cara dalam sesuai dengan porsi dalam tulis buku ini isi kaji sesuai dengan rantai kembang seni cara periodik tulis guna gaya papar yang sistematis mulai dari ruang lingkup sampai kepada orientasi dan kembang esensi dalam buku lihat agak pragmatis namun tetap depan aspek seni dalam kacamata tekstual maupun kontekstual moga buku ini dapat jawab soal butuh keilmuwan seni dan manfaat bagi seluruh mahasiswa didik seni khusus di wilayah provinsi lampung
12277,12277,['FKIP25'],dasardasar musik,,"['M1', 'ML', 'MT']",,Arttex,2016,,,?,dasardasar musik
12278,12278,['FKIP1'],integrated learning of lampungnese tradition music,,['L1'],,,2016-11-02,,,?,integrated learning of lampungnese tradition music
12279,12279,['FKIP25'],estetika seni,,['NX'],,Arttex,2016,,,?,estetika seni
12280,12280,['FP25'],seleksi dan pengembangan padi berberas merah untuk lahan sawah dan gogo dari sumber genetik lokal,beras merupakan pangan pokok strategis bangsa indonesia dengan kebutuhan mencapai 28 juta ton per tahun walaupun beras merupakan pangan pokok strategis petani padi secara umum berada pada tangga demografiekonomi terbawah inovasi teknologi pada makalah ini ditujukan agar petani dapat mengembangkan benih sendiri seleksi terhadap benih induk dilakukan dengan cara mengoleksi plasma nutfah yang dikumpulkan dari sumber genetik lokal sgl in situ beras merah mempunyai indeks glisemik yang rendah sekitar 50 sehingga baik untuk dikonsumsi oleh penderita diabetes mellitus beras merah yang diseleksi dari padi sgl mempunyai aroma yang wangi dan rasa pulen hasil seleksi dan koleksi padi sgl berberas merah kemudian dapat diuji ketahanannya terhadap kekurangan air sehingga teradaptasi pada sawah miskin air atau bahkan dikembangkan di lahan gogo makalah ini membahas inovasi teknologi untuk menyeleksi padi berberas merah untuk budidaya sawah dan gogo darat budidaya padi beras merah di lahan gogo selain mengurangi kebutuhan air juga dapat dilakukan budidaya organik sehingga nilai jual berasnya menjadi lebih tinggi kata kunci padi berberas merah sumber genetik lokal indeks glisemik gogo organik,['S1'],,CIS School of Innovation,2016-10-21,,,id,seleksi dan kembang padi beras merah untuk lahan sawah dan gogo dari sumber genetik lokal beras rupa pangan pokok strategis bangsa indonesia dengan butuh capai 28 juta ton per tahun walaupun beras rupa pangan pokok strategis tani padi cara umum ada pada tangga demografiekonomi bawah inovasi teknologi pada makalah ini tuju agar tani dapat kembang benih sendiri seleksi hadap benih induk laku dengan cara koleksi plasma nutfah yang kumpul dari sumber genetik lokal sgl in situ beras merah punya indeks glisemik yang rendah sekitar 50 sehingga baik untuk konsumsi oleh derita diabetes mellitus beras merah yang seleksi dari padi sgl punya aroma yang wangi dan rasa pulen hasil seleksi dan koleksi padi sgl beras merah kemudian dapat uji tahan hadap kurang air sehingga adaptasi pada sawah miskin air atau bahkan kembang di lahan gogo makalah ini bahas inovasi teknologi untuk seleksi padi beras merah untuk budidaya sawah dan gogo darat budidaya padi beras merah di lahan gogo selain kurang butuh air juga dapat laku budidaya organik sehingga nilai jual beras jadi lebih tinggi kata kunci padi beras merah sumber genetik lokal indeks glisemik gogo organik
12281,12281,['FP2'],semua dalam setongkol jagung,semua dalam setongkol jagung,['S1'],,Business Inovation Center dan LIPI,2016,,,id,semua dalam tongkol jagung semua dalam tongkol jagung
12282,12282,['FP2'],semua dalam setongkol jagung,hasil teknologi adalah pengembangan benih jagung melalui teknik persilangan berulang multiple crossing berbagai genotipe lokal yang direkombinasikan di dalam satu tongkol selain itu benih ini dapat ditanam pada lahan yang sempit dengan hasil yang tetap menguntungkan karena sifatnya yang tangguh dan berumur pendek saat ini jagung yang telah berhasil direkombinasi adalah kuning nirmanis putih nirmanis kuning manis putih manis dan dwi warna manis untuk lini jagung manis direkombinasikan alel sugary shrunken sugary extender inovasi ini diharapkan mampu mendukung pemanfaatan lahan marjinal dan mengurangi ketergantungan petani terhadap benih impor,['S1'],,Business Inovation Center dan LIPI,2016-12-30,,,id,semua dalam tongkol jagung hasil teknologi adalah kembang benih jagung lalu teknik silang ulang multiple crossing bagai genotipe lokal yang rekombinasi di dalam satu tongkol selain itu benih ini dapat tanam pada lahan yang sempit dengan hasil yang tetap untung karena sifat yang tangguh dan umur pendek saat ini jagung yang telah hasil rekombinasi adalah kuning nirmanis putih nirmanis kuning manis putih manis dan dwi warna manis untuk lini jagung manis rekombinasi alel sugary shrunken sugary extender inovasi ini harap mampu dukung manfaat lahan marjinal dan kurang gantung tani hadap benih impor
