,Unnamed: 0,divisions,title,abstract,subjects,publication,publisher,date,keywords,keyword,lang,text_stemmed
6857,6857,['FP5'],persepsi masyarakat terhadap keanekaragaman burung di ekosistem mangrove pulau pahawang,"pulaupulau kecil merupakan ekosistem yang sangat rentan terhadap gangguan salah satunya disebabkan oleh peningkatan kegiatan pariwisata berupa alih fungsi hutan mangrove menjadi sarana pendukung pariwisata perubahan tersebut pada akhirnya akan mempengaruhi keragaman jenis burung yang ada tujuan penelitian yaitu menjelaskan persepsi masyarakat terhadap keanekaragaman burung penelitian ini menggunakan metode wawancara untuk mengetahui persepsi masyarakat dan metode line transect untuk mengetahui tingkat keanekaragaman burung data yang diperoleh kemudian dianalisis secara deskriptif dan indeks keragaman shannonwiener hasil penelitian menunjukkan persepsi masyarakat terhadap keanekaragaman burung termasuk dalam kategori sedang sebanyak 66,7% informan hanya tahu keanekaragaman spesies burung hal ini menunjukkan bahwa sebagian besar informan kurang memperhatikan keberadaan burung yang ada di lingkungannya nilai indeks shannonwiener h berada pada skala sedang yaitu 2.89 yang menunjukkan bahwa ekosistem hutan mangrove di pulau pahawang cenderung stabil karena masih mampu menyediakan sumber pakan bersarang istirahat dan berkembang biak serta tidak ditemukan dominasi dari jenis burung tertentu meskipun sebagian mengalami konversi lahan keberadaan spesies burung dapat dijadikan obyek wisata untuk mendapatkan tambahan pendapatan masyarakat kata kunci ekosistem mangrove keanekaragaman burung persepsi masyarakat pahawang pulaupulau kecil",['SD'],,,2019,,,id,persepsi masyarakat hadap keanekaragaman burung di ekosistem mangrove pulau pahawang pulaupulau kecil rupa ekosistem yang sangat rentan hadap ganggu salah satu sebab oleh tingkat giat pariwisata upa alih fungsi hutan mangrove jadi sarana dukung pariwisata ubah sebut pada akhir akan pengaruh ragam jenis burung yang ada tuju teliti yaitu jelas persepsi masyarakat hadap keanekaragaman burung teliti ini guna metode wawancara untuk tahu persepsi masyarakat dan metode line transect untuk tahu tingkat keanekaragaman burung data yang oleh kemudian analis cara deskriptif dan indeks ragam shannonwiener hasil teliti tunjuk persepsi masyarakat hadap keanekaragaman burung masuk dalam kategori sedang banyak 66 7 informan hanya tahu keanekaragaman spesies burung hal ini tunjuk bahwa bagi besar informan kurang perhati ada burung yang ada di lingkung nilai indeks shannonwiener h ada pada skala sedang yaitu 2 89 yang tunjuk bahwa ekosistem hutan mangrove di pulau pahawang cenderung stabil karena masih mampu sedia sumber pakan sarang istirahat dan kembang biak serta tidak temu dominasi dari jenis burung tentu meski bagi alami konversi lahan ada spesies burung dapat jadi obyek wisata untuk dapat tambah dapat masyarakat kata kunci ekosistem mangrove keanekaragaman burung persepsi masyarakat pahawang pulaupulau kecil
6858,6858,['FK1'],penyakit tiroid pada kehamilan diagnosis dan manajemen,penyakit tiroid dapat terjadi pada masa kehamilan skrining dapat dilakukan pada ibu dengan risiko tinggi terjadi gangguan tiroid sehingga diagnose dapat ditegakkan sejak dini penyakit tiroid dapat berupa tingginya kadar hormone tiroid hipertiroid atau rendahnya hormone tiroid hipotiroid hormon tiroid bermanfaat bagi janin maupun maternal abortus persalinan prematur preeklampsia tiroiditis pascapersalinan pada maternal dan penurunan iq pada anakanak semuanya merupakan sekuele disfungsi tiroid maternal sehingga kontrol yang baik pada ibu dengan hipertiroid harus dilakukan sejak dini pada kasus hipertiroid propiltiourasil merupakan pilihan obat pada trimester pertama dan methimazole digunakan bagi trimester kedua pada hipotiroid pemberian levotiroksin ditujukan untuk mencapai kadar hormone tiroid yang optimal kata kunci diagnosis hipertiroid hypothiroid kehamilan skrining penyakit tiroid,['RG'],"MEDULA, medicalprofession journal of lampung university",fakultas kedokteran universitas lampung,2019-07,,,id,sakit tiroid pada hamil diagnosis dan manajemen sakit tiroid dapat jadi pada masa hamil skrining dapat laku pada ibu dengan risiko tinggi jadi ganggu tiroid sehingga diagnose dapat tegak sejak dini sakit tiroid dapat upa tinggi kadar hormone tiroid hipertiroid atau rendah hormone tiroid hipotiroid hormon tiroid manfaat bagi janin maupun maternal abortus salin prematur preeklampsia tiroiditis pascapersalinan pada maternal dan turun iq pada anakanak semua rupa sekuele disfungsi tiroid maternal sehingga kontrol yang baik pada ibu dengan hipertiroid harus laku sejak dini pada kasus hipertiroid propiltiourasil rupa pilih obat pada trimester pertama dan methimazole guna bagi trimester dua pada hipotiroid beri levotiroksin tuju untuk capai kadar hormone tiroid yang optimal kata kunci diagnosis hipertiroid hypothiroid hamil skrining sakit tiroid
6859,6859,['FMIPA2'],survei serologis toxoplasmosis pada ternak kambing capra sp di desa purwosari metro utara dengan metode tomat toxoplasma modified aglutination test,"toxoplasmosis merupakan penyakit zoonosis yang disebabkan oleh protozoa parasit yaitu toxoplasma gondii penularan toxoplasmosis dapat terjadi melalui infeksi langsung yaitu ketika manusia memakan daging dari hewan yang terinfeksi dan dimakan dalam keadaan setengah matang kambing adalah salah satu hewan yang sering diolah setengah matang seperti sate di kota bandar lampung angka prevalensi toxoplasmosis pada kambing yang beredar di masyarakat mencapai angka 60% penelitian ini bertujuan untuk mengetahui prevalensi dan tingkat infeksi toxoplasmosis pada ternak kambing di desa purwosari metro utara penelitian ini dilakukan pada november sampai desember 2018 jenis penelitian ini bersifat deskriptif menggunakan metode tomat hasil penelitian diperoleh prevalensi toxoplasmosis pada kambing di desa purwosari metro utara sebesar 96,67% dari keseluruhan 30 sampel sedangkan yang terkena infeksi lama kronis toxoplasmosis berjumlah 93,33% 28 dari 30 sampel sedangkan yang terkena infeksi baru akut toxoplasmosis berjumlah 66,67% 20 dari 30 sampel kata kunci capra sp metode tomat toxoplasmosis",['QL'],Jurnal Ilmiah Perternakan Terpadu,Jurusan Peternakan Unila,2019,,,id,survei serologis toxoplasmosis pada ternak kambing capra sp di desa purwosari metro utara dengan metode tomat toxoplasma modified aglutination test toxoplasmosis rupa sakit zoonosis yang sebab oleh protozoa parasit yaitu toxoplasma gondii tular toxoplasmosis dapat jadi lalu infeksi langsung yaitu ketika manusia makan daging dari hewan yang infeksi dan makan dalam ada tengah matang kambing adalah salah satu hewan yang sering olah tengah matang seperti sate di kota bandar lampung angka prevalensi toxoplasmosis pada kambing yang edar di masyarakat capai angka 60 teliti ini tuju untuk tahu prevalensi dan tingkat infeksi toxoplasmosis pada ternak kambing di desa purwosari metro utara teliti ini laku pada november sampai desember 2018 jenis teliti ini sifat deskriptif guna metode tomat hasil teliti oleh prevalensi toxoplasmosis pada kambing di desa purwosari metro utara besar 96 67 dari seluruh 30 sampel sedang yang kena infeksi lama kronis toxoplasmosis jumlah 93 33 28 dari 30 sampel sedang yang kena infeksi baru akut toxoplasmosis jumlah 66 67 20 dari 30 sampel kata kunci capra sp metode tomat toxoplasmosis
6860,6860,,photovoltaic emulator berbasis embedded system pada jaringan listirk cerdas,"photovoltaic emulator merupakan alat yang dirancang untuk meniru karakteristik tegangan dan arus keluaran dari pembangkit listrik tenaga surya penelitian ini bertujuan untuk merancang dan mengimplementasikan photovoltaic emulator dengan menggunakan rangkaian elektronika daya dengan pemrograman pemodelan panel surya penyinaran mataharai dan suhu harian digantikan mikrokontroler dengan chip atmega 328p sebagai komponen pengendali dan pemantau berdasarkan hasil pengujian photovoltaic emulator yang dibuat dalam studi ini terbukti dapat meniru karakteristik tegangan dan arus keluaran dari panel surya dengan masukan irradiance dan suhu harian pada suatu daerah pengukuran menggunakan sensor arus dengan ratarata galat senilai 2.601% dan sensor tegangan dengan ratarata galat senilai 1,971% dibandingkan dengan pengukuran multimeter persentase kemiripan karakteristik keluaran photovoltaic emulator dengan panel surya yang ditiru yaitu 95.13% setiap data disimpan berdasarkan waktu pada secure digital card melalui datalogger",['T1'],ELECTRICIAN  Jurnal Rekayasa dan Teknologi Elektro,Universitas Lampung,2019-05-01,,,id,photovoltaic emulator bas embedded system pada jaring listirk cerdas photovoltaic emulator rupa alat yang rancang untuk tiru karakteristik tegang dan arus keluar dari bangkit listrik tenaga surya teliti ini tuju untuk rancang dan implementasi photovoltaic emulator dengan guna rangkai elektronika daya dengan pemrograman model panel surya sinar mataharai dan suhu hari ganti mikrokontroler dengan chip atmega 328p bagai komponen kendali dan pantau dasar hasil uji photovoltaic emulator yang buat dalam studi ini bukti dapat tiru karakteristik tegang dan arus keluar dari panel surya dengan masuk irradiance dan suhu hari pada suatu daerah ukur guna sensor arus dengan ratarata galat nila 2 601 dan sensor tegang dengan ratarata galat nila 1 971 banding dengan ukur multimeter persentase mirip karakteristik keluar photovoltaic emulator dengan panel surya yang tiru yaitu 95 13 tiap data simpan dasar waktu pada secure digital card lalu datalogger
6861,6861,['FKIP1'],pembelajaran menulis teks deskripsi bahasa prancis siswa kelas xi ips 3 sma negeri 9 bandarlampung tahun pelajaran 2017 2018,tujuan penelitian ini adalah untuk mendeskripsikan pembelajaran menulis teks deskripsi bahasa prancis pada siswa kelas xi ips 3 sma negeri 9 bandarlampung tahun pelajaran 2017 2018 metode penelitian yang digunakan adalah deksriptif kualitatif sumber data pada penelitian ini ialah kegiatan pembelajaran menulis teks deskripsi bahasa prancis teknik pengumpulan data pada penelitian ini dilakukan dengan caraobservasi dokumentasi dan wawancara hasil penelitian menunjukkan guru melakukan tiga tahap kegiatan dalam pembelajaran ketiga kegiatan tersebut mencakup 1 perencanaan yaitu guru membuat rpp sesuai dengan permendikbud 2 pelaksanaan yang melibatkan keaktifan siswa dan guru 3 penilaian pembelajaran guru menggunakan teknik tes dengan bentuk soal essai pada perencanaan guru telah menyusun rpp dengan lengkap berdasarkan kd dan indikator pelaksanaan pembelajaran yang dilakukan guru meliputikegiatan pendahuluan inti dan penutup yang melibatkan kegiatan guru dan siswa sesuai dengan apkg untuk penilaian pembelajaran menulis teks deskripsi guru menggunakan jenis tes tertulis dalam bentuk tes uraian essai kata kunci menulis pembelajaran bahasa prancis teks deskripsi,"['L1', 'PC']",Pranala,Pendidikan Bahasa Prancis Unila,2019-01,,,id,ajar tulis teks deskripsi bahasa prancis siswa kelas xi ips 3 sma negeri 9 bandarlampung tahun ajar 2017 2018 tuju teliti ini adalah untuk deskripsi ajar tulis teks deskripsi bahasa prancis pada siswa kelas xi ips 3 sma negeri 9 bandarlampung tahun ajar 2017 2018 metode teliti yang guna adalah deksriptif kualitatif sumber data pada teliti ini ialah giat ajar tulis teks deskripsi bahasa prancis teknik kumpul data pada teliti ini laku dengan caraobservasi dokumentasi dan wawancara hasil teliti tunjuk guru laku tiga tahap giat dalam ajar tiga giat sebut cakup 1 rencana yaitu guru buat rpp sesuai dengan permendikbud 2 laksana yang libat aktif siswa dan guru 3 nilai ajar guru guna teknik tes dengan bentuk soal essai pada rencana guru telah susun rpp dengan lengkap dasar kd dan indikator laksana ajar yang laku guru meliputikegiatan dahulu inti dan tutup yang libat giat guru dan siswa sesuai dengan apkg untuk nilai ajar tulis teks deskripsi guru guna jenis tes tulis dalam bentuk tes urai essai kata kunci tulis ajar bahasa prancis teks deskripsi
6862,6862,['FP24'],komposisi biopestisida untuk mengendalikan hama dan penyakit tanaman,invensi ini merupakan pembuatan formulasi simpan agensia hayati pengendali hama dan penyakit tumbuhan agensia hayati yang diformulasikan adalah konsorsium 4 isolat jamur aspergillus spp dan 6 isolat jamur talaromyces spp yang mempunyai multi peranan yang menguntungkan antara lain sebagai pengendali hama pengendali penyakit meningkatkan pertumbuhan tanaman pelarut fosfat dan pendegradasi kitin selama ini formulasi agensia hayati yang berasal dari jamur aspergillus spp dan talaromyces spp belum pernah diformulasikan jamur aspergillus spp dan talaromyces spp yang digunakan merupakan isolat jamur hasil skrining yang diisolasi dari risosfer tanaman nanas jagung dan cabai di propinsi lampung formulasi simpan dibuat dalam dalam bentuk pelet kering bahan pembawa yang digunakan berasal dari ekstrak pupuk kandang tepung jagung bekatul dan suspensi 2% gula permohonan,['S1'],,,2019-03-12,,,id,komposisi biopestisida untuk kendali hama dan sakit tanam invensi ini rupa buat formulasi simpan agensia hayati kendali hama dan sakit tumbuh agensia hayati yang formulasi adalah konsorsium 4 isolat jamur aspergillus spp dan 6 isolat jamur talaromyces spp yang punya multi peran yang untung antara lain bagai kendali hama kendali sakit tingkat tumbuh tanam larut fosfat dan degradasi kitin lama ini formulasi agensia hayati yang asal dari jamur aspergillus spp dan talaromyces spp belum pernah formulasi jamur aspergillus spp dan talaromyces spp yang guna rupa isolat jamur hasil skrining yang isolasi dari risosfer tanam nanas jagung dan cabai di propinsi lampung formulasi simpan buat dalam dalam bentuk pelet kering bahan bawa yang guna asal dari ekstrak pupuk kandang tepung jagung bekatul dan suspensi 2 gula mohon
6863,6863,['FP24'],komposisi biopestisida untuk mengendalikan hama dan penyakit tanaman,invensi ini mengenai komposisi biopestisida yang terdiri dari 20% w ekstrak pupuk kandang 10% w tepung jagung 10% w bekatul 10% v suspensi aspergillus spp 10% v suspensi 25 talaromyces spp 20% v suspensi gula 2% dan 20% v air destilasi untuk mengendalikan hama dan penyakit tanaman dengan adanya invensi ini didapatkan komposisi biopestisida yang mempunyai multi peranan yang menguntungkan karena dapat mengendalikan hama dan penyakit dalam satu aplikasi,['S1'],,,2019-03-12,,,id,komposisi biopestisida untuk kendali hama dan sakit tanam invensi ini kena komposisi biopestisida yang diri dari 20 w ekstrak pupuk kandang 10 w tepung jagung 10 w bekatul 10 v suspensi aspergillus spp 10 v suspensi 25 talaromyces spp 20 v suspensi gula 2 dan 20 v air destilasi untuk kendali hama dan sakit tanam dengan ada invensi ini dapat komposisi biopestisida yang punya multi peran yang untung karena dapat kendali hama dan sakit dalam satu aplikasi
6864,6864,['FP24'],penilaian paten komposisi biopestisida untuk mengendalikan hama dan penyakit,penilaian sertifikat paten oleh tiga revewer dari dalam dan luar unila,['S1'],,Kemenkumham RI,2019,,,id,nilai paten komposisi biopestisida untuk kendali hama dan sakit nilai sertifikat paten oleh tiga revewer dari dalam dan luar unila
6865,6865,['FP24'],lembar hasil penilaian artikel influence of culture medium on the sporulation and viability of aspergilus spp and talaromyces spp entomopathogenic fungi,lembar hasil penilaian artikel jurnal ilmiah oleh tiga revewer dari dalam dan luar unila,['S1'],,Jurusan Proteksi Tanaman FP Unila,2019,,,id,lembar hasil nilai artikel influence of culture medium on the sporulation and viability of aspergilus spp and talaromyces spp entomopathogenic fungi lembar hasil nilai artikel jurnal ilmiah oleh tiga revewer dari dalam dan luar unila
6866,6866,['FP1'],kesiapan petani kelapa sawit menghadapi sertifikasi ispo indonesia sustainable palm oil kasus perkebunan sawit rakyat di propinsi lampung,sertifikasi kelapa sawit di indonesia dilakukan berlandaskan permentan no 11 tahun 2015 penerapan sertifikasi ispo indonesia sustainable palm oil bagi pelaku usaha kelapa sawit bersifat mandatory bagi pabrik kelapa sawit pk untuk memproduksi produk kelapa sawit ks cpo dan turunannya ispo secara sukarela bagi petani ks mandiri informasi terkait respon kesiapan petani ks terhadap tuntutan penerapan sertifikasi ispo masih sangat terbatas penelitian ini bertujuan untuk 1 mengkaji persepsi petani mandiri petani kemitraan terhadap pks tersertifikasi 2 mengkaji kesiapan petani mandiri dan petani kemitraan ketika pks telah disertifikasi 3 menganalisis praktek pengelolaan usaha kelapa sawit saat ini dengan standar gap ispo metode penelitian yang digunakan adalah metode survei penentuan lokasi penelitian dilakukan di enam kabupaten di provinsi lampung sentra kelapa sawit rakyat yaitu kabupaten tulang bawang mesuji way kanan dan lampung tengah lampung selatan dan pesisir barat dua kecamatan dipilih kabupaten sebagai perwakilan potensi usahatani kelapa sawit dengan populasi sebanyak 93.937 kepala keluarga kk sampel penelitian sebear 1.000 rumah tangga petani kelapa sawit secara proporsional pola pengelolaan usahatani kelapa sawit dibedakan menjadi petani mandiri dan petani mitra plasma analisis data mengunakan statistik deskriptif dan cross tabulation berdasarkan hasil pembahasan disimpulkan bahwa 1 petani mandiri dan mitra plasm 90% merespon positif setuju pks yang disertifikasi demikian halnya dengan petani mitra plasma juga menyatakan persetujuan terhadap pks yang telah disertifikasi 2 pengelolaan usaha perkebunan rakyat ks petani mitra perusahaan dan petani mandiri menunjukkan tingkat kesiapan yang berbeda dengan petani mitra plasma petani mitra plasma memiliki kondisi siap mengikuti sertifikasi ks lebih tinggi dari petani mandiri 3 tingkat penerapan gap di level kebun dinilai berdasarkan ketersediaan dokumentasi praktik gap dari pembenihan penanganan dan asal benih penanaman hingga pengangkutan menunjukkan kondisi berbeda antara pengusahaan ks mandiri dengan petani mitra plasma jumlah petani mitra plasma yang menerapkan praktik gap dan memiliki rekaman dokumen penerapan gap lebih banyak 30% dibandingkan dengan petani mandiri 10% key words ispo sertifikasi produksi berkelanjutan,['AC'],,,2019-11-06,,,id,kesiap tani kelapa sawit hadap sertifikasi ispo indonesia sustainable palm oil kasus kebun sawit rakyat di propinsi lampung sertifikasi kelapa sawit di indonesia laku landas tan no 11 tahun 2015 terap sertifikasi ispo indonesia sustainable palm oil bagi laku usaha kelapa sawit sifat mandatory bagi pabrik kelapa sawit pk untuk produksi produk kelapa sawit ks cpo dan turun ispo cara sukarela bagi tani ks mandiri informasi kait respon kesiap tani ks hadap tuntut terap sertifikasi ispo masih sangat batas teliti ini tuju untuk 1 kaji persepsi tani mandiri tani mitra hadap pks sertifikasi 2 kaji kesiap tani mandiri dan tani mitra ketika pks telah sertifikasi 3 analis praktek kelola usaha kelapa sawit saat ini dengan standar gap ispo metode teliti yang guna adalah metode survei tentu lokasi teliti laku di enam kabupaten di provinsi lampung sentra kelapa sawit rakyat yaitu kabupaten tulang bawang mesuji way kanan dan lampung tengah lampung selatan dan pesisir barat dua camat pilih kabupaten bagai wakil potensi usahatani kelapa sawit dengan populasi banyak 93 937 kepala keluarga kk sampel teliti sebear 1 000 rumah tangga tani kelapa sawit cara proporsional pola kelola usahatani kelapa sawit beda jadi tani mandiri dan tani mitra plasma analisis data mengunakan statistik deskriptif dan cross tabulation dasar hasil bahas simpul bahwa 1 tani mandiri dan mitra plasm 90 merespon positif tuju pks yang sertifikasi demikian hal dengan tani mitra plasma juga nyata tuju hadap pks yang telah sertifikasi 2 kelola usaha kebun rakyat ks tani mitra usaha dan tani mandiri tunjuk tingkat kesiap yang beda dengan tani mitra plasma tani mitra plasma milik kondisi siap ikut sertifikasi ks lebih tinggi dari tani mandiri 3 tingkat terap gap di level kebun nilai dasar sedia dokumentasi praktik gap dari benih tangan dan asal benih tanam hingga angkut tunjuk kondisi beda antara usaha ks mandiri dengan tani mitra plasma jumlah tani mitra plasma yang terap praktik gap dan milik rekam dokumen terap gap lebih banyak 30 banding dengan tani mandiri 10 key words ispo sertifikasi produksi lanjut
6867,6867,['FH3'],analisis hukum terhadap perluasan tindakan kedokteran yang dilakukan dokter terhadap pasien,perluasan tindakan kedokteran hanya dapat dilakukan apabila terdapat indikasi kemungkinan dilakukannya perluasan tindakan kedokteran dan yang tidak terdapat indikasi sebelumnya tetapi dilakukan untuk tujuan menyelamatkan jiwa pasien penelitian ini bertujuan untuk menganalisis mengenai alasan hukum dasar hukum dan akibat hukum dilakukannyaperluasan tindakan kedokteran jenis penelitian yang digunakan dalam penelitian ini adalah penelitian hukum normatif dengan tipe penelitian deskriptif tipe pendekatan masalah dalam penelitian ini adalah normatif yuridis data yang digunakan dalam penelitian ini adalah data sekunder yang terdiri dari bahan hukum primer bahan hukum sekunder dan bahan hukum tersier yang kemudian dianalisis secara kualitatif hasil penelitian menunjukan bahwa terdapat 2 dua alasan hukum dilakukannya perluasan tindakan kedokteran diantaranya yaitu adanya indikasi kemungkinan dilakukannya perluasan tindakan kedokteran yang ditemukan pada saat pembahasan mengenai diagnosa pasiensertabaru terindikasi perlunya dilakukannya perluasan tindakan kedokteran pada saat pembedahan medis dilakukan dasar hukum pada perluasan tindakan kedokteran berdasarkan pasal 11 dan pasal 12 peraturan menteri kesehatan nomor 290 tahun 2008 tentang persetujuan tindakan kedokteran adapun akibat hukum yang ditimbulkan pada perluasan tindakan kedokteran ini adalah dokter bertanggung jawab atas semua tindakan medis yang dilakukan kemudian pasien berdasarkan informed consent harus menerima konsekuensi atas semua tindakan medis yang akan dilakukan dokter kepada dirinya,['K1'],Pactum Law Journal,fakultas hukum,2019-04,"Perluasan  Tindakan  Kedokteran, Informed  Consent,  Tindakan Medis",,id,analisis hukum hadap luas tindak dokter yang laku dokter hadap pasien luas tindak dokter hanya dapat laku apabila dapat indikasi mungkin laku luas tindak dokter dan yang tidak dapat indikasi belum tetapi laku untuk tuju selamat jiwa pasien teliti ini tuju untuk analis kena alas hukum dasar hukum dan akibat hukum dilakukannyaperluasan tindak dokter jenis teliti yang guna dalam teliti ini adalah teliti hukum normatif dengan tipe teliti deskriptif tipe dekat masalah dalam teliti ini adalah normatif yuridis data yang guna dalam teliti ini adalah data sekunder yang diri dari bahan hukum primer bahan hukum sekunder dan bahan hukum tersier yang kemudian analis cara kualitatif hasil teliti tunjuk bahwa dapat 2 dua alas hukum laku luas tindak dokter antara yaitu ada indikasi mungkin laku luas tindak dokter yang temu pada saat bahas kena diagnosa pasiensertabaru indikasi perlu laku luas tindak dokter pada saat bedah medis laku dasar hukum pada luas tindak dokter dasar pasal 11 dan pasal 12 atur menteri sehat nomor 290 tahun 2008 tentang tuju tindak dokter adapun akibat hukum yang timbul pada luas tindak dokter ini adalah dokter tanggung jawab atas semua tindak medis yang laku kemudian pasien dasar informed consent harus terima konsekuensi atas semua tindak medis yang akan laku dokter kepada diri
6868,6868,['FP5'],karakteristik ekologi lanskap hutan lindung bukit rigis studi kasus areal kelola kelompok hutan kemasyarakatan hkm binawana,"lanskap dikenal dengan karakteristik bentang alam yang didominasi oleh hutan yang wilayahnya meliputi dari daerah hulu hingga ke bagian hilir dari suatu daerah aliran sungai das diperlukan model pengelolaan lanskap yang baik dengan memperhatikan fungsi hutan lindung tata air dan pengelolaan yang berkelanjutan sebab kelestarian hutan tidak hanya ditentukan oleh pilihan sistem silvikultur saja melainkan kekompakan fungsi hutan sebagai suatu kesatuan ekosistem penelitian ini bertujuan untuk menganalisis karakteristik ekologi lanskap hutan lindung register 45b bukit rigis di areal kelola kelompok hkm binawana penelitian ini menggunakan metode analisa gis dan deskripsi kualitatif berdasarkan hasil penelitian diketahui bahwa karakteristik ekologi hutan lindung bukit rigis dengan 27,58% tutupan hutan ada lebih dari tiga stratifikasi tajuk dan jumlah jenis pohon yang cukup tinggi dengan 3 jenis mayoritas spesies di lahan hkm binawana yaitu kemit sarcosperma paniculatum randu ceiba pentandra dan cendana santalum album selain itu diperlukan penyuluhan terkait pemahaman pengelolaan hkm yang memperhatikan lingkungan ekologis bagi kelestarian hkm maupun hutan lindung tersebut",['SD'],,,2019,,,id,karakteristik ekologi lanskap hutan lindung bukit rigis studi kasus areal kelola kelompok hutan masyarakat hkm binawana lanskap kenal dengan karakteristik bentang alam yang dominasi oleh hutan yang wilayah liput dari daerah hulu hingga ke bagi hilir dari suatu daerah alir sungai das perlu model kelola lanskap yang baik dengan perhati fungsi hutan lindung tata air dan kelola yang lanjut sebab lestari hutan tidak hanya tentu oleh pilih sistem silvikultur saja lain kompak fungsi hutan bagai suatu satu ekosistem teliti ini tuju untuk analis karakteristik ekologi lanskap hutan lindung register 45b bukit rigis di areal kelola kelompok hkm binawana teliti ini guna metode analisa gis dan deskripsi kualitatif dasar hasil teliti tahu bahwa karakteristik ekologi hutan lindung bukit rigis dengan 27 58 tutup hutan ada lebih dari tiga stratifikasi tajuk dan jumlah jenis pohon yang cukup tinggi dengan 3 jenis mayoritas spesies di lahan hkm binawana yaitu kemit sarcosperma paniculatum randu ceiba pentandra dan cendana santalum album selain itu perlu suluh kait paham kelola hkm yang perhati lingkung ekologis bagi lestari hkm maupun hutan lindung sebut
