,Unnamed: 0,divisions,title,abstract,subjects,publication,publisher,date,keywords,keyword,lang,text_stemmed
2629,2629,['FT7'],kajian numerik karakteristik perpindahan panas konveksi fluida organik pada kondisi tekanan superkritis,"proses perpindahan panas yang terjadi dalam pemindah panas merupakan proses perpindahan energi dari sumber energi ke fluida kerja organik yang digunakan sebagai fluida kerja untuk menggerakkan turbin ekspander guna menghasilkan daya pada tekanan superkritis proses perpindahan panas ini lebih baik dibandingankan dengan pada tekanan subkritis dalam desain pemindah panas perlu diketahui karakteristik perpindahan panas fluida kerja untuk mendapatkan kondisi yang optimal untuk kondisi subkritis karakteristik perpindahan panas ini telah tersedia untuk digunakan tidak demikian halnya dengan kondisi superkritis proses perpindahan panas pada kondisi superkritis sangat komplek dan rumit dikarenakan tajamnya perubahan sifatsifat termodinamika dan fisik fluida pada kondisi ini oleh karena itu penelitian ini menginvestigasi karakteristik perpindahan panas konveksi paksa dari fluida superkritis yakni propana pada tekanan di atas tekanan kritisnya atau pada tekanan superkritisnya dengan tersedianya karakteristik perpindahan panas yang tepat untuk suatu fluida organik tertentu pada kondisi yang spesifik maka dapat dihasilkan pemindah panas yang efisien sehingga dapat meningkatkan prestasi kinerja dan nilai ekonomi dari sistem pembangkit siklus rankine organik superkritis dalam penelitian ini juga dilakukan perumusan korelasi bilangan nusselt baru yang mampu secara akurat memprediksi nilai koefisien perpindahan panas konveksi paksa penelitian ini dilakukan secara numerik nilai htc dan karateristik perpindahan panasnya diperoleh melalui simulasi cfd dengan model turbulensi k proses perpindahan panas dari oli termal yang mengalir dalam annulus he tipe pipa ganda aliran berlawanan arah ke aliran propana dalam pipa berdiameter 8 mm dimodelkan dengan model 2d menggunakan sumbu simetris hasil perhitungan htc dari simulasi cfd ini digunakan sebagai data untuk merumuskan korelasi bilangan nusselt baru menggunakan metoda curve fitting selanjutnya nilai htc yang dihitung dari korelasi bilangan nusselt baru di validasi menggunakan data htc dari simulasi cfd yang telah divalidasi dengan data eksperimental yang berupa grafik dan juga divalidasi dari hasil hitungan menggunakan korelasi lain yang telah dipublikasi hasil yang didapat dari studi teoretis adalah bahwa untuk sumber energi rendah kalori r-290 menghasilkan kerja bersih isentropis yang lebih baik dari r-1270 r-134a dan r-227ea baik untuk tekanan subkritis tekanan kritis maupun tekanan superkritis namun efisiensinya masih di bawah r-134a korelasi bilangan nusselt baru yang mampu untuk memprediksi nilai koefisien perpindahan panas konveksi pada tekanan superkritis telah didapatkan dalam penelitian ini korelasi ini memiliki nilai kesalahan standar estimasi dan koefisien korelasi sebesar sy x 0,0333 dan r 0,9875 dan telah divalidasi menggunakan persamaan korelasi yang telah dipublikasikan dan datadata hasil simulasi cfd peningkatan tekanan superkritis akan mereduksi kenaikan dan penurunan koefisien perpindahan panas konveksi paksa di sekitar temperatur pseudocritical propana sedangkan peningkatan fluks massa akan meningkatkan htc peningkatan fluks massa juga mengurangi temperatur propana keluar supercritical heat exchanger she perbandingan fluks massa propana dengan fluks massa oli termal sebagai sumber panas energi dengan temperatur maksimum 150oc terbaik adalah sebesar 1 5 perbandingan nilai htc dari korelasi bilangan nusselt baru dengan htc r-134a dan propana pada berbagai variasi tekanan superkritis dan fluks massa memiliki penyimpangan antara -30% sampai 20%",['TJ'],,LPPM Universitas Lampung,2021-09-20,,,id,kaji numerik karakteristik pindah panas konveksi fluida organik pada kondisi tekan superkritis proses pindah panas yang jadi dalam pindah panas rupa proses pindah energi dari sumber energi ke fluida kerja organik yang guna bagai fluida kerja untuk gerak turbin ekspander guna hasil daya pada tekan superkritis proses pindah panas ini lebih baik dibandingankan dengan pada tekan subkritis dalam desain pindah panas perlu tahu karakteristik pindah panas fluida kerja untuk dapat kondisi yang optimal untuk kondisi subkritis karakteristik pindah panas ini telah sedia untuk guna tidak demikian hal dengan kondisi superkritis proses pindah panas pada kondisi superkritis sangat komplek dan rumit karena tajam ubah sifatsifat termodinamika dan fisik fluida pada kondisi ini oleh karena itu teliti ini investigasi karakteristik pindah panas konveksi paksa dari fluida superkritis yakni propana pada tekan di atas tekan kritis atau pada tekan superkritisnya dengan sedia karakteristik pindah panas yang tepat untuk suatu fluida organik tentu pada kondisi yang spesifik maka dapat hasil pindah panas yang efisien sehingga dapat tingkat prestasi kerja dan nilai ekonomi dari sistem bangkit siklus rankine organik superkritis dalam teliti ini juga laku rumus korelasi bilang nusselt baru yang mampu cara akurat prediksi nilai koefisien pindah panas konveksi paksa teliti ini laku cara numerik nilai htc dan karateristik pindah panas oleh lalu simulasi cfd dengan model turbulensi k proses pindah panas dari oli termal yang alir dalam annulus he tipe pipa ganda alir lawan arah ke alir propana dalam pipa diameter 8 mm model dengan model 2d guna sumbu simetris hasil hitung htc dari simulasi cfd ini guna bagai data untuk rumus korelasi bilang nusselt baru guna metoda curve fitting lanjut nilai htc yang hitung dari korelasi bilang nusselt baru di validasi guna data htc dari simulasi cfd yang telah divalidasi dengan data eksperimental yang upa grafik dan juga divalidasi dari hasil hitung guna korelasi lain yang telah publikasi hasil yang dapat dari studi teoretis adalah bahwa untuk sumber energi rendah kalori r-290 hasil kerja bersih isentropis yang lebih baik dari r-1270 r-134a dan r-227ea baik untuk tekan subkritis tekan kritis maupun tekan superkritis namun efisiensi masih di bawah r-134a korelasi bilang nusselt baru yang mampu untuk prediksi nilai koefisien pindah panas konveksi pada tekan superkritis telah dapat dalam teliti ini korelasi ini milik nilai salah standar estimasi dan koefisien korelasi besar sy x 0 0333 dan r 0 9875 dan telah divalidasi guna sama korelasi yang telah publikasi dan datadata hasil simulasi cfd tingkat tekan superkritis akan reduksi naik dan turun koefisien pindah panas konveksi paksa di sekitar temperatur pseudocritical propana sedang tingkat fluks massa akan tingkat htc tingkat fluks massa juga kurang temperatur propana keluar supercritical heat exchanger she banding fluks massa propana dengan fluks massa oli termal bagai sumber panas energi dengan temperatur maksimum 150oc baik adalah besar 1 5 banding nilai htc dari korelasi bilang nusselt baru dengan htc r-134a dan propana pada bagai variasi tekan superkritis dan fluks massa milik simpang antara -30 sampai 20
2630,2630,['FP5'],nilai ekonomi ekowisata mangrove di desa margasari kecamatan labuhan maringgai kabupaten lampung timur,pengembangan hutan mangrove sebagai sarana ekowisata memiliki nilai ekonomi yang tinggi tujuan penelitian ini adalah menganalisis nilai ekonomi ekowisata mangrove penentuan sampel dilakukan dengan menggunakan metode accidental sampling data dikumpulkan dengan teknik wawancara dan observasi di lapangan kemudian dianalisis secara deskriptif kuantitatif melalui pendekatan biaya perjalanan hasil penelitian menunjukkan bahwa pengunjung ekowisata berasal dari dalam maupun luar provinsi lampung dengan biaya perjalanan ratarata sebesar rp 107.500 orang kunjungan jumlah pengunjung mencapai 1.200 orang tahun sehingga nilai ekonomi yang dihasilkan adalah rp 129.000.000 tahun atau rp 1.038.647 ha tahun objek yang terdapat di lokasi ekowisata masih sangat sederhana yaitu berupa jembatan spot foto tempat duduk saung dan perahu untuk mengelilingi hutan mangrove pemerintah dan masyarakat memiliki peran penting dalam upaya meningkatkan nilai ekonomi melalui penyediaan fasilitas kualitas dan pelayanan yang baik guna menjamin keberlanjutan ekowisata mangrove,['SD'],Jurnal Belantara,"Program Studi Kehutanan, Univeristas Mataram",2021-03,,,id,nilai ekonomi ekowisata mangrove di desa margasari camat labuh maringgai kabupaten lampung timur kembang hutan mangrove bagai sarana ekowisata milik nilai ekonomi yang tinggi tuju teliti ini adalah analis nilai ekonomi ekowisata mangrove tentu sampel laku dengan guna metode accidental sampling data kumpul dengan teknik wawancara dan observasi di lapang kemudian analis cara deskriptif kuantitatif lalu dekat biaya jalan hasil teliti tunjuk bahwa unjung ekowisata asal dari dalam maupun luar provinsi lampung dengan biaya jalan ratarata besar rp 107 500 orang kunjung jumlah unjung capai 1 200 orang tahun sehingga nilai ekonomi yang hasil adalah rp 129 000 000 tahun atau rp 1 038 647 ha tahun objek yang dapat di lokasi ekowisata masih sangat sederhana yaitu upa jembatan spot foto tempat duduk saung dan perahu untuk keliling hutan mangrove perintah dan masyarakat milik peran penting dalam upaya tingkat nilai ekonomi lalu sedia fasilitas kualitas dan layan yang baik guna jamin lanjut ekowisata mangrove
2631,2631,['FKIP12'],eksistensi pendidikan kewarganegaraan dalam meningkatkan civic responsibility di masa pembelajaran daring,pembelajaran daring dalam kondisi covid-19 tentu menjadi sebuah solusi sekaligus menjadi permasalahan baru pembelajaran daring dilaksanakan setelah adanya surat edaran dari kementerian pendidikan sebagai wujud untuk meminimalsir kasus covid-19 di lingkungan pendidikan ataupun lingkungan sekolah lainnya pembelajaran daring akan membawa dampak pada sebuah urgensi rasa tanggung jawab peserta didik dalam eksistensi pendidikan kewarganegaraan artikel ini bertujuan untuk mengukuhkan sebuah eksistensi pendidikan kewarganegaraan dalam meningkatkan civic responsibility metode yang digunakan dalam penulisan ini yakni menggunakan metode studi literatur dan metode pengamatan hasil dari artikel ini membahas mengenai esksistensi pendidikan kewargenegaraan kemudian civic responsibility dan pembelajaran daring serta yang terakhir membahas mengenai urgensi dari eksistensi civic responsibility dalam pembelajaran daring sementara rekomendasi artikel ini dapat menyasar kepada masyarakat yang masih awam sekali terhadap meningkatkan rasa tanggung jawab,['H1'],,,2021-01-28,,,id,eksistensi didik kewarganegaraan dalam tingkat civic responsibility di masa ajar daring ajar daring dalam kondisi covid-19 tentu jadi buah solusi sekaligus jadi masalah baru ajar daring laksana telah ada surat edar dari menteri didik bagai wujud untuk meminimalsir kasus covid-19 di lingkung didik atau lingkung sekolah lain ajar daring akan bawa dampak pada buah urgensi rasa tanggung jawab serta didik dalam eksistensi didik kewarganegaraan artikel ini tuju untuk kukuh buah eksistensi didik kewarganegaraan dalam tingkat civic responsibility metode yang guna dalam tulis ini yakni guna metode studi literatur dan metode amat hasil dari artikel ini bahas kena esksistensi didik kewargenegaraan kemudian civic responsibility dan ajar daring serta yang akhir bahas kena urgensi dari eksistensi civic responsibility dalam ajar daring sementara rekomendasi artikel ini dapat sasar kepada masyarakat yang masih awam sekali hadap tingkat rasa tanggung jawab
2632,2632,['FKIP12'],efektivitas pembelajaran daring dalam meningkatkan literasi digital,kondisi pandemi covid-19 masih berlangsung dan masih berdampak hingga sampai saat ini pada sektor pendidikan hal tersebut dapat dilihat dari kebijakan pembelajaran daring masih terus berjalan di jenjang pendidikan sd smp sma dan bahkan perguruan tinggi di indonesia pembelajaran daring yang dipraktikan di lapanganpun memiliki dua sisi penilaian yakni dampak positif dan negatif dampak positif didapat jika dilaksanakan atau diikuti secara sungguhsungguh begitu pula dengan dampak negatif didapat ketika tidak sungguhsungguh dalam melaksanakan pembelajaran daring durasi adanya pembelajaran daring ini terbilang cukup lama yang dirasakan oleh pendidik maupun peserta didik sehingga secara otomatis akan memiliki dampak pada wilayah proses pembelajaran individu tertentu artikel ini bertujuan untuk menganalisis bagaimana pembelajaran daring dalam meningkatkan literasi digital metode yang digunakan dalam karya penulisan ini menggunakan pendekatan kuanitatif hasil dari artikel ini membahas mengenai efektivitas pembelajaran pembelajaran daring dan literasi digital serta membahas presentase hasil dari kuisioner yang disebarluaskan kepada responden berkaitan dengan efektivitas pembelajaran daring dalam meningkatkan literasi digital,['L1'],,,2021-03-30,,,id,efektivitas ajar daring dalam tingkat literasi digital kondisi pandemi covid-19 masih langsung dan masih dampak hingga sampai saat ini pada sektor didik hal sebut dapat lihat dari bijak ajar daring masih terus jalan di jenjang didik sd smp sma dan bahkan guru tinggi di indonesia ajar daring yang praktik di lapang milik dua sisi nilai yakni dampak positif dan negatif dampak positif dapat jika laksana atau ikut cara sungguhsungguh begitu pula dengan dampak negatif dapat ketika tidak sungguhsungguh dalam laksana ajar daring durasi ada ajar daring ini bilang cukup lama yang rasa oleh didik maupun serta didik sehingga cara otomatis akan milik dampak pada wilayah proses ajar individu tentu artikel ini tuju untuk analis bagaimana ajar daring dalam tingkat literasi digital metode yang guna dalam karya tulis ini guna dekat kuanitatif hasil dari artikel ini bahas kena efektivitas ajar ajar daring dan literasi digital serta bahas presentase hasil dari kuisioner yang disebarluaskan kepada responden kait dengan efektivitas ajar daring dalam tingkat literasi digital
2633,2633,['FKIP12'],media pendidikan moral warga negara muda berbasis pengembangan film pendek pada era society 5.0,siklus zaman yang semakin hari semakin modern harus kita sikapi dengan bijaksana dan penuh dengan konsep yang membangun konsep tersebut tentu harus disesuikan dengan kebutuhan yang akan dihadapi tantangan terbesar dalam modernnya zaman ditandai dengan adanya perubahan paradigma terhadap sesuatu hal semisalnya tentang moral kemajuan zaman akan menghilangkan batasbatas moral yang sebelumnya sudah ada di dalam masyarakat kita ambil contohnya yang berkaitan dengan sikap dan cara berpakaian yang semakin modern akan bergeser ke arah yang negatif jika individu tidak memfilter dengan aturanaturan yang berlaku dalam bermasyarakat hal tersebutlah yang menjadi konsentrasi bagaimana memanfaatkan perkembangan iptek dengan menggunakan film pendek sebagai medianya untuk memfilter budayabudaya atau sikap yang tidak sesuai norma warga negara muda di era menghadapi society 5.0 selain menguasai teknologi harus memiliki moral yang baik guna mengeksistensikan diri sebagai individu ataupun kolektif di masyarakat pada dasarnya pendidikan moral itu mengajarkan dan menanamkan bagaimana berprilaku dan bersikap dengan baik moral ini sudah sejak lama tumbuh dan diajarkan kepada bangsa kita menyadari era saat ini kekhawatiran dalam menyampaikan pendidikan moral kepada bangsa kita semakin tumbuh pemanfaatan media komunikasi menjadi alternatif dalam menyampaikan pendidikan moral kepada bangsa kita tidak sedikit pendidik memanfaatkan hasil dari kreator film pendek yang dalam film menyisipkan pesanpesan moral dalam karyanya hal ini menjadi trobosan media baru dalam penyampaian pendidikan moral dalam sebuah pengajaran pendidikan moral,['H1'],,,2021-07-01,,,id,media didik moral warga negara muda bas kembang film pendek pada era society 5 0 siklus zaman yang makin hari makin modern harus kita sikap dengan bijaksana dan penuh dengan konsep yang bangun konsep sebut tentu harus disesuikan dengan butuh yang akan hadap tantang besar dalam modern zaman tanda dengan ada ubah paradigma hadap sesuatu hal misal tentang moral maju zaman akan hilang batasbatas moral yang belum sudah ada di dalam masyarakat kita ambil contoh yang kait dengan sikap dan cara pakai yang makin modern akan geser ke arah yang negatif jika individu tidak filter dengan aturanaturan yang laku dalam masyarakat hal sebut yang jadi konsentrasi bagaimana manfaat kembang iptek dengan guna film pendek bagai media untuk filter budayabudaya atau sikap yang tidak sesuai norma warga negara muda di era hadap society 5 0 selain kuasa teknologi harus milik moral yang baik guna eksistensi diri bagai individu atau kolektif di masyarakat pada dasar didik moral itu ajar dan tanam bagaimana berprilaku dan sikap dengan baik moral ini sudah sejak lama tumbuh dan ajar kepada bangsa kita sadar era saat ini khawatir dalam sampai didik moral kepada bangsa kita makin tumbuh manfaat media komunikasi jadi alternatif dalam sampai didik moral kepada bangsa kita tidak sedikit didik manfaat hasil dari kreator film pendek yang dalam film sisip pesanpesan moral dalam karya hal ini jadi trobosan media baru dalam sampai didik moral dalam buah ajar didik moral
2634,2634,['FP17'],korespondensi artikel berjudul the effect of black cumin nigella sativa supplementation through drinking water on the histology of small intestine and large intestine of broiler chickens,,['SF'],,Universitas Syiah Kuala (Syiah Kuala University) and Indonesian Veterinary Medical Association (PDHI),2021,,,?,korespondensi artikel judul the effect of black cumin nigella sativa supplementation through drinking water on the histology of small intestine and large intestine of broiler chickens
2635,2635,['FP18'],bukti reviewer jurnal internasional bereputasi elsevier energy,reviewer jurnal,['T1'],,Elsevier,2021,,,af,bukti reviewer jurnal internasional reputasi elsevier energy reviewer jurnal
2636,2636,['FP18'],laporan penelitian pengembangan teknologi pirolisis biomasa limbah jagung untuk menghasilkan biochar pembenah tanah,"budidaya jagung dan aktivitas panen beserta pasca panen menghasilkan limbah biomassa dalam jumlah besar yaitu batang jagung sekitar 1 ton ha dan janggel sekitar 2 ton ha sejauh ini penanganan limbah jagung adalah dengan cara dibakar pembakaran biomassa limbah jagung tidak hanya menghasilkan asap yang menggangu tetapi juga membuang sumberdaya yang sangat berharga yaitu karbon organik ke atmosfer secara siasia pembakaran biomassa limbah jagung dapat dilakukan dengan cara yang lebih ramah dan berdaya guna dengan cara membatasi jumlah oksigen atau udara selama pembakaran sehingga terjadi pembakaran secara anaerobik atau pembakaran dengan oksigen yang sangat terbatas proses yang dinamakan pirolisis atau karbonisasi ini akan menghasilkan produk arang padat atau biochar yang dapat digunakan untuk berbagai keperluan selain sebagai bahan bakar dengan nilai energi yang tinggi sekitar 30 mj kg arang dapat dikembalikan ke lahan sebagai bahan pembenah tanah soil amendment dan akan menjadi sumber karbon selama bertahuntahun dengan mengembalikan arang ke lahan akan tercipta suatu system budidaya jagung yang sirkuler sehingga lebih sustainable penelitian ini bertujuan untuk mengembangkan teknologi pirolisis yang sesuai untuk diaplikasikan guna penanganan limbah jagung penelitian dilakukan dengan merancang kiln pirolisis janggel jagung kiln dirancang untuk mampu mengolah tongkol jagung minimal 5 ton sekali proses produk arang biochar yang dihasilkan akan dianalisis karakteristiknya yang meliputi kadar air kadar abu nilai kalori daya serap air dan berat jenis hasil yang sudah diperoleh dari penelitian kiln pirolisis berukuran 3,5 m x 4,5 m dengan kedalaman 1,5 m dengan kapasitas sampai 7 ton tongkol jagung kiln sudah diuji dan hasilnya belum maksimal karena masih ada sebagian tongkol jagung yang belum terpirolisi biochar dari tongkol yang sudah terpirolisis digiling dan digunakan sebagai bahan pembenah amendment tanah pada budidaya tanaman jagung hingga laporan ini dibuat tanaman jagung masih berumur 1 bulan secara terpisah penggunaan biochar tongkol jagung sebagai bahan pembenah tanah juga dilakukan pada budidaya tanaman sawi penanaman dilakukan di dalam pot dengan ukuran tinggi 13 cm diameter atas 19 cm dan diameter bawah 13,5 cm dosis biochar yang diaplikasikan sebanyak 90 g pot atau 3% dari berat total media tanam hasil penelitian menunjukkan pengaruh biochar nyata pada taraf p 5% terhadap parameter pertumbuhan berat brangkasan segar produktivitas air dan produktivitas pupuk suhu pirolisis biochar yang optimal untuk pakcoy adalah pada suhu 350 c dengan hasil ratarata bobot brangkasan atas segar 30,6 gram bobot total 39,36 gram dan produktivitas pupuk 35,06% kombinasi biochar dan dosis pupuk urea terbaik terhadap pertumbuhan dan produktivitas tanaman pakcoy yaitu b2p1 luaran yang ditargetkan dari penelitian ini adalah teknologi tepat guna berupa kiln pirolisis kapasitas 7 ton tongkol jagung dengan tingkat kesiapterapan tkt level 6 yang telah didemonstrasikan di lokasi mitra selain itu sebuah paper telah disubmit ke jurnal internasional q3 journal of agriculture and rural development in the tropics and subtropics",['S1'],,Fakultas Pertanian,2021,,,id,lapor teliti kembang teknologi pirolisis biomasa limbah jagung untuk hasil biochar benah tanah budidaya jagung dan aktivitas panen serta pasca panen hasil limbah biomassa dalam jumlah besar yaitu batang jagung sekitar 1 ton ha dan janggel sekitar 2 ton ha jauh ini tangan limbah jagung adalah dengan cara bakar bakar biomassa limbah jagung tidak hanya hasil asap yang menggangu tetapi juga buang sumberdaya yang sangat harga yaitu karbon organik ke atmosfer cara siasia bakar biomassa limbah jagung dapat laku dengan cara yang lebih ramah dan daya guna dengan cara batas jumlah oksigen atau udara lama bakar sehingga jadi bakar cara anaerobik atau bakar dengan oksigen yang sangat batas proses yang nama pirolisis atau karbonisasi ini akan hasil produk arang padat atau biochar yang dapat guna untuk bagai perlu selain bagai bahan bakar dengan nilai energi yang tinggi sekitar 30 mj kg arang dapat kembali ke lahan bagai bahan benah tanah soil amendment dan akan jadi sumber karbon lama bertahuntahun dengan kembali arang ke lahan akan cipta suatu system budidaya jagung yang sirkuler sehingga lebih sustainable teliti ini tuju untuk kembang teknologi pirolisis yang sesuai untuk aplikasi guna tangan limbah jagung teliti laku dengan rancang kiln pirolisis janggel jagung kiln rancang untuk mampu olah tongkol jagung minimal 5 ton sekali proses produk arang biochar yang hasil akan analis karakteristik yang liput kadar air kadar abu nilai kalori daya serap air dan berat jenis hasil yang sudah oleh dari teliti kiln pirolisis ukur 3 5 m x 4 5 m dengan dalam 1 5 m dengan kapasitas sampai 7 ton tongkol jagung kiln sudah uji dan hasil belum maksimal karena masih ada bagi tongkol jagung yang belum terpirolisi biochar dari tongkol yang sudah pirolisis giling dan guna bagai bahan benah amendment tanah pada budidaya tanam jagung hingga lapor ini buat tanam jagung masih umur 1 bulan cara pisah guna biochar tongkol jagung bagai bahan benah tanah juga laku pada budidaya tanam sawi tanam laku di dalam pot dengan ukur tinggi 13 cm diameter atas 19 cm dan diameter bawah 13 5 cm dosis biochar yang aplikasi banyak 90 g pot atau 3 dari berat total media tanam hasil teliti tunjuk pengaruh biochar nyata pada taraf p 5 hadap parameter tumbuh berat brangkasan segar produktivitas air dan produktivitas pupuk suhu pirolisis biochar yang optimal untuk pakcoy adalah pada suhu 350 c dengan hasil ratarata bobot brangkasan atas segar 30 6 gram bobot total 39 36 gram dan produktivitas pupuk 35 06 kombinasi biochar dan dosis pupuk urea baik hadap tumbuh dan produktivitas tanam pakcoy yaitu b2p1 luar yang target dari teliti ini adalah teknologi tepat guna upa kiln pirolisis kapasitas 7 ton tongkol jagung dengan tingkat kesiapterapan tkt level 6 yang telah demonstrasi di lokasi mitra selain itu buah paper telah disubmit ke jurnal internasional q3 journal of agriculture and rural development in the tropics and subtropics
