,Unnamed: 0,divisions,title,abstract,subjects,publication,publisher,date,keywords,keyword,lang,text_stemmed
1377,1377,['FT1'],kajian teknis existing jembatan way semangka rangka baja pasca bencana gempa tahun 1994 di suoh kabupaten lampung barat,pembangunan jaringan jalan dan jembatan sebagai urat nadi perekonomian diharapkan mampu menghubungkan jalan antar daerah dan antar simpulsimpul perekonomian serta meningkatkan penanganan pada ruas jalan agar senantiasa dapat berfungsi untuk mendukung kelancaran arus lalu lintas barang dan jasa dalam rangka percepatan pemulihan perekonomian lampung barat umumnya dan kecamatan suoh pada khususnya guna mencapai maksud tersebut salah satu kegiatan yaitu kajian teknis jembatan way semangka pekon tugu ratu yang merupakan jembatan lama dengan kontruksi darurat abudment bronjong dan bangunan atas menggunakan rangka baja bentang 35 meter kajian teknis tersebut bertujuan untuk memastikan apakah struktur existing dalam kondisi layak untuk ditingkatkan mengingat pembangunan awal jembatan tersebut hanya bersifat darurat dimana seiring berjalannya waktu pertumbuhan ekonomi dan lalu lintas orang dan barang mengalami peningkatan signifikan melintas di jembatan tersebut maka untuk itu kajian teknis pemeriksaan pengukuran detail dan khusus elemenelemen jembatan dimensi mutu dan analisa sangat penting untuk dilakukan agar preservasi jembatan mendapatkan hasil yang maksimal dan tepat sebagai acuan dan dasar penentuan keputusan dalam kegiatan peningkatan jembatan way semangka kedepannya,['T1'],Jurnal Rekayasa Lampung,Fakultas Teknik Universitas Lampung,2022-04,,,id,kaji teknis existing jembatan way semangka rangka baja pasca bencana gempa tahun 1994 di suoh kabupaten lampung barat bangun jaring jalan dan jembatan bagai urat nadi ekonomi harap mampu hubung jalan antar daerah dan antar simpulsimpul ekonomi serta tingkat tangan pada ruas jalan agar senantiasa dapat fungsi untuk dukung lancar arus lalu lintas barang dan jasa dalam rangka cepat pulih ekonomi lampung barat umum dan camat suoh pada khusus guna capai maksud sebut salah satu giat yaitu kaji teknis jembatan way semangka pekon tugu ratu yang rupa jembatan lama dengan kontruksi darurat abudment bronjong dan bangun atas guna rangka baja bentang 35 meter kaji teknis sebut tuju untuk pasti apakah struktur existing dalam kondisi layak untuk tingkat ingat bangun awal jembatan sebut hanya sifat darurat mana iring jalan waktu tumbuh ekonomi dan lalu lintas orang dan barang alami tingkat signifikan lintas di jembatan sebut maka untuk itu kaji teknis periksa ukur detail dan khusus elemenelemen jembatan dimensi mutu dan analisa sangat penting untuk laku agar preservasi jembatan dapat hasil yang maksimal dan tepat bagai acu dan dasar tentu putus dalam giat tingkat jembatan way semangka depan
1378,1378,['FT1'],kajian teknis existing jembatan way semangka rangka baja pasca bencana gempa tahun 1994 di suoh kabupaten lampung barat,kecamatan bahuga merupakan salah satu daerah lumbung padi penghasil beras di kabupaten way kanan yang sangat mengandalkan transportasi darat untuk membawa hasil pertanian dan perkebunan keluar daerah untuk dijual pemerintah daerah kabupaten way kanan melalui dinas pekerjaan umum dan penataan ruang melakukan pembangunan dan peningkatan infrastuktur bidang transportasi untuk memenuhi kebutuhan angkutan barang dan orang secara baik dan benar serta menyelenggarakan sistem jaringan jalan yang mampu menunjang mendorong dan menggerakkan pengembangan wilayah dan kawasan memiliki standarisasi keteknikan sesuai dengan ketentuan yang ada sebagaimana diamanatkan dalam undangundang nomor 2 pembangunan jaringan jalan dan jembatan sebagai urat nadi perekonomian diharapkan mampu menghubungkan jalan antar daerah dan antar simpulsimpul perekonomian serta meningkatkan penanganan pada ruas jalan agar senantiasa dapat berfungsi untuk mendukung kelancaran arus lalu lintas barang dan jasa dalam rangka percepatan pemulihan perekonomian lampung barat umumnya dan kecamatan suoh pada khususnya guna mencapai maksud tersebut salah satu kegiatan yaitu kajian teknis jembatan way semangka pekon tugu ratu yang merupakan jembatan lama dengan kontruksi darurat abudment bronjong dan bangunan atas menggunakan rangka baja bentang 35 meter kajian teknis tersebut bertujuan untuk memastikan apakah struktur existing dalam kondisi layak untuk ditingkatkan mengingat pembangunan awal jembatan tersebut hanya bersifat darurat dimana seiring berjalannya waktu pertumbuhan ekonomi dan lalu lintas orang dan barang mengalami peningkatan signifikan melintas di jembatan tersebut maka untuk itu kajian teknis pemeriksaan pengukuran detail dan khusus elemenelemen jembatan dimensi mutu dan analisa sangat penting untuk dilakukan agar preservasi jembatan mendapatkan hasil yang maksimal dan tepat sebagai acuan dan dasar penentuan keputusan dalam kegiatan peningkatan jembatan way semangka kedepannya,['T1'],JURNAL REKAYASA LAMPUNG,Fakultas Teknik Universitas Lampung,2022-04,,,id,kaji teknis existing jembatan way semangka rangka baja pasca bencana gempa tahun 1994 di suoh kabupaten lampung barat camat bahuga rupa salah satu daerah lumbung padi hasil beras di kabupaten way kanan yang sangat andal transportasi darat untuk bawa hasil tani dan kebun keluar daerah untuk jual perintah daerah kabupaten way kanan lalu dinas kerja umum dan tata ruang laku bangun dan tingkat infrastuktur bidang transportasi untuk penuh butuh angkut barang dan orang cara baik dan benar serta selenggara sistem jaring jalan yang mampu tunjang dorong dan gerak kembang wilayah dan kawasan milik standar teknik sesuai dengan tentu yang ada bagaimana amanat dalam undangundang nomor 2 bangun jaring jalan dan jembatan bagai urat nadi ekonomi harap mampu hubung jalan antar daerah dan antar simpulsimpul ekonomi serta tingkat tangan pada ruas jalan agar senantiasa dapat fungsi untuk dukung lancar arus lalu lintas barang dan jasa dalam rangka cepat pulih ekonomi lampung barat umum dan camat suoh pada khusus guna capai maksud sebut salah satu giat yaitu kaji teknis jembatan way semangka pekon tugu ratu yang rupa jembatan lama dengan kontruksi darurat abudment bronjong dan bangun atas guna rangka baja bentang 35 meter kaji teknis sebut tuju untuk pasti apakah struktur existing dalam kondisi layak untuk tingkat ingat bangun awal jembatan sebut hanya sifat darurat mana iring jalan waktu tumbuh ekonomi dan lalu lintas orang dan barang alami tingkat signifikan lintas di jembatan sebut maka untuk itu kaji teknis periksa ukur detail dan khusus elemenelemen jembatan dimensi mutu dan analisa sangat penting untuk laku agar preservasi jembatan dapat hasil yang maksimal dan tepat bagai acu dan dasar tentu putus dalam giat tingkat jembatan way semangka depan
1379,1379,['FP27'],substitusi silase daun singkong dengan rumput pakchong pennisetum purpureum cv thailand terhadap kadar protein dan laktosa susu kambing peranakan etawah,"abstract penelitian ini bertujuan untuk mengetahui pengaruh substitusi silase daun singkong dengan rumput pakchong pennisetum purpureum cv thailand pada ransum terhadap kadar protein dan laktosa susu kambing peranakan etawah dan mengetahui pengaruh substitusi silase daun singkong dengan rumput pakchong pennisetum purpureum cv thailand yang terbaik pada ransum terhadap kadar protein dan laktosa susu kambing peranakan etawah penelitian ini dilaksanakan pada bulan februarimaret 2022 lokasi penelitian ini dilakukan di asyifa farm kelurahan yosomulyo kecamatan metro pusat kota metro analisis susu kambing dilakukan di laboratorium produksi ternak jurusan peternakan fakultas pertanian universitas lampung rancangan percobaan yang digunakan adalah rancangan acak kelompok rak dengan tiga perlakuan dan tiga kelompok sebagai ulangan sehingga dapat terdapat sembilan satuan percobaan perlakuan yang diberikan yaitu p1 30% silase daun singkong 70% konsentrat p2 15% silase daun singkong 15% silase rumput pakchong 70% konsentrat dan p3 30% silase rumput pakchong 70% konsentrat data yang diperoleh dianalisis menggunakan analisis sidik ragam anova dengan taraf 5% hasil penelitian ini didapatkan bahwa perlakuan ransum p1 p2 dan p3 tidak berpengaruh nyata p 0,05 terhadap kadar protein dan laktosa susu kambing peranakan etawah ratarata kadar protein dan laktosa pada penelitian ini yaitu 3,409-4,627% dan 3,217-3,425% hasil penelitian dapat disimpulkan bahwa kualitas susu kambing segar berdasarkan kadar protein telah memenuhi standar susu segar menurut badan standarisasi nasional 01-3141-2011 dan thai agricultural standard kadar protein dan laktosa tertinggi terdapat pada perlakuan tanpa pemberian silase rumput pakchong dengan kadar protein dan laktosa secara berturut turut adalah 3,627 0,331% dan 3,425 0,312%",['SF'],Jurnal Riset dan Inovasi Peternakan,"JURUSAN PETERNAKAN, FAKULTAS PERTANIAN,  UNIVERSITAS LAMPUNG",2022-08-08,,,id,substitusi silase daun singkong dengan rumput pakchong pennisetum purpureum cv thailand hadap kadar protein dan laktosa susu kambing ana etawah abstract teliti ini tuju untuk tahu pengaruh substitusi silase daun singkong dengan rumput pakchong pennisetum purpureum cv thailand pada ransum hadap kadar protein dan laktosa susu kambing ana etawah dan tahu pengaruh substitusi silase daun singkong dengan rumput pakchong pennisetum purpureum cv thailand yang baik pada ransum hadap kadar protein dan laktosa susu kambing ana etawah teliti ini laksana pada bulan februarimaret 2022 lokasi teliti ini laku di asyifa farm lurah yosomulyo camat metro pusat kota metro analisis susu kambing laku di laboratorium produksi ternak jurus terna fakultas tani universitas lampung rancang coba yang guna adalah rancang acak kelompok rak dengan tiga laku dan tiga kelompok bagai ulang sehingga dapat dapat sembilan satu coba laku yang beri yaitu p1 30 silase daun singkong 70 konsentrat p2 15 silase daun singkong 15 silase rumput pakchong 70 konsentrat dan p3 30 silase rumput pakchong 70 konsentrat data yang oleh analis guna analisis sidik ragam anova dengan taraf 5 hasil teliti ini dapat bahwa laku ransum p1 p2 dan p3 tidak pengaruh nyata p 0 05 hadap kadar protein dan laktosa susu kambing ana etawah ratarata kadar protein dan laktosa pada teliti ini yaitu 3 409-4 627 dan 3 217-3 425 hasil teliti dapat simpul bahwa kualitas susu kambing segar dasar kadar protein telah penuh standar susu segar turut badan standar nasional 01-3141-2011 dan thai agricultural standard kadar protein dan laktosa tinggi dapat pada laku tanpa beri silase rumput pakchong dengan kadar protein dan laktosa cara turut turut adalah 3 627 0 331 dan 3 425 0 312
1380,1380,['FMIPA9'],penerapan metode artificial neural network dalam memprediksi kurs rupiah terhadap euro,,['QA76'],,,2022-08-22,,,?,terap metode artificial neural network dalam prediksi kurs rupiah hadap euro
1381,1381,['FK1'],karakteristik gcms dalam kandungan senyawa ekstrak umbi cyperus rotundus l yang berasal dari provinsi lampung dengan dua pelarut yang berbeda,cyperus rotundus l merupakan salah satu tanaman yang menjadi populer bagi peneliti dari beberapa penelitian cyperus rotundus l diketahui memiliki banyak khasiat yaitu sebagai antikanker antiparasit antibakteri antioksidan antiinflamasi antiplatelet antidiabetik hepatoprotektor neuroprotektor dan banyak khasiat lainnya banyaknya khasiat tersebut diduga karena adanya kandungan senyawa aktif yang merupakan hasil metabolit sekunder yang terkandung didalam tumbuhan ini senyawa utama yang telah berhasil diisolasi antara lain αcyperone cyperene cyperotundone cyperol βselinene dan βcaryophyllene namun komposisi dan konsentrasi senyawa aktif tersebut sangat bervariasi bergantung dari chemotypes lokasi geografi metode ekstrak dan metode analisisnya penelitian ini bertujuan untuk mengetahui perbedaan senyawa aktif yang terdapat pada umbi cyperus rotundus l yang berasal dari provinsi lampung dengan menggunakan dua bahan pelarut yang berbeda umbi cyperus rotundus l akan diambil dari wilayah kota bandar lampung pelarut yang digunakan yaitu etanol 96% dan kloroform sedangkan identifikasi senyawa aktif akan dilakukan dengan menggunakan metode gcms ekstrak kloroform umbi rumput teki cyperus rotundus l mengandung 36 komposisi senyawa dengan 11 senyawa utama sedangkan ekstrak etanol umbi rumput teki cyperus rotundus l mengandung 42 komposisi senyawa dengan 4 senyawa utama,"['Q1', 'R1']",JUKE,Fakultas Kedokteran Universitas Lampung dan IDI WIlayah Lampung,2022,,,id,karakteristik gcms dalam kandung senyawa ekstrak umbi cyperus rotundus l yang asal dari provinsi lampung dengan dua larut yang beda cyperus rotundus l rupa salah satu tanam yang jadi populer bagi teliti dari beberapa teliti cyperus rotundus l tahu milik banyak khasiat yaitu bagai antikanker antiparasit antibakteri antioksidan antiinflamasi antiplatelet antidiabetik hepatoprotektor neuroprotektor dan banyak khasiat lain banyak khasiat sebut duga karena ada kandung senyawa aktif yang rupa hasil metabolit sekunder yang kandung dalam tumbuh ini senyawa utama yang telah hasil isolasi antara lain cyperone cyperene cyperotundone cyperol selinene dan caryophyllene namun komposisi dan konsentrasi senyawa aktif sebut sangat variasi gantung dari chemotypes lokasi geografi metode ekstrak dan metode analisis teliti ini tuju untuk tahu beda senyawa aktif yang dapat pada umbi cyperus rotundus l yang asal dari provinsi lampung dengan guna dua bahan larut yang beda umbi cyperus rotundus l akan ambil dari wilayah kota bandar lampung larut yang guna yaitu etanol 96 dan kloroform sedang identifikasi senyawa aktif akan laku dengan guna metode gcms ekstrak kloroform umbi rumput teki cyperus rotundus l kandung 36 komposisi senyawa dengan 11 senyawa utama sedang ekstrak etanol umbi rumput teki cyperus rotundus l kandung 42 komposisi senyawa dengan 4 senyawa utama
1382,1382,['FEB4'],analisis pengaruh total assets turnover working capital turnover debt to equity ratio dan current ratio terhadap kinerja keuangan perusahaan,penelitian ini bertujuan untuk mengetahui bagaimana pengaruh dari total assets turnover working capital turnover debt to equity ratio dan current ratio terhadap kinerja keuangan perusahaan kinerja keuangan perusahaan dapat digambarkan salah satunya melalui rasio keuangan perusahaan yang dapat dilihat dan diketahui melalui laporan keuangan perusahaan terdapat 3 rasio keuangan dengan 4 metode pengukuran yang digunakan dalam penelitian ini yaitu rasio aktivitas total assets turnover dan working capital turnover rasio leverage debt to equity ratio dan rasio likuiditas current ratio penelitian ini menggunakan metode kuantitatif dengan menggunakan teknik slovin dan stratified random sampling dalam pengambilan sampel perusahaan yang di jadikan sampel merupakan perusahaan yang terdaftar di bursa efek indonesia bei periode 2015-2019 hasil dari penelitian ini adalah total assets turnover tato memiliki pengaruh secara positif dan signifikan terhadap kinerja keuangan perusahaan working capital turnover wcto memiliki pengaruh negatif dan signifikan terhadap kinerja keuangan perusahaan debt to equity ratio der memiliki pengaruh secara negatif dan signifikan terhadap kinerja keuangan perusahaan dan current ratio cr pengaruh secara negatif dan tidak signifikan terhadap kinerja keuangan perusahaan kata kunci total assets turnover working capital turnover debt to equity ratio current ratio dan kinerja keuangan perusahaan,['HF5601'],Jurnal Administrasi Bisnis Terapan,Universitas Indonesia,2022-06-30,,,id,analisis pengaruh total assets turnover working capital turnover debt to equity ratio dan current ratio hadap kerja uang usaha teliti ini tuju untuk tahu bagaimana pengaruh dari total assets turnover working capital turnover debt to equity ratio dan current ratio hadap kerja uang usaha kerja uang usaha dapat gambar salah satu lalu rasio uang usaha yang dapat lihat dan tahu lalu lapor uang usaha dapat 3 rasio uang dengan 4 metode ukur yang guna dalam teliti ini yaitu rasio aktivitas total assets turnover dan working capital turnover rasio leverage debt to equity ratio dan rasio likuiditas current ratio teliti ini guna metode kuantitatif dengan guna teknik slovin dan stratified random sampling dalam ambil sampel usaha yang di jadi sampel rupa usaha yang daftar di bursa efek indonesia bei periode 2015-2019 hasil dari teliti ini adalah total assets turnover tato milik pengaruh cara positif dan signifikan hadap kerja uang usaha working capital turnover wcto milik pengaruh negatif dan signifikan hadap kerja uang usaha debt to equity ratio der milik pengaruh cara negatif dan signifikan hadap kerja uang usaha dan current ratio cr pengaruh cara negatif dan tidak signifikan hadap kerja uang usaha kata kunci total assets turnover working capital turnover debt to equity ratio current ratio dan kerja uang usaha
1383,1383,['FP17'],pengaruh penambahan larutan daun kersen muntingia calabura l terdahap kualitas albumen telur asin rendah sodium,"penelitian ini bertujuan untuk mengetahui pengaruh penambahan larutan daun kersen dan konsentrasi larutan daun kersen yang berpengaruh terbaik terhadap nilai haugh unit hu indeks albumen dan ph albumen telur asin rendah sodium penelitian ini dilaksanakan pada februari 2022 di laboratorium produksi ternak jurusan peternakan fakultas pertanian universitas lampung penelitian dilakukan menggunakan rancangan acak lengkap ral dengan 4 perlakuan penambahan 0% 10% 20% dan 30% larutan daun kersen dan diulang sebanyak 5 kali setiap satuan percobaan terdiri dari 3 butir telur ayam ras sehingga jumlah telur yang digunakan yaitu 60 butir peubah yang diamati meliputi haugh unit hu indeks albumen dan ph albumen data yang diperoleh dianalisis menggunakan analisis ragam pada taraf nyata 5% hasil penelitian menunjukkan bahwa perlakuan penambahan larutan daun kersen konsentrasi 0% 10% 20% dan 30% tidak berpengaruh nyata p 0,05 terhadap nilai haugh unit hu indeks albumen dan ph albumen perlakuan penambahan larutan daun kersen sampai konsentrasi 30% masih memberikan hasil kualitas haugh unit hu indeks albumen dan ph albumen telur asin rendah sodium yang relatif sama kata kunci albumen daun kersen haugh unit indeks albumen ph albumen",['SF'],Jurnal Riset dan Inovasi Peternakan,"JURUSAN PETERNAKAN, FAKULTAS PERTANIAN,  UNIVERSITAS LAMPUNG",2022-08,,,id,pengaruh tambah larut daun kersen muntingia calabura l terdahap kualitas albumen telur asin rendah sodium teliti ini tuju untuk tahu pengaruh tambah larut daun kersen dan konsentrasi larut daun kersen yang pengaruh baik hadap nilai haugh unit hu indeks albumen dan ph albumen telur asin rendah sodium teliti ini laksana pada februari 2022 di laboratorium produksi ternak jurus terna fakultas tani universitas lampung teliti laku guna rancang acak lengkap ral dengan 4 laku tambah 0 10 20 dan 30 larut daun kersen dan ulang banyak 5 kali tiap satu coba diri dari 3 butir telur ayam ras sehingga jumlah telur yang guna yaitu 60 butir peubah yang amat liput haugh unit hu indeks albumen dan ph albumen data yang oleh analis guna analisis ragam pada taraf nyata 5 hasil teliti tunjuk bahwa laku tambah larut daun kersen konsentrasi 0 10 20 dan 30 tidak pengaruh nyata p 0 05 hadap nilai haugh unit hu indeks albumen dan ph albumen laku tambah larut daun kersen sampai konsentrasi 30 masih beri hasil kualitas haugh unit hu indeks albumen dan ph albumen telur asin rendah sodium yang relatif sama kata kunci albumen daun kersen haugh unit indeks albumen ph albumen
1384,1384,['FP24'],pengaruh empat isolat trichoderma spp terhadap penyakit bulai dan pertumbuhan tanaman jagung zea mays l,abstrak provinsi lampung merupakan salah satu daerah sentra penghasil jagung di indonesia produktivitas jagung masih belum optimal rendahnya produktivitas lahan jagung dapat disebabkan oleh berbagai faktor salah satunya adanya penyakit bulai penyakit bulai dapat menyebabkan kehilangan hasil hingga 90% alternatif pengendalian yang efektif dan ramah lingkungan adalah dengan memanfaatkan trichodema spp sebagai penginduksi ketahanan tanaman terhadap penyakit bulai tujuan penelitian ini adalah untuk mengetahui pengaruh empat isolat trichoderma spp terhadap keterjadian dan keparahan penyakit bulai dan pengaruhnya terhadap pertumbuhan tanaman jagung penelitian ini dilakukan dalam rancangan acak kelompok rak dengan lima perlakuan dan empat ulangan perlakuan terdiri dari t0 tanpa isolat trichoderma sp t1 trichoderma sp isolat hajimena t2 trichoderma sp isolat lampung tengah t3 trichoderma spp isolat lampung timur dan t4 trichoderma sp isolat metro hasil penelitian menunjukkan bahwa jamur trichoderma spp trichoderma spp isolat hajimena dan metro dapat menekan keterjadian penyakit dan trichoderma spp isolat hajimena dan lampung tengah dapat meningkatkan pertumbuhan tanaman pada bobot basah akar kata kunci induksi ketahanan keterjadian ramah lingkungan,['SB'],Jurnal Agrotek Tropika,Jurnal Agrotek Tropika,2022-04-30,,,id,pengaruh empat isolat trichoderma spp hadap sakit bulai dan tumbuh tanam jagung zea mays l abstrak provinsi lampung rupa salah satu daerah sentra hasil jagung di indonesia produktivitas jagung masih belum optimal rendah produktivitas lahan jagung dapat sebab oleh bagai faktor salah satu ada sakit bulai sakit bulai dapat sebab hilang hasil hingga 90 alternatif kendali yang efektif dan ramah lingkung adalah dengan manfaat trichodema spp bagai induksi tahan tanam hadap sakit bulai tuju teliti ini adalah untuk tahu pengaruh empat isolat trichoderma spp hadap jadi dan parah sakit bulai dan pengaruh hadap tumbuh tanam jagung teliti ini laku dalam rancang acak kelompok rak dengan lima laku dan empat ulang laku diri dari t0 tanpa isolat trichoderma sp t1 trichoderma sp isolat hajimena t2 trichoderma sp isolat lampung tengah t3 trichoderma spp isolat lampung timur dan t4 trichoderma sp isolat metro hasil teliti tunjuk bahwa jamur trichoderma spp trichoderma spp isolat hajimena dan metro dapat tekan jadi sakit dan trichoderma spp isolat hajimena dan lampung tengah dapat tingkat tumbuh tanam pada bobot basah akar kata kunci induksi tahan jadi ramah lingkung
1385,1385,['FP17'],penyuluhan manajemen pemeliharaan kambing perah dan penanaman rumput unggul sebagai pakan di kecamatan sukoharjo,abstract tujuan dari kegiatan pengabdian ini yaitu untuk meningkatkan pemahaman peternak tentang manajemen pemeliharaan kambing yang baik meningkatkan pemahaman pentingnya rumput unggul dan meningkatkan kemampuan peternak dalam budidaya rumput unggul pakchong kegiatan pengabdian kepada masyarakat dilakukan pada bulan aprilagustus 2022 di kecamatan sukoharjo kabupaten pringsewu mitra dalam kegiatan ini adalah kelompok tani rukun amrih sentosa tim pelaksana kegiatan ini adalah tim dosen program studi peternakan program studi nutrisi dan teknologi pakan jurusan peternakan fakultas pertanian universitas lampung metode kegiatan ini meliputi ceramah diskusi pelatihan dan demplot penanaman rumput pengolahan rumput dan evaluasi pelaksanaan kegiatan pengabdian kepada masyarakat berjalan lancar dan memberikan manfaat bagi kelompok tani rukun amrih sentosa kecamatan sukoharjo kabupaten pringsewu peternak lebih memahami system pemeliharaan ternak kambing yang tepat serta penanaman rumput unggul sebagai pakan ternak,['SF'],Jurnal Pengadian Fakultas Pertanian Universitas Lampung,Fakultas Pertanian Universitas Lampung,2022-09-24,,,id,suluh manajemen pelihara kambing perah dan tanam rumput unggul bagai pakan di camat sukoharjo abstract tuju dari giat abdi ini yaitu untuk tingkat paham ternak tentang manajemen pelihara kambing yang baik tingkat paham penting rumput unggul dan tingkat mampu ternak dalam budidaya rumput unggul pakchong giat abdi kepada masyarakat laku pada bulan aprilagustus 2022 di camat sukoharjo kabupaten pringsewu mitra dalam giat ini adalah kelompok tani rukun amrih sentosa tim laksana giat ini adalah tim dosen program studi terna program studi nutrisi dan teknologi pakan jurus terna fakultas tani universitas lampung metode giat ini liput ceramah diskusi latih dan demplot tanam rumput olah rumput dan evaluasi laksana giat abdi kepada masyarakat jalan lancar dan beri manfaat bagi kelompok tani rukun amrih sentosa camat sukoharjo kabupaten pringsewu ternak lebih paham system pelihara ternak kambing yang tepat serta tanam rumput unggul bagai pakan ternak
1386,1386,['FMIPA4'],bukti menghadiri seminar icbs 2021,,['QD'],,Universitas Gadjah Mada,2022-10-18,,,?,bukti hadir seminar icbs 2021
1387,1387,['FMIPA7'],info kegiatan tambahan ke guru besar,-,['QD'],,-,2022-04-22,,,?,info giat tambah ke guru besar -
1388,1388,['FMIPA4'],korespondensi nurun u and qudus h i 2017 analisis senyawa trifeniltimah iv benzoat secara voltammetri gelombang persegi analit analytical and environmental chemistry 2 01 pp 72-81.,,['QD'],,Jurusan Kimia FMIPA Universitas Lampung,2022-10-16,,,?,korespondensi nurun u and qudus h i 2017 analisis senyawa trifeniltimah iv benzoat cara voltammetri gelombang persegi analit analytical and environmental chemistry 2 01 pp 72-81
1389,1389,['FMIPA4'],korespondensi nurun u and qudus h i 2017 analisis senyawa trifeniltimah iv benzoat secara voltammetri gelombang persegi analit analytical and environmental chemistry 2 01 pp 72-81.,,['QD'],,Jurusan Kimia FMIPA Universitas Lampung,2022-10-16,,,?,korespondensi nurun u and qudus h i 2017 analisis senyawa trifeniltimah iv benzoat cara voltammetri gelombang persegi analit analytical and environmental chemistry 2 01 pp 72-81
1390,1390,['FMIPA4'],similarity index of in vitro antibacterial activity of some of dibutyltin iv chlorobenzoate derivatives against staphylococcus aureus and escherichia coli arpn journal of engineering and applied sciences 16 15 pp 1623-1629 issn 1819-6608,,['QD'],,Asian Research Publishing Network (ARPN).,2022-10-20,,,?,similarity index of in vitro antibacterial activity of some of dibutyltin iv chlorobenzoate derivatives against staphylococcus aureus and escherichia coli arpn journal of engineering and applied sciences 16 15 pp 1623-1629 issn 1819-6608
