,Unnamed: 0,divisions,title,abstract,subjects,publication,publisher,date,keywords,keyword,lang,text_stemmed
10761,10761,['FT7'],aplikasi minyak kelapa sawit pada photovoltaic yang terintegrasi pada dinding bangunan sebagai pendingin pasif untuk meningkatkan efisiensi dan menurunkan beban pendingin ruangan,"menanggapi isu green building dan penggunaan clean energy yang sangat santer saat ini pemanfaatan energi terbarukan menjadi meningkat penggunaan energi surya menggunakan photovoltaic pv pada sistem building intergated photovoltaics bipv akan menambah pasokan listrik dan mengurangi ketergantungan terhadap pembangkit listrik menurut m farid dan abhat a low dalam jurnal monev muhammad irsyad penambahan minyak kelapa sawit pada photovoltaic yang terintegrasi pada dinding bangunan untuk meningkatkan efisiensi dan menurunkan beban pendingin ruangan 2012 persoalan tiap kenaikan 1o c temperatur pv yang mengurangi efisiensi pv 0,4 0,5% dapat disiasati dengan integrasi phase change material pcm selain itu dengan sifatnya sebagai pendinginan pasif masuknya kalor ke dalam ruangan juga akan direduksi penelitian ini dilakukan untuk melihat karakteristik efisiensi pv dan perambatan kalor pada ruangan model bipv yang diintegrasikan dengan pcm cpo pengujian dilakukan dengan membandingkan dua model bipv yang dengan dan tanpa pcm cpo variasi dilakukan dengan kemiringan bipv 45º dan 30º masingmasing orientasi timur dan barat setelah dilakukan empat variasi percobaan bipv dengan kemiringan 30º lebih unggul dibanding dengan kemiringan 45º perbandingan perpindahan panas dinding dalam menuju ruang bipv dengan pcm cpo kemiringan 30º orientasi barat lebih signifikan dan stabil terutama pada intensitas 850 w m² perbandingan panas dari dinding dalam menuju ruang yang sebesar 0,4012 w dapat diredam dengan menggunakan cpo hanya sebesar 0,2596 w kemudian pada puncak perpindahan panas tertinggi dari dinding dalam ke ruang model bipv tanpa cpo dengan intensitas 923 w m² mencapai 0,43426 w dengan penambahan pcm cpo hanya 0,25913 w perbedaan efisiensi dengan pemakaian pcm cpo juga lebih unggul hingga menaikkan efisiensi 5,75% saat intensitas 982 w m² sudut penyinaran 120 º dari timur kata kunci green building clean energy photovoltaic bahan perubah fasa minyak kelapa sawit pendingin pasif",['TJ'],TURBO,"Jurusan Teknik Mesin, Fakultas Teknik, Universitas Muhammadiyah Metro",2017-06-01,,,id,aplikasi minyak kelapa sawit pada photovoltaic yang integrasi pada dinding bangun bagai dingin pasif untuk tingkat efisiensi dan turun beban dingin ruang tanggap isu green building dan guna clean energy yang sangat santer saat ini manfaat energi baru jadi tingkat guna energi surya guna photovoltaic pv pada sistem building intergated photovoltaics bipv akan tambah pasok listrik dan kurang gantung hadap bangkit listrik turut m farid dan abhat a low dalam jurnal monev muhammad irsyad tambah minyak kelapa sawit pada photovoltaic yang integrasi pada dinding bangun untuk tingkat efisiensi dan turun beban dingin ruang 2012 soal tiap naik 1o c temperatur pv yang kurang efisiensi pv 0 4 0 5 dapat siasat dengan integrasi phase change material pcm selain itu dengan sifat bagai dingin pasif masuk kalor ke dalam ruang juga akan reduksi teliti ini laku untuk lihat karakteristik efisiensi pv dan rambat kalor pada ruang model bipv yang integrasi dengan pcm cpo uji laku dengan banding dua model bipv yang dengan dan tanpa pcm cpo variasi laku dengan miring bipv 45 dan 30 masingmasing orientasi timur dan barat telah laku empat variasi coba bipv dengan miring 30 lebih unggul banding dengan miring 45 banding pindah panas dinding dalam tuju ruang bipv dengan pcm cpo miring 30 orientasi barat lebih signifikan dan stabil utama pada intensitas 850 w m banding panas dari dinding dalam tuju ruang yang besar 0 4012 w dapat redam dengan guna cpo hanya besar 0 2596 w kemudian pada puncak pindah panas tinggi dari dinding dalam ke ruang model bipv tanpa cpo dengan intensitas 923 w m capai 0 43426 w dengan tambah pcm cpo hanya 0 25913 w beda efisiensi dengan pakai pcm cpo juga lebih unggul hingga naik efisiensi 5 75 saat intensitas 982 w m sudut sinar 120 dari timur kata kunci green building clean energy photovoltaic bahan ubah fasa minyak kelapa sawit dingin pasif
10762,10762,['FT7'],perancangan ulang alat pengering biji kakao tipe rotari sederhana pada usaha mandiri di desa wiyono kabupaten pesawaran,"penelitian ini dilakukan pada alat pengering biji kakao untuk proses pengeringan biji kakao milik usaha mandiri di desa wiyono kabupaten pesawaran penelitian ini bertujuan untuk merancang ulang alat pengering biji kakao tipe rotari sederhana agar proses pengeringan lebih efektif dan didapat kualitas hasil pengeringan biji kakao lebih baik perhitungan yang dilakukan meliputi dimensi alat pengering termal yang terjadi pada alat pengering dan kebutuhan bahan bakar pada alat pengering biji kakao tipe rotari sederhana serta dilakukan simulasi pada model alat pengering biji kakao tipe rotari sederhana yang telah dirancang menggunakan software autodesk cfd untuk mengetahui sebaran suhu pada model alat pengering yang telah dirancang dari hasil penelitian yang telah dilakukan alat pengering biji kakao tipe rotari sederhana ini memiliki dimensi ruang pengering dengan diameter 90 cm panjang 108 cm dan tebal 1,2 mm sebaran suhu pada ruang pengering sebesar 65,06oc kalor yang dibutuhkan untuk proses pengeringan biji kakao sebesar 1028906,047 kj waktu yang dibutuhkan untuk proses pengeringan 8 jam 14 menit dan bahan bakar yang dibutuhkan untuk proses pengeringan sebanyak 302,62 kg atau 0,30260 kubik serta sebaran suhu ratarata hasil simulasi menggunkan software autodesk cfd sebesar 63,5116 oc kata kunci kakao pengeringan autodesk cfd suhu",['TJ'],TURBO,"Jurusan Teknik Mesin, Fakultas Teknik, Universitas Muhammadiyah Metro",2017-12,,,id,ancang ulang alat ering biji kakao tipe rotari sederhana pada usaha mandiri di desa wiyono kabupaten sawar teliti ini laku pada alat ering biji kakao untuk proses ering biji kakao milik usaha mandiri di desa wiyono kabupaten sawar teliti ini tuju untuk rancang ulang alat ering biji kakao tipe rotari sederhana agar proses ering lebih efektif dan dapat kualitas hasil ering biji kakao lebih baik hitung yang laku liput dimensi alat ering termal yang jadi pada alat ering dan butuh bahan bakar pada alat ering biji kakao tipe rotari sederhana serta laku simulasi pada model alat ering biji kakao tipe rotari sederhana yang telah rancang guna software autodesk cfd untuk tahu sebar suhu pada model alat ering yang telah rancang dari hasil teliti yang telah laku alat ering biji kakao tipe rotari sederhana ini milik dimensi ruang ering dengan diameter 90 cm panjang 108 cm dan tebal 1 2 mm sebar suhu pada ruang ering besar 65 06oc kalor yang butuh untuk proses ering biji kakao besar 1028906 047 kj waktu yang butuh untuk proses ering 8 jam 14 menit dan bahan bakar yang butuh untuk proses ering banyak 302 62 kg atau 0 30260 kubik serta sebar suhu ratarata hasil simulasi gun software autodesk cfd besar 63 5116 oc kata kunci kakao ering autodesk cfd suhu
10763,10763,['FKIP14'],model pembelajaran bahasa lampung berbasis kekonteksan wilayah,siswa multijenjang di lampung harus menguasai bahasa dari dua budaya lampung dialek saibatin dan pepadun dialek a dan dialek o kebijakan ini memberikan masalah yaitu belum maksimalnya pencapaian tujuan pembelajasan bahasa lampung sebagai bahasa ibu untuk menghasilkan para siswa yang mampu berbahasa lampung baik aktif maupun pasif tujuan penelitian ini yaitu untuk merumuskan pola pembelajaran bahasa lampung yang berbasis pada konteks wilayah tertentu penelitian ini menggunakan metode deskriptif kualitatif sumber data berasal dari data lapang yang diolah melalui tahapan reduksi data penyajian dan penarikan simpulan verifikasi peneliti juga menggunakan teknik triangulasi untuk menguji keabsahan data penelitian ini dilakukan di kabupaten waykanan dengan hasil yaitu ditemukannya pola pembelajaran bahasa lampung yang terfokus pada penggunaan materi ajar yang sesuai dengan budaya yang berkembang dalam masingmasing wilayah adat pola pembelajaran ini berbeda dengan pola sebelumnya yang mengharuskan siswa multijenjang untuk memelajari bahasa dari dua budaya lampung pola pembelajaran ini memberikan dampak positif bagi peningkatan penguasaan siswa terhadap bahasa lampung selain itu dengan pola pembelajaran ini siswa juga dapat mempelajari adat istiadat yang ada di wilayah tempat tinggalnya kata kunci pola pembelajaran bahasa lampung kekonteksan wilayah,"['L1', 'LB']",,,2017-12,,,id,model ajar bahasa lampung bas konteks wilayah siswa multijenjang di lampung harus kuasa bahasa dari dua budaya lampung dialek saibatin dan pepadun dialek a dan dialek o bijak ini beri masalah yaitu belum maksimal capai tuju pembelajasan bahasa lampung bagai bahasa ibu untuk hasil para siswa yang mampu bahasa lampung baik aktif maupun pasif tuju teliti ini yaitu untuk rumus pola ajar bahasa lampung yang bas pada konteks wilayah tentu teliti ini guna metode deskriptif kualitatif sumber data asal dari data lapang yang olah lalu tahap reduksi data saji dan tari simpul verifikasi teliti juga guna teknik triangulasi untuk uji absah data teliti ini laku di kabupaten waykanan dengan hasil yaitu temu pola ajar bahasa lampung yang fokus pada guna materi ajar yang sesuai dengan budaya yang kembang dalam masingmasing wilayah adat pola ajar ini beda dengan pola belum yang harus siswa multijenjang untuk ajar bahasa dari dua budaya lampung pola ajar ini beri dampak positif bagi tingkat kuasa siswa hadap bahasa lampung selain itu dengan pola ajar ini siswa juga dapat ajar adat istiadat yang ada di wilayah tempat tinggal kata kunci pola ajar bahasa lampung konteks wilayah
10764,10764,['FP24'],keanekaragaman arthropoda permukaan tanah pada pertanaman ubikayu manihot utilissima pohl setelah perlakuan olah tanah dan pengendalian gulma,"penelitian ini bertujuan untuk mengetahui keanekaragaman arthropoda permukaan tanah pada pertanaman ubikayu setelah perlakuan olah tanah dan pengelolaan gulma perlakuan disusun dalam rancangan acak kelompok rak dengan empat perlakuan dan empat ulangan keempat perlakuan tersebut ialah olah tanah minimum dan pengelollaan gulma secara manual non herbisida olah tanah minimum dan pengelolaan gulma dengan herbisida olah tanah intensif dan pengelolaan gulma dengan herbisida serta olah tanah intensif dengan pengelolaan gulma non herbisida herbisida yang digunakan berbahan aktif glifosat dan 2,4 d dengan dosis 160 ml bimastar 240 120 sl dalam 1 liter air per ha diaplikasikan pada awal tanam pengambilan sampel arthropoda dengan pitfall trap diameter 9 cm tinggi 12 cm dilakukan sebanyak 8 kali dengan selang waktu 1 minggu hasil penelitian menunjukkan bahwa kemelimpahan total arthropoda permukaan tanah pada lahan pertanaman ubikayu dengan perlakuan pengolahan tanah dan pengelolaan gulma ialah sebanyak 8.910 ekor yang tercakup dalam lo ordo dan 29 famili diantara ordo dan famili yang diperoleh dua ordo dan famili dengan kemelimpahan dan kepadatan populasi relative tertinggi berturutturut ialah ordo collembola dan hymenoptera serta famili paronellidae dan formicidae baik perlakuan pengolahan tanah maupun pengelolaan gulma yang dilakukan pada awal tanam tidak berpengaruh terhadap keanekaragaman arthropoda besamya nilainilai indeks shannonwiener dan indeks simpson tergolong dalam kategori sedang selain itu juga diketahui bahwa pada keseluruhan lahan perlakuan arthropoda permukaan tanah yang didapatkan didominasi oleh arthropoda yang berperan sebagai dekomposer dan predator",['S1'],Jurnal Agrotek Tropika,Jurnal Agrotek Tropika,2017-09,,,id,keanekaragaman arthropoda muka tanah pada tanam ubikayu manihot utilissima pohl telah laku olah tanah dan kendali gulma teliti ini tuju untuk tahu keanekaragaman arthropoda muka tanah pada tanam ubikayu telah laku olah tanah dan kelola gulma laku susun dalam rancang acak kelompok rak dengan empat laku dan empat ulang empat laku sebut ialah olah tanah minimum dan pengelollaan gulma cara manual non herbisida olah tanah minimum dan kelola gulma dengan herbisida olah tanah intensif dan kelola gulma dengan herbisida serta olah tanah intensif dengan kelola gulma non herbisida herbisida yang guna bahan aktif glifosat dan 2 4 d dengan dosis 160 ml bimastar 240 120 sl dalam 1 liter air per ha aplikasi pada awal tanam ambil sampel arthropoda dengan pitfall trap diameter 9 cm tinggi 12 cm laku banyak 8 kali dengan selang waktu 1 minggu hasil teliti tunjuk bahwa limpah total arthropoda muka tanah pada lahan tanam ubikayu dengan laku olah tanah dan kelola gulma ialah banyak 8 910 ekor yang cakup dalam lo ordo dan 29 famili antara ordo dan famili yang oleh dua ordo dan famili dengan limpah dan padat populasi relative tinggi berturutturut ialah ordo collembola dan hymenoptera serta famili paronellidae dan formicidae baik laku olah tanah maupun kelola gulma yang laku pada awal tanam tidak pengaruh hadap keanekaragaman arthropoda besamya nilainilai indeks shannonwiener dan indeks simpson golong dalam kategori sedang selain itu juga tahu bahwa pada seluruh lahan laku arthropoda muka tanah yang dapat dominasi oleh arthropoda yang peran bagai dekomposer dan predator
10765,10765,['FP5'],kajian kelembagaan gabungan kelompok tani dalam program kemitraan di kphp way terusan,kph merupakan salah satu solusi terhadap permasalahan degradasi dan deforestasi yang terjadi di hampir seluruh wilayah hutan di indonesia namun dalam praktiknya kph mengalami kendala yaitu pengembangan kelembagaan kelompok tani yang mengelola lahan di wilayahnya melalui program kemitraan tujuan dilakukanya penelitian ini adalah untuk mengkaji kelembagaan gabungan kelompok tani di kphp way terusan pengumpulan data dilakukan dengan wawancara data yang diperoleh dianalisis secara deskriptif hasil penelitian menunjukan bahwa proses terbentuknya kth merupakan respon dari program kemitraan sehingga masyarakat belum memahami sepenuhnya arah dan tujuan dibentuknya kth implementasi aturan main dalam bentuk ad art belum sepenuhnya dilakukan karena baik dari pengurus maupun anggota tidak dilibatkan dalam pembentukan ad art masyarakat percaya bahwa pengurus kth dapat membantu mengembangkan usaha tani sehingga dapat meningkatkan kesejahteraan masyarakat peningkatan kapasitas masyarakat perlu dilakukan melalui penyuluhan dan pelatihan agar gapoktan maupun kelompok tani menjadi lebih kuat dan mandiri kata kunci aturan kelembagaan kelompok tani hutan kemitraan,['SD'],Jurnal Hutan Tropis,Fakultas Kehutanan Universitas Lambung Mangkurat,2017-01,,,id,kaji lembaga gabung kelompok tani dalam program mitra di kphp way terus kph rupa salah satu solusi hadap masalah degradasi dan deforestasi yang jadi di hampir seluruh wilayah hutan di indonesia namun dalam praktik kph alami kendala yaitu kembang lembaga kelompok tani yang kelola lahan di wilayah lalu program mitra tuju dilakukanya teliti ini adalah untuk kaji lembaga gabung kelompok tani di kphp way terus kumpul data laku dengan wawancara data yang oleh analis cara deskriptif hasil teliti tunjuk bahwa proses bentuk kth rupa respon dari program mitra sehingga masyarakat belum paham sepenuh arah dan tuju bentuk kth implementasi atur main dalam bentuk ad art belum sepenuh laku karena baik dari urus maupun anggota tidak libat dalam bentuk ad art masyarakat percaya bahwa urus kth dapat bantu kembang usaha tani sehingga dapat tingkat sejahtera masyarakat tingkat kapasitas masyarakat perlu laku lalu suluh dan latih agar gapoktan maupun kelompok tani jadi lebih kuat dan mandiri kata kunci atur lembaga kelompok tani hutan mitra
10766,10766,['FKIP8'],alih tutur film 99 cahaya di langit eropa sutradara guntur soeharjanto,penelitian ini bertujuan menganalisis dan menjelaskan alih tutur pada film 99 cahaya di langit eropa sutradara guntur soeharjanto dan implikasinya terhadap mata kuliah keterampilan berbicara penelitian ini menggunakan metode deskriptif kualitatif hasil penelitian menunjukkan bahwa alih tutur dengan cara memperoleh ditemukan paling banyak dibandingkan cara alih tutur yang lainnya alih tutur dengan cara merebut ditemukan paling sedikit hasil penelitian ini juga dapat diimplikasikan dalam mata kuliah keterampilan berbicara di perguruan tinggi pada program studi pendidikan bahasa dan sastra indonesia sebagai tambahan materi ajar pada kompetensi dasar berbicara dalam bentuk berdiskusi peserta didik dapat menggunakan hasil penelitian alih tutur dalam materi berbicara dalam bentuk berdiskusi karena dalam materi ini seluruh peserta didik dituntut untuk aktif selama perkuliahan berlangsung contoh alih tutur dalam tambahan materi ajar dapat membantu dalam memahami peralihan bertutur,['L1'],J-Simbol,Universitas Lampung,2017-04-01,,,id,alih tutur film 99 cahaya di langit eropa sutradara guntur soeharjanto teliti ini tuju analis dan jelas alih tutur pada film 99 cahaya di langit eropa sutradara guntur soeharjanto dan implikasi hadap mata kuliah terampil bicara teliti ini guna metode deskriptif kualitatif hasil teliti tunjuk bahwa alih tutur dengan cara oleh temu paling banyak banding cara alih tutur yang lain alih tutur dengan cara rebut temu paling sedikit hasil teliti ini juga dapat implikasi dalam mata kuliah terampil bicara di guru tinggi pada program studi didik bahasa dan sastra indonesia bagai tambah materi ajar pada kompetensi dasar bicara dalam bentuk diskus serta didik dapat guna hasil teliti alih tutur dalam materi bicara dalam bentuk diskus karena dalam materi ini seluruh serta didik tuntut untuk aktif lama kuliah langsung contoh alih tutur dalam tambah materi ajar dapat bantu dalam paham alih tutur
10767,10767,['FEB5'],pelatihan kiat sukses umkm dalam menjalin hubungan dengan pihak perbankan di kelurahan pematangwangi kecamatan tanjung senang bandar lampung,bank merupakan lembaga keuangan yang dibutuhkan oleh masyarakat bank mempunyai peran yang penting bagi masyarakat yang mempunyai kelebihan dana maupun kekurangan dana khususnya usaha mikro kecil dan menengah umkm dalam mengembangkan usahanya untuk mendapatkan kredit bank bukan hal yang mudah bagi pengusaha kecil hal ini disebabkan faktor persyaratan yang harus dipenuhi untuk mendapatkan kredit pengusaha kecil membutuhkan dana dengen cepat sedangkan bank tidak bisa semudah itu untuk mengeluarkan dana tersebut dikarenakan adanya unsur persyaratan yang harus dipenuhi untuk meyakinkan pada bank apakah nantinya dapat membayar mengangsur atau tidak umkm perlu bekerjasama baik antara pihak bank sebagai lembaga pemberi kredit agar permasalahan diantara kedua belah pihak dapat diatasi dan saling menguntungkan pelatihan ini telah dilaksanakan pada tanggal 6 november 2016 peserta yang hadir adalah pelaku umkm di kelurahan pematangwangi kecamatan lampung tanjung senang bandar lampung kata kunci bank pelaku umkm umkm,['H1'],,ZAMZAM TOWER,2017-12-11,,,id,latih kiat sukses umkm dalam jalin hubung dengan pihak perban di lurah pematangwangi camat tanjung senang bandar lampung bank rupa lembaga uang yang butuh oleh masyarakat bank punya peran yang penting bagi masyarakat yang punya lebih dana maupun kurang dana khusus usaha mikro kecil dan tengah umkm dalam kembang usaha untuk dapat kredit bank bukan hal yang mudah bagi usaha kecil hal ini sebab faktor syarat yang harus penuh untuk dapat kredit usaha kecil butuh dana dengen cepat sedang bank tidak bisa mudah itu untuk keluar dana sebut karena ada unsur syarat yang harus penuh untuk yakin pada bank apakah nanti dapat bayar angsur atau tidak umkm perlu bekerjasama baik antara pihak bank bagai lembaga beri kredit agar masalah antara dua belah pihak dapat atas dan saling untung latih ini telah laksana pada tanggal 6 november 2016 serta yang hadir adalah laku umkm di lurah pematangwangi camat lampung tanjung senang bandar lampung kata kunci bank laku umkm umkm
10768,10768,['FP19'],metode pembuatan surfaktan metil ester sulfonat untuk aplikasi eor,"invensi ini berhubungan dengan produk dan metode pembuatan surfaktan metil ester sulfonat khususnya berhubungan dengan proses pembuatan metil ester sulfonat mes dari minyak cpo dan formulasinya sebagai surfaktan untuk eor surfaktan mes dipilih karena mempunyai nilai ift yang memadai dan indonesia kaya akan cpo sebagai bahan baku pembuatnya formulasi dilakukan untuk meningkatkan kinerja surfaktan sehingga memenuhi kriteria pembuatan surfaktan mes menggunakan bahan baku metil ester dari cpo yang diperoleh dari minyak curah pada invensi ini dilakukan uji pengaruh suhu reaksi lama reaksi dan rasio mol pereaksi dengan menggunakan nahso3 sebagai bahan pensulfonasi proses formulasi menghasilkan formula surfaktan rpe811 dengan kinerja mampu menurunkan tegangan antar muka mencapai 10-3 dyne cm kompatibel dengan air formulasi nilai filtration ratio fr lebih kecil dari 1,2 dan stabil sampai 30 hari pada suhu 60oc pada uji core flooding dengan batuan standar bentheimer mampu menghasilkan minyak sebesar 16,51%",['S1'],,,2017-08,,,id,metode buat surfaktan metil ester sulfonat untuk aplikasi eor invensi ini hubung dengan produk dan metode buat surfaktan metil ester sulfonat khusus hubung dengan proses buat metil ester sulfonat mes dari minyak cpo dan formulasi bagai surfaktan untuk eor surfaktan mes pilih karena punya nilai ift yang pada dan indonesia kaya akan cpo bagai bahan baku buat formulasi laku untuk tingkat kerja surfaktan sehingga penuh kriteria buat surfaktan mes guna bahan baku metil ester dari cpo yang oleh dari minyak curah pada invensi ini laku uji pengaruh suhu reaksi lama reaksi dan rasio mol reaksi dengan guna nahso3 bagai bahan pensulfonasi proses formulasi hasil formula surfaktan rpe811 dengan kerja mampu turun tegang antar muka capai 10-3 dyne cm kompatibel dengan air formulasi nilai filtration ratio fr lebih kecil dari 1 2 dan stabil sampai 30 hari pada suhu 60oc pada uji core flooding dengan batu standar bentheimer mampu hasil minyak besar 16 51
10769,10769,['FP19'],deskripsi paten surfaktan untuk eor,surfaktan berbasis minyak sawit yatu metil ester sulfonat dapat dimanfaatkan untuk enhance oil recovery atau eor,['S1'],,Dephumkam,2017,,,id,deskripsi paten surfaktan untuk eor surfaktan bas minyak sawit yatu metil ester sulfonat dapat manfaat untuk enhance oil recovery atau eor
10770,10770,['FKIP16'],pemberdayaan perekonomian masyarakat melalui koperasi unit desa berbasis usaha terbimbing,koperasi dan masyarakat merupakan aspek penting dalam peningkatan ekonomi pedesaan yang akan bermuara pada kemajuan desa tersebut maka koperasi dan masyarakat tidak dapat berjalan sendirisendiri atau bergerak terlalu dominan pada salah satu aspek nya sehingga pola gerakan koperasi harus selalu beriringan dengan pola gerakan masyarakat sebagai anggotanya usaha terbimbing merupakan sebuah perlakuan khusus kepada pelaku usaha untuk dapat diberikan pendampingan pembimbingan penyuluhan hingga pada tahap evaluasi usaha hal tersebut dimaksudkan agar pelaku usaha tersebut dapat terarah dengan baik mampu memecahkan masalah mampu menjawab tantangan mampu mengikuti perkembangan zaman dan memiliki daya saing sehingga usaha yang didirikan dapat terus maju dan berkembang sebagai bukti turut ambil bagian dalam pembangunan perekonomian masyarakat pemberdayaan dengan cara pembimbingan atau pendampingan dinilai akan berjalan lebih efektif dan efesien sehingga target yang telah ditentukan dapat lebih mudah dicapai paradigma yang masih menganggap koperasi menjadi jalan untuk kepentingan individual,['HN'],Pemberdayaan perekonomian masyarakat melalui koperasi unit desa berbasis usaha terbimbing,AKADEMIKA,2017-12-05,,,id,daya ekonomi masyarakat lalu koperasi unit desa bas usaha bimbing koperasi dan masyarakat rupa aspek penting dalam tingkat ekonomi desa yang akan muara pada maju desa sebut maka koperasi dan masyarakat tidak dapat jalan sendirisendiri atau gerak terlalu dominan pada salah satu aspek nya sehingga pola gera koperasi harus selalu iring dengan pola gera masyarakat bagai anggota usaha bimbing rupa buah laku khusus kepada laku usaha untuk dapat beri damping bimbing suluh hingga pada tahap evaluasi usaha hal sebut maksud agar laku usaha sebut dapat arah dengan baik mampu pecah masalah mampu jawab tantang mampu ikut kembang zaman dan milik daya saing sehingga usaha yang diri dapat terus maju dan kembang bagai bukti turut ambil bagi dalam bangun ekonomi masyarakat daya dengan cara bimbing atau damping nilai akan jalan lebih efektif dan efesien sehingga target yang telah tentu dapat lebih mudah capai paradigma yang masih anggap koperasi jadi jalan untuk penting individual
10771,10771,['FKIP16'],asterplan pendidikan sekolah menengah pertama di kabupaten lampung barat,penilaian reviewer,['L1'],,Erlina Rufaidah,2017,,,af,asterplan didik sekolah tengah pertama di kabupaten lampung barat nilai reviewer
10772,10772,['FKIP16'],laporan penelitian masterplan pendidikan sekolah pendidikan menengah pertama kabupaten pesisir barat,,['L1'],Not Published,,2017-03,,,?,lapor teliti masterplan didik sekolah didik tengah pertama kabupaten pesisir barat
10773,10773,['FKIP16'],masterplan pendidikan dasar kabupaten lampung barat 2015-2030,,['L1'],,Universitas Lampung,2017-12,,,?,masterplan didik dasar kabupaten lampung barat 2015-2030
10774,10774,['FKIP16'],ilmu ekonomi mikro,buku ini menjelaskan tentang mekanisme pasar konsep elastistias teori perilaku konsumen teori biaya produksi teori biaya memaksimumkan laba pasar persaingan sempurna pasar monopoli pasar persaingan monopolistik pasar oligopoli pasar faktor produksi uang dan lembaga keuangan dan interaksi dengan dunia internasional,['LB1501'],,GRAHA ILMU,2017-12-19,,,id,ilmu ekonomi mikro buku ini jelas tentang mekanisme pasar konsep elastistias teori perilaku konsumen teori biaya produksi teori biaya maksimum laba pasar saing sempurna pasar monopoli pasar saing monopolistik pasar oligopoli pasar faktor produksi uang dan lembaga uang dan interaksi dengan dunia internasional
