,Unnamed: 0,divisions,title,abstract,subjects,publication,publisher,date,keywords,keyword,lang,text_stemmed
5604,5604,['FP23'],pengaruh aplikasi asam humat dan pemupukan fosfat terhadap populasi dan biomassa cacing tanah pada pertanaman jagung zea mays l di tanah ultisol,tujuan penelitian ini untuk mempelajari pengaruh aplikasi asam humat dan pemupukan fosfat terhadap populasi dan biomassa cacing tanah serta mempelajari interaksi antara dua perlakuan yang diberikan penelitian ini dilaksanakan pada desember 2018 sampai april 2019 di kebun percobaan badan pengkajian teknologi pertanian bptp natar perlakuan disusun secara faktorial dalam rancangan acak kelompok rak disusun secara faktorial dengan dua faktor dan diulang sebanyak 3 kali sebagai kelompok faktor pertama adalah asam humat tanpa aplikasi asam humat asam humat 15 kg ha-1 asam humat 30 kg ha-1 sedangkan faktor kedua adalah pemupukan fosfat tanpa pupuk tsp pupuk tsp 100 kg ha-1 pupuk tsp 200 kg ha-1 pupuk tsp 300 kg ha-1 hasil penelitian menunjukan bahwa aplikasi asam humat berpengaruh nyata terhadap populasi cacing tanah pada pengamatan fase vegetatif maksimum 50 hst dan sebelum panen 90 hst populasi cacing tanah tanah pada pengamatan 50 hst dengan perlakuan tanpa aplikasi asam humat lebih tinggi 4 ekor dibandingkan dengan perlakuan aplikasi asam humat 15 kg ha-1 2 ekor dan 30 kg ha-1 1 ekor selanjutnya populasi cacing tanah pada pengamatan 90 hst dengan perlakuan aplikasi asam humat 30 kg ha-1 lebih tinggi 56 ekor dibandingkan dengan perlakuan asam humat 15 kg ha-1 37 ekor dan tanpa aplikasi asam humat 25 ekor pemupukan fosfat berpengaruh nyata terhadap populasi dan biomassa cacing tanah pada pengamatan fase vegetatif maksimum 50 hst populasi cacing tanah pada pengamatan 50 hst dengan perlakuan pupuk tsp 300 kg ha-1 lebih tinggi 5 ekor dibandingkan dengan perlakuan pupuk tsp 200 kg ha-1 1 ekor pupuk tsp 100 kg ha-1 1 ekor dan tanpa pupuk tsp 1 ekor populasi cacing tanah meningkat sejalan dengan pertumbuhan tanaman jagung identifikasi cacing tanah pada penelitian ini menunjukkan bahwa jenis cacing tanah tergolong genus pontoscolex sp cacing tanah genus pontoscolex sp termasuk dalam famili glossoscolicidae cacing ini memiliki ciriciri klitelum yang terletak pada segmen ke-14 memiliki setae dengan pola lumbrisin dan tipe prostomium yaitu prolobus,['S1'],Journal of Tropical Upland Resources (J. Trop. Upland Res.),LPPM Universitas Lampung,2020-03-01,,,id,pengaruh aplikasi asam humat dan pupu fosfat hadap populasi dan biomassa cacing tanah pada tanam jagung zea mays l di tanah ultisol tuju teliti ini untuk ajar pengaruh aplikasi asam humat dan pupu fosfat hadap populasi dan biomassa cacing tanah serta ajar interaksi antara dua laku yang beri teliti ini laksana pada desember 2018 sampai april 2019 di kebun coba badan kaji teknologi tani bptp natar laku susun cara faktorial dalam rancang acak kelompok rak susun cara faktorial dengan dua faktor dan ulang banyak 3 kali bagai kelompok faktor pertama adalah asam humat tanpa aplikasi asam humat asam humat 15 kg ha-1 asam humat 30 kg ha-1 sedang faktor dua adalah pupu fosfat tanpa pupuk tsp pupuk tsp 100 kg ha-1 pupuk tsp 200 kg ha-1 pupuk tsp 300 kg ha-1 hasil teliti tunjuk bahwa aplikasi asam humat pengaruh nyata hadap populasi cacing tanah pada amat fase vegetatif maksimum 50 hst dan belum panen 90 hst populasi cacing tanah tanah pada amat 50 hst dengan laku tanpa aplikasi asam humat lebih tinggi 4 ekor banding dengan laku aplikasi asam humat 15 kg ha-1 2 ekor dan 30 kg ha-1 1 ekor lanjut populasi cacing tanah pada amat 90 hst dengan laku aplikasi asam humat 30 kg ha-1 lebih tinggi 56 ekor banding dengan laku asam humat 15 kg ha-1 37 ekor dan tanpa aplikasi asam humat 25 ekor pupu fosfat pengaruh nyata hadap populasi dan biomassa cacing tanah pada amat fase vegetatif maksimum 50 hst populasi cacing tanah pada amat 50 hst dengan laku pupuk tsp 300 kg ha-1 lebih tinggi 5 ekor banding dengan laku pupuk tsp 200 kg ha-1 1 ekor pupuk tsp 100 kg ha-1 1 ekor dan tanpa pupuk tsp 1 ekor populasi cacing tanah tingkat jalan dengan tumbuh tanam jagung identifikasi cacing tanah pada teliti ini tunjuk bahwa jenis cacing tanah golong genus pontoscolex sp cacing tanah genus pontoscolex sp masuk dalam famili glossoscolicidae cacing ini milik ciriciri klitelum yang letak pada segmen ke-14 milik setae dengan pola lumbrisin dan tipe prostomium yaitu prolobus
5605,5605,['FK1'],the differences of community knowledge between before and after health education of malaria,"latar belakang desa suka jaya lempasing merupakan daerah endemis malaria dengan peningkatan annual parasite insidence api dari tahun 2015 yaitu 1,7 per 1.000 penduduk menjadi 2,2 per 1.000 penduduk pada tahun 2016 desa tersebut memiliki angka api lebih tinggi dibandingkan dengan api nasional di indonesia yaitu 0,84 per 1.000 penduduk berbagai upaya pencegahan telah dilakukan antara lain diagnosis dini pengobatan cepat dan tepat serta surveilans dan pengendalian vektor namun program tersebut belum efektif mengurangi jumlah penderita malaria dikarenakan rendahnya pengetahuan masyarakat tentang malaria metode penelitian ini menggunakan metode quassy experimental teknik pengambilan sampel adalah total sampling penelitian dilaksanakan periode april juni 2017 bertempat di desa suka jaya lempasing pesawaran lampung sampel yang berhasil didapatkan adalah 25 orang data diperoleh dari kuesioner pengetahuan hasil hasil analisis univariat didapatkan distribusi data tidak normal dengan nilai p pre test 0,03 dan p post test 0,00 karena dsitribusi data tidak normal digunakan analisis bivariat uji non parametrik wilcoxon yang menunjukan nilai p 0,00 kesimpulan kesimpulan penelitian ini adalah terdapat perbedaan pengetahuan tentang malaria sebelum dan sesudah pendidikan kesehatan pada masyarakat desa suka jaya lempasing kata kunci malaria pendidikan kesehatan pengetahuan","['R1', 'RA']",Jambi Medical Journal,Unit Kerja Publikasi dan Penerbit Fakultas Kedokteran dan Ilmu Kesehatan Universitas Jambi,2020-11,,,id,the differences of community knowledge between before and after health education of malaria latar belakang desa suka jaya lempasing rupa daerah endemis malaria dengan tingkat annual parasite insidence api dari tahun 2015 yaitu 1 7 per 1 000 duduk jadi 2 2 per 1 000 duduk pada tahun 2016 desa sebut milik angka api lebih tinggi banding dengan api nasional di indonesia yaitu 0 84 per 1 000 duduk bagai upaya cegah telah laku antara lain diagnosis dini obat cepat dan tepat serta surveilans dan kendali vektor namun program sebut belum efektif kurang jumlah derita malaria karena rendah tahu masyarakat tentang malaria metode teliti ini guna metode quassy experimental teknik ambil sampel adalah total sampling teliti laksana periode april juni 2017 tempat di desa suka jaya lempasing sawar lampung sampel yang hasil dapat adalah 25 orang data oleh dari kuesioner tahu hasil hasil analisis univariat dapat distribusi data tidak normal dengan nilai p pre test 0 03 dan p post test 0 00 karena dsitribusi data tidak normal guna analisis bivariat uji non parametrik wilcoxon yang tunjuk nilai p 0 00 simpul simpul teliti ini adalah dapat beda tahu tentang malaria belum dan sudah didik sehat pada masyarakat desa suka jaya lempasing kata kunci malaria didik sehat tahu
5606,5606,['FP5'],pemetaan kesehatan pohon di hutan konservasi studi kasus tahura wan abdul rachman desa cilimus kecamatan teluk pandan kabupaten pesawaran provinsi lampung,"abstrak pohon merupakan penyusun utama sebuah hutan hutan konservasi yang sehat harus tersusun dari pepohonan yang sehat pula tahura wan abdul rahman termasuk hutan konservasi dalam bentuk kawasan pelestarian alam salah satu cara untuk mengetahui hutan konservasi yang sehat yaitu dengan melakukan pemetaan kesehatan pohon penelitian ini bertujuan untuk mengetahui sebaran kondisi kesehatan pohon di hutan konservasi penelitian ini dilaksanakan pada hutan konservasi di desa cilimus kecamatan teluk pandan kabupaten pesawaran provinsi lampung penelitian ini menggunakan metode penilaian kerusakan pohon berdasarkan teknik forest health monitoring fhm plot ukur sampel berdasarkan desain klasterplot fhm sebanyak dua klasterplot hasil penelitian menunjukkan bahwa terdapat 47 pohon yang dinilai kesehatan pohonnya dengan 4 pohon 9% pada kategori baik 16 pohon 34% pada ketegori sedang dan 27 pohon 57% pada kategori jelek kerusakan pohon yang paling banyak ditemukan yaitu pada lokasi cabang kode 7 sebanyak 16 25,40% dengan tipe kerusakan daun pucuk atau tunas rusak kode 24 sebanyak 20 31,75% dengan demikian sebaran kesehatan pohon yang rusak pada hutan konservasi tersebar secara menyeluruh dengan tingkat kondisi kesehatan pohon yang jelek kata kunci forest health monitoring hutan konservasi kesehatan pohon",['SD'],TALENTA Conference Series: Agriculturan & Natural Resource (ANR),"TALENTA Publisher, Universitas Sumatera Utara",2020,,,id,meta sehat pohon di hutan konservasi studi kasus tahura wan abdul rachman desa cilimus camat teluk pandan kabupaten sawar provinsi lampung abstrak pohon rupa susun utama buah hutan hutan konservasi yang sehat harus susun dari pohon yang sehat pula tahura wan abdul rahman masuk hutan konservasi dalam bentuk kawasan lestari alam salah satu cara untuk tahu hutan konservasi yang sehat yaitu dengan laku meta sehat pohon teliti ini tuju untuk tahu sebar kondisi sehat pohon di hutan konservasi teliti ini laksana pada hutan konservasi di desa cilimus camat teluk pandan kabupaten sawar provinsi lampung teliti ini guna metode nilai rusa pohon dasar teknik forest health monitoring fhm plot ukur sampel dasar desain klasterplot fhm banyak dua klasterplot hasil teliti tunjuk bahwa dapat 47 pohon yang nilai sehat pohon dengan 4 pohon 9 pada kategori baik 16 pohon 34 pada ketegori sedang dan 27 pohon 57 pada kategori jelek rusa pohon yang paling banyak temu yaitu pada lokasi cabang kode 7 banyak 16 25 40 dengan tipe rusa daun pucuk atau tunas rusak kode 24 banyak 20 31 75 dengan demikian sebar sehat pohon yang rusak pada hutan konservasi sebar cara seluruh dengan tingkat kondisi sehat pohon yang jelek kata kunci forest health monitoring hutan konservasi sehat pohon
5607,5607,['FP5'],pemetaan kesehatan pohon di hutan konservasi studi kasus tahura wan abdul rachman desa cilimus kecamatan teluk pandan kabupaten pesawaran provinsi lampung,"pohon merupakan penyusun utama sebuah hutan hutan konservasi yang sehat harus tersusun dari pepohonan yang sehat pula tahura wan abdul rahman termasuk hutan konservasi dalam bentuk kawasan pelestarian alam salah satu cara untuk mengetahui hutan konservasi yang sehat yaitu dengan melakukan pemetaan kesehatan pohon penelitian ini bertujuan untuk mengetahui sebaran kondisi kesehatan pohon di hutan konservasi penelitian ini dilaksanakan pada hutan konservasi di desa cilimus kecamatan teluk pandan kabupaten pesawaran provinsi lampung penelitian ini menggunakan metode penilaian kerusakan pohon berdasarkan teknik forest health monitoring fhm plot ukur sampel berdasarkan desain klasterplot fhm sebanyak dua klasterplot hasil penelitian menunjukkan bahwa terdapat 47 pohon yang dinilai kesehatan pohonnya dengan 4 pohon 9% pada kategori baik 16 pohon 34% pada ketegori sedang dan 27 pohon 57% pada kategori jelek kerusakan pohon yang paling banyak ditemukan yaitu pada lokasi cabang kode 7 sebanyak 16 25,40% dengan tipe kerusakan daun pucuk atau tunas rusak kode 24 sebanyak 20 31,75% dengan demikian sebaran kesehatan pohon yang rusak pada hutan konservasi tersebar secara menyeluruh dengan tingkat kondisi kesehatan pohon yang jelek",['SD'],TALENTA Conference Series: Agriculturan & Natural Resource (ANR),"TALENTA Publisher, Universitas Sumatera Utara",2020,,,id,meta sehat pohon di hutan konservasi studi kasus tahura wan abdul rachman desa cilimus camat teluk pandan kabupaten sawar provinsi lampung pohon rupa susun utama buah hutan hutan konservasi yang sehat harus susun dari pohon yang sehat pula tahura wan abdul rahman masuk hutan konservasi dalam bentuk kawasan lestari alam salah satu cara untuk tahu hutan konservasi yang sehat yaitu dengan laku meta sehat pohon teliti ini tuju untuk tahu sebar kondisi sehat pohon di hutan konservasi teliti ini laksana pada hutan konservasi di desa cilimus camat teluk pandan kabupaten sawar provinsi lampung teliti ini guna metode nilai rusa pohon dasar teknik forest health monitoring fhm plot ukur sampel dasar desain klasterplot fhm banyak dua klasterplot hasil teliti tunjuk bahwa dapat 47 pohon yang nilai sehat pohon dengan 4 pohon 9 pada kategori baik 16 pohon 34 pada ketegori sedang dan 27 pohon 57 pada kategori jelek rusa pohon yang paling banyak temu yaitu pada lokasi cabang kode 7 banyak 16 25 40 dengan tipe rusa daun pucuk atau tunas rusak kode 24 banyak 20 31 75 dengan demikian sebar sehat pohon yang rusak pada hutan konservasi sebar cara seluruh dengan tingkat kondisi sehat pohon yang jelek
5608,5608,['FP5'],analisis kesehatan pohon dengan menggunakan metode forest health monitoring studi kasus pada tiga fungsi hutan di provinsi lampung,ekosistem hutan yang sehat dapat dicirikan dengan kesehatan pohonpohon penyusun tegakannya pohon dikatakan sehat apabila pohon tersebut dapat melaksanakan fungsi fisiologis dan mempunyai ketahanan ekologis dari berbagai macam gangguan penurunan kesehatan pohon dapat dilihat berdasarkan kondisi kerusakan pohonnya penelitian ini bertujuan untuk mengetahui kondisi kesehatan pohon pada areal tiga fungsi hutan di provinsi lampung penelitian ini dilaksanakan di tiga fungsi hutan yaitu konservasi di tahura wan abdul rachman lindung di kphp kota agung utara dan produksi di hutan rakyat desa buana sakti kecamatan batang hari kabupaten lampung timur pengukuran dan penilaian kesehatan pohon menggunakan metode forest health monitoring hasil penelitian menunjukkan bahwa pohonpohon penyusun tegakan di tiga fungsi hutan tersebut terdapat 143 dari 176 pohon yang mengalami kerusakan dari 143 pohon ada 22 jenis pohon yang mengalami kerusakan lokasi yang paling banyak mengalami kerusakan 2 yaitu pada bagian batang dan daun sebesar 26% dengan tipe kerusakan yang paling banyak yaitu cabang patah sebesar 26% dan daun pucuk tunas rusak sebesar 24% pada tingkat kerusakan ratarata diatas 20% dengan demikian kondisi kesehatan hutan pada areal tiga fungsi hutan di provinsi lampung berdasarkan kerusakan pohon tingkat klasterplot berada pada kategori sedang kata kunci forest health monitoring fungsi hutan kerusakan pohon kesehatan hutan,['SD'],,,2020-11-12,,,id,analisis sehat pohon dengan guna metode forest health monitoring studi kasus pada tiga fungsi hutan di provinsi lampung ekosistem hutan yang sehat dapat ciri dengan sehat pohonpohon susun tega pohon kata sehat apabila pohon sebut dapat laksana fungsi fisiologis dan punya tahan ekologis dari bagai macam ganggu turun sehat pohon dapat lihat dasar kondisi rusa pohon teliti ini tuju untuk tahu kondisi sehat pohon pada areal tiga fungsi hutan di provinsi lampung teliti ini laksana di tiga fungsi hutan yaitu konservasi di tahura wan abdul rachman lindung di kphp kota agung utara dan produksi di hutan rakyat desa buana sakti camat batang hari kabupaten lampung timur ukur dan nilai sehat pohon guna metode forest health monitoring hasil teliti tunjuk bahwa pohonpohon susun tega di tiga fungsi hutan sebut dapat 143 dari 176 pohon yang alami rusa dari 143 pohon ada 22 jenis pohon yang alami rusa lokasi yang paling banyak alami rusa 2 yaitu pada bagi batang dan daun besar 26 dengan tipe rusa yang paling banyak yaitu cabang patah besar 26 dan daun pucuk tunas rusak besar 24 pada tingkat rusa ratarata atas 20 dengan demikian kondisi sehat hutan pada areal tiga fungsi hutan di provinsi lampung dasar rusa pohon tingkat klasterplot ada pada kategori sedang kata kunci forest health monitoring fungsi hutan rusa pohon sehat hutan
5609,5609,['FP5'],analisis kesehatan pohon dengan menggunakan metode forest health monitoring studi kasus pada tiga fungsi hutan di provinsi lampung,ekosistem hutan yang sehat dapat dicirikan dengan kesehatan pohonpohon penyusun tegakannya pohon dikatakan sehat apabila pohon tersebut dapat melaksanakan fungsi fisiologis dan mempunyai ketahanan ekologis dari berbagai macam gangguan penurunan kesehatan pohon dapat dilihat berdasarkan kondisi kerusakan pohonnya penelitian ini bertujuan untuk mengetahui kondisi kesehatan pohon pada areal tiga fungsi hutan di provinsi lampung penelitian ini dilaksanakan di tiga fungsi hutan yaitu konservasi di tahura wan abdul rachman lindung di kphp kota agung utara dan produksi di hutan rakyat desa buana sakti kecamatan batang hari kabupaten lampung timur pengukuran dan penilaian kesehatan pohon menggunakan metode forest health monitoring hasil penelitian menunjukkan bahwa pohonpohon penyusun tegakan di tiga fungsi hutan tersebut terdapat 143 dari 172 pohon yang mengalami kerusakan dari 143 pohon ada 22 jenis pohon yang mengalami kerusakan lokasi yang paling banyak mengalami kerusakan yaitu pada bagian cabang dan daun sebesar 26% dengan tipe kerusakan yang paling banyak yaitu cabang patah sebesar 26% dan daun pucuk tunas rusak sebesar 24% pada tingkat kerusakan ratarata diatas 20% dengan demikian kondisi kesehatan hutan pada areal tiga fungsi hutan di provinsi lampung berdasarkan kerusakan pohon tingkat klasterplot berada pada kategori sedang,['SD'],,,2020-11-12,,,id,analisis sehat pohon dengan guna metode forest health monitoring studi kasus pada tiga fungsi hutan di provinsi lampung ekosistem hutan yang sehat dapat ciri dengan sehat pohonpohon susun tega pohon kata sehat apabila pohon sebut dapat laksana fungsi fisiologis dan punya tahan ekologis dari bagai macam ganggu turun sehat pohon dapat lihat dasar kondisi rusa pohon teliti ini tuju untuk tahu kondisi sehat pohon pada areal tiga fungsi hutan di provinsi lampung teliti ini laksana di tiga fungsi hutan yaitu konservasi di tahura wan abdul rachman lindung di kphp kota agung utara dan produksi di hutan rakyat desa buana sakti camat batang hari kabupaten lampung timur ukur dan nilai sehat pohon guna metode forest health monitoring hasil teliti tunjuk bahwa pohonpohon susun tega di tiga fungsi hutan sebut dapat 143 dari 172 pohon yang alami rusa dari 143 pohon ada 22 jenis pohon yang alami rusa lokasi yang paling banyak alami rusa yaitu pada bagi cabang dan daun besar 26 dengan tipe rusa yang paling banyak yaitu cabang patah besar 26 dan daun pucuk tunas rusak besar 24 pada tingkat rusa ratarata atas 20 dengan demikian kondisi sehat hutan pada areal tiga fungsi hutan di provinsi lampung dasar rusa pohon tingkat klasterplot ada pada kategori sedang
5610,5610,['FP5'],kajian kesehatan hutan dalam pengelolaan hutan konservasi,"hutan konservasi harus tetap terjaga fungsi dan kualitas hutannya agar kelestarian sumber daya alam hayati didalamnya tidak rusak dan keseimbangan ekosistemnya tertata dengan baik manfaat dari adanya hutan konservasi dapat dirasakan oleh masyarakat yang tinggal di sekitar hutan tersebut seperti karbon sumber air hasil hutan bukan kayu sehingga masyarakat dapat hidup sejahtera pemantauan kesehatan hutan merupakan kegiatan yang didesain untuk memantau kondisi kesehatan hutan berdasarkan hasil indikator ekologis yang terukur untuk pengambilan keputusan pengelolaan hutan tujuan dari penelitian ini adalah untuk mengetahui nilai status kesehatan hutan konservasi dan mengidentifikasi faktor internal dan eksternal kesehatan hutan konservasi metode yang digunakan adalah forest health monitoring untuk penilaian status kesehatan hutan dan software statistical product and service solutions 20 untuk penentuan hubungan faktor internal dengan eksternal kesehatan hutan hasil penelitian menunjukkan nilai status kesehatan hutan konservasi yang termasuk dalam wilayah kelola sub kelompok tani sistem hutan kerakyatan lestari di kecamatan teluk pandan kabupaten pesawaran tersebut termasuk dalam kategori sedang 3,20 faktor internal yang memengaruhi kesehatan hutan konservasi adalah biodiversitas dan kerusakan pohon sedangkan faktor eksternal yang memengaruhi kesehatan hutan konservasi adalah tingkat pengetahuan petani partisipasi petani dan motivasi petani",['SD'],Ulin Jurnal Hutan Tropis,Fakultas Kehutanan Universitas Mulawarman,2020-09,,,id,kaji sehat hutan dalam kelola hutan konservasi hutan konservasi harus tetap jaga fungsi dan kualitas hutan agar lestari sumber daya alam hayati dalam tidak rusak dan imbang ekosistem tata dengan baik manfaat dari ada hutan konservasi dapat rasa oleh masyarakat yang tinggal di sekitar hutan sebut seperti karbon sumber air hasil hutan bukan kayu sehingga masyarakat dapat hidup sejahtera pantau sehat hutan rupa giat yang desain untuk pantau kondisi sehat hutan dasar hasil indikator ekologis yang ukur untuk ambil putus kelola hutan tuju dari teliti ini adalah untuk tahu nilai status sehat hutan konservasi dan identifikasi faktor internal dan eksternal sehat hutan konservasi metode yang guna adalah forest health monitoring untuk nilai status sehat hutan dan software statistical product and service solutions 20 untuk tentu hubung faktor internal dengan eksternal sehat hutan hasil teliti tunjuk nilai status sehat hutan konservasi yang masuk dalam wilayah kelola sub kelompok tani sistem hutan rakyat lestari di camat teluk pandan kabupaten sawar sebut masuk dalam kategori sedang 3 20 faktor internal yang pengaruh sehat hutan konservasi adalah biodiversitas dan rusa pohon sedang faktor eksternal yang pengaruh sehat hutan konservasi adalah tingkat tahu tani partisipasi tani dan motivasi tani
5611,5611,['FP5'],kajian kesehatan hutan dalam pengelolaan hutan konservasi,"abstrak hutan konservasi harus tetap terjaga fungsi dan kualitas hutannya agar kelestarian sumber daya alam hayati didalamnya tidak rusak dan keseimbangan ekosistemnya tertata dengan baik manfaat dari adanya hutan konservasi dapat dirasakan oleh masyarakat yang tinggal di sekitar hutan tersebut seperti karbon sumber air hasil hutan bukan kayu sehingga masyarakat dapat hidup sejahtera pemantauan kesehatan hutan merupakan kegiatan yang didesain untuk memantau kondisi kesehatan hutan berdasarkan hasil indikator ekologis yang terukur untuk pengambilan keputusan pengelolaan hutan tujuan dari penelitian ini adalah untuk mengetahui nilai status kesehatan hutan konservasi dan mengidentifikasi faktor internal dan eksternal kesehatan hutan konservasi metode yang digunakan adalah forest health monitoring untuk penilaian status kesehatan hutan dan software statistical product and service solutions 20 untuk penentuan hubungan faktor internal dengan eksternal kesehatan hutan hasil penelitian menunjukkan nilai status kesehatan hutan konservasi yang termasuk dalam wilayah kelola sub kelompok tani sistem hutan kerakyatan lestari di kecamatan teluk pandan kabupaten pesawaran tersebut termasuk dalam kategori sedang 3,20 faktor internal yang memengaruhi kesehatan hutan konservasi adalah biodiversitas dan kerusakan pohon sedangkan faktor eksternal yang memengaruhi kesehatan hutan konservasi adalah tingkat pengetahuan petani partisipasi petani dan motivasi petani kata kunci forest health monitoring hutan konservasi kesehatan hutan",['SD'],Ulin â€“ Jurnal Hutan Tropis,Universitas Mulawarman,2020-10-08,,,id,kaji sehat hutan dalam kelola hutan konservasi abstrak hutan konservasi harus tetap jaga fungsi dan kualitas hutan agar lestari sumber daya alam hayati dalam tidak rusak dan imbang ekosistem tata dengan baik manfaat dari ada hutan konservasi dapat rasa oleh masyarakat yang tinggal di sekitar hutan sebut seperti karbon sumber air hasil hutan bukan kayu sehingga masyarakat dapat hidup sejahtera pantau sehat hutan rupa giat yang desain untuk pantau kondisi sehat hutan dasar hasil indikator ekologis yang ukur untuk ambil putus kelola hutan tuju dari teliti ini adalah untuk tahu nilai status sehat hutan konservasi dan identifikasi faktor internal dan eksternal sehat hutan konservasi metode yang guna adalah forest health monitoring untuk nilai status sehat hutan dan software statistical product and service solutions 20 untuk tentu hubung faktor internal dengan eksternal sehat hutan hasil teliti tunjuk nilai status sehat hutan konservasi yang masuk dalam wilayah kelola sub kelompok tani sistem hutan rakyat lestari di camat teluk pandan kabupaten sawar sebut masuk dalam kategori sedang 3 20 faktor internal yang pengaruh sehat hutan konservasi adalah biodiversitas dan rusa pohon sedang faktor eksternal yang pengaruh sehat hutan konservasi adalah tingkat tahu tani partisipasi tani dan motivasi tani kata kunci forest health monitoring hutan konservasi sehat hutan
