,Unnamed: 0,divisions,title,abstract,subjects,publication,publisher,date,keywords,keyword,lang,text_stemmed
6619,6619,['FK1'],pengaruh induksi gelombang elektromagnetik ponsel terhadap sel spermatosit primer pada tikus putih galur spraque dawley,"pengguna ponsel lakilaki biasanya menyimpan ponsel di saku celana sedangkan banyak penelitian epidemiologi menyimpulkan penggunaan ponsel berperan menyebabkan infertilitas pria radiasi gelombang elektromagnetik ponsel dapat menimbulkan stres oksidatif yang mempunyai pengaruh terhadap fungsi dan struktur testis berupa berkurangnya jumlah sel spermatogenik penelitian ini terdapat 25 sampel terbagi menjadi 5 kelompok kelompok kontrol positif k hanya diberi pakan dan minum kelompok kontrol negatif k diberi pakan dan minum serta diberi induksi paparan ponsel sar 1,56 w kg perlakuan 1 p1 diberikan dosis tomat 1,85 g dan zink 0,54 mg dan diinduksi paparan ponsel sar 1,56 w kg perlakuan 2 p2 diberikan dosis tomat 3,4 g dan zink 0,27 mg dan diinduksi paparan ponsel sar 1,56 w kg perlakuan 3 p3 diberikan dosis tomat 7,4 g dan zink 0,135 mg dan diinduksi paparan ponsel sar 1,56 w kg perlakuan diberikan selama 35 hari diperoleh pada p1 p2 dan p3 sel spermatosit primer berpengaruh nyata dengan  0,05.",['R1'],Jurnal Agromedicine,Fakultas Kedokteran Universitas Lampung,2019-06,,,id,pengaruh induksi gelombang elektromagnetik ponsel hadap sel spermatosit primer pada tikus putih galur spraque dawley guna ponsel lakilaki biasa simpan ponsel di saku celana sedang banyak teliti epidemiologi simpul guna ponsel peran sebab infertilitas pria radiasi gelombang elektromagnetik ponsel dapat timbul stres oksidatif yang punya pengaruh hadap fungsi dan struktur testis upa kurang jumlah sel spermatogenik teliti ini dapat 25 sampel bagi jadi 5 kelompok kelompok kontrol positif k hanya beri pakan dan minum kelompok kontrol negatif k beri pakan dan minum serta beri induksi papar ponsel sar 1 56 w kg laku 1 p1 beri dosis tomat 1 85 g dan zink 0 54 mg dan induksi papar ponsel sar 1 56 w kg laku 2 p2 beri dosis tomat 3 4 g dan zink 0 27 mg dan induksi papar ponsel sar 1 56 w kg laku 3 p3 beri dosis tomat 7 4 g dan zink 0 135 mg dan induksi papar ponsel sar 1 56 w kg laku beri lama 35 hari oleh pada p1 p2 dan p3 sel spermatosit primer pengaruh nyata dengan 0 05
6620,6620,['FK1'],terapi madu pada penderita ulkus diabetikum,diabetes mellitus dm adalah gangguan metabolik yang ditandai dengan tingginya kadar gula hiperglikemia akibat penurunan sekresi insulin oleh pancreas berkurangnya sensitifitas insulin atau keduanya salah satu komplikasi dm adalah ulkus diabetikum ulkus diabetikum terjadi akibat berkurangnya pasokan vascular pembuluh darah pada ujung perifer sehingga menyebabkan tidak adanya oksigen sehingga jaringan menjadi nekrosis pentingnya perawatan luka penting untuk mencegah terjadinya komplikasi fatal berupa amputasi menuru kriteria wagner derajat 5 perawatan luka berupa bahan herbal seperti minyak zaitun madu dan aloe vera sudah dilakukan madu memiliki beberapa kandungan yang bermanfaat sebagai antibacterial antiinflamasi autolisis dan penyembuhan luka sedangkan enzim yang penting terkandung dalam madu adalah enzim diastase invertase glukosa oksidase peroksidase dan lipase madu sebagai antibacterial memiliki campuran 48% gula dan kadar air 15-20% sehingga kandungan tersebut membuat bakteri tidak dapat hidup madu dapat mengaktivasi plasminogen menjadi plasmin plasmin ini nantinya akan menjhadi benang fibrin yang memperlancar aliran darah tingginya kadar glukosa madu meningkatkan glukolisis yang menghasilkan sumber energi bagi makrofag,['R1'],"MEDULA, medicalprofession journal of lampung university",fakultas kedokteran universitas lampung,2019-07-08,,,id,terapi madu pada derita ulkus diabetikum diabetes mellitus dm adalah ganggu metabolik yang tanda dengan tinggi kadar gula hiperglikemia akibat turun sekresi insulin oleh pancreas kurang sensitifitas insulin atau dua salah satu komplikasi dm adalah ulkus diabetikum ulkus diabetikum jadi akibat kurang pasok vascular buluh darah pada ujung perifer sehingga sebab tidak ada oksigen sehingga jaring jadi nekrosis penting awat luka penting untuk cegah jadi komplikasi fatal upa amputasi menuru kriteria wagner derajat 5 awat luka upa bahan herbal seperti minyak zaitun madu dan aloe vera sudah laku madu milik beberapa kandung yang manfaat bagai antibacterial antiinflamasi autolisis dan sembuh luka sedang enzim yang penting kandung dalam madu adalah enzim diastase invertase glukosa oksidase peroksidase dan lipase madu bagai antibacterial milik campur 48 gula dan kadar air 15-20 sehingga kandung sebut buat bakteri tidak dapat hidup madu dapat mengaktivasi plasminogen jadi plasmin plasmin ini nanti akan menjhadi benang fibrin yang lancar alir darah tinggi kadar glukosa madu tingkat glukolisis yang hasil sumber energi bagi makrofag
6621,6621,,pengaruh pembayaran non tunai terhadap jumlah uang yang diminta masyarakat m1 dan perekonomian,perkembangan teknologi telah menyentuh aspek kehidupan termasuk sektor ekonomi perbankan seiring dengan kemajuan teknologi finansial transaksi ekonomi terus mengalami perubahan pada pola dan sistem pembayaran payment yang pengaruhnya mempermudah jangkauan masyarakat dengan produk keuangan bank saat ini peranan pembayaran uang tunai mulai tergeser dengan adanya kemajuan teknologi tujuan penelitian ini adalah untuk mengetahui pengaruh pembayaran non tunai kartu debit atm kartu kredit e money kliring rtgs terhadap perekonomian dan permintaan uang tunai di masyarakat indonesia penelitian ini menggunakandata yang bersumber dari bank indonesia bi dan badan pusat statistik bps data penelitianyang digunakan adalah data time seriestriwulan dengan sampel waktu 2013 1 sampai dengan 2018 4t eknik analisis data yang digunakan adalah eror correction model ecm dan analisis trend hasil penelitian menunjukkan bahwapembayaran non tunai kartu debit atm kartu kredit e money kliring rtgs berpengaruh positif terhadap perekonomian dan permintaan uang tunai di masyarakat indonesia kata kunci kartu debet atm kartu kredit emoney kliring rtgs pdb m1,"['H1', 'HB']",,Jurnal Ekonomi Pembangunan Fakultas Ekonomi dan Bisnis Universitas Lampung,2019,,,id,pengaruh bayar non tunai hadap jumlah uang yang minta masyarakat m1 dan ekonomi kembang teknologi telah sentuh aspek hidup masuk sektor ekonomi perban iring dengan maju teknologi finansial transaksi ekonomi terus alami ubah pada pola dan sistem bayar payment yang pengaruh mudah jangkau masyarakat dengan produk uang bank saat ini peran bayar uang tunai mulai geser dengan ada maju teknologi tuju teliti ini adalah untuk tahu pengaruh bayar non tunai kartu debit atm kartu kredit e money kliring rtgs hadap ekonomi dan minta uang tunai di masyarakat indonesia teliti ini menggunakandata yang sumber dari bank indonesia bi dan badan pusat statistik bps data penelitianyang guna adalah data time seriestriwulan dengan sampel waktu 2013 1 sampai dengan 2018 4t eknik analisis data yang guna adalah eror correction model ecm dan analisis trend hasil teliti tunjuk bahwapembayaran non tunai kartu debit atm kartu kredit e money kliring rtgs pengaruh positif hadap ekonomi dan minta uang tunai di masyarakat indonesia kata kunci kartu debet atm kartu kredit emoney kliring rtgs pdb m1
6622,6622,['FEB2'],pengaruh pembayaran non tunai terhadap jumlah uang yang diminta masyarakat m1 dan perekonomian,perkembangan teknologi telah menyentuh aspek kehidupan termasuk sektor ekonomi perbankan seiring dengan kemajuan teknologi finansial transaksi ekonomi terus mengalami perubahan pada pola dan sistem pembayaran payment yang pengaruhnya mempermudah jangkauan masyarakat dengan produk keuangan bank saat ini peranan pembayaran uang tunai mulai tergeser dengan adanya kemajuan teknologi tujuan penelitian ini adalah untuk mengetahui pengaruh pembayaran non tunai kartu debit atm kartu kredit e money kliring rtgs terhadap perekonomian dan permintaan uang tunai di masyarakat indonesia penelitian ini menggunakandata yang bersumber dari bank indonesia bi dan badan pusat statistik bps data penelitianyang digunakan adalah data time seriestriwulan dengan sampel waktu 2013 1 sampai dengan 2018 4t eknik analisis data yang digunakan adalah eror correction model ecm dan analisis trend hasil penelitian menunjukkan bahwapembayaran non tunai kartu debit atm kartu kredit e money kliring rtgs berpengaruh positif terhadap perekonomian dan permintaan uang tunai di masyarakat indonesia kata kunci kartu debet atm kartu kredit emoney kliring rtgs pdb m1,"['H1', 'HB']",,Jurnal Ekonomi Pembangunan Fakultas Ekonomi dan Bisnis Universitas Lampung,2019-11,,,id,pengaruh bayar non tunai hadap jumlah uang yang minta masyarakat m1 dan ekonomi kembang teknologi telah sentuh aspek hidup masuk sektor ekonomi perban iring dengan maju teknologi finansial transaksi ekonomi terus alami ubah pada pola dan sistem bayar payment yang pengaruh mudah jangkau masyarakat dengan produk uang bank saat ini peran bayar uang tunai mulai geser dengan ada maju teknologi tuju teliti ini adalah untuk tahu pengaruh bayar non tunai kartu debit atm kartu kredit e money kliring rtgs hadap ekonomi dan minta uang tunai di masyarakat indonesia teliti ini menggunakandata yang sumber dari bank indonesia bi dan badan pusat statistik bps data penelitianyang guna adalah data time seriestriwulan dengan sampel waktu 2013 1 sampai dengan 2018 4t eknik analisis data yang guna adalah eror correction model ecm dan analisis trend hasil teliti tunjuk bahwapembayaran non tunai kartu debit atm kartu kredit e money kliring rtgs pengaruh positif hadap ekonomi dan minta uang tunai di masyarakat indonesia kata kunci kartu debet atm kartu kredit emoney kliring rtgs pdb m1
6623,6623,['FP5'],dsitribusi monyet ekor panjang macaca fascicularis di taman nasional way kambas,monyet ekor panjang macaca fascicularis merupakan salah satu satwa penghuni hutan monyet ekor panjang dapat dijumpai di sepanjang jalan yang menghubungkan plang hijau dengan plg tujuan penelitian untuk mengetahui penyebaran monyet ekor panjang di areal tersebut ditemukannya kelompok monyet ekor panjang metode observasi digunakan untuk menentukan luas areal beraktivitas monyet ekor panjang dilakukan dengan pengambilan titik koordinat gps berdasarkan tajuk terluar yang digunakan untuk beraktivitas kondisi habitat ditentukan dengan menggunakan metode rapid assessment hasil penelitian yang diperoleh bahwa di lokasi tersebut terdapat lima kelompok monyet ekor panjang yang secara geografis terpisah satu sama lain kondisi habitat kelima kelompok relatif sama didominasi oleh sonokeling dan pakan utama yaitu jeluak waru dan pulai tiga kelompok dari lima kelompok tersebut aktivitasnya terjadi dekat dengan pintu masuk plg hal itu menunjukkan bahwa kelompok tersebut dipengaruhi oleh aktivitas wisatawan dua kelompok lainnya berada pada kondisi habitat yang alami,['SD'],Jurnal Belantara,Universitas Gorontalo,2019-03-01,,,id,dsitribusi monyet ekor panjang macaca fascicularis di taman nasional way kambas monyet ekor panjang macaca fascicularis rupa salah satu satwa huni hutan monyet ekor panjang dapat jumpa di panjang jalan yang hubung plang hijau dengan plg tuju teliti untuk tahu sebar monyet ekor panjang di areal sebut temu kelompok monyet ekor panjang metode observasi guna untuk tentu luas areal aktivitas monyet ekor panjang laku dengan ambil titik koordinat gps dasar tajuk luar yang guna untuk aktivitas kondisi habitat tentu dengan guna metode rapid assessment hasil teliti yang oleh bahwa di lokasi sebut dapat lima kelompok monyet ekor panjang yang cara geografis pisah satu sama lain kondisi habitat lima kelompok relatif sama dominasi oleh sonokeling dan pakan utama yaitu jeluak waru dan pulai tiga kelompok dari lima kelompok sebut aktivitas jadi dekat dengan pintu masuk plg hal itu tunjuk bahwa kelompok sebut pengaruh oleh aktivitas wisatawan dua kelompok lain ada pada kondisi habitat yang alami
6624,6624,['FK1'],leptospirosis intervensi faktor resiko penularan,,['R1'],Majority,Juke Unila,2019-03,,,?,leptospirosis intervensi faktor resiko tular
6625,6625,['FK1'],hubungan tingkat kecemasan terhadap hasil ujian osce pada mahasiswa tingkat pertama di fakultas kedokteran universitas lampung,"kecemasan adalah perasaan takut yang disertai dengan meningkatnya ketegangan fisiologis memasuki perguruan tinggi mahasiswa harus mempunyai kesadaran penuh dalam kegiatan pembelajaran pada mahasiswa kedokteran hal lain yang dapat menjadi pemicu kecemasan adalah ujian salah satunya osce objective structured clinical examination kecemasan itu sendiri dapat mempengaruhi performa mahasiswa saat ujian osce yang berdampak pada hasil atau nilai penelitian ini bertujuan untuk mengetahui hubungan tingkat kecemasan terhadap hasil ujian osce pada mahasiswa tingkat pertama di fakultas kedokteran universitas lampung penelitian yang digunakan adalah deskriptif analitik dengan pendekatan cross sectional penelitian ini menggunakan total sampling sebanyak 240 mahasiswa semester awal data didapatkan melalui pengisian kuesioner hama hamilton rating scale for anxiety dan data hasil ujian osce didapatkan hasil bahwa dari 240 mahasiswa tingkat awal terdapat 145 mahasiswa 60,4% mengalami kecemasan ringan 51 mahasiswa 21,3% mengalami kecemasan sedang 20 mahasiswa 8,3% mengalami kecemasan berat dan mahasiswa 24 mahasiswa 10% mengalami kecemasan sangat berat dan didapatkan 48 sampel tidak lulus dengan presentase 20% dan lulus sebanyak 192 sampel dengan presentase 80% lalu dilakukan pendekatan dengan uji mannwhitney dan didapatkan hasil p value 0,000 atau 0,05 sehingga terdapat hubungan antara tingkat kecemasan terhadap hasil ujian osce",['RZ'],"MEDULA, medicalprofession journal of lampung university",fakultas kedokteran universitas lampung,2019-07,,,id,hubung tingkat cemas hadap hasil uji osce pada mahasiswa tingkat pertama di fakultas dokter universitas lampung cemas adalah asa takut yang serta dengan tingkat tegang fisiologis pasuk guru tinggi mahasiswa harus punya sadar penuh dalam giat ajar pada mahasiswa dokter hal lain yang dapat jadi picu cemas adalah uji salah satu osce objective structured clinical examination cemas itu sendiri dapat pengaruh performa mahasiswa saat uji osce yang dampak pada hasil atau nilai teliti ini tuju untuk tahu hubung tingkat cemas hadap hasil uji osce pada mahasiswa tingkat pertama di fakultas dokter universitas lampung teliti yang guna adalah deskriptif analitik dengan dekat cross sectional teliti ini guna total sampling banyak 240 mahasiswa semester awal data dapat lalu isi kuesioner hama hamilton rating scale for anxiety dan data hasil uji osce dapat hasil bahwa dari 240 mahasiswa tingkat awal dapat 145 mahasiswa 60 4 alami cemas ringan 51 mahasiswa 21 3 alami cemas sedang 20 mahasiswa 8 3 alami cemas berat dan mahasiswa 24 mahasiswa 10 alami cemas sangat berat dan dapat 48 sampel tidak lulus dengan presentase 20 dan lulus banyak 192 sampel dengan presentase 80 lalu laku dekat dengan uji mannwhitney dan dapat hasil p value 0 000 atau 0 05 sehingga dapat hubung antara tingkat cemas hadap hasil uji osce
6626,6626,['FT7'],similarity check result hightemperature corrosion of aluminizedaisi 1020 steel with nacl and na2so4 deposits,,['TJ'],,Indian Academy of Sciences-Springer,2019-12-17,,,?,similarity check result hightemperature corrosion of aluminizedaisi 1020 steel with nacl and na2so4 deposits
6627,6627,['FT7'],similarity check result improvement of lowcycle fatigue resistance in aisi 4140 steel by annealing treatment,,['TJ'],,Elsevier,2019-08-25,,,?,similarity check result improvement of lowcycle fatigue resistance in aisi 4140 steel by annealing treatment
6628,6628,['FT4'],similarity check result increasing of mild steel st 41 grade hardness by carburizing treatment using an active carbon from coconut shell and caco3 catalyst from chicken eggshell,,['TJ'],,BKSTM,2019-10,,,?,similarity check result increasing of mild steel st 41 grade hardness by carburizing treatment using an active carbon from coconut shell and caco3 catalyst from chicken eggshell
6629,6629,['FT7'],similarity check result low cycle fatigue properties of extruded 6061t6 aluminum alloy,,['TJ'],,IOP,2019-05-10,,,?,similarity check result low cycle fatigue properties of extruded 6061t6 aluminum alloy
6630,6630,['FT7'],similarity check result the resistence of an aluminide coating on a highstrength astm a29 steel subjected to a temperature of 850 c,,['TJ'],,IOP Publishing Ltd.,2019-08-18,,,?,similarity check result the resistence of an aluminide coating on a highstrength astm a29 steel subjected to a temperature of 850 c
6631,6631,['FT7'],similarity check results experimental investigation of mechanical properties of colddrawn aisi 1018 steel at hightemperature steadystate conditions,,"['TH', 'TJ']",,Elsevier,2019-12-23,,,?,similarity check results experimental investigation of mechanical properties of colddrawn aisi 1018 steel at hightemperature steadystate conditions
6632,6632,['FT7'],increasing of mild steel st 41 grade hardness by carburizing treatment using an active carbon from coconut shell and caco3 catalyst from chicken eggshell,"usaha untuk meningkatkan kekerasan permukaan baja karbon rendah st41 dilakukan dengan proses karburising menggunakan bahan karburising bentuk bubuk dengan ukuran 200 mesh yang mengandung karbon aktif dari tempurung kelapa dan katalisator caco3 dari cangkang telur ayam variasi campuran arang dengan katalisator adalah 60 40,70 30 80 20 dan 90 10 dalam persen berat lalu dimasukan bersama spesimen dalam kotak sementasi proses karburising dilakukan dengan memanaskan kotak sementasi pada suhu 850 c selama 30 menit hasil proses karburising pada baja st41 menghasilkan nilai kekerasan yang paling tinggi pada permukaan baja untuk variasi campuran 60 40 arang dengan bubuk cangkang telur ayam kekerasan permukaan baja st41 dihasilkan dari pembentukan fasa yang berbeda kekerasan baja setelah karburising dengan pendinginan udara dikaitkan dengan pembentukan fasa perlit yang mengandung banyak karbida sementitfe3c sedangkan kekerasan baja hasil kombinasi karburising dan quenching dikaitkan dengan fasa martensit yang terbentuk pada baja st41.","['TA', 'TJ']",Prosiding SNTTM XVIII,BKSTM,2019-10-19,,,id,increasing of mild steel st 41 grade hardness by carburizing treatment using an active carbon from coconut shell and caco3 catalyst from chicken eggshell usaha untuk tingkat keras muka baja karbon rendah st41 laku dengan proses karburising guna bahan karburising bentuk bubuk dengan ukur 200 mesh yang kandung karbon aktif dari tempurung kelapa dan katalisator caco3 dari cangkang telur ayam variasi campur arang dengan katalisator adalah 60 40 70 30 80 20 dan 90 10 dalam persen berat lalu masuk sama spesimen dalam kotak sementasi proses karburising laku dengan panas kotak sementasi pada suhu 850 c lama 30 menit hasil proses karburising pada baja st41 hasil nilai keras yang paling tinggi pada muka baja untuk variasi campur 60 40 arang dengan bubuk cangkang telur ayam keras muka baja st41 hasil dari bentuk fasa yang beda keras baja telah karburising dengan dingin udara kait dengan bentuk fasa perlit yang kandung banyak karbida sementitfe3c sedang keras baja hasil kombinasi karburising dan quenching kait dengan fasa martensit yang bentuk pada baja st41
6633,6633,['FT7'],meningkatkan kemampuan pengelasan siswa smk blk bandar lampung dengan pelatihan pengelasan horisontal pada pelat baja,pembukaan usaha skala industry rumah tangga home industry yang bergerak dibidang pengelasan terbukti menjadi usaha yang mampu bertahan ditengah kondisi krisis ekonomi sekarang ini kebutuhan bahan dari baja meningkat dari tahun ketahun karena pertambahan jumlah penduduk khsususnya di wilayah propinsi lampung yang membutuhkan tambahan aksesories rumah untuk alasan keamanan dan estetika seperti pagar besi tralis dan kanopi peluang untuk membuka usaha pengelasan baja dan bahan logam lain cukup menjanjikan sebagai wirausaha mandiri bagi lulusan smk oleh karena itu keterampilan dan pengetahuan tentang pengelasan pelat baja posisi horisontal 1g dapat diberikan melalui program pengabdian kepada masyarakat pkm universitas lampung kepada calon lulusan smk khususnya di siswa kelas 3 smk blk bandar lampung ketrampilan dalam mengelas baja posisi horizontal dapat dicapai melalui pelatihan yang cukup dengan pemahaman dasar proses pengelasan pelatihan pengelasan ini diberikan secara teori dan praktek sebelum teori siswa diberikan pretests untuk melihat sampai sejauj mana siswa paham tentang proses pengelasan dan jenisjenis pengelasaa pemberian materi teori dasar pengelasan diberikan secara tutorial melalui komunikasi interaktif antara dosen pemateri dan siswa kemudian praktek pengalasan diberikan setiap siswa mulai cara memilih jenis elektroda mengatur arus listrik yang tepat meletakan posisi grounding dan mengetahui apakah elektroda dan arus sudah terpasang ujian praktek pengelasan secara acak diberikan kepada siswa sebanyak 5 orang untuk melalukan pengelasan yang sebenarnya hasil pemgelasan dilakukan analisis secara visual kesimpulan yang diperoleh semangat siswa untuk mampu trampil dalam mengelas baja posisi horizontal relatif tinggi meskipun hasil pengelasan benda kerja belum menunjukan hasil yang standar,['TJ'],,LPPM UNILA,2019-11-05,,,id,tingkat mampu kelas siswa smk blk bandar lampung dengan latih kelas horisontal pada pelat baja buka usaha skala industry rumah tangga home industry yang gerak bidang kelas bukti jadi usaha yang mampu tahan tengah kondisi krisis ekonomi sekarang ini butuh bahan dari baja tingkat dari tahun tahun karena tambah jumlah duduk khsususnya di wilayah propinsi lampung yang butuh tambah aksesories rumah untuk alas aman dan estetika seperti pagar besi tralis dan kanopi peluang untuk buka usaha kelas baja dan bahan logam lain cukup janji bagai wirausaha mandiri bagi lulus smk oleh karena itu terampil dan tahu tentang kelas pelat baja posisi horisontal 1g dapat beri lalu program abdi kepada masyarakat pkm universitas lampung kepada calon lulus smk khusus di siswa kelas 3 smk blk bandar lampung ketrampilan dalam kelas baja posisi horizontal dapat capai lalu latih yang cukup dengan paham dasar proses kelas latih kelas ini beri cara teori dan praktek belum teori siswa beri pretests untuk lihat sampai sejauj mana siswa paham tentang proses kelas dan jenisjenis pengelasaa beri materi teori dasar kelas beri cara tutorial lalu komunikasi interaktif antara dosen materi dan siswa kemudian praktek pengalasan beri tiap siswa mulai cara pilih jenis elektroda atur arus listrik yang tepat leta posisi grounding dan tahu apakah elektroda dan arus sudah pasang uji praktek kelas cara acak beri kepada siswa banyak 5 orang untuk lalu kelas yang benar hasil pemgelasan laku analisis cara visual simpul yang oleh semangat siswa untuk mampu trampil dalam kelas baja posisi horizontal relatif tinggi meski hasil kelas benda kerja belum tunjuk hasil yang standar
6634,6634,['FT1'],17 jge analisis penurunan muka tanah dengan small baseline,"bandar lampung adalah salah satu kota di indonesia yang berpotensi mengalami penurunan muka tanah karena adanya ekstraksi air tanah kegiatan pertambangan alihfungsi lahan dan kondisi geologi untuk itu dilakukan studi penurunan muka tanah dengan teknik sbas dikarenakan sangat kurangnya informasi mengenai gejala penurunan muka tanah di kota bandar lampung dalam penelitian ini digunakan 15 data sar dalam selang tahun 2006 2011 yang kemudian dikombinasikan untuk menghasilkan 40 interferogram yang kemudian diinversi sehingga menghasilkan data deformasi timeseries dan kecepatan deformasi ratarata akurasi kecepatan yang diperoleh dengan teknik sbas sangat bergantung terhadap jenis tutupan lahan di daerah studi selain itu diketahui pula bahwa penurunan muka tanah di bandar lampung ratarata adalah 0,06 mm tahun yang dinilai cukup stabil dikarenakan tatanan geologi yang tidak memungkinkan untuk terjadinya proses konsolidasi secara masif beberapa area mengalami indikasi penurunan muka tanah 5 mm tahun yang diduga disebabkan oleh aktivitas tektonik dan kegiatan manusia industri pertambangan ekstraksi air tanah dan alihfungsi lahan yang kemudian berimplikasi terhadap kerusakan struktur bangunan terjadinya banjir rob di daerah pesisir dan tanah longsor di daerah perbukitan",['QE'],Jurnal Geofisika Eksplorasi,Teknik Geofisika,2019-07-02,,,id,17 jge analisis turun muka tanah dengan small baseline bandar lampung adalah salah satu kota di indonesia yang potensi alami turun muka tanah karena ada ekstraksi air tanah giat tambang alihfungsi lahan dan kondisi geologi untuk itu laku studi turun muka tanah dengan teknik sbas karena sangat kurang informasi kena gejala turun muka tanah di kota bandar lampung dalam teliti ini guna 15 data sar dalam selang tahun 2006 2011 yang kemudian kombinasi untuk hasil 40 interferogram yang kemudian inversi sehingga hasil data deformasi timeseries dan cepat deformasi ratarata akurasi cepat yang oleh dengan teknik sbas sangat gantung hadap jenis tutup lahan di daerah studi selain itu tahu pula bahwa turun muka tanah di bandar lampung ratarata adalah 0 06 mm tahun yang nilai cukup stabil karena tatanan geologi yang tidak mungkin untuk jadi proses konsolidasi cara masif beberapa area alami indikasi turun muka tanah 5 mm tahun yang duga sebab oleh aktivitas tektonik dan giat manusia industri tambang ekstraksi air tanah dan alihfungsi lahan yang kemudian implikasi hadap rusa struktur bangun jadi banjir rob di daerah pesisir dan tanah longsor di daerah bukit
