,Unnamed: 0,divisions,title,abstract,subjects,publication,publisher,date,keywords,keyword,lang,text_stemmed
2872,2872,['UNILA5'],pemberdayaan remaja putri melalui komsi komunitas milenial sadar nutrisi di desa negeri katon kabupaten pesawaran provinsi lampung,stunting pada anak masih menjadi masalah diseluruh dunia stunting dinilai berdasarkan indeks tinggi badan menurut umur tb u dengan ambang batas z score -2 standar deviasi sd pertumbuhan anak stunting dapat terjadi pada 1000 hari setelah konsepsi dan berhubungan sengan banyak faktor termasuk sosial ekonomi asupan nutrisi ibu hamil dan bayi infeksi status gizi ibu penyakit menular defisisensi mikronutrien dan lingkungan remaja merupakan fase dimana terjadi peningkatan bermakna kebutuhan faal tubuh untuk nutrisi akbat peningkatan pertumbuhan dalam siklus perubahan fisik yang membantu tercapainya kematangan fungsi dan sistem reproduksi pernikahan dini atau kehamilan di usia dini didapatkan memiliki risiko tinggi untuk terjadinya komplikasi kematian ibu dan bayi juga anemia maupun kek pada ibu hamil yang menjadi penyumbang bbblr dan memicu berkembangnya stunting pada anak pendekatan intervensi managemen nutrisi menjadi salah satu program utama yang diharapkan mampu menurunkan kasus stunting di seluruh dunia khususnya indonesia pengelolaan gizi ibu juga dapat dimulai sejak remaja karena status kesehatan seorang ibu didapatkan berkaitan dengan status gizinya di masa remaja sehingga peningkatan pemahaman dan perilaku remaja putri mengenai gizi seimbang dapat mengoptimalkan penurunan kasus stunting desa negeri katon merupakan salah satu desa binaan universitas lampung tahun 2021 yang merupakan bagian dari kabupaten pesawaran lampung yang pada tahun 2020 masuk menjadi salah satu lokus stunting di provinsi lampung komsi komunitas milenial sadar nutrisi diharapkan dapat mengoptimalkan pemberdayaan masyarakat melalui komunitas remaja putri untuk membantu pengimplementasian gizi seimbang dalam keluarga di desa binaan negeri katon kabupaten pesawaran lampung komsi akan menjadi unit pemberdayaan yang diharapkan mampu berperan dalam pencegahan dan penurunan angka stunting metode yang digunakan adalah edukasi gizi seimbang yang mencakup kuantitas kualitas dan komposisi asupan makanan termasuk asupan nutrisi 1000 hpk untuk mencegah atau menurunkan kasus stunting komsi akan melibatkan para remaja putri di daerah binaan untuk diberikan edukasi gizi seimbang dalam bentuk penyuluhan demonstrasi dan pelatihan penyusunan menu gizi seimbang akan diberikan secara berkala secara online dan offline metode pelaksanaan pkm didasari dengan pembentukan model pemberdayaan masyarakat dimulai dengan beberapa survey pendahuluan ke desa negeri katon kecamatan negeri katon kabupaten pesawaran lampung pertemuan dan koordinasi diawali dengan pamong desa para tokoh masyarakat dan para remaja karang taruna desa negeri katon untuk menjaring para remaja putri yang mampu dan mau dilibatkan dalam komunitas ini dilanjutkan dengan proses penyuluhan dan edukasi dan dididapatkan peningkatan pengetahuan mengenai asupan dan asuhan 1000 hpk yang mengalami peningkatan pengetahuan berdasarkan hasil evaluasi pre test dan post test hasil pretset menunjukkan 37% dengan nilai pengetahuan yang cukup dan 63% pengetahuan kurang dari 35 peserta remaja putri yang berusia antara 14 sampai 21 tahun hasil pengamatan post test diketahui bahwa 62% peserta pengetahuan cukup 21% telah memiliki pengetahuan yang baik dan 17% sangat baik kegiatan juga dilanjutkan dengan fgd mengenai model komunitas ini yang bisa dibentuk berdasarkan kultur sosial daan kearifan lokal dan juga dilakukan pemilihan formatur yang akan terlibat sebagai pengurus komsi desa negeri katon dan di dapatkan seorang ketua seorang sekretaris dan peranagkat lain pengayakan dilakukan secara diskusi melalui jalur media whatsapp selama beberapa pekan difinalkan dengan mengenalkan komunitas baru ini dengan pimpinan kecamatan negeri katon untuk dapat diintegrasikan dengan kegiatan yang terkait dengan kesehatan masyarakat khususnya bagi kesehatan ibu dan balita yang ada dalam periode 1000 hari pertama kehidupan dan dilibatkan dalam kegiatan edukasi kepada para ibu hamil dan ibu dengan balita dalam kegiatan posyandu yang dilakukan di wilayah kecamaatan negeri katon model pemberdayaan masyarakat komsi ini diharapkan akan dikembangkan dengan memperluas peran dan fungsinya dalam membangun status kesehatan masyarakat khususnya di wilayah kecamatan negeri katon kata kunci stunting komunitas milenial pemberdayaan masyaraka,['R1'],,PENGABDIAN KEPADA MASYARAKAT DESA BINAAN UNIVERSITAS LAMPUNG,2021,,,id,daya remaja putri lalu komsi komunitas milenial sadar nutrisi di desa negeri katon kabupaten sawar provinsi lampung stunting pada anak masih jadi masalah seluruh dunia stunting nilai dasar indeks tinggi badan turut umur tb u dengan ambang batas z score -2 standar deviasi sd tumbuh anak stunting dapat jadi pada 1000 hari telah konsepsi dan hubung seng banyak faktor masuk sosial ekonomi asupan nutrisi ibu hamil dan bayi infeksi status gizi ibu sakit tular defisisensi mikronutrien dan lingkung remaja rupa fase mana jadi tingkat makna butuh faal tubuh untuk nutrisi akbat tingkat tumbuh dalam siklus ubah fisik yang bantu capa matang fungsi dan sistem reproduksi nikah dini atau hamil di usia dini dapat milik risiko tinggi untuk jadi komplikasi mati ibu dan bayi juga anemia maupun kek pada ibu hamil yang jadi sumbang bbblr dan picu kembang stunting pada anak dekat intervensi managemen nutrisi jadi salah satu program utama yang harap mampu turun kasus stunting di seluruh dunia khusus indonesia kelola gizi ibu juga dapat mulai sejak remaja karena status sehat orang ibu dapat kait dengan status gizi di masa remaja sehingga tingkat paham dan perilaku remaja putri kena gizi imbang dapat optimal turun kasus stunting desa negeri katon rupa salah satu desa bina universitas lampung tahun 2021 yang rupa bagi dari kabupaten sawar lampung yang pada tahun 2020 masuk jadi salah satu lokus stunting di provinsi lampung komsi komunitas milenial sadar nutrisi harap dapat optimal daya masyarakat lalu komunitas remaja putri untuk bantu implementasi gizi imbang dalam keluarga di desa bina negeri katon kabupaten sawar lampung komsi akan jadi unit daya yang harap mampu peran dalam cegah dan turun angka stunting metode yang guna adalah edukasi gizi imbang yang cakup kuantitas kualitas dan komposisi asupan makan masuk asupan nutrisi 1000 hpk untuk cegah atau turun kasus stunting komsi akan libat para remaja putri di daerah bina untuk beri edukasi gizi imbang dalam bentuk suluh demonstrasi dan latih susun menu gizi imbang akan beri cara kala cara online dan offline metode laksana pkm dasar dengan bentuk model daya masyarakat mulai dengan beberapa survey dahulu ke desa negeri katon camat negeri katon kabupaten sawar lampung temu dan koordinasi awal dengan pamong desa para tokoh masyarakat dan para remaja karang taruna desa negeri katon untuk jaring para remaja putri yang mampu dan mau libat dalam komunitas ini lanjut dengan proses suluh dan edukasi dan dapat tingkat tahu kena asupan dan asuh 1000 hpk yang alami tingkat tahu dasar hasil evaluasi pre test dan post test hasil pretset tunjuk 37 dengan nilai tahu yang cukup dan 63 tahu kurang dari 35 serta remaja putri yang usia antara 14 sampai 21 tahun hasil amat post test tahu bahwa 62 serta tahu cukup 21 telah milik tahu yang baik dan 17 sangat baik giat juga lanjut dengan fgd kena model komunitas ini yang bisa bentuk dasar kultur sosial daan arif lokal dan juga laku pilih formatur yang akan libat bagai urus komsi desa negeri katon dan di dapat orang ketua orang sekretaris dan peranagkat lain kaya laku cara diskusi lalu jalur media whatsapp lama beberapa pekan final dengan kenal komunitas baru ini dengan pimpin camat negeri katon untuk dapat integrasi dengan giat yang kait dengan sehat masyarakat khusus bagi sehat ibu dan balita yang ada dalam periode 1000 hari pertama hidup dan libat dalam giat edukasi kepada para ibu hamil dan ibu dengan balita dalam giat posyandu yang laku di wilayah kecamaatan negeri katon model daya masyarakat komsi ini harap akan kembang dengan luas peran dan fungsi dalam bangun status sehat masyarakat khusus di wilayah camat negeri katon kata kunci stunting komunitas milenial daya masyaraka
2873,2873,['UNILA3'],model asupan virgin coconut oil untuk perbaikan indikator stress metabolik balita stunting di wilayah kerja puskesmas karang anyar lampung selatan,"stunting merupakan salah satu masalah gizi yang sedang dihadapi indonesia stunting adalah masalah gizi kronis pada balita yang ditandai dengan tinggi badan yang lebih pendek dibandingkan dengan anak seusianya jumlah anak stunting di dunia saat ini mencapai 159 juta dan 9 juta di antaranya adalah anak indonesia anak yang menderita stunting akan lebih rentan terhadap penyakit dan ketika dewasa berisiko untuk mengidap penyakit degeneratif dampak stunting tidak hanya pada segi kesehatan tetapi juga mempengaruhi tingkat kecerdasan anak hal ini akan mengancam daya saing bangsa sehingga menjadi penting karena menyangkut kualitas sumber daya manusia indonesia di masa yang akan datang oleh karena itu stunting harus dicegah dengan berbagai upaya dari berbagai sector atau secara multisektoral salah satu fokus pemerintah saat ini adalah pencegahan stunting upaya ini bertujuan agar anakanak indonesia dapat tumbuh dan berkembang secara optimal dan maksimal dengan disertai kemampuan emosional sosial dan fisik yang siap untuk belajar serta mampu berinovasi dan berkompetisi di tingkat global penurunan stunting merupakan salah satu program strategis nasional yang tertuang dalam perpres 42 tahun 2013 tentang gerakan nasional percepatan perbaikan gizi sasaran pembangunan kesehatan pada rpjm 2015-2019 antara lain adalah penurunan prevalensi stunting pendek dan sangat pendek pada anak baduta bawah dua tahun dari 32,9% 2013 menjadi 28% pada tahun 2019 propinsi lampung termasuk dalam 8 propinsi yang mengalami peningkatan prevalensi stunting berturutturut selama 3 tahun tiga kabupaten di propinsi lampung yang mengalami stunting tinggi adalah lampung tengah lampung timur dan lampung selatan prevalensi stunting di kabupaten lampung selatan mencapai 43,0% yang tersebar di 10 desa di 7 penelitian ini bertujuan untuk rekomendasi asupan sehat bersumber daya alam yang banyak didapatkan di wilayah kabupaten lampung selatan yaitu buah kelapa yang akan diolah menjadi virgin coconut oil vco telah terbukti memilik sifat antiinflamasi analgesik dan antipiretik vco juga terbukti menurunkan kadar lipid dalam serum dan jaringan juga perosidasi lipid ldl sehingga bisa menurunkan kondisi stress metabolik yang didapatkan meningkat pada anak stunting penelitian ini diba gi menjadi dua tahap di mana tahap awal adalah penelusuran data kasus dan penentuan kelompok kasus dan kontrol edukasi dan rekomendasi asupan vco pada balita stunting target kasus dan kontrol yang akan dilakukan oleh tim peneliti tahap ke dua adalah pengambilan sampel laboratorium kabupaten lampung selatan untuk dilakukan coding dan analisis hasil penelitian ini didapatkan bahwa asupan vco yang diberikan secara oral sebanyak 5 cc perhari pada pagi hari dapat memperbaiki fungsi metabolik balita stunting yang ditandai dengan perbaikan profil antropometrik dengan kenaikan tinggi badan dari 85,83 6,04 cm menjadi 87,61 5,96 cm perbaikan kadar hb dari 12,41 1,45 g dl menjadi 13,07 1,78 g dl dan penurunan indikator stress metabolik dengan penurunan mda plasma dari 1,94 0,36 µmol l menjadi 1,16 0,14 µmol l juga menunjukan hasil analisa statistik yang signifikan p 0,05 untuk saturasi oksigen kadar hb dan glukosa darah didapatkan menurun tapi tidak stignifikan secara statistik hasil ini membantu dibangunnya model asupan vco harian dengan dosis harian 5 cc hari pada pagi hari bagi balita yang berusia 2-6 tahun hal ini dapat diterapkan di daerah penelitian serta daerah lain yang sesuai tipe agroekologinya penerapan hasil penelitian ini lebih lanjut akan berpotensi meningkatkan keuntungan ekonomi wilayah dengan adanya perbaikan gizi anak stunting bersumber alam wilayah hasil penelitian akan didiseminasikan pada seminar ilmiah internasional dan atau jurnal ilmiah internasional atau jurnal nasional terakreditasi minimal sinta 3 hasil riset d menghasilkan produk iptek metode tehnologi tepat guna model asupan yang di hkikan paten hak cipta dan terdaftar melalui sentra haki lppm unila",['R1'],,PENELITIAN PROFESSORSHIP UNIVERSITAS LAMPUNG,2021,,,id,model asupan virgin coconut oil untuk baik indikator stress metabolik balita stunting di wilayah kerja puskesmas karang anyar lampung selatan stunting rupa salah satu masalah gizi yang sedang hadap indonesia stunting adalah masalah gizi kronis pada balita yang tanda dengan tinggi badan yang lebih pendek banding dengan anak usia jumlah anak stunting di dunia saat ini capai 159 juta dan 9 juta di antara adalah anak indonesia anak yang derita stunting akan lebih rentan hadap sakit dan ketika dewasa risiko untuk idap sakit degeneratif dampak stunting tidak hanya pada segi sehat tetapi juga pengaruh tingkat cerdas anak hal ini akan ancam daya saing bangsa sehingga jadi penting karena sangkut kualitas sumber daya manusia indonesia di masa yang akan datang oleh karena itu stunting harus cegah dengan bagai upaya dari bagai sector atau cara multisektoral salah satu fokus perintah saat ini adalah cegah stunting upaya ini tuju agar anakanak indonesia dapat tumbuh dan kembang cara optimal dan maksimal dengan serta mampu emosional sosial dan fisik yang siap untuk ajar serta mampu inovasi dan kompetisi di tingkat global turun stunting rupa salah satu program strategis nasional yang tuang dalam pres 42 tahun 2013 tentang gera nasional cepat baik gizi sasar bangun sehat pada rpjm 2015-2019 antara lain adalah turun prevalensi stunting pendek dan sangat pendek pada anak baduta bawah dua tahun dari 32 9 2013 jadi 28 pada tahun 2019 propinsi lampung masuk dalam 8 propinsi yang alami tingkat prevalensi stunting berturutturut lama 3 tahun tiga kabupaten di propinsi lampung yang alami stunting tinggi adalah lampung tengah lampung timur dan lampung selatan prevalensi stunting di kabupaten lampung selatan capai 43 0 yang sebar di 10 desa di 7 teliti ini tuju untuk rekomendasi asupan sehat sumber daya alam yang banyak dapat di wilayah kabupaten lampung selatan yaitu buah kelapa yang akan olah jadi virgin coconut oil vco telah bukti milik sifat antiinflamasi analgesik dan antipiretik vco juga bukti turun kadar lipid dalam serum dan jaring juga perosidasi lipid ldl sehingga bisa turun kondisi stress metabolik yang dapat tingkat pada anak stunting teliti ini diba gi jadi dua tahap di mana tahap awal adalah telusur data kasus dan tentu kelompok kasus dan kontrol edukasi dan rekomendasi asupan vco pada balita stunting target kasus dan kontrol yang akan laku oleh tim teliti tahap ke dua adalah ambil sampel laboratorium kabupaten lampung selatan untuk laku coding dan analisis hasil teliti ini dapat bahwa asupan vco yang beri cara oral banyak 5 cc hari pada pagi hari dapat baik fungsi metabolik balita stunting yang tanda dengan baik profil antropometrik dengan naik tinggi badan dari 85 83 6 04 cm jadi 87 61 5 96 cm baik kadar hb dari 12 41 1 45 g dl jadi 13 07 1 78 g dl dan turun indikator stress metabolik dengan turun mda plasma dari 1 94 0 36 mol l jadi 1 16 0 14 mol l juga tunjuk hasil analisa statistik yang signifikan p 0 05 untuk saturasi oksigen kadar hb dan glukosa darah dapat turun tapi tidak stignifikan cara statistik hasil ini bantu bangun model asupan vco hari dengan dosis hari 5 cc hari pada pagi hari bagi balita yang usia 2-6 tahun hal ini dapat terap di daerah teliti serta daerah lain yang sesuai tipe agroekologinya terap hasil teliti ini lebih lanjut akan potensi tingkat untung ekonomi wilayah dengan ada baik gizi anak stunting sumber alam wilayah hasil teliti akan didiseminasikan pada seminar ilmiah internasional dan atau jurnal ilmiah internasional atau jurnal nasional akreditasi minimal sinta 3 hasil riset d hasil produk iptek metode tehnologi tepat guna model asupan yang di hkikan paten hak cipta dan daftar lalu sentra hak lppm unila
2874,2874,['FK1'],edukasi perilaku sehat untuk meningkatkan imunitas dalam menghadapi pandemi covid-19 di sma negeri 2 bandar lampung,bandar lampung termasuk daerah dengan prevalensi covid-19 tertinggi di provinsi lampung dengan total kematian sampai bulan september 2020 mencapai 15 pasien penyakit ini rentan menyerang remaja sekolah karena kelompok remaja menjadi komunitas yang banyak beraktifitas di luar rumah sehingga berisiko terpapar covid-19 remaja biasanya terinfeksi dengan status tanpa gejala sehingga berisiko menularkan sman 2 bandar lampung merupakan sekolah favorit dan diharapkan pengabdian kepada masyarakat pkm ini akan membentuk komunitas remaja yang bisa menjadi model pelaku protokol covid-19 kegiatan pkm ini bertujuan meningkatkan imunitas atau status kesehatan pada kelompok remaja target melalui edukasi untuk menerapkan protokol covid-19 untuk membangun perilaku sehat sebagai upaya pencegahan covid-19 metode pkm menggunakan teknik penyuluhan serta demonstrasi video dan edukasi yang menunjukkan beberapa hal mengenai covid-19 dan pencegahannya aturan menjaga jarak cuci tangan dan masker yang dipresentasikan melalui daring buku saku dan pamflet sebagai wahana edukasi berkelanjutan proses kegiatan yang dilaksanakan didapatkan peningkatan pengetahuan berdasarkan nilai ratarata posttest sebesar 83 sedangkan nilai pretest hanya sebesar 65 diharapkan para siswa dapat mengimplikasikan pengetahuan dan pemahaman yang didapat mengenai protokol covid-19 dan pencegahannya pada diri sendiri dan lingkungan sekitarnya,['R1'],Jurnal Pengabdian Masyarakat: Humanity and Medicine,"Faculty of Medicine, Universitas Sriwijaya.",2021-03,,,id,edukasi perilaku sehat untuk tingkat imunitas dalam hadap pandemi covid-19 di sma negeri 2 bandar lampung bandar lampung masuk daerah dengan prevalensi covid-19 tinggi di provinsi lampung dengan total mati sampai bulan september 2020 capai 15 pasien sakit ini rentan serang remaja sekolah karena kelompok remaja jadi komunitas yang banyak beraktifitas di luar rumah sehingga risiko papar covid-19 remaja biasa infeksi dengan status tanpa gejala sehingga risiko tular sman 2 bandar lampung rupa sekolah favorit dan harap abdi kepada masyarakat pkm ini akan bentuk komunitas remaja yang bisa jadi model laku protokol covid-19 giat pkm ini tuju tingkat imunitas atau status sehat pada kelompok remaja target lalu edukasi untuk terap protokol covid-19 untuk bangun perilaku sehat bagai upaya cegah covid-19 metode pkm guna teknik suluh serta demonstrasi video dan edukasi yang tunjuk beberapa hal kena covid-19 dan cegah atur jaga jarak cuci tangan dan masker yang presentasi lalu daring buku saku dan pamflet bagai wahana edukasi lanjut proses giat yang laksana dapat tingkat tahu dasar nilai ratarata posttest besar 83 sedang nilai pretest hanya besar 65 harap para siswa dapat implikasi tahu dan paham yang dapat kena protokol covid-19 dan cegah pada diri sendiri dan lingkung sekitar
2875,2875,['FK1'],penatalaksanaan isolated systolic hypertension ish suspek retinopati hipertensi dan imobilitas pada lansia dengan pendekatan kedokteran keluarga,isolated systolic hypertension ish adalah peningkatan tekanan darah td sistol tanpa disertai peningkatan td diastol sering terjadi pada usia tua ish dapat berkembang dari riwayat hipertensi esensial kronik atau akibat penurunan elastisitas arteri pada orang yang normotensive penyebab sekunder menurunnya elastisitas arteri adalah diabetes tipe 1 osteoporosis dengan kalsifikasi aterosklerosis penyakit vaskular perifer tirotoksikosis dan kelainan aorta penerapan pelayanan dokter keluarga berbasis evidence based medicine dengan mengidentifikasi faktor risiko masalah klinis serta penatalaksanaan berdasarkan pendekatan patient centered dan family approach studi ini merupakan laporan kasus data primer diperoleh melalui anamnesis pemeriksaan fisik dan kunjungan rumah penilaian berdasarkan pendekatan keluarga secara indepth interview observasi dan lembar isian pasien pasien mengeluh nyeri kepala hilang timbul dan kedua penglihatan kabur sejak 1 minggu lalu keluhan baru pertama kali dan belum pernah berobat kekhawatiran pasien keluhan tersebut mengganggu aktivitas dan istirahatnya harapan pasien keluhan berkurang dan tidak memburuk persepsi pasien keluhan terjadi akibat gaya hidup tertentu menyebabkan penyakit yang belum diketahui pasti oleh pasien dan keluarga pasien terdiagnosis ish grade ii ayah pasien memiliki riwayat hipertensi dan penyakit jantung jarang beraktivitas fisik ringan pengetahuan kurang tentang penyakitnya pola diet dan kebiasaan makan tidak sesuai usia lansia serta kurangnya pengetahuan keluarga tentang penyakit dan komplikasinya derajat fungsional 2 setelah dilakuan intervensi menunjukkan perbaikan secara klinis dan perubahan perilaku ish pada lansia dengan pengetahuan kurang tentang faktor risiko penggunaan obat dan kepatuhan dalam kontrol td dapat menimbulkan komplikasi akut dan lanjutan,['R1'],"MEDULA, medicalprofession journal of lampung university",fakultas kedokteran universitas lampung,2021-01-02,,,id,penatalaksanaan isolated systolic hypertension ish suspek retinopati hipertensi dan imobilitas pada lansia dengan dekat dokter keluarga isolated systolic hypertension ish adalah tingkat tekan darah td sistol tanpa serta tingkat td diastol sering jadi pada usia tua ish dapat kembang dari riwayat hipertensi esensial kronik atau akibat turun elastisitas arteri pada orang yang normotensive sebab sekunder turun elastisitas arteri adalah diabetes tipe 1 osteoporosis dengan kalsifikasi aterosklerosis sakit vaskular perifer tirotoksikosis dan lain aorta terap layan dokter keluarga bas evidence based medicine dengan identifikasi faktor risiko masalah klinis serta penatalaksanaan dasar dekat patient centered dan family approach studi ini rupa lapor kasus data primer oleh lalu anamnesis periksa fisik dan kunjung rumah nilai dasar dekat keluarga cara indepth interview observasi dan lembar isi pasien pasien keluh nyeri kepala hilang timbul dan dua lihat kabur sejak 1 minggu lalu keluh baru pertama kali dan belum pernah obat khawatir pasien keluh sebut ganggu aktivitas dan istirahat harap pasien keluh kurang dan tidak buruk persepsi pasien keluh jadi akibat gaya hidup tentu sebab sakit yang belum tahu pasti oleh pasien dan keluarga pasien diagnosis ish grade ii ayah pasien milik riwayat hipertensi dan sakit jantung jarang aktivitas fisik ringan tahu kurang tentang sakit pola diet dan biasa makan tidak sesuai usia lansia serta kurang tahu keluarga tentang sakit dan komplikasi derajat fungsional 2 telah laku intervensi tunjuk baik cara klinis dan ubah perilaku ish pada lansia dengan tahu kurang tentang faktor risiko guna obat dan patuh dalam kontrol td dapat timbul komplikasi akut dan lanjut
