,Unnamed: 0,divisions,title,abstract,subjects,publication,publisher,date,keywords,keyword,lang,text_stemmed
1298,1298,['FP5'],pengetahuan ekologi lokal dalam konservasi pohon di blok pemanfaatan kphl batutegi,kesatuan pengelolaan hutan lindung kphl batutegi provinsi lampung merupakan hutan negara yang terdiri atas beberapa blok pengelolaan di antaranya adalah blok pemanfaatan pada blok ini petani hutan melakukan kegiatan pemanfaatan lahan dengan pola agroforestri konservasi pohon dapat dikatakan sebagai salah satu tindakan petani hutan dalam melakukan pengelolaan lahan yang lestari dan salah satunya melalui praktek pengetahuan dan kearifan lokal tujuan dari penelitian ini untuk menganalisis peran local ecological knowledge lek gapoktan cempaka dalam konservasi pohon di blok pemanfaatan penelitian ini menggunakan metode wawancara terbuka terhadap 55 responden yang merupakan anggota gapoktan cempaka dan observasi lapangan kemudian dianalisis secara deskriptif kualitatif dengan menggunakan agroecological knowledge toolkit akt 5 berdasarkan hasil penelitian diketahui bahwa lek petani hutan dikelompokkan berdasarkan 3 aspek konservasi yaitu a perlindungan meliputi karakteristik lahan garapan fungsi tegakan dan faktor yang mempengaruhi faktor alam dan manusia b pengawetan meliputi habitat satwa budidaya tanaman istilah dan alat yang digunakan dan c pemanfaatan meliputi jenis dan bagian pohon yang dipanen metode dan waktu pemanenan berdasarkan hasil penelitian diharapkan petani hutan gapoktan cempaka tetap menerapkan local ecological knowledge lek dalam kegiatan pengelolaan lahan dikarenakan memiliki dampak terhadap pengelolaan lahan yang berkelanjutan,"['P1', 'S1', 'SD']",Journal of Forest Science Avicennia,Universitas Muhammadiyah Malang,2022-02-01,,,id,tahu ekologi lokal dalam konservasi pohon di blok manfaat kphl batutegi satu kelola hutan lindung kphl batutegi provinsi lampung rupa hutan negara yang diri atas beberapa blok kelola di antara adalah blok manfaat pada blok ini tani hutan laku giat manfaat lahan dengan pola agroforestri konservasi pohon dapat kata bagai salah satu tindak tani hutan dalam laku kelola lahan yang lestari dan salah satu lalu praktek tahu dan arif lokal tuju dari teliti ini untuk analis peran local ecological knowledge lek gapoktan cempaka dalam konservasi pohon di blok manfaat teliti ini guna metode wawancara buka hadap 55 responden yang rupa anggota gapoktan cempaka dan observasi lapang kemudian analis cara deskriptif kualitatif dengan guna agroecological knowledge toolkit akt 5 dasar hasil teliti tahu bahwa lek tani hutan kelompok dasar 3 aspek konservasi yaitu a lindung liput karakteristik lahan garap fungsi tega dan faktor yang pengaruh faktor alam dan manusia b awet liput habitat satwa budidaya tanam istilah dan alat yang guna dan c manfaat liput jenis dan bagi pohon yang panen metode dan waktu panen dasar hasil teliti harap tani hutan gapoktan cempaka tetap terap local ecological knowledge lek dalam giat kelola lahan karena milik dampak hadap kelola lahan yang lanjut
1299,1299,['FKIP21'],kegiatan tambahan kamisah d pandiangan 2022 pengajuan guru besar,kegiatan tambahan kamisah d pandiangan 2022 pengajuan guru besar mendapatkan hibah penelitian kompetitif sebagai ketua minimal rp 100 juta,['QD'],,-,2022-04-18,,,id,giat tambah kamisah d pandiangan 2022 aju guru besar giat tambah kamisah d pandiangan 2022 aju guru besar dapat hibah teliti kompetitif bagai ketua minimal rp 100 juta
1300,1300,['FMIPA4'],peer review 2021 pandiangan rasayan journal of chemistry volume 14,,['QD'],,-,2022-01,,,?,peer review 2021 pandiangan rasayan journal of chemistry volume 14
1301,1301,['FMIPA4'],metode ekstraksi silika dari sekam padi,-,['QD'],,,2022-01-13,,,?,metode ekstraksi silika dari sekam padi -
1302,1302,['FMIPA4'],peer review 2021 pandiangan material research express,,['QD'],,-,2022-01,,,?,peer review 2021 pandiangan material research express
1303,1303,['FMIPA4'],peer review 2019 pandiangan the journal of pure and applied chemistry research,,['QD'],,-,2022-01,,,?,peer review 2019 pandiangan the journal of pure and applied chemistry research
1304,1304,['FMIPA4'],peer review 2020 paten pandiangan metode pembuatan mgo sio2 sekam padi untuk pengolahan minyak nabati menjadi biodiesel,,['QD'],,-,2022-01-28,,,?,peer review 2020 paten pandiangan metode buat mgo sio2 sekam padi untuk olah minyak nabati jadi biodiesel
1305,1305,['FEB6'],electronic word of mouth brand image trust and online utilization intention korespondensi,,['AC'],Academic Journal of Interdisciplinary Studies,Richtmann,2022,,,?,electronic word of mouth brand image trust and online utilization intention korespondensi
1306,1306,['FEB6'],pengaruh electronic word of mouth dan citra merek terhadap niat beli produk kecantikan avoskin,abstrak di era industri 4.0 perkembangan internet saat ini semakin pesat sehingga memudahkan masyarakat untuk mencari informasi tentang suatu produk melalui ulasanulasan di internet saat ini sedang marak tren konten ulasan produk kecantikan di internet produk avoskin ialah salah satu produk kecantikan yang seringkali dijadikan sebagai konten review terkait dengan kondisi tersebut penting bagi perusahaan untuk memperhatikan dampak dari ewom dan citra merek pada niat beli karena mayoritas orang saat ini mendengarkan teman atau orang lain yang berpengalaman serta melihat sejauh mana citra dari sebuah merek memiliki riwayat yang baik penelitian ini mempunyai tujuan untuk mengevaluasi efek electronic word of mouth dan citra merek terhadap niat beli produk kecantikan avoskin populasi pada penelitian ini adalah masyarakat bandar lampung yang mengetahui dan tertarik untuk membeli produk kecantikan avoskin penelitian ini merupakan penelitian explanatory research dimana alat penelitiannya berupa kuisioner yang dibagikan kepada responden 120 responden yang ditentukan dengan memakai teknik purposive sampling kuesioner digunakan dalam pengumpulan data yang sudah diuji validitas dan reliabilitasnya alat analisis dalam penelitian ini memakai analisis regresi linier berganda hasil penelitian yang didapatkan dalam penelitian ini menyatakan bahwa ewom dan citra merek berpengaruh positif signifikan terhadap niat beli kata kunci citra merek electronic word of mouth niat beli,['AC'],"Ekonomi, Keuangan, Investasi dan Syariah (EKUITAS)",EKUITAS,2022,,,id,pengaruh electronic word of mouth dan citra merek hadap niat beli produk cantik avoskin abstrak di era industri 4 0 kembang internet saat ini makin pesat sehingga mudah masyarakat untuk cari informasi tentang suatu produk lalu ulasanulasan di internet saat ini sedang marak tren konten ulas produk cantik di internet produk avoskin ialah salah satu produk cantik yang seringkali jadi bagai konten review kait dengan kondisi sebut penting bagi usaha untuk perhati dampak dari ewom dan citra merek pada niat beli karena mayoritas orang saat ini dengar teman atau orang lain yang alam serta lihat jauh mana citra dari buah merek milik riwayat yang baik teliti ini punya tuju untuk evaluasi efek electronic word of mouth dan citra merek hadap niat beli produk cantik avoskin populasi pada teliti ini adalah masyarakat bandar lampung yang tahu dan tarik untuk beli produk cantik avoskin teliti ini rupa teliti explanatory research mana alat teliti upa kuisioner yang bagi kepada responden 120 responden yang tentu dengan pakai teknik purposive sampling kuesioner guna dalam kumpul data yang sudah uji validitas dan reliabilitas alat analisis dalam teliti ini pakai analisis regresi linier ganda hasil teliti yang dapat dalam teliti ini nyata bahwa ewom dan citra merek pengaruh positif signifikan hadap niat beli kata kunci citra merek electronic word of mouth niat beli
1307,1307,['FP25'],korespondensi artikel pengaruh campuran ekstrak fermentasi pupuk kandang sapi sebagai subtitusi nutrisi ab mix pada tanaman pakcoy dengan sistem hidroponik,ab mix merupakan nutrisi hidroponik yang mengandung unsur hara yang lengkap namun harganya relatif mahal sehingga diperlukan alternatif untuk menggantikan nutrisi tersebut penelitian ini bertujuan untuk 1 mengetahui apakah ekstrak fermentasi dari campuran pupuk kandang sapi dengan daun gamal atau daun afrika atau daun kelor dapat dijadikan sebagai subtitusi nutrisi ab mix 2 mengetahui persentase ekstrak fermentasi dari campuran pupuk kandang sapi dengan daun gamal atau daun afrika atau daun kelor yang dapat dijadikan sebagai subtitusi nutrisi ab mix rancangan yang digunakan ialah rancangan acak kelompok lengkap yang terdiri dari 7 perlakuan yaitu p0 100% ab mix p1 75% ab mix 25% ekstrak fermentasi pupuk kandang sapi dan daun gamal p2 50% ab mix 50% ekstrak fermentasi pupuk kandang sapi dan daun gamal p3 75% ab mix 25% ekstrak fermentasi pupuk kandang sapi dan daun afrika p4 50% ab mix 50% ekstrak fermentasi pupuk kandang sapi dan daun afrika p5 75% ab mix 25% ekstrak fermentasi pupuk kandang sapi dan daun kelor dan p6 50% ab mix 50% ekstrak fermentasi campuran 25% pupuk kandang sapi dan daun kelor dengan enam ulangan hasil penelitian menunjukkan bahwa perlakuan 25% ekstrak fermentasi campuran pupuk kandang sapi dengan daun gamal atau daun afrika atau daun kelor memberikan pengaruh yang sama dengan nutrisi ab mix namun hasil terbaik diperoleh dari perlakuan 75% ab mix 25% ekstrak fermentasi campuran pupuk kandang sapi dan daun gamal yang terlihat pada peubah bobot segar tajuk,['S1'],,"Faculty of Agriculture, Panji Sakti University",2022-03-30,,,id,korespondensi artikel pengaruh campur ekstrak fermentasi pupuk kandang sapi bagai subtitusi nutrisi ab mix pada tanam pakcoy dengan sistem hidroponik ab mix rupa nutrisi hidroponik yang kandung unsur hara yang lengkap namun harga relatif mahal sehingga perlu alternatif untuk ganti nutrisi sebut teliti ini tuju untuk 1 tahu apakah ekstrak fermentasi dari campur pupuk kandang sapi dengan daun gamal atau daun afrika atau daun kelor dapat jadi bagai subtitusi nutrisi ab mix 2 tahu persentase ekstrak fermentasi dari campur pupuk kandang sapi dengan daun gamal atau daun afrika atau daun kelor yang dapat jadi bagai subtitusi nutrisi ab mix rancang yang guna ialah rancang acak kelompok lengkap yang diri dari 7 laku yaitu p0 100 ab mix p1 75 ab mix 25 ekstrak fermentasi pupuk kandang sapi dan daun gamal p2 50 ab mix 50 ekstrak fermentasi pupuk kandang sapi dan daun gamal p3 75 ab mix 25 ekstrak fermentasi pupuk kandang sapi dan daun afrika p4 50 ab mix 50 ekstrak fermentasi pupuk kandang sapi dan daun afrika p5 75 ab mix 25 ekstrak fermentasi pupuk kandang sapi dan daun kelor dan p6 50 ab mix 50 ekstrak fermentasi campur 25 pupuk kandang sapi dan daun kelor dengan enam ulang hasil teliti tunjuk bahwa laku 25 ekstrak fermentasi campur pupuk kandang sapi dengan daun gamal atau daun afrika atau daun kelor beri pengaruh yang sama dengan nutrisi ab mix namun hasil baik oleh dari laku 75 ab mix 25 ekstrak fermentasi campur pupuk kandang sapi dan daun gamal yang lihat pada peubah bobot segar tajuk
1308,1308,['FP2'],pengaruh campuran ekstrak fermentasi pupuk kandang sapi sebagai subtitusi nutrisi ab mix pada tanaman pakcoy dengan sistem hidroponik,ab mix merupakan nutrisi hidroponik yang mengandung unsur hara yang lengkap namun harganya relatif mahal sehingga diperlukan alternatif untuk menggantikan nutrisi tersebut penelitian ini bertujuan untuk 1 mengetahui apakah ekstrak fermentasi dari campuran pupuk kandang sapi dengan daun gamal atau daun afrika atau daun kelor dapat dijadikan sebagai subtitusi nutrisi ab mix 2 mengetahui persentase ekstrak fermentasi dari campuran pupuk kandang sapi dengan daun gamal atau daun afrika atau daun kelor yang dapat dijadikan sebagai subtitusi nutrisi ab mix rancangan yang digunakan ialah rancangan acak kelompok yang terdiri dari 7 perlakuan yaitu p0 100% ab mix p1 75% ab mix 25% ekstrak fermentasi pupuk kandang sapi dan daun gamal p2 50% ab mix 50% campuran ekstrak fermentasi pupuk kandang sapi dan daun gamal p3 75% ab mix 25% campuran ekstrak fermentasi pupuk kandang sapi dan daun afrika p4 50% ab mix 50% campuran ekstrak fermentasi pupuk kandang sapi dan daun afrika p5 75% ab mix 25% campuran ekstrak fermentasi pupuk kandang sapi dan daun kelor dan p6 50% ab mix campuran 50% ekstrak fermentasi pupuk kandang sapi dan daun kelor dengan enam ulangan hasil penelitian menunjukkan bahwa perlakuan 25% campuran ekstrak fermentasi pupuk kandang sapi dengan daun gamal atau daun afrika atau daun kelor memberikan pengaruh yang sama dengan nutrisi ab mix namun hasil bobot segar terberat diperoleh dari perlakuan 75% ab mix 25% campuran ekstrak fermentasi pupuk kandang sapi dan daun gamal,['S1'],Agro Bali : Agricultural Journal,"Faculty of Agriculture, Panji Sakti University",2022-03-05,,,id,pengaruh campur ekstrak fermentasi pupuk kandang sapi bagai subtitusi nutrisi ab mix pada tanam pakcoy dengan sistem hidroponik ab mix rupa nutrisi hidroponik yang kandung unsur hara yang lengkap namun harga relatif mahal sehingga perlu alternatif untuk ganti nutrisi sebut teliti ini tuju untuk 1 tahu apakah ekstrak fermentasi dari campur pupuk kandang sapi dengan daun gamal atau daun afrika atau daun kelor dapat jadi bagai subtitusi nutrisi ab mix 2 tahu persentase ekstrak fermentasi dari campur pupuk kandang sapi dengan daun gamal atau daun afrika atau daun kelor yang dapat jadi bagai subtitusi nutrisi ab mix rancang yang guna ialah rancang acak kelompok yang diri dari 7 laku yaitu p0 100 ab mix p1 75 ab mix 25 ekstrak fermentasi pupuk kandang sapi dan daun gamal p2 50 ab mix 50 campur ekstrak fermentasi pupuk kandang sapi dan daun gamal p3 75 ab mix 25 campur ekstrak fermentasi pupuk kandang sapi dan daun afrika p4 50 ab mix 50 campur ekstrak fermentasi pupuk kandang sapi dan daun afrika p5 75 ab mix 25 campur ekstrak fermentasi pupuk kandang sapi dan daun kelor dan p6 50 ab mix campur 50 ekstrak fermentasi pupuk kandang sapi dan daun kelor dengan enam ulang hasil teliti tunjuk bahwa laku 25 campur ekstrak fermentasi pupuk kandang sapi dengan daun gamal atau daun afrika atau daun kelor beri pengaruh yang sama dengan nutrisi ab mix namun hasil bobot segar berat oleh dari laku 75 ab mix 25 campur ekstrak fermentasi pupuk kandang sapi dan daun gamal
1309,1309,['FP25'],teknik fermentasi campuran bahan organik sebagai sumber nutrisi organik pada sayuran sawi yang ditanam dengan hidroponik,"nutrisi organik untuk budidaya sistem sumbu hidroponik merupakan salah satu alternatif untuk mengatasi kendala mahalnya harga pupuk anorganik penelitian ini bertujuan untuk mengetahui metode ekstraksi terbaik antara metode air hangat air dingin dan fermentasi kemudian menentukan waktu fermentasi terbaik dari unsur hara organik campuran rumput laut sabut kelapa dan daun kelor yang diharapkan memiliki kandungan nutrisi organik yang mendekati dengan formula nutrisi anorganik penelitian ini terdiri atas 2 percobaan percobaan pertama meneliti jenis metode ekstraksi dan percobaan kedua meneliti waktu fermentasi terbaik rancangan percobaan yang digunakan adalah rancangan acak kelompok rak dengan faktor tunggal dan diulang sebanyak 6 kali hasil penelitian ini menunjukkan bahwa unsur hara organik yang dicampur dengan rumput laut sabut kelapa dan daun kelor belum mampu menyamai unsur hara campuran ab mix pada budidaya tanaman sawi secara hidroponik bobot segar tanaman sawi pada sub percobaan metode ekstraksi menunjukkan bahwa metode fermentasi menghasilkan 11,28 g atau 52,22% dari bobot segar tanaman hasil perlakuan nutrisi ab mix yang mencapai 21,60 g bobot segar tanaman sawi pada sub percobaan waktu fermentasi menunjukkan bahwa fermentasi 20 hari menghasilkan 1,83 g atau 50,8% dari bobot segar tanaman hasil perlakuan hara ab mix yang mencapai 3,60 g waktu fermentasi terbaik diperoleh pada 20 hari fermentasi",['S1'],Jurnal Kultivasi,"Unpad Press, Universitas Padjadjaran",2022-12-10,,,id,teknik fermentasi campur bahan organik bagai sumber nutrisi organik pada sayur sawi yang tanam dengan hidroponik nutrisi organik untuk budidaya sistem sumbu hidroponik rupa salah satu alternatif untuk atas kendala mahal harga pupuk anorganik teliti ini tuju untuk tahu metode ekstraksi baik antara metode air hangat air dingin dan fermentasi kemudian tentu waktu fermentasi baik dari unsur hara organik campur rumput laut sabut kelapa dan daun kelor yang harap milik kandung nutrisi organik yang dekat dengan formula nutrisi anorganik teliti ini diri atas 2 coba coba pertama teliti jenis metode ekstraksi dan coba dua teliti waktu fermentasi baik rancang coba yang guna adalah rancang acak kelompok rak dengan faktor tunggal dan ulang banyak 6 kali hasil teliti ini tunjuk bahwa unsur hara organik yang campur dengan rumput laut sabut kelapa dan daun kelor belum mampu sama unsur hara campur ab mix pada budidaya tanam sawi cara hidroponik bobot segar tanam sawi pada sub coba metode ekstraksi tunjuk bahwa metode fermentasi hasil 11 28 g atau 52 22 dari bobot segar tanam hasil laku nutrisi ab mix yang capai 21 60 g bobot segar tanam sawi pada sub coba waktu fermentasi tunjuk bahwa fermentasi 20 hari hasil 1 83 g atau 50 8 dari bobot segar tanam hasil laku hara ab mix yang capai 3 60 g waktu fermentasi baik oleh pada 20 hari fermentasi
1310,1310,['FP26'],peer review pemanfaatan bokashi untuk budidaya tanaman di pekarangan,peer review jurnal pengabdian fakultas pertanian universitas lampung,['S1'],,Jurnal Pengabdian Fakultas Pertanian Universitas Lampung,2022-03,,,id,peer review manfaat bokashi untuk budidaya tanam di pekarang peer review jurnal abdi fakultas tani universitas lampung
1311,1311,['FP2'],pemanfaatan bokashi untuk budidaya tanaman di pekarangan,pekarangan mempunyai potensi yang besar sebagai penunjang berbagai kebutuhan hidup seharihari pemiliknya salah satu pertanian yang diandalkan tersebut adalah pertanian organik yaitu kompos bokashi tujuan penyuluhan pertanian ini adalah 1 meningkatkan pengetahuan petani dalam membuat pupuk organik kompos bokashi 2 meningkatkan pemahaman petani dalam memanfaatkan lahan pekarangan dengan menerapkan teknologi budidaya sayuran dan tanaman obat yang ramah lingkungan secara organik metode penyuluhan yang digunakan yaitu denagan daemonstrasi cara teknik pembuatan bokashi pupuk kandang dilaksanakan sesuai dengan teknik pembuatan pupuk hayati hasil penyuluhan menunjukan bahwa pengetahuan petani tentang manfaat pupuk hayati untuk budidaya tanaman pangan dan tanaman obat di pekarangan mereka meningkat sampai ratarata 70% tanggapan petani terhadap kegiatan demonstrasi cara membuat pupuk hayati positif serta petani ingin mencoba melaksanakannya pada musim tanam selanjutnya petani berencana untuk membuat pupuk hayati sendiri dan menerapkannya pada tanaman pangan tanaman sayuran dan tanaman obatobatan di sekitar pekarangan,['S1'],Jurnal Pengabdian Fakultas Pertanian Universitas Lampung,Fakultas Pertanian Universitas Lampung,2022-03-30,,,id,manfaat bokashi untuk budidaya tanam di pekarang pekarang punya potensi yang besar bagai tunjang bagai butuh hidup seharihari milik salah satu tani yang andal sebut adalah tani organik yaitu kompos bokashi tuju suluh tani ini adalah 1 tingkat tahu tani dalam buat pupuk organik kompos bokashi 2 tingkat paham tani dalam manfaat lahan pekarang dengan terap teknologi budidaya sayur dan tanam obat yang ramah lingkung cara organik metode suluh yang guna yaitu denagan daemonstrasi cara teknik buat bokashi pupuk kandang laksana sesuai dengan teknik buat pupuk hayati hasil suluh tunjuk bahwa tahu tani tentang manfaat pupuk hayati untuk budidaya tanam pangan dan tanam obat di pekarang mereka tingkat sampai ratarata 70 tanggap tani hadap giat demonstrasi cara buat pupuk hayati positif serta tani ingin coba laksana pada musim tanam lanjut tani rencana untuk buat pupuk hayati sendiri dan terap pada tanam pangan tanam sayur dan tanam obatobatan di sekitar pekarang
1312,1312,['FP26'],peer review penyuluhan pembuatan pupuk organik cair dari ekstrak tanaman di desa sidowaluyo kabupaten lampung selatan lampung,peer review jurnal ilmu pengetahuan teknologi dan seni bagi masyarakat,['S1'],,"Jurnal Ilmu Pengetahuan, Teknologi, dan Seni Bagi Masyarakat",2022-04,,,id,peer review suluh buat pupuk organik cair dari ekstrak tanam di desa sidowaluyo kabupaten lampung selatan lampung peer review jurnal ilmu tahu teknologi dan seni bagi masyarakat
1313,1313,['FP2'],penyuluhan pembuatan pupuk organik cair dari ekstrak tanaman di desa sidowaluyo kabupaten lampung selatan lampung,potensi lokal tanaman suatu daerah perlu digali untuk mendatangkan kesejahteraan bagi petani desa sidowaluyo kecamatan sidomulyo kabupaten lampung selatan memiliki sumber daya pertanian yang dapat dimanfaatkan untuk pembuatan pupuk organik cair dari ekstrak tanaman tujuan dari kegiatan pengabdian ini adalah 1 meningkatkan pengetahuan petani tentang manfaat ekstrak tanaman 2 meningkatkan keterampilan petani tentang teknik pembuatan pupuk organik cair dari ekstrak tanaman metode penyuluhan berupa ceramah diskusi dan demonstrasi pembuatan pupuk organik cair dari ekstrak tanaman kegiatan penyuluhan telah dilaksanakan di desa sidowaluyo kecamatan sidomulyo kabupaten lampung selatan pada bulan oktober 2021 dari selisih antara tahap akhir dengan tahap awal terjadi peningkatan pengetahuan 35 point atau 73% hasil observasi dilapangan keterampilan petani tentang teknik pembuatan ekstrak tanaman juga meningkat hasil pengabdian kepada masyarakat menunjukkan pengetahuan petani tentang teknik pembuatan ekstrak tanaman meningkat keterampilan petani tentang teknik pembuatan ekstrak tanaman juga meningkat hasil pengabdian menunjukkan bahwa sosialisasi pertanian organic harus terus digalakkan,['S1'],Jurnal SEMAR,Universitas Sebelas Maret UNS,2022-05-10,,,id,suluh buat pupuk organik cair dari ekstrak tanam di desa sidowaluyo kabupaten lampung selatan lampung potensi lokal tanam suatu daerah perlu gali untuk datang sejahtera bagi tani desa sidowaluyo camat sidomulyo kabupaten lampung selatan milik sumber daya tani yang dapat manfaat untuk buat pupuk organik cair dari ekstrak tanam tuju dari giat abdi ini adalah 1 tingkat tahu tani tentang manfaat ekstrak tanam 2 tingkat terampil tani tentang teknik buat pupuk organik cair dari ekstrak tanam metode suluh upa ceramah diskusi dan demonstrasi buat pupuk organik cair dari ekstrak tanam giat suluh telah laksana di desa sidowaluyo camat sidomulyo kabupaten lampung selatan pada bulan oktober 2021 dari selisih antara tahap akhir dengan tahap awal jadi tingkat tahu 35 point atau 73 hasil observasi lapang terampil tani tentang teknik buat ekstrak tanam juga tingkat hasil abdi kepada masyarakat tunjuk tahu tani tentang teknik buat ekstrak tanam tingkat terampil tani tentang teknik buat ekstrak tanam juga tingkat hasil abdi tunjuk bahwa sosialisasi tani organic harus terus galak
