,Unnamed: 0,divisions,title,abstract,subjects,publication,publisher,date,keywords,keyword,lang,text_stemmed
12382,12382,,studi kualitatif faktorfaktor yang mempengaruhi pemilihan karier pada mahasiswa kedokteran dan dokter internship di bandar lampung,pemilihan karier merupakan hal penting dan krusial bagi seorang dokter pemilihan karier menjadi hal yang sangat menentukan masa depan seorang dokter ketika terjun di masyarakat penelitian ini bertujuan untuk megetahui faktorfaktor yang mempengaruhi pemilihan karier mahasiswa kedokteran tahun pertama ketiga dan dokter internship fakultas kedokteran universitas lampung fk unila di bandar lampung penelitian ini dilakukan dengan menggunakan desain penelitian kualitatif studi pendahuluan dilakukan dengan melakukan survei gambaran pilihan karier pada mahasiswa kedokteran tahun pertama dan ketiga fk unila dari gambaran pilihan karir yang didapatkan dilakukan wawancara mendalam pada mahasiswa tahun pertama n 4 tahun ketiga n 6 dan dokter internship n 8 data kemudian ditranskripsi dikoding dan dianalisis konten untuk mendapatkan tematema yang muncul gambaran pilihan karier mahasiswa masih didominasi oleh dokter fungsional khususnya dokter spesialis baik pada mahasiswa tahun pertama 67% 85 dari 127 responden maupun pada mahasiswa tahun ke tiga 54% 70 dari 130 responden faktor yang mempengaruhi pemilihan karier terdiri dari faktor pendorong dan faktor penghambat terdapat delapan kategori utama faktorfaktor yang mempengaruhi pemilihan karier yaitu karakteristik pribadi karakteristik profesi kondisi lapangan pekerjaan peran keluarga kehiduoan pribadi tuntutan pendidikan lanjut fase preklinik dan fase rotasi klinik dari kedelapan kategori tersebut kategori fase preklinik tidak didapatkan sebagai kategori pada faktor penghambat tetapi terdapat dua kategori lainnya yaitu beban kerja dan keterbatasan informasi simpulan pemilihan karier mahasiswa kedokteran dan dokter internship bervariasi sesuai dengan tahapan pendidikan yang dilalui semakin tinggi tahapan pendidikan yang dilalui semakin kompleks halhal yang dipertimbangkan dalam pemilihan kariernya jk unila 2016 1 2 272-282 kata kunci dokter internship mahasiswa kedokteran pemilihan karier,['R1'],Jurnal Kedokteran dan Kesehatan Universitas Lampung,Fakultas Kedokteran Universitas Lampung,2016-10,,,id,studi kualitatif faktorfaktor yang pengaruh pilih karier pada mahasiswa dokter dan dokter internship di bandar lampung pilih karier rupa hal penting dan krusial bagi orang dokter pilih karier jadi hal yang sangat tentu masa depan orang dokter ketika terjun di masyarakat teliti ini tuju untuk megetahui faktorfaktor yang pengaruh pilih karier mahasiswa dokter tahun pertama tiga dan dokter internship fakultas dokter universitas lampung fk unila di bandar lampung teliti ini laku dengan guna desain teliti kualitatif studi dahulu laku dengan laku survei gambar pilih karier pada mahasiswa dokter tahun pertama dan tiga fk unila dari gambar pilih karir yang dapat laku wawancara dalam pada mahasiswa tahun pertama n 4 tahun tiga n 6 dan dokter internship n 8 data kemudian transkripsi dikoding dan analis konten untuk dapat tematema yang muncul gambar pilih karier mahasiswa masih dominasi oleh dokter fungsional khusus dokter spesialis baik pada mahasiswa tahun pertama 67 85 dari 127 responden maupun pada mahasiswa tahun ke tiga 54 70 dari 130 responden faktor yang pengaruh pilih karier diri dari faktor dorong dan faktor hambat dapat delapan kategori utama faktorfaktor yang pengaruh pilih karier yaitu karakteristik pribadi karakteristik profesi kondisi lapang kerja peran keluarga kehiduoan pribadi tuntut didik lanjut fase preklinik dan fase rotasi klinik dari delap kategori sebut kategori fase preklinik tidak dapat bagai kategori pada faktor hambat tetapi dapat dua kategori lain yaitu beban kerja dan batas informasi simpul pilih karier mahasiswa dokter dan dokter internship variasi sesuai dengan tahap didik yang lalu makin tinggi tahap didik yang lalu makin kompleks halhal yang timbang dalam pilih karier jk unila 2016 1 2 272-282 kata kunci dokter internship mahasiswa dokter pilih karier
12383,12383,,strategi pengembangan sdm dan lingkungan kerja serta dampaknya pada kinerja karyawan pdam way rilau bandar lampung,strategi pengembangan sdm dan lingkungan kerja serta dampaknya pada kinerja karyawan pdam way rilau bandar lampung nova mardiana universitas lampung abstrak kualitas sumber daya manusia sangat menetukan dalam organisasi dalam mencapai visi dan misinya oleh karena itu dibutuhkan strategi pengembangan sumber daya manusia yang berkelanjutan sesuai dengan kebutuhan organisasi dalam meningkatkan fungsi sumber daya manusia yang maksimal dibutuhkan pula lingkungan kerja yang kondusif sehingga tercapai kinerja yang maksimal penelitian ini bertujuan untuk mengetahui strategi pengembangan sumber daya manusia yang paling tepat pada karyawan pdam way rilau bandar lampung serta mengetahui pengeruh pengembangan karir dan lingkungan kerja terhadap kinerja karyawan hipotesis yang diajukan adalah pengembangan sumber daya manusia dan lingkungan kerja berpengaruh signifikan baik secara parsial maupun simultan terhadap kinerja karyawan metode penelitian yang digunakan adalah descriptive survey dan explanatory survey penelitian ini menggunakan teknik stratified random sampling dengan alokasi proporsional pengumpulan data meliputi pencatatan dokumen wawancara dan kuestioner data dianalisis menggunakan analisis deskriptif dan analisi jalur path analysis kesimpulan dalam penelitian ini adalah bahwa penelitian ini mendukung hipotesis yang diajukan yaitu pengembahan sumber daya manusia berpengaruh positip dan signifikan terhadap kinerja karyawan lingkungan kerja berpengaruh positip dan signifikan terhadap kinerja karyawan dan pengembangan sumberdaya manusia dan lingkungan kerja secara bersamasama berpengaruh positip dan signifikan terhadap kinerja karyawan pdam way rilau bandar lampung saran dalam penelitian ini adalah agar pdam way rilau lebih memperhatikan kelanjutan hasil setelah dilaksanakannya pengembangan sumber daya manusia hubungan kerja antar karyawan dan hubungan antar pimpinan dan bawahan hendaknya bisa lebih diusahakan lebih luwes dengan cara mengadakan pertemuan santai dan pelatihan outdoor antar karyawan secara rutin minimal setahun sekali sehingga karyawan lebih semangat dalam bekerja dan pada akhirnya akan meningkatkan kinerja karyawan kata kunci strategi pengembangan sdm lingkungan kerja dan kinerja karyawan,['HN'],Proceedings Forum Management Indonesia 8,Forum Manajemen Indonesia,2016-11-12,,,id,strategi kembang sdm dan lingkung kerja serta dampak pada kerja karyawan pdam way rilau bandar lampung strategi kembang sdm dan lingkung kerja serta dampak pada kerja karyawan pdam way rilau bandar lampung nova mardiana universitas lampung abstrak kualitas sumber daya manusia sangat menetukan dalam organisasi dalam capai visi dan misi oleh karena itu butuh strategi kembang sumber daya manusia yang lanjut sesuai dengan butuh organisasi dalam tingkat fungsi sumber daya manusia yang maksimal butuh pula lingkung kerja yang kondusif sehingga capai kerja yang maksimal teliti ini tuju untuk tahu strategi kembang sumber daya manusia yang paling tepat pada karyawan pdam way rilau bandar lampung serta tahu keruh kembang karir dan lingkung kerja hadap kerja karyawan hipotesis yang aju adalah kembang sumber daya manusia dan lingkung kerja pengaruh signifikan baik cara parsial maupun simultan hadap kerja karyawan metode teliti yang guna adalah descriptive survey dan explanatory survey teliti ini guna teknik stratified random sampling dengan alokasi proporsional kumpul data liput catat dokumen wawancara dan kuestioner data analis guna analisis deskriptif dan analis jalur path analysis simpul dalam teliti ini adalah bahwa teliti ini dukung hipotesis yang aju yaitu embah sumber daya manusia pengaruh positip dan signifikan hadap kerja karyawan lingkung kerja pengaruh positip dan signifikan hadap kerja karyawan dan kembang sumberdaya manusia dan lingkung kerja cara bersamasama pengaruh positip dan signifikan hadap kerja karyawan pdam way rilau bandar lampung saran dalam teliti ini adalah agar pdam way rilau lebih perhati lanjut hasil telah laksana kembang sumber daya manusia hubung kerja antar karyawan dan hubung antar pimpin dan bawah hendak bisa lebih usaha lebih luwes dengan cara ada temu santai dan latih outdoor antar karyawan cara rutin minimal tahun sekali sehingga karyawan lebih semangat dalam kerja dan pada akhir akan tingkat kerja karyawan kata kunci strategi kembang sdm lingkung kerja dan kerja karyawan
12384,12384,['FK1'],tatalaksana farmakologi diabetes melitus tipe 2 pada wanita lansia dengan kadar gula tidak terkontrol,diabetes melitus dm merupakan masalah kesehatan yang perlu mendapatkan penanganan yang seksama diabetes melitus merupakan suatu kelompok penyakit metabolik dengan karakteristik hiperglikemia yang terjadi karena kelainan sekresi insulin kerja insulin atau kedua duanya tujuan studi ini adalah untuk menerapkan pendekatan dokter keluarga secara holistik dan komprehensif serta menyelesaikan masalah berbasis evidence based medicine yang bersifat familyapproached dan patient centered studi ini merupakan laporan kasus pasien wanita 60 tahun dengan keluhan sering mengalami kesemutan pada kedua tangan faktor internal adalah pasien seorang lanjut usia tidak menjalankan pola makan yang sehat dikarenakan pengetahuan yang kurang kurang aktifitas fisik dan perilaku berobat kuratif pasien memiliki kadar glukosa darah sewaktu 290 mg dl dilakukan intervensi terhadap pasien dan keluarga tentang penyakitnya pola makan dan pentingnya tindakan preventif untuk mencegah komplikasi penyakitnya wanita usia lanjut menjadi faktor utama terjadinya diabetes melitus diperberat dengan pola makan tinggi glukosa dan kurangnya olahraga pelayanan dokter keluarga dalam terapi farmakologis maupun non farmakologis mampu menyelesaikan masalah kesehatan dan meningkatkan kualitas hidup pasien,['RL'],"MEDULA, medicalprofession journal of lampung university",fakultas kedokteran universitas lampung,2016-08,,,id,tatalaksana farmakologi diabetes melitus tipe 2 pada wanita lansia dengan kadar gula tidak kontrol diabetes melitus dm rupa masalah sehat yang perlu dapat tangan yang seksama diabetes melitus rupa suatu kelompok sakit metabolik dengan karakteristik hiperglikemia yang jadi karena lain sekresi insulin kerja insulin atau dua dua tuju studi ini adalah untuk terap dekat dokter keluarga cara holistik dan komprehensif serta selesai masalah bas evidence based medicine yang sifat familyapproached dan patient centered studi ini rupa lapor kasus pasien wanita 60 tahun dengan keluh sering alami semut pada dua tangan faktor internal adalah pasien orang lanjut usia tidak jalan pola makan yang sehat karena tahu yang kurang kurang aktifitas fisik dan perilaku obat kuratif pasien milik kadar glukosa darah waktu 290 mg dl laku intervensi hadap pasien dan keluarga tentang sakit pola makan dan penting tindak preventif untuk cegah komplikasi sakit wanita usia lanjut jadi faktor utama jadi diabetes melitus berat dengan pola makan tinggi glukosa dan kurang olahraga layan dokter keluarga dalam terapi farmakologis maupun non farmakologis mampu selesai masalah sehat dan tingkat kualitas hidup pasien
12385,12385,['FK1'],kehamilanatermdengan riwayat pecah ketuban danpresentasi bokong,presentasi bokong merupakan keadaan dimana janin terletak memanjang dengan kepala di fundus uteri dan bokong di bawah kavum uteri angka kejadian presentasi bokong jika dihubungkan dengan paritas ibu maka kejadian terbanyak adalah pada ibu dengan multigravida dibanding pada primigravida seorang wanitaberusia 15 tahun dengan keluhan akan melahirkan dengan anak letak sungsang pasien mengeluh perut mulas yang menjalar kepinggang sejak 7 jam yang lalu hilang timbul semakin lama semakin sering dan kuat terapi yang dilakukan kemudian adalah observasi tanda vital ibu his denyut jantung janin pasien diberikan ivfd rl gtt xx menit ampisilin 3x1 gr iv evaluasi dengan partograf who modifikasi dan rencana partus pervaginam seorang wanita g3p2a0 hamil 40 minggu inpartu kala 1 fase aktif dengan riwayat pecah ketuban 7 jam janin tunggal hidup dengan presentasi bokong pemilihan partus pervaginam pada kasus ini sudah tepat sesuai dengan kriteria indeks zatuchni andros dimana indeks zatuchniandros pada kasus ini adalah 7.,['RG'],medical profession journal of lampung university,FK Unila,2016-05-01,,,id,kehamilanatermdengan riwayat pecah ketuban danpresentasi bokong presentasi bokong rupa ada mana janin letak panjang dengan kepala di fundus uteri dan bokong di bawah kavum uteri angka jadi presentasi bokong jika hubung dengan paritas ibu maka jadi banyak adalah pada ibu dengan multigravida banding pada primigravida orang wanitaberusia 15 tahun dengan keluh akan lahir dengan anak letak sungsang pasien keluh perut mulas yang jalar pinggang sejak 7 jam yang lalu hilang timbul makin lama makin sering dan kuat terapi yang laku kemudian adalah observasi tanda vital ibu his denyut jantung janin pasien beri ivfd rl gtt xx menit ampisilin 3x1 gr iv evaluasi dengan partograf who modifikasi dan rencana partus pervaginam orang wanita g3p2a0 hamil 40 minggu inpartu kala 1 fase aktif dengan riwayat pecah ketuban 7 jam janin tunggal hidup dengan presentasi bokong pilih partus pervaginam pada kasus ini sudah tepat sesuai dengan kriteria indeks zatuchni andros mana indeks zatuchniandros pada kasus ini adalah 7
12386,12386,['FH3'],pengelolaan anggaran pendapatan dan belanja daerah menurut undangundang nomor 23 tahun 2014 tentang pemerintahan daerah,,['K1'],,LPPM Unila,2016-10,,,?,kelola anggar dapat dan belanja daerah turut undangundang nomor 23 tahun 2014 tentang perintah daerah
12387,12387,['FP5'],properties of oriented strand board prepared from modified steam treated bamboo strands,,['SD'],,,2016-04-15,,,?,properties of oriented strand board prepared from modified steam treated bamboo strands
12388,12388,['FK1'],pencegahan demam berdarah dan virus zika di posyandu dahlia iii kelurahan olok gading teluk betung barat,abstrak kota bandar lampung menempati urutan ketiga kasus dbd terbanyak di provinsi lampung pada tahun 2016 terjadi peningkatan kasus dbd dari yang pada tahun 2015 hanya 15 kasus menjadi 84 kasus dbd baru ini ditemukan bahwa nyamuk aedes juga dapat menjadi vektor untuk virus zika virus zika merupakan virus dari jenis flavivirus dan memiliki kesamaan dengan virus dengue yang berasal dari kelompok arbovirus virus zika dapat menyerang siapa saja dan menimbulkan efek yang berbahaya terutama untuk ibu hamil ibu hamil yang tertular virus zika dapat menularkan virus zika kepada bayinya dan menimbulkan kecacatan virus zika merupakan jenis virus baru yang belum banyak diketahui oleh masyarakat sehingga sangat diperlukan pemberian informasi mengenai virus zika tujuan dari pelaksanaan penyuluhan dbd dan virus zika di posyandu adalah untuk memberikan edukasi pada masyarakat tentang penyakit dbd dan virus zika agar masyarakat dapat mengenali gejala dini penyakit mengetahui cara penanganan dan upaya pencegahan penyakit dbd dan virus zika pemecahan masalah yang diterapkan pada kegiatan ini mencakup penyuluhan mengenai demam berdarah dan virus zika dengan metode ceramah dan media cetak flip chart dan leaflet penyuluhan dilaksanakan pada tanggal 14 april 2016 di posyandu dahlia iii kelurahan olok gading teluk betung barat bandar lampung kegiatan penyuluhan mengenai pencegahan demam berdarah dan virus zika oleh 50 orang ibuibu yang mempunyai balita dan ibu hamil setelah mendapatkan penyuluhan tentang materi pencegahan demam berdarah dan virus zika pengetahuan peserta penyuluhan meningkat hal ini ditunjukan dengan menilai jawaban yang diberikan peserta saat diberikan pertanyaan benar dan tepat kata kunci demam berdarah dengue virus zika,['RA0421'],Jurnal Pengabdian Masyarakat Ruwa Jurai,fakultas kedokteran universitas lampung,2016-10,,,id,cegah demam darah dan virus zika di posyandu dahlia iii lurah olok gading teluk betung barat abstrak kota bandar lampung tempat urut tiga kasus dbd banyak di provinsi lampung pada tahun 2016 jadi tingkat kasus dbd dari yang pada tahun 2015 hanya 15 kasus jadi 84 kasus dbd baru ini temu bahwa nyamuk aedes juga dapat jadi vektor untuk virus zika virus zika rupa virus dari jenis flavivirus dan milik sama dengan virus dengue yang asal dari kelompok arbovirus virus zika dapat serang siapa saja dan timbul efek yang bahaya utama untuk ibu hamil ibu hamil yang tular virus zika dapat tular virus zika kepada bayi dan timbul cacat virus zika rupa jenis virus baru yang belum banyak tahu oleh masyarakat sehingga sangat perlu beri informasi kena virus zika tuju dari laksana suluh dbd dan virus zika di posyandu adalah untuk beri edukasi pada masyarakat tentang sakit dbd dan virus zika agar masyarakat dapat nali gejala dini sakit tahu cara tangan dan upaya cegah sakit dbd dan virus zika pecah masalah yang terap pada giat ini cakup suluh kena demam darah dan virus zika dengan metode ceramah dan media cetak flip chart dan leaflet suluh laksana pada tanggal 14 april 2016 di posyandu dahlia iii lurah olok gading teluk betung barat bandar lampung giat suluh kena cegah demam darah dan virus zika oleh 50 orang ibuibu yang punya balita dan ibu hamil telah dapat suluh tentang materi cegah demam darah dan virus zika tahu serta suluh tingkat hal ini tunjuk dengan nilai jawab yang beri serta saat beri tanya benar dan tepat kata kunci demam darah dengue virus zika
12389,12389,['FK1'],ergonomi sebagai upaya pencegahan musculoskeletal disorders pada pekerja,"abstrak pada tahun 2003 world health organization who melaporkan musculoskeletal disorder s msds adalah penyakit akibat kerja yang paling banyak terjadi dan diperkirakan mencapai 60% dari semua penyakit akibat kerja begitu juga di indonesia departemen kesehatan ri tahun 2005 melaporkan terdapat 40,5% pekerja mempunyai gangguan kesehatan yang berhubungan dengan pekerjaan diantaranya yang tertinggi adalah gangguan muskuloskeletal sebanyak 16% musculoskeletal disorder s dapat disebabkan oleh kontribusi berbagai faktor risiko antara lain faktor individu faktor pekerjaan atau biomekanik dan faktor psikososial faktor pekerjaan yang berhubungan dengan gangguan muskuloskeletal dapat berasal dari pajanan ergonomi berupa postur janggal gerakan statis dan berulang ergonomi adalah ilmu yang mempelajari perilaku manusia dalam kaitannya dengan pekerjaan mereka ergonomi merancang suatu sistem di mana letak lokasi kerja metode kerja peralatan mesinmesin dan lingkungan kerja sesuai dengan keterbatasan fisik dan sifatsifat pekerja prinsip utama dalam ergonomi adalah menyerasikan pekerjaan dengan pekerja atau fitting the job to the worker occupational safety and health administration osha merekomendasikan suatu tindakan ergonomik untuk mengatasi keluhan muskuloskeletal melalui dua cara yaitu rekayasa teknik pada desain stasiun dan alat kerja dan rekayasa manajemen pada organisasi kerja dengan adanya aplikasi ergonomi dalam pekerjaan diharapkan angka cedera dan kesakitan dalam melakukan pekerjaan dapat dikurangi produktivitas dan keselamatan kerja meningkat yang pada akhirnya akan meningkatkan kesejahteraan fisik mental dan sosial pekerja kata kunci ergonomi musculoskeletal disorder s penyakit akibat kerja",['RA0421'],Jurnal Kedokteran dan Kesehatan Universitas Lampung,fakultas kedokteran universitas lampung dan ikatan dokter wilayah provinsi lampungr,2016-10,,,id,ergonomi bagai upaya cegah musculoskeletal disorders pada kerja abstrak pada tahun 2003 world health organization who lapor musculoskeletal disorder s msds adalah sakit akibat kerja yang paling banyak jadi dan kira capai 60 dari semua sakit akibat kerja begitu juga di indonesia departemen sehat ri tahun 2005 lapor dapat 40 5 kerja punya ganggu sehat yang hubung dengan kerja antara yang tinggi adalah ganggu muskuloskeletal banyak 16 musculoskeletal disorder s dapat sebab oleh kontribusi bagai faktor risiko antara lain faktor individu faktor kerja atau biomekanik dan faktor psikososial faktor kerja yang hubung dengan ganggu muskuloskeletal dapat asal dari pajan ergonomi upa postur janggal gera statis dan ulang ergonomi adalah ilmu yang ajar perilaku manusia dalam kait dengan kerja mereka ergonomi rancang suatu sistem di mana letak lokasi kerja metode kerja alat mesinmesin dan lingkung kerja sesuai dengan batas fisik dan sifatsifat kerja prinsip utama dalam ergonomi adalah serasi kerja dengan kerja atau fitting the job to the worker occupational safety and health administration osha rekomendasi suatu tindak ergonomik untuk atas keluh muskuloskeletal lalu dua cara yaitu rekayasa teknik pada desain stasiun dan alat kerja dan rekayasa manajemen pada organisasi kerja dengan ada aplikasi ergonomi dalam kerja harap angka cedera dan sakit dalam laku kerja dapat rang produktivitas dan selamat kerja tingkat yang pada akhir akan tingkat sejahtera fisik mental dan sosial kerja kata kunci ergonomi musculoskeletal disorder s sakit akibat kerja
12390,12390,['FP21'],produksi dan pengujian aktivitas amilase burkholderia cepacia terhadap substrat yang berbeda,"pati atau amilum merupakan bahan utama yang dihasilkan oleh tumbuhan untuk menyimpan kelebihan glukosa sebagai produk fotosintesis burkholderia cepacia merupakan bakteri yang mampu menghidrolisis pati karena bakteri tersebut memiliki enzim amilase penelitian ini bertujuan untuk mengetahui pengaruh pemberian substrat yang berbeda terhadap pertumbuhan indeks amilolitik dan aktivitas enzim amilase bakteri b cepacia penelitian ini menggunakan rancangan acak lengkap dengan 3 perlakuan substrat daun singkong daun pepaya dan sente dengan 3 ulangan hasil penelitian menunjukkan bahwa bakteri b cepacia mampu hidup dengan baik pada substrat daun pepaya pemberian substrat daun sente memberikan pengaruh terhadap indeks amilolitik yang ditunjukkan dengan adanya zona bening sebesar 9,8 mm aktivitas enzim amilase pada penelitan ini adalah 101,8 unit dan konsentrasi protein sebesar 0,094 mg ml",['SH'],E-JURNAL REKAYASA DAN TEKNOLOGI BUDIDAYA PERAIRAN,"Jurusan Budidaya Perairan, Fakultas Pertanian Universitas Lampung",2016-10,,,id,produksi dan uji aktivitas amilase burkholderia cepacia hadap substrat yang beda pati atau amilum rupa bahan utama yang hasil oleh tumbuh untuk simpan lebih glukosa bagai produk fotosintesis burkholderia cepacia rupa bakteri yang mampu hidrolisis pati karena bakteri sebut milik enzim amilase teliti ini tuju untuk tahu pengaruh beri substrat yang beda hadap tumbuh indeks amilolitik dan aktivitas enzim amilase bakteri b cepacia teliti ini guna rancang acak lengkap dengan 3 laku substrat daun singkong daun pepaya dan sente dengan 3 ulang hasil teliti tunjuk bahwa bakteri b cepacia mampu hidup dengan baik pada substrat daun pepaya beri substrat daun sente beri pengaruh hadap indeks amilolitik yang tunjuk dengan ada zona bening besar 9 8 mm aktivitas enzim amilase pada penelitan ini adalah 101 8 unit dan konsentrasi protein besar 0 094 mg ml
12391,12391,['FP3'],produksi dan pengujian aktivitas amilase burkholderia cepacia terhadap substrat yang berbeda,"pati atau amilum merupakan bahan utama yang dihasilkan oleh tumbuhan untuk menyimpan kelebihan glukosa sebagai produk fotosintesis burkholderia cepacia merupakan bakteri yang mampu menghidrolisis pati karena bakteri tersebut memiliki enzim amilase penelitian ini bertujuan untuk mengetahui pengaruh pemberian substrat yang berbeda terhadap pertumbuhan indeks amilolitik dan aktivitas enzim amilase bakteri b cepacia penelitian ini menggunakan rancangan acak lengkap dengan 3 perlakuan substrat daun singkong daun pepaya dan sente dengan 3 ulangan hasil penelitian menunjukkan bahwa bakteri b cepacia mampu hidup dengan baik pada substrat daun pepaya pemberian substrat daun sente memberikan pengaruh terhadap indeks amilolitik yang ditunjukkan dengan adanya zona bening sebesar 9,8 mm aktivitas enzim amilase pada penelitan ini adalah 101,8 unit dan konsentrasi protein sebesar 0,094 mg ml kata kunci burkholderia cepacia pati enzim amilase protein",['SH'],E-JURNAL REKAYASA DAN TEKNOLOGI BUDIDAYA PERAIRAN,"Jurusan Budidaya Perairan, Fakultas Pertanian Universitas Lampung",2016,,,id,produksi dan uji aktivitas amilase burkholderia cepacia hadap substrat yang beda pati atau amilum rupa bahan utama yang hasil oleh tumbuh untuk simpan lebih glukosa bagai produk fotosintesis burkholderia cepacia rupa bakteri yang mampu hidrolisis pati karena bakteri sebut milik enzim amilase teliti ini tuju untuk tahu pengaruh beri substrat yang beda hadap tumbuh indeks amilolitik dan aktivitas enzim amilase bakteri b cepacia teliti ini guna rancang acak lengkap dengan 3 laku substrat daun singkong daun pepaya dan sente dengan 3 ulang hasil teliti tunjuk bahwa bakteri b cepacia mampu hidup dengan baik pada substrat daun pepaya beri substrat daun sente beri pengaruh hadap indeks amilolitik yang tunjuk dengan ada zona bening besar 9 8 mm aktivitas enzim amilase pada penelitan ini adalah 101 8 unit dan konsentrasi protein besar 0 094 mg ml kata kunci burkholderia cepacia pati enzim amilase protein
