,Unnamed: 0,divisions,title,abstract,subjects,publication,publisher,date,keywords,keyword,lang,text_stemmed
10500,10500,['FP17'],performa kambing saburai yang dipelihara peternak di desa campang kecamatan gisting tanggamus,"tujuan dilakukan penelitian ini adalah mengetahui kondisi kinerja kambing saburai yang dipelihara oleh peternak sebagai landasan pembentukan vbc penelitian dilakukan di kelompok peternak kambing saburai berlokasi di desa campang kecamatan gisting kabupaten tanggamus lampung materi penelitian ini melibatkan ternak kambing saburai pada berbagai tingkatan umur baik induk cempe pejantan maupun kambing muda yang dipelihara oleh peternak juga peternak pemelihara sebagai responden untuk mengetahui manajemen pemeliharaan ternak selain pengamatan langsung di lapangan juga dilakukan wawancara dengan peternak dengan bantuan kuesioner hasil penelitian di dapat ratarata kinerja reproduksi yang meliputi litter size 1,53 0,60 ekor umur sapih 99,9 0,78 hari post partum estrus 53 20,13 hari siklus estrus 25,15 2,06 hari post partum mating 82,8 0,94 hari lama kebuntingan 158,22 3,34 hari dan jarak beranak 249 1,04 hari sedangkan kinerja produksi yang meliputi bobot lahir ratarata 3,05 0,23 kg bobot sapih 16,76 1,64 kg dan bobot satu tahun 43,67 5,51 kg berdasarkan kondisi tersebut secara umum peternak kambing saburai telah menerapkan manajemen pemeliharaan secara intensif sehingga ternak dapat berproduksi dengan baik dan memiliki kinerja reproduksi dan produksi yang lebih baik jika dibandingkan dengan jenis kambing lainnya",['SF'],,,2017-08,,,id,performa kambing saburai yang pelihara ternak di desa campang camat gisting tanggamus tuju laku teliti ini adalah tahu kondisi kerja kambing saburai yang pelihara oleh ternak bagai landas bentuk vbc teliti laku di kelompok ternak kambing saburai lokasi di desa campang camat gisting kabupaten tanggamus lampung materi teliti ini libat ternak kambing saburai pada bagai tingkat umur baik induk cempe jantan maupun kambing muda yang pelihara oleh ternak juga ternak pelihara bagai responden untuk tahu manajemen pelihara ternak selain amat langsung di lapang juga laku wawancara dengan ternak dengan bantu kuesioner hasil teliti di dapat ratarata kerja reproduksi yang liput litter size 1 53 0 60 ekor umur sapih 99 9 0 78 hari post partum estrus 53 20 13 hari siklus estrus 25 15 2 06 hari post partum mating 82 8 0 94 hari lama bunting 158 22 3 34 hari dan jarak anak 249 1 04 hari sedang kerja produksi yang liput bobot lahir ratarata 3 05 0 23 kg bobot sapih 16 76 1 64 kg dan bobot satu tahun 43 67 5 51 kg dasar kondisi sebut cara umum ternak kambing saburai telah terap manajemen pelihara cara intensif sehingga ternak dapat produksi dengan baik dan milik kerja reproduksi dan produksi yang lebih baik jika banding dengan jenis kambing lain
10501,10501,['FP17'],performa kambing saburai yang dipelihara peternak di desa campang kecamatan gisting tanggamus,"tujuan dilakukan penelitian ini adalah mengetahui kondisi kinerja kambing saburai yang dipelihara oleh peternak sebagai landasan pembentukan vbc penelitian dilakukan di kelompok peternak kambing saburai berlokasi di desa campang kecamatan gisting kabupaten tanggamus lampung materi penelitian ini melibatkan ternak kambing saburai pada berbagai tingkatan umur baik induk cempe pejantan maupun kambing muda yang dipelihara oleh peternak juga peternak pemelihara sebagai responden untuk mengetahui manajemen pemeliharaan ternak selain pengamatan langsung di lapangan juga dilakukan wawancara dengan peternak dengan bantuan kuesioner hasil penelitian di dapat ratarata kinerja reproduksi yang meliputi litter size 1,53 0,60 ekor umur sapih 99,9 0,78 hari post partum estrus 53 20,13 hari siklus estrus 25,15 2,06 hari post partum mating 82,8 0,94 hari lama kebuntingan 158,22 3,34 hari dan jarak beranak 249 1,04 hari sedangkan kinerja produksi yang meliputi bobot lahir ratarata 3,05 0,23 kg bobot sapih 16,76 1,64 kg dan bobot satu tahun 43,67 5,51 kg berdasarkan kondisi tersebut secara umum peternak kambing saburai telah menerapkan manajemen pemeliharaan secara intensif sehingga ternak dapat berproduksi dengan baik dan memiliki kinerja reproduksi dan produksi yang lebih baik jika dibandingkan dengan jenis kambing lainnya",['SF'],,,2017,,,id,performa kambing saburai yang pelihara ternak di desa campang camat gisting tanggamus tuju laku teliti ini adalah tahu kondisi kerja kambing saburai yang pelihara oleh ternak bagai landas bentuk vbc teliti laku di kelompok ternak kambing saburai lokasi di desa campang camat gisting kabupaten tanggamus lampung materi teliti ini libat ternak kambing saburai pada bagai tingkat umur baik induk cempe jantan maupun kambing muda yang pelihara oleh ternak juga ternak pelihara bagai responden untuk tahu manajemen pelihara ternak selain amat langsung di lapang juga laku wawancara dengan ternak dengan bantu kuesioner hasil teliti di dapat ratarata kerja reproduksi yang liput litter size 1 53 0 60 ekor umur sapih 99 9 0 78 hari post partum estrus 53 20 13 hari siklus estrus 25 15 2 06 hari post partum mating 82 8 0 94 hari lama bunting 158 22 3 34 hari dan jarak anak 249 1 04 hari sedang kerja produksi yang liput bobot lahir ratarata 3 05 0 23 kg bobot sapih 16 76 1 64 kg dan bobot satu tahun 43 67 5 51 kg dasar kondisi sebut cara umum ternak kambing saburai telah terap manajemen pelihara cara intensif sehingga ternak dapat produksi dengan baik dan milik kerja reproduksi dan produksi yang lebih baik jika banding dengan jenis kambing lain
10502,10502,,peer review bunga rampai pemikiran angota dewan riset dewan riset daerah drd provinsi lampung,,['AC'],,AURA Publishing,2017,,,?,peer review bunga rampai pikir angota dewan riset dewan riset daerah drd provinsi lampung
10503,10503,['FMIPA3'],peer review bunga rampai pemikiran angota dewan riset dewan riset daerah drd provinsi lampung,,['AC'],,AURA Publishing,2017,,,?,peer review bunga rampai pikir angota dewan riset dewan riset daerah drd provinsi lampung
10504,10504,['FMIPA3'],bunga rampai pemikiran angota dewan riset dewan riset daerah drd provinsi lampung,,['AC'],,AURA Publishing,2017-10,,,?,bunga rampai pikir angota dewan riset dewan riset daerah drd provinsi lampung
10505,10505,['FMIPA3'],peer review bunga rampai pemikiran angota dewan riset dewan riset daerah drd provinsi lampung,,['AC'],,AURA Publishing,2017,,,?,peer review bunga rampai pikir angota dewan riset dewan riset daerah drd provinsi lampung
10506,10506,['FP24'],engaruh ekstrak gulma siam kemuning dan saliara terhadap penghambatan pertumbuhan bakteri layu pisang secara in vitro,lembar hasil penilaian sejawat peer review,['S1'],,Jurnal Agrotek Tropika,2017,,,id,engaruh ekstrak gulma siam kemuning dan saliara hadap hambat tumbuh bakteri layu pisang cara in vitro lembar hasil nilai jawat peer review
10507,10507,['FP24'],first report of dickeya zeae associated with pineapple soft rot and fruit collapse in indonesia,disease note draft,['S1'],,,2017,,,af,first report of dickeya zeae associated with pineapple soft rot and fruit collapse in indonesia disease note draft
10508,10508,['FKIP4'],the application of discovery learning using interactive multimedia to enhance students metacognition on the content area of biological inheritance,,"['L1', 'LB1501', 'LC5201']",,University of Medan,2017-11-13,,,?,the application of discovery learning using interactive multimedia to enhance students metacognition on the content area of biological inheritance
10509,10509,['FP18'],production of biogas from a mixture of cowdung and elephant grass pennisetum purpureum,"penelitian ini bertujuan untuk mengetahui produksi biogas dari bahan campuran rumput gajah dan kotoran sapi rumput gajah berumur 2 bulan yang diperoleh dari petani di gedong tataan pesawaran dicacah dengan panjang maksimum 5 cm kotoran sapi segar diambil dari laboratorium di jurusan peternakan universitas lampung rumput gajah 25 kg diaduk rata dengan kotoran sapi 25 kg campuran ini lalu diencerkan dengan air pada tiga level pengenceran yaitu 50 ℓ p1 75 ℓ p2 dan 100 ℓ p3 campuran dimasukkan ke dalam digester batch dari drum plastik dengan volume 220 liter dan ditutup rapat untuk kontrol hanya digunakan 25 kg kotoran sapi yang diencerkan dengan 25 l air semua perlakukan dilakukan dengan dua ulangan parameter yang diamati pada penelitian ini meliputi temperatur harian ph awal dan akhir substrat kandungan ts dan vs volume biogas produktivitas biogas dan komposisi biogas hasil penelitian menunjukan bahwa nilai ph awal semua perlakuan berada pada kisaran normal yaitu 7,73 8,08 8,00 7,20 berturutturut untuk p1 p2 p3 dan kontrol sedangkan ph akhir berturutturut adalah 4,50 4,62 6,82 7,30 suhu harian ratarata hampir sama untuk semua perlakuan yaitu 33,1 c 29,6 c 31,2 c dan 30,2 c total dari produksi biogas adalah 439,42 ℓ 353,02 ℓ 524.32 ℓ dan 519,27 ℓ berturutturut untuk p1 p2 p3 dan kontrol dengan produktivitas biogas secara berurutan adalah 42.20 ℓ kgts 33.91 ℓ kgts 50.38 ℓ kgts 72.42 ℓ kgts dan produktivitas metana 6,85ℓ kgvs 13,38ℓ kgvs 69,62ℓ kgvs dan 102,86ℓ kgvs kata kunci biogas kotoran sapi rumput gajah batch produktivitas",['S1'],Jurnal Teknik Pertanian Lampung,Jurusan Teknik Pertanian Fakultas Pertanian Unila,2017-06-16,,,id,production of biogas from a mixture of cowdung and elephant grass pennisetum purpureum teliti ini tuju untuk tahu produksi biogas dari bahan campur rumput gajah dan kotor sapi rumput gajah umur 2 bulan yang oleh dari tani di gedong tata sawar cacah dengan panjang maksimum 5 cm kotor sapi segar ambil dari laboratorium di jurus terna universitas lampung rumput gajah 25 kg aduk rata dengan kotor sapi 25 kg campur ini lalu encer dengan air pada tiga level encer yaitu 50 p1 75 p2 dan 100 p3 campur masuk ke dalam digester batch dari drum plastik dengan volume 220 liter dan tutup rapat untuk kontrol hanya guna 25 kg kotor sapi yang encer dengan 25 l air semua laku laku dengan dua ulang parameter yang amat pada teliti ini liput temperatur hari ph awal dan akhir substrat kandung ts dan vs volume biogas produktivitas biogas dan komposisi biogas hasil teliti tunjuk bahwa nilai ph awal semua laku ada pada kisar normal yaitu 7 73 8 08 8 00 7 20 berturutturut untuk p1 p2 p3 dan kontrol sedang ph akhir berturutturut adalah 4 50 4 62 6 82 7 30 suhu hari ratarata hampir sama untuk semua laku yaitu 33 1 c 29 6 c 31 2 c dan 30 2 c total dari produksi biogas adalah 439 42 353 02 524 32 dan 519 27 berturutturut untuk p1 p2 p3 dan kontrol dengan produktivitas biogas cara rurut adalah 42 20 kgts 33 91 kgts 50 38 kgts 72 42 kgts dan produktivitas metana 6 85 kgvs 13 38 kgvs 69 62 kgvs dan 102 86 kgvs kata kunci biogas kotor sapi rumput gajah batch produktivitas
10510,10510,['FMIPA4'],peningkatan kreativitas masyarakat margosari melalui pelatihan pembuatan produk kebersihan rumah tangga di desa margosari pagelaran utara kabupaten pringsewu,sebagai desa yang berkembang pemerintah desa margosari terus berusaha meningkatkan kreatifitas masyarakatnya salah satu caranya melalui pelatihan pembuatan sabun cair sabun merupakan kebutuhan primer manusia sebagaimana fungsi utamanya sebagai pembersih kotoran dan lemak sabun cair utamanya merupakan produk yang strategis karena saat ini masyarakat modern lebih suka produk yang praktis dan ekonomis mengingat perannya yang strategis jika dijadikan suatu produk industri rumah tangga tentunya dapat meningkatkan pendapatan masyarakat untuk meracik sendiri sabun cair bukan merupakan hal yang mudah khususnya merancang sabun cair yang sesuai dengan harapanharapan konsumen oleh karena itu tim pkm unila melakukan kegiatan pelatihan pembuatan sabun cair di desa margosari pagelaran utara kabupaten pringsewu masyarakat margosari terlihat antusias dalam mengikuti kegiatan ini terlihat dari peningkatan tik kegiatan sebesar 51%,['QD'],,Jurusan Kimia FMIPA Unila,2017-11-15,,,id,tingkat kreativitas masyarakat margosari lalu latih buat produk bersih rumah tangga di desa margosari pagelaran utara kabupaten pringsewu bagai desa yang kembang perintah desa margosari terus usaha tingkat kreatifitas masyarakat salah satu cara lalu latih buat sabun cair sabun rupa butuh primer manusia bagaimana fungsi utama bagai bersih kotor dan lemak sabun cair utama rupa produk yang strategis karena saat ini masyarakat modern lebih suka produk yang praktis dan ekonomis ingat peran yang strategis jika jadi suatu produk industri rumah tangga tentu dapat tingkat dapat masyarakat untuk racik sendiri sabun cair bukan rupa hal yang mudah khusus rancang sabun cair yang sesuai dengan harapanharapan konsumen oleh karena itu tim pkm unila laku giat latih buat sabun cair di desa margosari pagelaran utara kabupaten pringsewu masyarakat margosari lihat antusias dalam ikut giat ini lihat dari tingkat tik giat besar 51
10511,10511,['FT6'],sertifikat mereview artikel jurnal internasioanl reputasi chemical engineering journal,,['TP'],,Elsevier,2017-05,,,?,sertifikat mereview artikel jurnal internasioanl reputasi chemical engineering journal
10512,10512,['FT6'],similarity check turnitin factors screening to statistical experimental design of racemic atenolol kinetic resolution via transesterification reaction in organic solvent using free pseudomonas fluorescens lipase,,['TP'],,John Wiley and Sons,2017-07,,,?,similarity check turnitin factors screening to statistical experimental design of racemic atenolol kinetic resolution via transesterification reaction in organic solvent using free pseudomonas fluorescens lipase
10513,10513,['FT6'],similarity check turnitin fast liquid chromatography for racemic atenolol acetate separation the analytical protocol,,['TP'],,John Wiley and Sons,2017-12,,,?,similarity check turnitin fast liquid chromatography for racemic atenolol acetate separation the analytical protocol
10514,10514,['FT6'],similarity check turnitin inkoporasi oksida timah sno2 ke dalam silika berpori dari kaolin alam lampung dan kajian aplikasinya sebagai fotokatalis untuk fotodegradasi rhodamin b,,['TP'],,FAKULTAS TEKNIK DAN ILMU KOMPUTER UNIVERSITAS KOMPUTER INDONESIA,2017-11,,,?,similarity check turnitin inkoporasi oksida timah sno2 ke dalam silika pori dari kaolin alam lampung dan kaji aplikasi bagai fotokatalis untuk fotodegradasi rhodamin b
10515,10515,['FT6'],similarity check turnitin silika berpori dari kaolin alam lampung dan kajian aplikasinya terhadap adsorpsi rhodamin b,,['TP'],,FAKULTAS TEKNIK DAN ILMU KOMPUTER UNIVERSITAS KOMPUTER INDONESIA,2017-11,,,?,similarity check turnitin silika pori dari kaolin alam lampung dan kaji aplikasi hadap adsorpsi rhodamin b
10516,10516,['FP25'],pengaruh pemberian silika dan mangan terhadap mutu fisiologis benih padi oryza sativa l yang dihasilkan,penelitian ini bertujuan untuk mengetahui tanggapan tanaman padi pada mutufisiologis benih terhadap pemberian silika dan mangan percobaan ini dilaksanakan di rumah kaca fakultas pertanian universitas lampung dari bulan juni 2013 sampai dengan september 2013 percobaan dilakukan dalam rancangan acak kelompok teracak sempurna diulang tiga kali rancangan perlakukan disusun secara faktorial 5x2 faktor pertama adalah pemberian silika si yang terdiri dari 5 taraf konsentrasi yaitu 0 5 100 150 200 ppm faktor kedua adalah pemberian mangan mn dengan konsentrasi 0 ppm mn0 dan 5 ppm mn1 berdasarkan hasil penelitian disimpulkan bahwa peningkatan konsentrasi si sampai 200 ppm yang disertai dengan pemberian mnsebesar 5 ppm mampu meningkatkan mutu fisiologis tanaman pada variable daya berkecambah keserempakan tumbuh dan bobot kering kecambah normal,['SB'],Jurnal Agrovigor,Jurusan Agroteknologi Universitas Trunojoyo,2017-03,,,id,pengaruh beri silika dan mangan hadap mutu fisiologis benih padi oryza sativa l yang hasil teliti ini tuju untuk tahu tanggap tanam padi pada mutufisiologis benih hadap beri silika dan mangan coba ini laksana di rumah kaca fakultas tani universitas lampung dari bulan juni 2013 sampai dengan september 2013 coba laku dalam rancang acak kelompok teracak sempurna ulang tiga kali rancang laku susun cara faktorial 5x2 faktor pertama adalah beri silika si yang diri dari 5 taraf konsentrasi yaitu 0 5 100 150 200 ppm faktor dua adalah beri mangan mn dengan konsentrasi 0 ppm mn0 dan 5 ppm mn1 dasar hasil teliti simpul bahwa tingkat konsentrasi si sampai 200 ppm yang serta dengan beri mnsebesar 5 ppm mampu tingkat mutu fisiologis tanam pada variable daya kecambah rempa tumbuh dan bobot kering kecambah normal
10517,10517,['FP18'],6 sistem hidroponik organik dengan memanfaatkan limbah effluent biogas industri tapioka dan limbah kolam lele,"industri tapioka dan kolam lele termasuk di kalangan industri pertanian yang membuang limbah cair yang belum dimanfaatkan limbah cair ini sangat potensial dimanfaatkan sebagai sumber nutrisi untuk sistem hidroponik karena limbahnya mengandung bahan organik penelitian ini bertujuan untuk mengeksplorasi penggunaan limbah cair untuk menanam sayuran organik dalam sistem hidroponik bahan utama yang digunakan dalam penelitian ini adalah limbah cair tapioka dari pabrik tapioka di pesawaran l imbah cair budidaya ikan dari laboratorium lapangan terpadu fakultas pertanian universitas lampung bahan lainnya termasuk benih sayuran dan bahan kimia yang digunakan untuk analisis laboratorium larutan standar amoniak 1000 ppm naoh ki dan hgi2 limbah kolam lele dan l imbah tapioka diapl ikasikan pada sistem hidroponik dft parameter yang diamati dalam penel itian ini meliputi ph ec ts tss tfs nammonium bod dan pertumbuhan tanaman hasil penelitian menunjukkan bahwa limbah tapioka masingmasing memiliki ph dan ec yang paling tinggi 9,7 dan 2038 ìs cm limbah tapioka memiliki ts dan tfs yang tinggi 1672 mg l dan 1496 mg l dan limbah budidaya ikan lele memiliki nilai tss dan nammonium paling tinggi 372 mg l dan 10,79 mg l pertumbuhan tanaman terbaik ditemukan pada penerapan limbah kolam lele pada sistem limbah kolam lele tinggi tanaman mencapai 12,92 cm tanaman dan biomassa tanaman yang dipanen adalah 10,46 gram tanaman namun dalam sistem tersebut sayuran menunjukkan pertumbuhan suboptimal hal ini menunjukkan bahwa mereka menderita kekurangan gizi dengan demikian sistem tidak menyuplai cukup nutrisi yang dibutuhkan oleh tanaman kata kunci ammonium limbah cair nutrisi sayuran 5",['S1'],Jurnal Teknik Pertanian Lampung,Jurusan Teknik Pertanian Fakultas Pertanian Unila,2017-12-26,,,id,6 sistem hidroponik organik dengan manfaat limbah effluent biogas industri tapioka dan limbah kolam lele industri tapioka dan kolam lele masuk di kalang industri tani yang buang limbah cair yang belum manfaat limbah cair ini sangat potensial manfaat bagai sumber nutrisi untuk sistem hidroponik karena limbah kandung bahan organik teliti ini tuju untuk eksplorasi guna limbah cair untuk tanam sayur organik dalam sistem hidroponik bahan utama yang guna dalam teliti ini adalah limbah cair tapioka dari pabrik tapioka di sawar l imbah cair budidaya ikan dari laboratorium lapang padu fakultas tani universitas lampung bahan lain masuk benih sayur dan bahan kimia yang guna untuk analisis laboratorium larut standar amoniak 1000 ppm naoh ki dan hgi2 limbah kolam lele dan l imbah tapioka diapl ikasikan pada sistem hidroponik dft parameter yang amat dalam tel itian ini liput ph ec ts tss tfs nammonium bod dan tumbuh tanam hasil teliti tunjuk bahwa limbah tapioka masingmasing milik ph dan ec yang paling tinggi 9 7 dan 2038 s cm limbah tapioka milik ts dan tfs yang tinggi 1672 mg l dan 1496 mg l dan limbah budidaya ikan lele milik nilai tss dan nammonium paling tinggi 372 mg l dan 10 79 mg l tumbuh tanam baik temu pada terap limbah kolam lele pada sistem limbah kolam lele tinggi tanam capai 12 92 cm tanam dan biomassa tanam yang panen adalah 10 46 gram tanam namun dalam sistem sebut sayur tunjuk tumbuh suboptimal hal ini tunjuk bahwa mereka derita kurang gizi dengan demikian sistem tidak suplai cukup nutrisi yang butuh oleh tanam kata kunci ammonium limbah cair nutrisi sayur 5
10518,10518,['FEB6'],commentary on recent developments in lampung 2015-2017,,['AC'],,World Scientific Publishing,2017,,,?,commentary on recent developments in lampung 2015-2017
10519,10519,,pengaruh ukuran pemerintah daerah intergovernmental revenue dan hasil audit bpk terhadap kinerja keuangan pemerintah daerah,,"['H1', 'HG']",Jurnal Akuntansi dan Keuangan,Fakultas Ekonomi Universitas Lampung,2017-01,,,?,pengaruh ukur perintah daerah intergovernmental revenue dan hasil audit bpk hadap kerja uang perintah daerah
10520,10520,['FK1'],pengaruh microwave diathermy dan latihan rentang gerak sendi pada osteoarthritis lutut di bandar lampung,"osteoarthritis lutut merupakan suatu penyakit degeneratif yang disebabkan oleh banyak faktor osteoarthritis mengakibatkan penurunan rentang gerak sendi selain adanya nyeri dan kekakuan yang mempengaruhi aktivitas keseharian penderitanya perawatan konservatif terdiri dari pengobatan dan fisioterapi seperti terapi microwave diathermy dan latihan rentang gerak sendi penelitian ini bertujuan untuk mengetahui pengaruh fisioterapi pada peningkatan rentang gerak sendi penelitian ini dilakukan selama satu bulan di rumah sakit abdul moeloek dan rumah sakit ahmad dadi tjokrodipo di bandar lampung penelitian ini menggunakan pendekatan kohort dengan 24 responden dan didominasi oleh wanita berusia ratarata 62 tahun nilai p untuk fisioterapi adalah 0,05 bagi masingmasing kemampuan fleksi dan ekstensi lutut responden kesimpulan microwave diathermy dan latihan rentang gerak sendi secara efektif mempengaruhi rentang gerak sendi",['RE'],AGROMEDICINE UNILA,Fakultas Kedokteran Universitas Lampung press,2017-12,,,id,pengaruh microwave diathermy dan latih rentang gerak sendi pada osteoarthritis lutut di bandar lampung osteoarthritis lutut rupa suatu sakit degeneratif yang sebab oleh banyak faktor osteoarthritis akibat turun rentang gerak sendi selain ada nyeri dan kaku yang pengaruh aktivitas hari derita awat konservatif diri dari obat dan fisioterapi seperti terapi microwave diathermy dan latih rentang gerak sendi teliti ini tuju untuk tahu pengaruh fisioterapi pada tingkat rentang gerak sendi teliti ini laku lama satu bulan di rumah sakit abdul moeloek dan rumah sakit ahmad dadi tjokrodipo di bandar lampung teliti ini guna dekat kohort dengan 24 responden dan dominasi oleh wanita usia ratarata 62 tahun nilai p untuk fisioterapi adalah 0 05 bagi masingmasing mampu fleksi dan ekstensi lutut responden simpul microwave diathermy dan latih rentang gerak sendi cara efektif pengaruh rentang gerak sendi
10521,10521,['FH3'],cost and benefit dalam penegakan hukum,-,['K1'],Cost and Benefit Ratio Dalam Penegakan Hukum,Jejamo.com,2017-03-26,,,?,cost and benefit dalam tega hukum -
10522,10522,['FH3'],penzaliman hukum,-,['K1'],Penzaliman Hukum,Jejamo.com,2017-05-25,,,?,zalim hukum -
10523,10523,,problematika kejahatan oleh anak,-,['K1'],Problematika Kejahatan Oleh Anak,Jejamo.com,2017-03-19,,,?,problematika jahat oleh anak -
10524,10524,['FT1'],pemetaan dan perhitungan cadangan batu andesit di bakauheni lampung selatan untuk pembangunan insfrastruktur di wilayah bakauheni dan sekitarnya,"abstrak sumberdaya batuan merupakan modal dasar untuk pengembangan infrastruktur wilayah salah satunya adalah batuan andesit untuk mengetahui potensi dan cadangan pada tambang batu andesit telah dilakukan pengamatan atau pemetaan geologi baik dari posisi sebaran dan perhitungan cadangan batu andesit di wilayah bakauheni telah dilakukan pemetaan geologi pengambilan sampel dan perhitungan cadangan di bakauheni lampung selatan dan sekitarnya perhitungan cadangan menggunakan metode kerucut terpancung perhitungan didapatkan luasan dan volumetrik batuan andesit sebesar 129,253,297m3 di 5 lokasi disekitar bakauheni dari uji sifat fisika menunjukan densitas batuan andesit antara 2,59-2,86 gram cm3 dan kuat tekan ultimate 1.200 kg cm2 yang dapat dikatagorikan bahan pondasi bangunan sedang cadangan dan kualitas batu andesit tersebut diharapkan dapat memenuhi kebutuhan pembangunan infrastruktur di wilayah pengembangan strategis bakauheni dan sekitarnya",['QE'],Seminar Nasional AVoER IX 2017,Fakultas Teknik Universitas Sriwijaya,2017-11-29,,,id,meta dan hitung cadang batu andesit di bakauheni lampung selatan untuk bangun insfrastruktur di wilayah bakauheni dan sekitar abstrak sumberdaya batu rupa modal dasar untuk kembang infrastruktur wilayah salah satu adalah batu andesit untuk tahu potensi dan cadang pada tambang batu andesit telah laku amat atau meta geologi baik dari posisi sebar dan hitung cadang batu andesit di wilayah bakauheni telah laku meta geologi ambil sampel dan hitung cadang di bakauheni lampung selatan dan sekitar hitung cadang guna metode kerucut pancung hitung dapat luas dan volumetrik batu andesit besar 129 253 297m3 di 5 lokasi sekitar bakauheni dari uji sifat fisika tunjuk densitas batu andesit antara 2 59-2 86 gram cm3 dan kuat tekan ultimate 1 200 kg cm2 yang dapat dikatagorikan bahan pondasi bangun sedang cadang dan kualitas batu andesit sebut harap dapat penuh butuh bangun infrastruktur di wilayah kembang strategis bakauheni dan sekitar
