,Unnamed: 0,divisions,title,abstract,subjects,publication,publisher,date,keywords,keyword,lang,text_stemmed
10864,10864,['FT7'],aplikasi box behnken design untuk optimasi parameter prosespemesinan bubut magnesium az31,"paduan logam magnesium az31 adalah salah satu jenis logam paduan yang penggunaanya semakin berkembang pekembangan penggunaan logam paduan magnesium az31 digunakan pada alatalat listrik alat olah raga biomedik dan industri otomotif salah satu proses pemesinan pada magnesium az31 adalah proses pembubutan penelitian ini ditujukan untuk mengoptimasi kecepatan benda kerja kecepatan putar pahat pemakanan dan kedalaman potong terhadap nilai kekasaran permukaan selain itu juga untuk mendapatkan model matematik nilai kekasaran permukaan yang optimal pada pemesinan bubut material magnesium az31 menggunakan pahat putar dan udara dingin bertekanan secara bersamaan penelitian ini menggunakan responce surface methode yaitu boxbehnken design dengan tiga faktor dan tiga level berdasarkan rancangan boxbehnken design data penelitian ini dilakukan 15 kali percobaan hasil analisa menunjukan bahwa nilai optimum kekasaran permukaan pada proses pembubutan paduan magnesium az31 menggunakan responce surface methode boxbehnken design adalah pada variabel kecepatan mesin 80 m min kecepatan potong 0.2 mm rev dan kecepatan modulur pahat putar adalah 25 m min dengan nilai ra yang didapat sebesar 0.55 μm sedangkan untuk pemodelan matematik yang diperoleh adalah ra 2,12-0,0242 vs -3,9 f 0,0108 vc 0,000105 vs vs -26,8 f f -0,000271 vc vc 0,0621 vs f -0,000027 vs vc 0,1027 f vc",['TJ'],,,2017-10,,,id,aplikasi box behnken design untuk optimasi parameter prosespemesinan bubut magnesium az31 padu logam magnesium az31 adalah salah satu jenis logam padu yang penggunaanya makin kembang kembang guna logam padu magnesium az31 guna pada alatalat listrik alat olah raga biomedik dan industri otomotif salah satu proses mesin pada magnesium az31 adalah proses bubut teliti ini tuju untuk mengoptimasi cepat benda kerja cepat putar pahat makan dan dalam potong hadap nilai kasar muka selain itu juga untuk dapat model matematik nilai kasar muka yang optimal pada mesin bubut material magnesium az31 guna pahat putar dan udara dingin tekan cara sama teliti ini guna responce surface methode yaitu boxbehnken design dengan tiga faktor dan tiga level dasar rancang boxbehnken design data teliti ini laku 15 kali coba hasil analisa tunjuk bahwa nilai optimum kasar muka pada proses bubut padu magnesium az31 guna responce surface methode boxbehnken design adalah pada variabel cepat mesin 80 m min cepat potong 0 2 mm rev dan cepat modulur pahat putar adalah 25 m min dengan nilai ra yang dapat besar 0 55 m sedang untuk model matematik yang oleh adalah ra 2 12-0 0242 vs -3 9 f 0 0108 vc 0 000105 vs vs -26 8 f f -0 000271 vc vc 0 0621 vs f -0 000027 vs vc 0 1027 f vc
10865,10865,['FH3'],legal framework kebutuhan perda pengelolaan irigasi di kabupaten tanggamus provinsi lampung,pengelolaan irigasi di kabupaten tanggamus belum dilandaskan pada peraturan daerah dan belum dilakukan dengan baik hal ini terlihat dari coverage jaringan irigasi yang hanya dapat mengaliri 5.000 ha sawah sehingga setiap tahunnya mengakibatkan trend penurunan produksi pertanian penelitian yang bertujuan untuk memetakan legal framework kebutuhan pengelolaan irigasi di kabupaten tanggamus provinsi lampung ini dilakukan dalam koridor doctrinal research serta menggunakan statute dan conceptual approach adapun temuan penelitian ini adalah legal framework kebutuhan perda pengelolaan irigasi di kabupaten tanggamus provinsi lampung diatur dalam 12 peraturan perundangundangan terkait pengelolaan irigasi yang isinya memaparkan aspek kewenangan dan aspek substantif pengelolaan irigasi yang dapat dijadikan dasar dalam pembentukan perda tentang pengelolaan irigasi di kabupaten tanggamus legal framework tersebut selain dalam bentuk rezim hukum yang sifatnya sektoral berkaitan juga dengan rezim hukum pemerintahan daerah,['K1'],Kanun Jurnal Ilmu Hukum,FH Universitas Syiahkuala,2017-04-08,,,id,legal framework butuh perda kelola irigasi di kabupaten tanggamus provinsi lampung kelola irigasi di kabupaten tanggamus belum landas pada atur daerah dan belum laku dengan baik hal ini lihat dari coverage jaring irigasi yang hanya dapat alir 5 000 ha sawah sehingga tiap tahun akibat trend turun produksi tani teliti yang tuju untuk meta legal framework butuh kelola irigasi di kabupaten tanggamus provinsi lampung ini laku dalam koridor doctrinal research serta guna statute dan conceptual approach adapun temu teliti ini adalah legal framework butuh perda kelola irigasi di kabupaten tanggamus provinsi lampung atur dalam 12 atur perundangundangan kait kelola irigasi yang isi papar aspek wenang dan aspek substantif kelola irigasi yang dapat jadi dasar dalam bentuk perda tentang kelola irigasi di kabupaten tanggamus legal framework sebut selain dalam bentuk rezim hukum yang sifat sektoral kait juga dengan rezim hukum perintah daerah
10866,10866,['FP2'],sistem budidaya cassava aman lingkungan dan berkelanjutan,puji syukur ke hadirat allah swt atas terselesainya buku pedoman yang akan digunakan untuk referensi peningkatan dan perbaikan produksi cassava di lampung buku pedoman cassava ini terdiri atas empat bagian utama yaitu bidang agronomi system pemupukan pengendalian hama dan penyakit cassava manfaat dan pascapanen cassava bidang agronomi mendiskusikan tentang system penyediaan bibit karakter berbagai varietas cassava dan system budidaya untuk produksi tinggi yang efektif dan berkelanjutan selanjutnya cara pemberian pupuk yang baik dan benar untuk produksi tinggi dimasukkan ke dalam system pemupukan bersama dengan pemberian bahan organik untuk memperbaiki sifat tanah cara pengendalian organisme pengganggu tanaman terpadu dibahas di dalam bagian pengendalian berbagai hama dan penyakit cassava terakhir adalah manfaat dan pascapanen cassava yang membahas tentang kegunaan cassava untuk kehidupan seharihari serta cara penyimpanan dan pengawetan tepung maupun prosesing penyajian makalah dari berbagai bidang bermaksud agar informasi yang didiskusikan di dalam makalah mampu memperbaiki produksi cassava dan bahkan bias dipahami oleh ibuibu petani ibuibu petani merupakan bagian dari faktor produksi dalam usahatani cassava latar belakang pendidikan para ibu petani ini berkisar antara lulusan sd hingga sma mudahnya para ibu petani memaham iinformasi tentang perbaikan produksi cassava yang berkerlanjutan dan ramah lingkungan ini diharapkan bisa berpartisipasi aktif dalam peningkatan produksi cassava tim editor memahami akan kekurangan informasi yang ada di makalah karena itu saran atau masukan yang bermanfaat akan sangat membantu dalam perbaikan di masa mendatang selanjutnya melalui tim editor kami mohon ijin kepada penulis author jurnal maupun tulisan yang digunakan sebagai referensi atas kerjasama budi baik dan dukungan positif para penulis jurnal atau majalah diucapkan terimakasih semoga kumpulan makalah yang sederhana untuk para ibu petani ini bisa digunakan sebagai acuan atau pedoman dalam pengembangan bahan bacaan untuk perbaikan produksi cassava baik kualitas maupun kuantitas,['S1'],,Universitas Lampung,2017-11,,,id,sistem budidaya cassava aman lingkung dan lanjut puji syukur ke hadirat allah swt atas selesa buku pedoman yang akan guna untuk referensi tingkat dan baik produksi cassava di lampung buku pedoman cassava ini diri atas empat bagi utama yaitu bidang agronomi system pupu kendali hama dan sakit cassava manfaat dan pascapanen cassava bidang agronomi diskusi tentang system sedia bibit karakter bagai varietas cassava dan system budidaya untuk produksi tinggi yang efektif dan lanjut lanjut cara beri pupuk yang baik dan benar untuk produksi tinggi masuk ke dalam system pupu sama dengan beri bahan organik untuk baik sifat tanah cara kendali organisme ganggu tanam padu bahas di dalam bagi kendali bagai hama dan sakit cassava akhir adalah manfaat dan pascapanen cassava yang bahas tentang guna cassava untuk hidup seharihari serta cara simpan dan awet tepung maupun prosesing saji makalah dari bagai bidang maksud agar informasi yang diskusi di dalam makalah mampu baik produksi cassava dan bahkan bias paham oleh ibuibu tani ibuibu tani rupa bagi dari faktor produksi dalam usahatani cassava latar belakang didik para ibu tani ini kisar antara lulus sd hingga sma mudah para ibu tani paham iinformasi tentang baik produksi cassava yang berkerlanjutan dan ramah lingkung ini harap bisa partisipasi aktif dalam tingkat produksi cassava tim editor paham akan kurang informasi yang ada di makalah karena itu saran atau masuk yang manfaat akan sangat bantu dalam baik di masa datang lanjut lalu tim editor kami mohon ijin kepada tulis author jurnal maupun tulis yang guna bagai referensi atas kerjasama budi baik dan dukung positif para tulis jurnal atau majalah ucap terimakasih moga kumpul makalah yang sederhana untuk para ibu tani ini bisa guna bagai acu atau pedoman dalam kembang bahan baca untuk baik produksi cassava baik kualitas maupun kuantitas
10867,10867,['FMIPA4'],uji antibakteri senyawa turunan organotimah iv karboksilat terhadap bacillus subtilis dan pseudomonas aeruginosa,senyawa organotimah iv karboksilat dan semua turunannya memiliki aktivitas biologi sangat kuat dan dikenal memiliki aktivitas penghambatan yang tinggi bahkan pada konsentrasi yang sangat rendah sehingga golongan senyawa ini sangat menarik untuk terus dipelajari melanjutkan keberhasilan dalam sintesis dan berbagai uji terhadap senyawa organotimah iv karboksilat pada beberapa penelitian sebelumnya dalam makalah ini kami laporkan uji antibakteri terhadap bacillus subtilis dan pseudomonas aeruginosa pada dua senyawa yaitu trifeniltimah iv benzoat dan difeniltimah iv dibenzoat kedga senyawa hasil sintesis dikarakterisasi dengan beberapa teknik spektroskopi dan juga berdasarkan data mikroanalisis unsur dan data fisika hasil penelitian menunjukkan bahwa kedua senyawa yang diuji memiliki kemampuan menghambat pertumbuhan bakteri dengan difeniltimah iv dibenzoat lebih aktif dibanding trifeniltimah iv benzoat pada konsentrasi 200 ppm hasil ini mengindikasikan bahwa ketiga senyawa memiliki kemampuan yang sangat baik sebagai penghambat pertumbuhan bakteri kata kunci antibakteri nilai penghambatan minimum organotimah iv benzoat,['QD'],,,2017-05-13,,,id,uji antibakteri senyawa turun organotimah iv karboksilat hadap bacillus subtil dan pseudomonas aeruginosa senyawa organotimah iv karboksilat dan semua turun milik aktivitas biologi sangat kuat dan kenal milik aktivitas hambat yang tinggi bahkan pada konsentrasi yang sangat rendah sehingga golong senyawa ini sangat tarik untuk terus ajar lanjut hasil dalam sintesis dan bagai uji hadap senyawa organotimah iv karboksilat pada beberapa teliti belum dalam makalah ini kami lapor uji antibakteri hadap bacillus subtil dan pseudomonas aeruginosa pada dua senyawa yaitu trifeniltimah iv benzoat dan difeniltimah iv benzoat kedga senyawa hasil sintesis karakterisasi dengan beberapa teknik spektroskop dan juga dasar data mikroanalisis unsur dan data fisika hasil teliti tunjuk bahwa dua senyawa yang uji milik mampu hambat tumbuh bakteri dengan difeniltimah iv benzoat lebih aktif banding trifeniltimah iv benzoat pada konsentrasi 200 ppm hasil ini indikasi bahwa tiga senyawa milik mampu yang sangat baik bagai hambat tumbuh bakteri kata kunci antibakteri nilai hambat minimum organotimah iv benzoat
10868,10868,,persepsi mahasiswa tentang peerassissted learning dalam pembelajaran keterampilan laboratorium klinik clinical skills lab csl di fakultas kedokteran universitas lampung,peerassisted learning pal merupakan metode pembelajaran yang berpusat pada mahasiswa yang melibatkan diskusi antara instruktur sebagai pengajar dan peserta sebagai yang diajar dalam pendidikan kedokteran latihan keterampilan klinik disajikan dalam bentuk clinical skill laboratorium yaitu suatu program simulasi dimana mahasiswa pendidikan dokter diberikan materi dan berbagai cara serta tindakan terhadap berbagai kasus medis penelitian ini dilakukan untuk mengetahui persepsi mahasiswa tentang pal pada keterampilan klinik clinical skills lab di fakultas kedokteran universitas lampung penelitian ini merupakan studi kualitatif dengan wawancara mendalam terhadap mahasiswa tahun 3 sebagai instruktur n 4 dan focuss group discussion terhadap 4 kelompok mahasiswa tahun 1 n 24 data yang didapat kemudian di transkrip dan dianalisis hasil penelitian didapatkan bahwa mahasiswa menganggap bahwa kegiatan pal dalam pembelajaran keterampilan klinik merupakan kegiatan yang positif dan bermanfaat serta perlu untuk dilanjutkan kata kunci keterampilan klinik mahasiswa kedokteran peerassisted learning,['R1'],Majority,Juke Unila,2017,,,id,persepsi mahasiswa tentang peerassissted learning dalam ajar terampil laboratorium klinik clinical skills lab csl di fakultas dokter universitas lampung peerassisted learning pal rupa metode ajar yang pusat pada mahasiswa yang libat diskusi antara instruktur bagai ajar dan serta bagai yang ajar dalam didik dokter latih terampil klinik saji dalam bentuk clinical skill laboratorium yaitu suatu program simulasi mana mahasiswa didik dokter beri materi dan bagai cara serta tindak hadap bagai kasus medis teliti ini laku untuk tahu persepsi mahasiswa tentang pal pada terampil klinik clinical skills lab di fakultas dokter universitas lampung teliti ini rupa studi kualitatif dengan wawancara dalam hadap mahasiswa tahun 3 bagai instruktur n 4 dan focuss group discussion hadap 4 kelompok mahasiswa tahun 1 n 24 data yang dapat kemudian di transkrip dan analis hasil teliti dapat bahwa mahasiswa anggap bahwa giat pal dalam ajar terampil klinik rupa giat yang positif dan manfaat serta perlu untuk lanjut kata kunci terampil klinik mahasiswa dokter peerassisted learning
10869,10869,['FK1'],pengendalian vektor virus dengue dengan metode release of insect carrying dominant lethal ridl,demam berdarah dengue dbd adalah penyakit infeksi yang disebabkan oleh virus dengue dengan manifestasi klinis demam nyeri otot dan atau nyeri sendi yang disertai leucopenia ruam limfadenopati trombositopenia dan diathesis hemoragik pada dbd terjadi perembesan plasma yang ditandai dengan hemokonsentrasi peningkatan hematokrit atau penumpukan cairan di rongga tubuh dbd tersebar di wilayah asia tenggara pasifik barat dan karibia indonesia merupakan wilayah endemis dengan sebaran di seluruh tanah air penyakit ini masih merupakan masalah kesehatan masyarakat yang utama di indonesia pada tiga tahun terakhir 2008-2010 jumlah ratarata kasus dilaporkan sebanyak 150.822 kasus dengan ratarata kematian 1.321 kematian situasi kasus dbd tahun 2011 sampai dengan juni 2011 dilaporkan sebanyak 16.612 orang dengan kematian sebanyak 142 orang penularan infeksi virus dengue terjadi melalui vektor nyamuk yaitu aedes aegypti spesies lain seperti aedes albopictus aedes polynesisensis dan aedes scutellaris dianggap sebagai vektor sekunder pengendalian dbd terutama bertujuan untuk memutus rantai penyebarannya dengan melakukan pengendalian vektor pengendalian vektor telah dilakukan dengan berbagai metode yaitu manajemen lingkungan pengedendalian secara kimiawi dan pengendalian secara biologis dalam beberapa tahun terakhir telah dikembangkan strategi terbaru untuk mengendalikan vektor virus dbd khususnya untuk spesies aedes aegypt metode ini memanfaatkan rekayasa genetika untuk menghasilkan nyamuk yang memiliki gen letal dominan rekayasa terbaru ini disebut release of insects carrying dominant lethal ridl,['R1'],MAJORITY,Medical Journal of Lampung University,2017-02,,,id,kendali vektor virus dengue dengan metode release of insect carrying dominant lethal ridl demam darah dengue dbd adalah sakit infeksi yang sebab oleh virus dengue dengan manifestasi klinis demam nyeri otot dan atau nyeri sendi yang serta leucopenia ruam limfadenopati trombositopenia dan diathesis hemoragik pada dbd jadi rembes plasma yang tanda dengan hemokonsentrasi tingkat hematokrit atau tumpu cair di rongga tubuh dbd sebar di wilayah asia tenggara pasifik barat dan karibia indonesia rupa wilayah endemis dengan sebar di seluruh tanah air sakit ini masih rupa masalah sehat masyarakat yang utama di indonesia pada tiga tahun akhir 2008-2010 jumlah ratarata kasus lapor banyak 150 822 kasus dengan ratarata mati 1 321 mati situasi kasus dbd tahun 2011 sampai dengan juni 2011 lapor banyak 16 612 orang dengan mati banyak 142 orang tular infeksi virus dengue jadi lalu vektor nyamuk yaitu aedes aegypti spesies lain seperti aedes albopictus aedes polynesisensis dan aedes scutellaris anggap bagai vektor sekunder kendali dbd utama tuju untuk putus rantai sebar dengan laku kendali vektor kendali vektor telah laku dengan bagai metode yaitu manajemen lingkung pengedendalian cara kimiawi dan kendali cara biologis dalam beberapa tahun akhir telah kembang strategi baru untuk kendali vektor virus dbd khusus untuk spesies aedes aegypt metode ini manfaat rekayasa genetika untuk hasil nyamuk yang milik gen letal dominan rekayasa baru ini sebut release of insects carrying dominant lethal ridl
10870,10870,['FK1'],hubungan stresor dengan kejadian stres pada mahasiswa kepaniteraan klinik,"pendidikan kedokteran merupakan program pendidikan dengan tingkat stres tinggi pendidikan kedokteran ditempuh dengan dua tahap yaitu tahap program sarjana kedokteran dan tahap kepaniteraan klinik penelitian ini bertujuan untuk mengetahui faktorfaktor yang berhubungan dengan stres pada mahasiswa kepaniteraan klinik ilmu kebidanan dan penyakit kandungan di rsud dr h abdul moeloek bandar lampung penelitian ini merupakan penelitian metode campuran kuantitatif dengan pendekatan cross sectional dan kualitatif dengan wawancara sebanyak 31 mahasiswa kepaniteraan klinik dilakukan pengukuran faktor faktor stress dengan kuesioner srq-20 self reporting quetionnaire dan sds survei diagnosis stres serta dilakukan juga wawancara mendalam pada 12 mahasiswa sebagai data pendukung pada penelitian ini hasil penelitian menunjukan bahwa sebanyak 16 responden 51,6% mengalami stres 21 responden 67,7% merasa ketaksaan peran sebagai stressor sedang 20 responden 64,5% merasa konflik peran sebagai stressor sedang 19 responden 61,3% merasa beban kerja kuantitatif sebagai stressor berat 21 responden 67,7% merasa beban kerja kualitatif sebagai stressor berat dan 15 responden 48,4% merasa tanggung jawab sebagai stressor berat hasil analisis statistik menunjukan tidak terdapat hubungan bermakna antara ketaksaan peran dengan stress p 0,05 terdapat hubungan bermakna antara konflik peran dengan stress p 0,05 ada hubungan bermakna antara beban kerja kualitatif dan kuantitatif terhadap stress p 0,05 dan ada hubungan bermakna antara tanggung jawab terhadap stress p 0,05 didapatkan hubungan yang bermakna antara konflik peran beban kerja berlebih kuantitatif beban kerja berlebih kualitatif dan tanggung jawab dengan stres sedangkan ketaksaan peran tidak berhubungan bermakna kata kunci ilmu kebidanan dan penyakit kandungan mahasiswa kedokteran mahasiswa kepaniteraan klinik stres",['R1'],Jurnal Agromedicine,Fakultas Kedokteran Universitas Lampung,2017-12-01,,,id,hubung stresor dengan jadi stres pada mahasiswa panitera klinik didik dokter rupa program didik dengan tingkat stres tinggi didik dokter tempuh dengan dua tahap yaitu tahap program sarjana dokter dan tahap panitera klinik teliti ini tuju untuk tahu faktorfaktor yang hubung dengan stres pada mahasiswa panitera klinik ilmu bidan dan sakit kandung di rsud dr h abdul moeloek bandar lampung teliti ini rupa teliti metode campur kuantitatif dengan dekat cross sectional dan kualitatif dengan wawancara banyak 31 mahasiswa panitera klinik laku ukur faktor faktor stress dengan kuesioner srq-20 self reporting quetionnaire dan sds survei diagnosis stres serta laku juga wawancara dalam pada 12 mahasiswa bagai data dukung pada teliti ini hasil teliti tunjuk bahwa banyak 16 responden 51 6 alami stres 21 responden 67 7 rasa taksa peran bagai stressor sedang 20 responden 64 5 rasa konflik peran bagai stressor sedang 19 responden 61 3 rasa beban kerja kuantitatif bagai stressor berat 21 responden 67 7 rasa beban kerja kualitatif bagai stressor berat dan 15 responden 48 4 rasa tanggung jawab bagai stressor berat hasil analisis statistik tunjuk tidak dapat hubung makna antara taksa peran dengan stress p 0 05 dapat hubung makna antara konflik peran dengan stress p 0 05 ada hubung makna antara beban kerja kualitatif dan kuantitatif hadap stress p 0 05 dan ada hubung makna antara tanggung jawab hadap stress p 0 05 dapat hubung yang makna antara konflik peran beban kerja lebih kuantitatif beban kerja lebih kualitatif dan tanggung jawab dengan stres sedang taksa peran tidak hubung makna kata kunci ilmu bidan dan sakit kandung mahasiswa dokter mahasiswa panitera klinik stres
10871,10871,['FH3'],implementasi gadai emas syariah sebagai alternatif pemiayaan masyarakat non bank di indonesia,"gadai emas adalah salah satu bentuk utang piutang berbasis kepercayaan dari orang yang berpiutang dimana terdapat orang yang menggadaikan barangnya berupa emas perhiasan maupun logam mulia sebagai jaminan dari sebuah hutang tetapi barang jaminan tersebut tetap menjadi milik yang menggadaikan penelitian ini dilakukan dengan rumusan masalah bagaimanakah implementasi gadai emas syariah dengan akad rahn sebagai alternatif pembiayaan pada masyarakat non bank dengan pokok kajian 1 dasar hukum gadai emas syariah sebagai pembiayaan 2 syarat dan prosedur pembiayaan melalui akad rahn serta 3 hak dan kewajiban para pihak pada akad gadai emas syariah dari hasil penelitian diketahui 1 dasar hukum a kitab undangundang hukum perdata sebagai dasar hukum gadai b alqur an dan alhadits c fatwa dewan syariah nasional dsn majelis ulama indonesia mui tentang rahn 2 syarat dan prosedur pegadaian syariah dengan akad rahn adalah a pihak penggadai mendatangi langsung lembaga pegadaian dengan membawa barang emas seberat 10,2 gram b pihak pegadaian menaksir barang emas perhiasan 24 karat dengan nilai sebesar22 karat c taksiran barang emas perhiasan sebagai jaminan dihitung oleh pegadaian syariah lebih rendah 12% dari harga pasar emas perhiasan d pihak pegadaian syariah menetapkan margin ujrah setiap 10 hari sebesar rp 7.300 untuk marhun bih rp 1.000.000 dan maksimal tempo penebusan yang ditetapkan adalah 120 hari 4 bulan e pihak pegadaian syariah menyerahkan dana pembiayaan kepada pemberi gadai f diberikan kemudahan untuk dapat menebus barang gadai setiap saat namun harus sesuai dengan syarat dan ketentuan yang berlaku g dana pembiayaan dikembalikan kepada pihak pegadaian syariah pada saat jatuh tempo dan barang gadai dikembalikan kepada pemberi gadai h jika pemberi gadai gagal mengembalikan dana pembiayaan pada saat jatuh tempo dan tidak memperpanjang akadnya maka dilakukan proses lelang eksekusi terhadap barang gadai 3 hak dan kewajiban secara spesifik ditetapkan dalam akad dimana akad rahn diikuti dengan akad ijarah guna penyewaan tempat penitipan barang emas poses akad berlangsung cepat dan mudah gadai syariah pada pegadaian syariah dengan akad rahn memiliki sifat tolong menolong dengan menguntungkan para pihak pelayanan yang baik syarat dan prosedur yang tidak berbelit kepercayaan yang tinggi dari masyarakat membuat lembaga ini diminati masyarakat sebagai alternatif pembiayaan syariah kata kunci gadai emas syariah arrahn akad ijarah hak dan kewajiban",['K1'],5th Southeast Asia international islamic philantropy and  financial confrence procedeeng 2017 Melaka Malaysia,"SEAPIIC@ Center for Islamic Philanthropy and Social Finance (CIPSF), Universiti Teknologi MARA Melaka Al",2017-01-01,,,id,implementasi gadai emas syariah bagai alternatif pemiayaan masyarakat non bank di indonesia gadai emas adalah salah satu bentuk utang piutang bas percaya dari orang yang piutang mana dapat orang yang gadai barang upa emas hias maupun logam mulia bagai jamin dari buah hutang tetapi barang jamin sebut tetap jadi milik yang gadai teliti ini laku dengan rumus masalah bagaimana implementasi gadai emas syariah dengan akad rahn bagai alternatif biaya pada masyarakat non bank dengan pokok kaji 1 dasar hukum gadai emas syariah bagai biaya 2 syarat dan prosedur biaya lalu akad rahn serta 3 hak dan wajib para pihak pada akad gadai emas syariah dari hasil teliti tahu 1 dasar hukum a kitab undangundang hukum perdata bagai dasar hukum gadai b alqur an dan alhadits c fatwa dewan syariah nasional dsn majelis ulama indonesia mui tentang rahn 2 syarat dan prosedur gadai syariah dengan akad rahn adalah a pihak gadai datang langsung lembaga gadai dengan bawa barang emas berat 10 2 gram b pihak gadai taksir barang emas hias 24 karat dengan nilai sebesar22 karat c taksir barang emas hias bagai jamin hitung oleh gadai syariah lebih rendah 12 dari harga pasar emas hias d pihak gadai syariah tetap margin ujrah tiap 10 hari besar rp 7 300 untuk marhun bih rp 1 000 000 dan maksimal tempo tebus yang tetap adalah 120 hari 4 bulan e pihak gadai syariah serah dana biaya kepada beri gadai f beri mudah untuk dapat tebus barang gadai tiap saat namun harus sesuai dengan syarat dan tentu yang laku g dana biaya kembali kepada pihak gadai syariah pada saat jatuh tempo dan barang gadai kembali kepada beri gadai h jika beri gadai gagal kembali dana biaya pada saat jatuh tempo dan tidak panjang akad maka laku proses lelang eksekusi hadap barang gadai 3 hak dan wajib cara spesifik tetap dalam akad mana akad rahn ikut dengan akad ijarah guna sewa tempat titip barang emas poses akad langsung cepat dan mudah gadai syariah pada gadai syariah dengan akad rahn milik sifat tolong tolong dengan untung para pihak layan yang baik syarat dan prosedur yang tidak belit percaya yang tinggi dari masyarakat buat lembaga ini mati masyarakat bagai alternatif biaya syariah kata kunci gadai emas syariah arrahn akad ijarah hak dan wajib
