,Unnamed: 0,divisions,title,abstract,subjects,publication,publisher,date,keywords,keyword,lang,text_stemmed
6729,6729,['FT5'],prediksi kebutuhan listrik tiga fase dengan jaringan syaraf tiruan berdasarkan data erte system universitas lampung,"electricity realtime estimation erte system universitas lampung melalui pemanfaatan iot internet of things memberikan informasi mengenai pemakaian listrik tiga fase dalam waktu nyata dan menympannya secara historis data tersebut dapat digunakan untuk melakukan prediksi kebutuhan listrik masa depan jaringan syaraf tiruan merupakan metode yang memungkinkan melakukan prediksi berdasarkan pengamatan pada pola data yang ada seperti layaknya otak manusia penelitian dilakukan dalam empat bagian pertama adalah penentuan lapisan masukan input layer terdiri dari tanggal hari hari libur jam ruangan dan pemakaian listrik serta lapisan keluaran output layer terdiri dari prediksi kebutuhan listrik kedua adalah pelatihan model ketiga adalah pengujian jaringan syaraf tiruan semua bagian tersebut dibagi ke masingmasing fase rst pada bagian keempat dilakukan prediksi kebutuhan listrik berdasarkan hasil estimasi dari setiap fase setelah dilakukan pelatihan dan pengujian dari model jaringan syaraf tiruan prediksi kebutuhan listrik tiga fase menggunakan jaringan syaraf tiruan memiliki tingkat akurasi yang tinggi yaitu 99,11% hal ini menunjukkan bahwa jaringan syaraf tiruan dengan backpropagation dapat digunakan untuk melakukan prediksi kebutuhan daya listrik dengan cukup akurat backpropagation menurunkan tingkat error yang cukup rendah sehingga hasil prediksi dapat dijadikan dasar dalam melakukan pengelolaan dan perencanaan perkiraan kebutuhan daya listrik untuk gedung yang menggunakan listrik tiga fase","['T1', 'TK']",Jurnal Nasional Terindeks SEBATIK,STMIK Widya Cipta Dharma,2019,,,id,prediksi butuh listrik tiga fase dengan jaring syaraf tiru dasar data erte system universitas lampung electricity realtime estimation erte system universitas lampung lalu manfaat iot internet of things beri informasi kena pakai listrik tiga fase dalam waktu nyata dan menympannya cara historis data sebut dapat guna untuk laku prediksi butuh listrik masa depan jaring syaraf tiru rupa metode yang mungkin laku prediksi dasar amat pada pola data yang ada seperti layak otak manusia teliti laku dalam empat bagi pertama adalah tentu lapis masuk input layer diri dari tanggal hari hari libur jam ruang dan pakai listrik serta lapis keluar output layer diri dari prediksi butuh listrik dua adalah latih model tiga adalah uji jaring syaraf tiru semua bagi sebut bagi ke masingmasing fase rst pada bagi empat laku prediksi butuh listrik dasar hasil estimasi dari tiap fase telah laku latih dan uji dari model jaring syaraf tiru prediksi butuh listrik tiga fase guna jaring syaraf tiru milik tingkat akurasi yang tinggi yaitu 99 11 hal ini tunjuk bahwa jaring syaraf tiru dengan backpropagation dapat guna untuk laku prediksi butuh daya listrik dengan cukup akurat backpropagation turun tingkat error yang cukup rendah sehingga hasil prediksi dapat jadi dasar dalam laku kelola dan rencana kira butuh daya listrik untuk gedung yang guna listrik tiga fase
6730,6730,['FT5'],prediksi kebutuhan listrik tiga fase dengan jaringan syaraf tiruan berdasarkan data erte system universitas lampung,"electricity realtime estimation erte system universitas lampung melalui pemanfaatan iot internet of things memberikan informasi mengenai pemakaian listrik tiga fase dalam waktu nyata dan menympannya secara historis data tersebut dapat digunakan untuk melakukan prediksi kebutuhan listrik masa depan jaringan syaraf tiruan merupakan metode yang memungkinkan melakukan prediksi berdasarkan pengamatan pada pola data yang ada seperti layaknya otak manusia penelitian dilakukan dalam empat bagian pertama adalah penentuan lapisan masukan input layer terdiri dari tanggal hari hari libur jam ruangan dan pemakaian listrik serta lapisan keluaran output layer terdiri dari prediksi kebutuhan listrik kedua adalah pelatihan model ketiga adalah pengujian jaringan syaraf tiruan semua bagian tersebut dibagi ke masingmasing fase rst pada bagian keempat dilakukan prediksi kebutuhan listrik berdasarkan hasil estimasi dari setiap fase setelah dilakukan pelatihan dan pengujian dari model jaringan syaraf tiruan prediksi kebutuhan listrik tiga fase menggunakan jaringan syaraf tiruan memiliki tingkat akurasi yang tinggi yaitu 99,11% hal ini menunjukkan bahwa jaringan syaraf tiruan dengan backpropagation dapat digunakan untuk melakukan prediksi kebutuhan daya listrik dengan cukup akurat backpropagation menurunkan tingkat error yang cukup rendah sehingga hasil prediksi dapat dijadikan dasar dalam melakukan pengelolaan dan perencanaan perkiraan kebutuhan daya listrik untuk gedung yang menggunakan listrik tiga fase","['T1', 'TK']",,,2019-04-13,,,id,prediksi butuh listrik tiga fase dengan jaring syaraf tiru dasar data erte system universitas lampung electricity realtime estimation erte system universitas lampung lalu manfaat iot internet of things beri informasi kena pakai listrik tiga fase dalam waktu nyata dan menympannya cara historis data sebut dapat guna untuk laku prediksi butuh listrik masa depan jaring syaraf tiru rupa metode yang mungkin laku prediksi dasar amat pada pola data yang ada seperti layak otak manusia teliti laku dalam empat bagi pertama adalah tentu lapis masuk input layer diri dari tanggal hari hari libur jam ruang dan pakai listrik serta lapis keluar output layer diri dari prediksi butuh listrik dua adalah latih model tiga adalah uji jaring syaraf tiru semua bagi sebut bagi ke masingmasing fase rst pada bagi empat laku prediksi butuh listrik dasar hasil estimasi dari tiap fase telah laku latih dan uji dari model jaring syaraf tiru prediksi butuh listrik tiga fase guna jaring syaraf tiru milik tingkat akurasi yang tinggi yaitu 99 11 hal ini tunjuk bahwa jaring syaraf tiru dengan backpropagation dapat guna untuk laku prediksi butuh daya listrik dengan cukup akurat backpropagation turun tingkat error yang cukup rendah sehingga hasil prediksi dapat jadi dasar dalam laku kelola dan rencana kira butuh daya listrik untuk gedung yang guna listrik tiga fase
6731,6731,,pengembangan potensi bisnis pariwisata berkelanjutan melalui pendekatan community based tourism cbt di pantai ketang kalianda,pantai ketang merupakan salah satu destinasi wisata yang ada di kabupaten lampung selatan dengan fasilitas yang jauh dari memadai namun cukup banyak pengunjung yang datang ke pantai ini terutama dipagi dan sore hari berdasarkan fakta inilah maka pengembangan wisata di pantai ketang perlu dilakukan pengembangan ini sedikit demi sedikit telah dilakukan oleh kelompokkelompok masyarakat yaitu kelompok masyarakat desa kelompok petani tambak dan juga kelompok pemerintah hal ini perlu dilakukan mengingat banyak sekali manfaat yang dapat diterima oleh kelompok masyarakat tersebut baik dari segi ekonomi sosial budaya politik maupun lingkungan,['H1'],,,2019,,,id,kembang potensi bisnis pariwisata lanjut lalu dekat community based tourism cbt di pantai ketang kalianda pantai ketang rupa salah satu destinasi wisata yang ada di kabupaten lampung selatan dengan fasilitas yang jauh dari pada namun cukup banyak unjung yang datang ke pantai ini utama pagi dan sore hari dasar fakta ini maka kembang wisata di pantai ketang perlu laku kembang ini sedikit demi sedikit telah laku oleh kelompokkelompok masyarakat yaitu kelompok masyarakat desa kelompok tani tambak dan juga kelompok perintah hal ini perlu laku ingat banyak sekali manfaat yang dapat terima oleh kelompok masyarakat sebut baik dari segi ekonomi sosial budaya politik maupun lingkung
6732,6732,['FISIP2'],efektivitas pengelolaan perusahaan publik di indonesia,peer review monograf,['AC'],,Pusaka Media,2019,,,af,efektivitas kelola usaha publik di indonesia peer review monograf
6733,6733,['FKIP19'],penggunaan pendekatan rme terhadap kemampuan pemecahan masalah siswa,era revolusi industri 4.0 menuntut anak mampu beradaptasi menghadapi persaingan global kecakapan hidup pada era globalisasi tidak hanya dipandang dari nilai akademik atau hasil belajarnya saja tetapi juga dinilai dari bagaimana seseorang tersebut mampu memecahkan masalahmasalah kehidupan yang akan datang salah satu persiapan menghadapi era tersebut adalah siswa memiliki kemampuan pemecahan masalah pada kenyataanya pembelajaran matematika di sd yang mengembangkan kemampuan masalah masih belum maksimal hal ini karena kurangnya perhatian guru dalam pengembangan kemampuan pemecahan masalah dalam proses pembelajaran maka dari itu diperlukan pendekatan pembelajaran yang mengintegrasikan pengetahuan keterampilan dan pengalaman anak sehingga siswa terlibat aktif dalam proses memecahkan masalah salah satu pendekatan pembelajaran yang dapat mengembangkan kemampuan pemecahan masalah yaitu dengan menggunakan pendekatan matematika realistic tujuan penelitian ini untuk mengetahui pengaruh penerapan pendekatan matematika realistic terhadap kemampuan pemecahan masalah siswa kelas v sekolah dasar di tangerang jenis penelitian ini adalah experiment dengan menggunakan teknik simple random sampling yang telah dilakukan kepada 60 siswa pengambilan data diperoleh melalui tes dan dianalisis dengan uji independent samples test uji mann whitneyu dan analisis deskriptif hasil penelitian menunjukan bahwa pendekatan matematika realistik dapat mengembangkan kemampuan pemecahan masalah siswa dari pada yang diajarkan menggunakan metode konvensional dan terdapat pengaruh interaksi antara penerapan pendekatan matematika realistik terhadap kemampuan pemecahan masalah kata kunci pendekatan matematika realistik pemecahan masalah sekolah dasar,['LB1501'],,,2019-09-28,,,id,guna dekat rme hadap mampu pecah masalah siswa era revolusi industri 4 0 tuntut anak mampu adaptasi hadap saing global cakap hidup pada era globalisasi tidak hanya pandang dari nilai akademik atau hasil ajar saja tetapi juga nilai dari bagaimana orang sebut mampu pecah masalahmasalah hidup yang akan datang salah satu siap hadap era sebut adalah siswa milik mampu pecah masalah pada kenyataanya ajar matematika di sd yang kembang mampu masalah masih belum maksimal hal ini karena kurang perhati guru dalam kembang mampu pecah masalah dalam proses ajar maka dari itu perlu dekat ajar yang integrasi tahu terampil dan alam anak sehingga siswa libat aktif dalam proses pecah masalah salah satu dekat ajar yang dapat kembang mampu pecah masalah yaitu dengan guna dekat matematika realistic tuju teliti ini untuk tahu pengaruh terap dekat matematika realistic hadap mampu pecah masalah siswa kelas v sekolah dasar di tangerang jenis teliti ini adalah experiment dengan guna teknik simple random sampling yang telah laku kepada 60 siswa ambil data oleh lalu tes dan analis dengan uji independent samples test uji mann whitneyu dan analisis deskriptif hasil teliti tunjuk bahwa dekat matematika realistik dapat kembang mampu pecah masalah siswa dari pada yang ajar guna metode konvensional dan dapat pengaruh interaksi antara terap dekat matematika realistik hadap mampu pecah masalah kata kunci dekat matematika realistik pecah masalah sekolah dasar
6734,6734,['FISIP2'],strategi penanganan narkoba di polres metro studi ifas dan efas,artikel ini bertujuan untuk mengetahui bagaimana kondisi lingkungan nternal dan external dalam strategi penanganan peredaran narkoba di kota metro oleh satuan narkoba polres metro tipe penelitian ini merupakan tipe penelitian yang bersifat deskriptif dengan pendekatan kuantitatif faktorfaktor strategi lingkungan internal yang menjadi kekuatan utama yaitu adanya kerjasama antara instansi kepolisian oleh stakeholder lainnya sedangkan yang menjadi kelemahan utama yaitu kualitas tenaga pelatih yang masih sangat terbatas dan belum memadai sehingga belum sesuai standar kompetensi faktorfaktor strategi lingkungan eksternal yang menjadi peluang utama yaitu tugas operasional dalam menciptakan keamanan dalam negri melalui strategi kepolisian semakin meningkat sehingga menjadi peluang dalam membangun kepercayaan sedangkan yang menjadi ancaman utama yaitu sistem hukum dan peradilan yang tumpang tindih belum terakomidasinya strategi sesuai dengan kebutuhan lingkungan karena belum adanya identifikasis lingkungan internal dan lingkungan eksternal tersendiri dari satuan narkoba polres,['H1'],Wacana Publik,LP3M  STISIPOL Dharma Wacana,2019-06,,,id,strategi tangan narkoba di polres metro studi ifas dan efas artikel ini tuju untuk tahu bagaimana kondisi lingkung nternal dan external dalam strategi tangan edar narkoba di kota metro oleh satu narkoba polres metro tipe teliti ini rupa tipe teliti yang sifat deskriptif dengan dekat kuantitatif faktorfaktor strategi lingkung internal yang jadi kuat utama yaitu ada kerjasama antara instansi polisi oleh stakeholder lain sedang yang jadi lemah utama yaitu kualitas tenaga latih yang masih sangat batas dan belum pada sehingga belum sesuai standar kompetensi faktorfaktor strategi lingkung eksternal yang jadi peluang utama yaitu tugas operasional dalam cipta aman dalam negri lalu strategi polisi makin tingkat sehingga jadi peluang dalam bangun percaya sedang yang jadi ancam utama yaitu sistem hukum dan adil yang tumpang tindih belum terakomidasinya strategi sesuai dengan butuh lingkung karena belum ada identifikasis lingkung internal dan lingkung eksternal sendiri dari satu narkoba polres
6735,6735,['FKIP5'],the novel work environment model to improve teacher performance a study at sman 1 sungkai jaya north lampung,,"['L1', 'LB1501', 'LC5201']",,JPP FKIP Universitas Lampung,2019-11-01,,,?,the novel work environment model to improve teacher performance a study at sman 1 sungkai jaya north lampung
6736,6736,['FH3'],peran indonesia sebagai anggota tidak tetap dewan keamanan perserikatan bangsabangsa dalam menciptakan perdamaian dan keamanan dunia,abstrak pelanggaran hak asasi manusia yang menimpa masyarakat rohingya uighur dan palestina merupakan isu penting yang mengancam perdamaian dan keamanan dunia sehingga sudah menjadi kewajiban masyarakat internasional termasuk indonesia untuk menghentikan pelanggaran tersebut sebagaimana yang ditegaskan dalam konstitusi indonesia yaitu alinea keempat uud 1945 bahwa indonesia berkomitmen untuk menjaga keamanan dunia dan perdamaian abadi dengan demikian bahwa sudah seharusnya agar indonesia tidak dapat diam saja terhadap apa yang menimpa masyarakat rohingya uighur dan palestina indonesia berkewajiban untuk ambil peran agar terciptanya perdamaian berdasarkan latar belakang tersebut maka persoalan yang akan dibahas dalam penelitian ini adalah bagaimana indonesia dapat mengambil peran untuk menyelesaikan konflik rohingya uighur dan palestina metode penelitian yang digunakan adalah hukum normatif dengan jenis penelitian deskriptif analitis penelitian ini menggunakan sumber data dari literatur artikel dan situssitus internet berdasarkan pembahasan di atas maka dapat disimpulkan bahwa indonesia sebagai anggota tidak tetap dewan keamanan pbb dapat mengambil peran penting dalam kasus pelanggaran ham yang terjadi pada masyarakat rohingya uighur dan palestina dalam hal ini indonesia sebagai anggota tidak tetap dewan keamanan pbb dapat memberikan saran dan desakan bagi anggota dewan keamanan lainnya untuk memberikan rujukan ke mahkamah pidana internasional atau icc atas kejahatan kemanusiaan genosida dan kejahatan perang yang dilakukan china myanmar dan israel kemudian sebagaimana yang telah dijelaskan bahwa satusatunya badan yang berhak melakukan intervensi demi keamanan internasional yang berlandaskan pada responsibility to protect adalah dewan keamanan pbb dengan kata lain dewan keamanan memiliki peran besar saat terjadinya pelanggaran ham yang menimpa suatu masyarakat di dunia sehingga indonesia sebagai salah satu anggota badan yang super power tersebut sangat memiliki peluang untuk menghentikan pelanggaran ham yang menimpa masyarakat rohingya uighur dan palestina kata kunci pelanggaran ham intervensi dan resposibility to protect,['K1'],,,2019-07-01,,,id,peran indonesia bagai anggota tidak tetap dewan aman serikat bangsabangsa dalam cipta damai dan aman dunia abstrak langgar hak asasi manusia yang timpa masyarakat rohingya uighur dan palestina rupa isu penting yang ancam damai dan aman dunia sehingga sudah jadi wajib masyarakat internasional masuk indonesia untuk henti langgar sebut bagaimana yang tegas dalam konstitusi indonesia yaitu alinea empat uud 1945 bahwa indonesia komitmen untuk jaga aman dunia dan damai abadi dengan demikian bahwa sudah harus agar indonesia tidak dapat diam saja hadap apa yang timpa masyarakat rohingya uighur dan palestina indonesia wajib untuk ambil peran agar cipta damai dasar latar belakang sebut maka soal yang akan bahas dalam teliti ini adalah bagaimana indonesia dapat ambil peran untuk selesai konflik rohingya uighur dan palestina metode teliti yang guna adalah hukum normatif dengan jenis teliti deskriptif analitis teliti ini guna sumber data dari literatur artikel dan situssitus internet dasar bahas di atas maka dapat simpul bahwa indonesia bagai anggota tidak tetap dewan aman pbb dapat ambil peran penting dalam kasus langgar ham yang jadi pada masyarakat rohingya uighur dan palestina dalam hal ini indonesia bagai anggota tidak tetap dewan aman pbb dapat beri saran dan desa bagi anggota dewan aman lain untuk beri rujuk ke mahkamah pidana internasional atau icc atas jahat manusia genosida dan jahat perang yang laku china myanmar dan israel kemudian bagaimana yang telah jelas bahwa satusatunya badan yang hak laku intervensi demi aman internasional yang landas pada responsibility to protect adalah dewan aman pbb dengan kata lain dewan aman milik peran besar saat jadi langgar ham yang timpa suatu masyarakat di dunia sehingga indonesia bagai salah satu anggota badan yang super power sebut sangat milik peluang untuk henti langgar ham yang timpa masyarakat rohingya uighur dan palestina kata kunci langgar ham intervensi dan resposibility to protect
6737,6737,['FH3'],sosialisasi tentang sensor mandiri sebagai upaya memberikan tontonan yang sehat bagi anak di sma bina mulya bandar lampung,abstrak media memiliki peran sentral dalam kehidupan seharihari terhadap anak baik atau buruk media memiliki efek yang besar pada perilaku anakanak sejumlah penelitian menyebutkan anakanak yang menonton video kekerasan yang muncul di televisi film video game telepon seluler dan internet rentan melakukan tindak kekerasan sejumlah kasus kekerasan yang terjadi pada anak belakangan marak di tanah air komisi perlindungan anak indonesia atau kpai mencatat dalam 7 tahun terakhir angka kasus kekerasan anak mencapai 26.954 kasus kasus tertinggi adalah kasus anak yang berhadapan hukum baik sebagai pelaku maupun korban yang mencapai 9.266 kasus dalam hal ini perlunya pengawasan dari berbagai pihak seperti keluarga guru pemerintah dan masyarakat salah satu bentuk pengawasan tersebut adalah dengan melakukan program baru yang disebut sensor mandiri yang nantinya diperuntukkan sebagai inisiatif masyarakat dalam memilih konten yang bakal tayang untuk itulah perlu difahami makna dari tontonan tersebut sehingga dapat memberikan tontonan yang sehat bagi anak khalayak sasaran kegiatan sosialisasi tentang sensor mandiri sebagai upaya memberikan tontonan yang sehat bagi anak ini adalah guru dan siswa siswi di di sma bina mulya bandar lampung,['K1'],,Lembaga Penelitian dan Pengabdian kepada Masyarakat Universitas Lampung,2019-12-03,,,id,sosialisasi tentang sensor mandiri bagai upaya beri tonton yang sehat bagi anak di sma bina mulya bandar lampung abstrak media milik peran sentral dalam hidup seharihari hadap anak baik atau buruk media milik efek yang besar pada perilaku anakanak jumlah teliti sebut anakanak yang tonton video keras yang muncul di televisi film video game telepon seluler dan internet rentan laku tindak keras jumlah kasus keras yang jadi pada anak belakang marak di tanah air komisi lindung anak indonesia atau kpai catat dalam 7 tahun akhir angka kasus keras anak capai 26 954 kasus kasus tinggi adalah kasus anak yang hadap hukum baik bagai laku maupun korban yang capai 9 266 kasus dalam hal ini perlu awas dari bagai pihak seperti keluarga guru perintah dan masyarakat salah satu bentuk awas sebut adalah dengan laku program baru yang sebut sensor mandiri yang nanti untuk bagai inisiatif masyarakat dalam pilih konten yang bakal tayang untuk itu perlu difahami makna dari tonton sebut sehingga dapat beri tonton yang sehat bagi anak khalayak sasar giat sosialisasi tentang sensor mandiri bagai upaya beri tonton yang sehat bagi anak ini adalah guru dan siswa siswi di di sma bina mulya bandar lampung
6738,6738,['FISIP2'],peningkatan kapasitas dan pemberdayaan kelompok perempuan pkk pembinaan kesejahteraan keluarga melalui penciptaan usaha strategis berbasis potensi daerah studi pada kelompok perempuan pkk desa sukajaya lempasing kecamatan teluk pandan kabupaten pesawaran,"ujuan umum yang dicapai dalam kegiatan ini adalah untuk menyebarluaskan hasilhasil penelitian kajian kepada masyarakat sebagai bagian dari upaya utuk memberdayakan dan meningkatkan kesejahteraan masyarakat membangun kerjasama dan kemitraan dengan masyarakat sebagai perwujudan dan pengembangan kompetensi sosial di kalangan para dosen sedangakan tujuan khususnya adalah untuk meningkatkan kapasitas pengetahuan dan memberdayaan kelompok perempuan pkk desa sukajaya lempasing kecamatan teluk pandan kabupaten pesawaran untuk menciptakan usaha strategisnya berbasis potensi daerah sehingga usaha tersebut berkelanjutan dan dapat meningkatkan perekonomian perempuan serta bermanfaat bagi pembangunan desanya dalam pelaksanaan kegiatan akan menggunakan metode ceramah dan diskusi metode ceramah dan diskusi serta fgd di dalam ruangan yang digunakan untuk menyajikan materi adapun khalayak sasaran kegiatan seminar tentang penciptaan usaha strategis yang berkelanjutan dengan menggunakan analisis swot adalah kelompok perempuan yang termasuk dalam pkk tetapi kegiatan ini tidak menutup kemungkinan untuk pihak pengamat lain dalam mengikuti kegiatan lokasi kegiatan pengabdian ini adalah di desa sukajaya lempasing kecamatan teluk pandan kabupaten pesawaran dengan adanya kegiatan pengabdian ini diharapkan dapat memberikan manfaat bagi khalayak sasaran yaitu memahami potensi daerahnya memahami usaha strategis dan menciptakan langkah untuk memulai usaha tersebut hasil kegiatan pengabdian membawa peningkatan kemampuan dasar peserta peningkatan terendah sebesar 5% dan peningkatan tertinggi sebesar 40% ratarata peningkatan adalah sebesar 17,5% berdasarkan hasil dan evaluasi pelaksanaan pengabdian kepada masyarakat dapat disimpulkan beberapa hal sebagai berikut 1 kemampuan peserta pelatihan pada aspek kognetif dan afektif mengalami peningkatan dengan ratarata sebesar 17,8% 2 hasil evaluasi menunjukan peserta memiliki persepsi positif dan motivasi yang tinggi untuk menjalankan point penting dalam penciptaan usaha strategis berbasis potensi daerahnya 3 peserta menghendaki adanya pelatihan lanjutan","['H1', 'HT']",Sakai Sembayan,LPPM Unila,2019-07,,,id,tingkat kapasitas dan daya kelompok perempuan pkk bina sejahtera keluarga lalu cipta usaha strategis bas potensi daerah studi pada kelompok perempuan pkk desa sukajaya lempasing camat teluk pandan kabupaten sawar uju umum yang capai dalam giat ini adalah untuk menyebarluaskan hasilhasil teliti kaji kepada masyarakat bagai bagi dari upaya utuk daya dan tingkat sejahtera masyarakat bangun kerjasama dan mitra dengan masyarakat bagai wujud dan kembang kompetensi sosial di kalang para dosen sedangakan tuju khusus adalah untuk tingkat kapasitas tahu dan daya kelompok perempuan pkk desa sukajaya lempasing camat teluk pandan kabupaten sawar untuk cipta usaha strategis bas potensi daerah sehingga usaha sebut lanjut dan dapat tingkat ekonomi perempuan serta manfaat bagi bangun desa dalam laksana giat akan guna metode ceramah dan diskusi metode ceramah dan diskusi serta fgd di dalam ruang yang guna untuk saji materi adapun khalayak sasar giat seminar tentang cipta usaha strategis yang lanjut dengan guna analisis swot adalah kelompok perempuan yang masuk dalam pkk tetapi giat ini tidak tutup mungkin untuk pihak amat lain dalam ikut giat lokasi giat abdi ini adalah di desa sukajaya lempasing camat teluk pandan kabupaten sawar dengan ada giat abdi ini harap dapat beri manfaat bagi khalayak sasar yaitu paham potensi daerah paham usaha strategis dan cipta langkah untuk mulai usaha sebut hasil giat abdi bawa tingkat mampu dasar serta tingkat rendah besar 5 dan tingkat tinggi besar 40 ratarata tingkat adalah besar 17 5 dasar hasil dan evaluasi laksana abdi kepada masyarakat dapat simpul beberapa hal bagai ikut 1 mampu serta latih pada aspek kognetif dan afektif alami tingkat dengan ratarata besar 17 8 2 hasil evaluasi tunjuk serta milik persepsi positif dan motivasi yang tinggi untuk jalan point penting dalam cipta usaha strategis bas potensi daerah 3 serta hendak ada latih lanjut
6739,6739,['FT1'],identification of biogenic gas reservoir zone using log petrophysics and geochemical data in s-1 well of nias basin north sumatera,,"['Q1', 'QD', 'QE']",,"IOP Publishing Ltd., United Kingdom",2019-09-27,,,?,identification of biogenic gas reservoir zone using log petrophysics and geochemical data in s-1 well of nias basin north sumatera
