,Unnamed: 0,divisions,title,abstract,subjects,publication,publisher,date,keywords,keyword,lang,text_stemmed
5698,5698,['FKIP22'],pengaruh model problem based learning pbl terhadap kemampuan pemecahan masalah matematis siswa,"kemampuan pemecahan masalah matematis merupakan hal yang penting dan harus dimiliki siswa dalam pembelajaran matematika salah satu model pembelajaran yang dapat melatih kemampuan pemecahan masalah adalah problem based learning pbl karna dapat membiasakan siswa terampil dalam menghadapi dan memecahkan masalah penelitian ini bertujuan untuk mengetahuipengaruh model pbl terhadap kemampuan pemecahan masalah matematissiswa populasi penelitian ini adalah seluruh siswa kelas xi sma negeri 1 tumijajarkabupaten tulang bawang baratsemester ganjil tahun pelajaran 2019 2020 yang terdistribusi dalam 6 kelas sampel pada penelitian ini adalah siswa kelas xi ipa 5 dan kelas xi ipa 6 yang dipilih dengan menggunakan teknik cluster random sampling desain penelitian ini ialah the randomized posttest onlycontrol group design data penelitian ini berupa data kuantitatif yang diperoleh melalui tes kemampuan pemecahan masalah matematis siswa dan diuji menggunakan ujit dengan Î± 0,05 berdasarkan hasil penelitian diperoleh kesimpulan bahwa pembelajaran model pblberpengaruh terhadap kemampuan pemecahan masalah matematis siswa",['L1'],,,2020,,,id,pengaruh model problem based learning pbl hadap mampu pecah masalah matematis siswa mampu pecah masalah matematis rupa hal yang penting dan harus milik siswa dalam ajar matematika salah satu model ajar yang dapat latih mampu pecah masalah adalah problem based learning pbl karna dapat biasa siswa terampil dalam hadap dan pecah masalah teliti ini tuju untuk mengetahuipengaruh model pbl hadap mampu pecah masalah matematissiswa populasi teliti ini adalah seluruh siswa kelas xi sma negeri 1 tumijajarkabupaten tulang bawang baratsemester ganjil tahun ajar 2019 2020 yang distribusi dalam 6 kelas sampel pada teliti ini adalah siswa kelas xi ipa 5 dan kelas xi ipa 6 yang pilih dengan guna teknik cluster random sampling desain teliti ini ialah the randomized posttest onlycontrol group design data teliti ini upa data kuantitatif yang oleh lalu tes mampu pecah masalah matematis siswa dan uji guna ujit dengan 0 05 dasar hasil teliti oleh simpul bahwa ajar model pblberpengaruh hadap mampu pecah masalah matematis siswa
5699,5699,['FK1'],holistic management of childhood patients with mild persistent asma through family medical approaches,penatalaksanaan holistik pasien balita dengan asma persisten ringan melalui pendekatan kedokteran keluarga arinda stefani1 diana mayasari2 1fakultas kedokteran universitas lampung 2bagian ilmu kedokteran komunitas fakultas kedokteran universitas lampung abstrak asma merupakan penyakit respiratori kronik dengan dasar inflamasi kronik yang mengakibatkan obstruksi dan hiperreaktivitas saluran respiratori sebagai hasil interaksi antara faktor genetik faktor inang dan lingkungan studi tentang riwayat alamiah asma menunjukkan bahwa hampir 80% kasus dimulai selama 6 tahun pertama kehidupan penatalaksanaan asma harus dengan pemantauan yang berkelanjutan untuk tercapainya asma yang terkontrol sehingga dokter harus menatalaksana pasien secara holistik dari berbagai aspek untuk meningkatkan kualitas hidup pasien penerapan pelayanan dokter keluarga berbasis evidence based medicine pada pasien dengan mengidentifikasi faktor risiko masalah klinis serta penatalaksanaan pasien berdasarkan kerangka penyelesaian masalah pasien dengan pendekatan patient centred dan family approach studi ini adalah case report data primer diperoleh melalui alloanamnesis pemeriksaan fisik kunjungan rumah untuk melengkapi data keluarga dan psikososial serta lingkungan penilaian berdasarkan diagnosis holistik dari awal proses dan akhir studi secara kuantitatif dan kualitatif pasien balita dengan asma persisten ringan pada faktor internal pada kasus seperti faktor genetik usia dan kurangnya kesadaran dalam menghindari faktor pencetus faktor eksternal kurangnya pengetahuan keluarga mengenai asma dan komplikasinya serta lingkungan yang berdebu dilakukan intervensi farmakologis dan non farmakologis berupa edukasi dalam mencegah terjadinya serangan asma pada pasien penegakan diagnosis dan penatalaksanaan pada pasien ini telah dilakukan secara holistik patient centered family approach dan berdasarkan beberapa teori dan penelitian terkini pada proses perubahan perilaku pasien dan keluarga sudah mencapai tahap adoption kata kunci asma balita kedokteran keluarga holistic management of childhood patients with mild persistent asma through family medical approaches abstract asthma is a chronic respiratory disease based on chronic inflammation which results obstruction and hyperreaction of the respiratory tract as a result of the interaction between genetic host and environmental factors studies on the natural history of asthma show that nearly 80% of cases begin during the first 6 years of life asthma management must be continuous monitoring to achieve controlled asthma doctors must manage patients holistically from various aspects to improve quality of life implementation of familybased evidence based medicine by identifying risk factors clinical problems and patient management based on patient problem solving framework with patient centred and family approach this study is a case report primary data were obtained through alloanamnesis physical examination home visits to complete family and psychosocial data as well as the environment assessment based on holistic diagnostic from the beginning process and in the end of thr study quantitatively and qualitatively patients under five with mild persistent asthma internal factors in cases such as genetic factors age and lack of awareness in avoiding trigger factors external factors are lack of family knowledge about asthma and its complications and a dusty environment pharmacological and nonpharmacological interventions are carried out in the form of education in preventing asthma attacks in patients the diagnosis and management of these patients has been carried out in a holistic patient centered family approach and based on several recent theories and studies in the behavior change process the patient and family have reached the adoption stage toddlers,['R1'],"MEDULA, medicalprofession journal of lampung university",fakultas kedokteran universitas lampung,2020-10-01,,"['asthma', 'family medicine', '']",id,holistic management of childhood patients with mild persistent asma through family medical approaches penatalaksanaan holistik pasien balita dengan asma persisten ringan lalu dekat dokter keluarga arinda stefani1 ana mayasari2 1fakultas dokter universitas lampung 2bagian ilmu dokter komunitas fakultas dokter universitas lampung abstrak asma rupa sakit respirator kronik dengan dasar inflamasi kronik yang akibat obstruksi dan hiperreaktivitas salur respirator bagai hasil interaksi antara faktor genetik faktor inang dan lingkung studi tentang riwayat alamiah asma tunjuk bahwa hampir 80 kasus mulai lama 6 tahun pertama hidup penatalaksanaan asma harus dengan pantau yang lanjut untuk capa asma yang kontrol sehingga dokter harus menatalaksana pasien cara holistik dari bagai aspek untuk tingkat kualitas hidup pasien terap layan dokter keluarga bas evidence based medicine pada pasien dengan identifikasi faktor risiko masalah klinis serta penatalaksanaan pasien dasar kerangka selesai masalah pasien dengan dekat patient centred dan family approach studi ini adalah case report data primer oleh lalu alloanamnesis periksa fisik kunjung rumah untuk lengkap data keluarga dan psikososial serta lingkung nilai dasar diagnosis holistik dari awal proses dan akhir studi cara kuantitatif dan kualitatif pasien balita dengan asma persisten ringan pada faktor internal pada kasus seperti faktor genetik usia dan kurang sadar dalam hindar faktor cetus faktor eksternal kurang tahu keluarga kena asma dan komplikasi serta lingkung yang debu laku intervensi farmakologis dan non farmakologis upa edukasi dalam cegah jadi serang asma pada pasien tega diagnosis dan penatalaksanaan pada pasien ini telah laku cara holistik patient centered family approach dan dasar beberapa teori dan teliti kini pada proses ubah perilaku pasien dan keluarga sudah capai tahap adoption kata kunci asma balita dokter keluarga holistic management of childhood patients with mild persistent asma through family medical approaches abstract asthma is a chronic respiratory disease based on chronic inflammation which results obstruction and hyperreaction of the respiratory tract as a result of the interaction between genetic host and environmental factors studies on the natural history of asthma show that nearly 80 of cases begin during the first 6 years of life asthma management must be continuous monitoring to achieve controlled asthma doctors must manage patients holistically from various aspects to improve quality of life implementation of familybased evidence based medicine by identifying risk factors clinical problems and patient management based on patient problem solving framework with patient centred and family approach this study is a case report primary data were obtained through alloanamnesis physical examination home visits to complete family and psychosocial data as well as the environment assessment based on holistic diagnostic from the beginning process and in the end of thr study quantitatively and qualitatively patients under five with mild persistent asthma internal factors in cases such as genetic factors age and lack of awareness in avoiding trigger factors external factors are lack of family knowledge about asthma and its complications and a dusty environment pharmacological and nonpharmacological interventions are carried out in the form of education in preventing asthma attacks in patients the diagnosis and management of these patients has been carried out in a holistic patient centered family approach and based on several recent theories and studies in the behavior change process the patient and family have reached the adoption stage toddlers
5700,5700,['FKIP1'],pembelajaran jarak jauh di perguruan tinggi di masa pandemi covid-19 sistem penjaminan mutu,,['H1'],,,2020,,,?,ajar jarak jauh di guru tinggi di masa pandemi covid-19 sistem jamin mutu
5701,5701,['FISIP4'],pola konsumsi berita pada kelompok khalayak digital di kota bandar lampung,tulisan ini bertujuan untuk mengetahui pola konsumsi berita di bandar lampung sekaligus melihat jenis media massa serta berita yang dipercaya dan paling banyak dikonsumsi oleh masyarakat penelitian ini adalah penelitian deskriptif kuantitatif menggunakan metode survei indikator penelitian berupa akses dan terpaan media serta motif keaktifan khalayak hasil penelitian menunjukkan bahwa para digital natives dan digital immigrants memiliki ketertarikan dan pola konsumsi tinggi terhadap berita karena kemampuan mereka dalam menggunakan teknologi digital dan internet hal ini berbeda dengan digital settlers yang tingkat ketertarikan dan pola konsumsi beritanya rendah,['HE'],Jurnal Ilmu Komunikasi,"Prodi Ilmu Komunikasi, FISIP, Universitas Atma Jaya Yogyakarta",2020-12,,,id,pola konsumsi berita pada kelompok khalayak digital di kota bandar lampung tulis ini tuju untuk tahu pola konsumsi berita di bandar lampung sekaligus lihat jenis media massa serta berita yang percaya dan paling banyak konsumsi oleh masyarakat teliti ini adalah teliti deskriptif kuantitatif guna metode survei indikator teliti upa akses dan terpa media serta motif aktif khalayak hasil teliti tunjuk bahwa para digital natives dan digital immigrants milik tari dan pola konsumsi tinggi hadap berita karena mampu mereka dalam guna teknologi digital dan internet hal ini beda dengan digital settlers yang tingkat tari dan pola konsumsi berita rendah
5702,5702,['FKIP18'],mineralogi petrologi,dalam ilmu ini akan dituntun untuk mengenal dan mempelajari lebih mendalam tentang berbagai batuan penyusun kulit bumi ini terdapat tiga macam batuan utama penyusun kulit bumi ini yang telah menghidupi manusia sepanjang masa batuan tersebut adalah batuan beku sering disebut dengan istilah igneous rocks batuan sedimen yang juga dinamakan dengan istilah sedimentary rocks dan batuan metamorf yang disebut juga sebagai batuan malihan atau metamorphic rocks masingmasing batuan tersebut kemudian dipelajari bagianbagian mineral yang terkandung di dalamnya,['GB'],,ALFABETA BANDUNG,2020-02-02,,,id,mineralogi petrologi dalam ilmu ini akan tuntun untuk kenal dan ajar lebih dalam tentang bagai batu susun kulit bumi ini dapat tiga macam batu utama susun kulit bumi ini yang telah hidup manusia panjang masa batu sebut adalah batu beku sering sebut dengan istilah igneous rocks batu sedimen yang juga nama dengan istilah sedimentary rocks dan batu metamorf yang sebut juga bagai batu malih atau metamorphic rocks masingmasing batu sebut kemudian ajar bagianbagian mineral yang kandung di dalam
5703,5703,['FEB4'],a study of village fund management to achieve good governance,,['HJ'],,,2020,,,?,a study of village fund management to achieve good governance
5704,5704,['FP26'],persepsi petani terhadap pemanfaatan bantuan combine harvester di kecamatan gadingrejo kabupaten pringsewu,penelitian ini bertujuan untuk mengetahui persepsi petani padi sawah terhadap pemanfaatan bantuan combine harvester di kecamatan gadingrejo kabupaten pringsewu penelitian dilakukan di kecamatan gadingrejo kabupaten pringsewu dengan 88 responden dari anggota kelompok tani penerima bantuan combine harvester pengumpulan data dilakukan dengan metode survey analisis data menggunakan analisis deskriptif hasil penelitian menunjukkan bahwa persepsi petani padi sawah anggota kelompok tani aktif terhadap keuntungan relatif kesesuaian alat kerumitan alat ketercobaan alat dan keteramatan hasil dalam pemanfaatan bantuan combine harvester berada pada klasifikasi baik persepsi petani padi sawah anggota kelompok tani tidak aktif terhadap keuntungan relatif berada padda klasifikasi cukup baik sedangkan persepsi terhadap kesesuaian alat kerumitan alat ketercobaan alat dan keteramatan hasil dalam pemanfaatan bantuan combine harvester berada pada klasifikasi kurang baik,['S1'],Jurnal Agribisnis Terpadu,"Jurusan Agribisnis, Fakultas Pertanian UNTIRTA",2020-06,,,id,persepsi tani hadap manfaat bantu combine harvester di camat gadingrejo kabupaten pringsewu teliti ini tuju untuk tahu persepsi tani padi sawah hadap manfaat bantu combine harvester di camat gadingrejo kabupaten pringsewu teliti laku di camat gadingrejo kabupaten pringsewu dengan 88 responden dari anggota kelompok tani terima bantu combine harvester kumpul data laku dengan metode survey analisis data guna analisis deskriptif hasil teliti tunjuk bahwa persepsi tani padi sawah anggota kelompok tani aktif hadap untung relatif sesuai alat kerumit alat coba alat dan amat hasil dalam manfaat bantu combine harvester ada pada klasifikasi baik persepsi tani padi sawah anggota kelompok tani tidak aktif hadap untung relatif ada padda klasifikasi cukup baik sedang persepsi hadap sesuai alat kerumit alat coba alat dan amat hasil dalam manfaat bantu combine harvester ada pada klasifikasi kurang baik
5705,5705,['FP26'],hasil review persepsi petani terhadap pemanfaatan bantuan combine harvester di kecamatan gading rejo kabupaten pringsewu,hasil review jurnal agribisnis terpadu,['S1'],,jurnal agribisnis terpadu,2020-06,,,et,hasil review persepsi tani hadap manfaat bantu combine harvester di camat gading rejo kabupaten pringsewu hasil review jurnal agribisnis padu
5706,5706,['FP19'],pengenalan oven surya untuk pengeringan gula semut dalam rangka peningkatan produksi dan mutu produk serta ekonomi masyarakat kwt putri handayani di pekon sidokaton kecamatan gisting kabupaten tanggamus,setelah dilakukan pembinaan oleh tim pengabdian pada masyarakat dari universitas lampung kelompok wanita tani kwt putri handayani di desa sidokaton kecamatan gisting kabupaten tanggamus sudah dapat membuat produk olahan dari gula merah dan dari nira aren menjadi gula semut tetapi anggota kwt putri handayani masih mengalami hambatan dalam mengembangkan usaha gula semut karena kondisi cuaca yang tidak stabil menyebabkan proses produksi gula semut terhambat dan mutu hasil produksi juga tidak menentu oleh karena itu diperlukan penyuluhan dan pelatihan tentang metode pembuatan dan pemanfaatan alat pengering oven tenaga surya untuk dapat menghasilkan gula semut dengan mutu yang baik kegiatan pengabdian masyarakat ini bertujuan untuk mengenalkan dan memberikan pelatihan penggunakan alat pengering oven surya untuk meningkatkan produksi dan mutu gula semut yang dihasilkan penyampaian materi pengabdian dilaksanakan dengan menggunakan metode ceramah kemudian dilakukan diskusi tanya jawab untuk memberikan kesempatan kepada peserta memahami materi dan menyampaikan gagasan atau permasalahan yang terkait dengan pengembangan produksi gula semut metode ini diharapkan dapat memberikan pengaruh positif terhadap pengetahuan dan sikap peserta pelatihan dan penyuluhan kegiatan dilanjutkan dengan praktek penggunaan oven alat pengering surya pelaksanaan kegiatan pengabdian ini dilaksanakan selama 4 bulan hasil kegiatan ini menyimpulkan bahwa anggota kwt putri handayani tertarik untuk menggunakan oven surya untuk pengeringan gula semut yang mereka produksi setelah menggunakan oven surya yang diserahkan oleh tim ppm unila anggota kwt merasakan bahwa mutu gula semut yang dihasilkan lebih baik dan proses pengeringan menjadi lebih cepat dibandingkan metode pengeringan sebelumnya hasil penyuluhan dan praktek penggunaan oven tenaga surya anggota kwt putri handayani merasa mampu untuk memproduksi membuat oven surya sendiri tetapi untuk di masa mendatang perlu dilakukan program ppm lanjutan dengan tujuan untuk melakukan pelatihan peningkatan mutu produk dan kemasan gula semut evaluasi pasar gula semut dan metode pemasaran gula semut penjualan online,['T1'],"SEMINAR NASIONAL HASIL-HASIL PENGABDIAN KEPADA MASYARAKAT, NOVEMBER 2020, Bandar Lampung",,2020-11-06,alat pengering; gula semut; nira aren; oven surya.,,id,kenal oven surya untuk ering gula semut dalam rangka tingkat produksi dan mutu produk serta ekonomi masyarakat kwt putri handayani di pekon sidokaton camat gisting kabupaten tanggamus telah laku bina oleh tim abdi pada masyarakat dari universitas lampung kelompok wanita tani kwt putri handayani di desa sidokaton camat gisting kabupaten tanggamus sudah dapat buat produk olah dari gula merah dan dari nira aren jadi gula semut tetapi anggota kwt putri handayani masih alami hambat dalam kembang usaha gula semut karena kondisi cuaca yang tidak stabil sebab proses produksi gula semut hambat dan mutu hasil produksi juga tidak tentu oleh karena itu perlu suluh dan latih tentang metode buat dan manfaat alat ering oven tenaga surya untuk dapat hasil gula semut dengan mutu yang baik giat abdi masyarakat ini tuju untuk kenal dan beri latih guna alat ering oven surya untuk tingkat produksi dan mutu gula semut yang hasil sampai materi abdi laksana dengan guna metode ceramah kemudian laku diskusi tanya jawab untuk beri sempat kepada serta paham materi dan sampai gagas atau masalah yang kait dengan kembang produksi gula semut metode ini harap dapat beri pengaruh positif hadap tahu dan sikap serta latih dan suluh giat lanjut dengan praktek guna oven alat ering surya laksana giat abdi ini laksana lama 4 bulan hasil giat ini simpul bahwa anggota kwt putri handayani tarik untuk guna oven surya untuk ering gula semut yang mereka produksi telah guna oven surya yang serah oleh tim ppm unila anggota kwt rasa bahwa mutu gula semut yang hasil lebih baik dan proses ering jadi lebih cepat banding metode ering belum hasil suluh dan praktek guna oven tenaga surya anggota kwt putri handayani rasa mampu untuk produksi buat oven surya sendiri tetapi untuk di masa datang perlu laku program ppm lanjut dengan tuju untuk laku latih tingkat mutu produk dan kemas gula semut evaluasi pasar gula semut dan metode pasar gula semut jual online
5707,5707,,menjadi kopromotor gugus kriswahyudi,menjadi kopromotor mahasiswa s3 gugus kriswahyudi,['TJ'],,LPPM-Unila,2020-06-09,,,id,jadi kopromotor gugus kriswahyudi jadi kopromotor mahasiswa s3 gugus kriswahyudi
5708,5708,,sk kopromotor mahasiswa s3 pps uin raden intan lampung nama sri lestari,sk kopromotor mahasiswa s3 pps uin raden intan lampung nama sri lestari,['TJ'],,LPPM-Unila,2020,,,id,sk kopromotor mahasiswa s3 pps uin raden intan lampung nama sri lestari sk kopromotor mahasiswa s3 pps uin raden intan lampung nama sri lestari
5709,5709,,sk sebagai penguji disertasi pps uny no 909 tahun 2020,keputusan direktur tentang tim penguji ujian hasil penelitian disertasi mahasiswa program s-3 pps uny tahun 2020,['TJ'],,PPS UNY Yogyakarta,2020-09,,,id,sk bagai uji disertasi pps uny no 909 tahun 2020 putus direktur tentang tim uji uji hasil teliti disertasi mahasiswa program s-3 pps uny tahun 2020
5710,5710,,sk sebagai penguji program doktor dalam ujian terbuka mahasiswa s3 pps uny,sk sebagai penguji program doktor dalam ujian terbuka sdr sukiter mahasiswa s3 pps uny yogyakarta yang dilaksanakan pada tanggal 22 oktober 2020.,['TJ'],,LPPM-Unila,2020-10-22,,,id,sk bagai uji program doktor dalam uji buka mahasiswa s3 pps uny sk bagai uji program doktor dalam uji buka sdr sukiter mahasiswa s3 pps uny yogyakarta yang laksana pada tanggal 22 oktober 2020
5711,5711,['FKIP11'],the influence of learning motivation on the learning outcomes of vocational students at lampung university,,"['L1', 'LB1501', 'LC5201']",,International Journal of Advanced Science and Technology,2020,,,?,the influence of learning motivation on the learning outcomes of vocational students at lampung university
5712,5712,['FKIP11'],the influence of learning motivation on the learning outcomes of vocational students at lampung university,,"['L1', 'LB1501', 'LC5201']",,International Journal of Advanced Science and Technology,2020,,,?,the influence of learning motivation on the learning outcomes of vocational students at lampung university
5713,5713,['FP18'],bukti melakukan review artikel di jurnal critical reviews in food science and nutrition tahun 2020 diding suhandy reviewer,,['S1'],,Universitas Lampung,2020,,,?,bukti laku review artikel di jurnal critical reviews in food science and nutrition tahun 2020 diding suhandy reviewer
5714,5714,['FP18'],klasifikasi madu berdasarkan jenis lebah apis dorsata versus apis mellifera menggunakan spektroskopi ultraviolet dan kemometrika,pada penelitian ini data spektra di daerah uv digunakan bersama dengan dua metode kemometrika pca dan simca untuk mengklasifikasi madu dari dua jenis lebah yang berbeda apis dorsata versus apis mellifera sebanyak 200 sampel madu monofloral durian dari lebah apis dorsata dan 120 sampel madu monofloral kelengkeng dari lebah apis mellifera disiapkan sebagai sampel data spektra diambil menggunakan parameter berikut rentang pengukuran 200-400 nm mode transmitansi dan interval 1 nm spektra original ditransformasi menggunakan tiga algoritma berbeda yaitu moving average smoothing dengan 11 segmen standard normal variate snv dan savitzkygolay 1st derivative dengan 11 segmen dan 2 ordo hasil analisis pca menggunakan spektra transformasi di rentang 250 400 nm menunjukkan bahwa madu durian dan kelengkeng dapat dipisahkan di sepanjang sumbu pc1 yang mampu menjelaskan varian data sebanyak 98% hasil simca menunjukkan bahwa semua sampel prediksi dapat diklasifikasikan secara benar sesuai dengan kelasnya masingmasing yang menghasilkan ketepatan klasifikasi sebesar 100% beberapa panjang gelombang memiliki nilai xloading tinggi yaitu di panjang gelombang 270 nm dan 300 nm panjang gelombang tersebut berkorelasi dengan absorbansi dari beberapa senyawa phenolic penting yang terdapat pada madu seperti benzoic salicylic dan arylalyphatic acids hasil penelitian ini membuka peluang terbangunnya sistem uji keaslian madu secara mudah dan murah dengan menggunakan spektroskopi uv dan kemometrika dengan persiapan sampel yang bebas bahan kimia,['S1'],JIPI Jurnal Ilmu Pertanian Indonesia,LPPM IPB,2020-10-27,,,id,klasifikasi madu dasar jenis lebah apis dorsata versus apis mellifera guna spektroskop ultraviolet dan kemometrika pada teliti ini data spektra di daerah uv guna sama dengan dua metode kemometrika pca dan simca untuk klasifikasi madu dari dua jenis lebah yang beda apis dorsata versus apis mellifera banyak 200 sampel madu monofloral durian dari lebah apis dorsata dan 120 sampel madu monofloral kelengkeng dari lebah apis mellifera siap bagai sampel data spektra ambil guna parameter ikut rentang ukur 200-400 nm mode transmitansi dan interval 1 nm spektra original transformasi guna tiga algoritma beda yaitu moving average smoothing dengan 11 segmen standard normal variate snv dan savitzkygolay 1st derivative dengan 11 segmen dan 2 ordo hasil analisis pca guna spektra transformasi di rentang 250 400 nm tunjuk bahwa madu durian dan kelengkeng dapat pisah di panjang sumbu pc1 yang mampu jelas varian data banyak 98 hasil simca tunjuk bahwa semua sampel prediksi dapat klasifikasi cara benar sesuai dengan kelas masingmasing yang hasil tepat klasifikasi besar 100 beberapa panjang gelombang milik nilai xloading tinggi yaitu di panjang gelombang 270 nm dan 300 nm panjang gelombang sebut korelasi dengan absorbansi dari beberapa senyawa phenolic penting yang dapat pada madu seperti benzoic salicylic dan arylalyphatic acids hasil teliti ini buka peluang bangun sistem uji asli madu cara mudah dan murah dengan guna spektroskop uv dan kemometrika dengan siap sampel yang bebas bahan kimia
