,Unnamed: 0,divisions,title,abstract,subjects,publication,publisher,date,keywords,keyword,lang,text_stemmed
12134,12134,['FMIPA2'],pengaruh protektif dan kuratif pemberian suplemen jus buah naga putih hylocereus undatus terhadap histologi tubulus seminiferus tikus putih rattus norvegicus dewasa galur sprague dawley yang diinduksi siproteron asetat,"ketiadaan anak dalam perkawinan pada waktu lama akan menjadi masalah halini disebut infertilitas keadaan ini akan mengancam keutuhan rumah tangga infertilitas merupakan kegagalan hamil atau melahirkan setelah 12 bulan atau lebih berhubungan seks teratur tanpa pelindung infertilitas bukan masalah perempuan saja karena 25% sampai 50% infertilitas disebabkan pria sehingga dibutuhkan pencegahan dan pengobatan yang aman salah satu pilihan menggunakan suplemen jus buah naga putih penelitian ini bertujuan untuk mengetahui pengaruh suplemen jus buah naga putih terhadap histologi tubulus seminiferus tikus putih yang diinduksi siproteron asetat penelitian menggunakan 25 tikus dipisah menjadi 5 kelompok k1 pakan biasa p1 jus buah naga putih 1 ml selama 24 hari p2 induksi siproteron asetat 2 mg selama 7 hari p3 jus buah naga putih 1 ml selama 24 hari kemudian induksi siproteron asetat 2 mg selama 7 hari dan p4 induksi siproteron asetat 2 mg selama 7 hari kemudian jus buah naga putih 1 ml selama 24 hari hasil menunjukan rerata jumlah sel spermatosit primer pada k p1 p2 p3 dan p4 adalah 375,20 8,408 381,40 11,082 320,00 6,519 346,00 8,276 dan 331,60 4,930 rerata jumlah sel spermatid adalah 345,60 11,216 362,80 16,843 306,00 6,205 333,00 6,042 dan 323,60 4,506 rerata diameter tubulus seminiferus adalah 311,32 7,86 314,84 23,01 286,91 5,89 310,45 3,86 dan 309,30 2,01 simpulan jus buah naga putih mampu meningkatkan spermatosit primer dan spermatid",['R1'],Jurnal Agromedicine,Fakultas Kedokteran Universitas Lampung,2016-02,,,id,pengaruh protektif dan kuratif beri suplemen jus buah naga putih hylocereus undatus hadap histologi tubulus seminiferus tikus putih rattus norvegicus dewasa galur sprague dawley yang induksi siproteron asetat tiada anak dalam kawin pada waktu lama akan jadi masalah halini sebut infertilitas ada ini akan ancam utuh rumah tangga infertilitas rupa gagal hamil atau lahir telah 12 bulan atau lebih hubung seks atur tanpa lindung infertilitas bukan masalah perempuan saja karena 25 sampai 50 infertilitas sebab pria sehingga butuh cegah dan obat yang aman salah satu pilih guna suplemen jus buah naga putih teliti ini tuju untuk tahu pengaruh suplemen jus buah naga putih hadap histologi tubulus seminiferus tikus putih yang induksi siproteron asetat teliti guna 25 tikus pisah jadi 5 kelompok k1 pakan biasa p1 jus buah naga putih 1 ml lama 24 hari p2 induksi siproteron asetat 2 mg lama 7 hari p3 jus buah naga putih 1 ml lama 24 hari kemudian induksi siproteron asetat 2 mg lama 7 hari dan p4 induksi siproteron asetat 2 mg lama 7 hari kemudian jus buah naga putih 1 ml lama 24 hari hasil tunjuk rerata jumlah sel spermatosit primer pada k p1 p2 p3 dan p4 adalah 375 20 8 408 381 40 11 082 320 00 6 519 346 00 8 276 dan 331 60 4 930 rerata jumlah sel spermatid adalah 345 60 11 216 362 80 16 843 306 00 6 205 333 00 6 042 dan 323 60 4 506 rerata diameter tubulus seminiferus adalah 311 32 7 86 314 84 23 01 286 91 5 89 310 45 3 86 dan 309 30 2 01 simpul jus buah naga putih mampu tingkat spermatosit primer dan spermatid
12135,12135,['FKIP11'],pembelajaran direct inovatif,buku referensi pembelajaran direct inovatif ini menyajikan variabelvariabel yang mempengaruhi hasil belajar pembelajaran direct dan pembelajaran direct inovatif bahasan variabel hasil belajar mencakup variabel metode dan kondisi pembelajaran bahasan pembelajaran direct mencakup landasan teoritis dan empiris fasefase pembelajaran direct keunggulan dan keterbatasan serta contoh pembelajaran direct bahasan pembelajaran direct inovatif mencakup landasan teoritis dan empiris pembelajaran direct inovatif fasefase pembelajaran direct inovatif keunggulan dan keterbatasan serta contoh pembelajaran direct inovatif buku referensi pembelajaran direct inovatif ini diharapkan dapat menjadi salah satu alternatif sumber rujukan dalam merancang dan melaksanakan pembelajaran,['L1'],,Media Akademi,2016-12,,,id,ajar direct inovatif buku referensi ajar direct inovatif ini saji variabelvariabel yang pengaruh hasil ajar ajar direct dan ajar direct inovatif bahas variabel hasil ajar cakup variabel metode dan kondisi ajar bahas ajar direct cakup landas teoritis dan empiris fasefase ajar direct unggul dan batas serta contoh ajar direct bahas ajar direct inovatif cakup landas teoritis dan empiris ajar direct inovatif fasefase ajar direct inovatif unggul dan batas serta contoh ajar direct inovatif buku referensi ajar direct inovatif ini harap dapat jadi salah satu alternatif sumber rujuk dalam rancang dan laksana ajar
12136,12136,['FKIP11'],pengembangan model dan perangkat pengembangan kurikulum di propinsi lampung,tujuan jangka panjang penelitian ini adalah 1 membangun kerjasama antara dosendosen ip fkip unila sehingga dapat membantu mengatasi permasalah yang dihadapi oleh pengembang kurikulum di propinsi lampung 2 membangun kerjasama antara dosendosen ip fkip unila dengan pengembang kurikulum di propinsi lampung sehingga dapat membantu mengatasi permasalah yang dihadapi dan 3 memberi altenatif mengenai model pengembangan kurikulum yang bisa dijadikan salah satu acuan bagi penyelenggaraan diklat pengembangan kurikulum tujuan jangka pendek penelitian ini adalah menghasilkan model dan perangkat pembelajaran bagi mahasiswa s2 teknologi pendidikan fkip unila produk mencakup 1 model pengembangan kurikulum 2 buku ajar pengembangan kurikulum dan 3 instrumen pengembangan kurikulum metode yang dipakai dalam pengembangan ini menggunakan model r d yang terdiri dari tahapantahapan kegiatan prosedur pengembangan dan uji coba produk prosedur pengembangan model dan perangkat pengembangan kurikulum tahun kedua dibagi dalam beberapa tahap yaitu ketiga dan keempat kegiatan yang dilakukan pada tahap ketiga adalah uji perorangan dan kelompok kecil sedangkan kegiatan yang dilakukan pada tahap keempat adalah uji lapangan dan sosialisasi hasil dengan mengikuti seminar internasional di luar propinsi lampung buku ajar pengembangan kurikulum merupakan salah satu sumber belajar yang mengandung konten 1 landasan filosofi pengembangan kurikulum 2 landasan teoritis pengembangan kurikulum 3 peran teori belajar untuk merancang pembelajaran 4 model pengembangan kurikulum 5 evaluasi dan uji dalam pengembangan kurikulum 6 sumber data subyek sumber data pengolahan data populasi dan sampel dan 7 macammacam evaluasi hasil belajar buku ajar perlu memiliki keterbacaan dengan kategori baik dan kemenarikan dengan kategori baik buku ajar pengembangan kurikulum hasil penelitian ini memiliki keterbacaan dan kemenarikan dengan kategori baik serta tingkat efisiensi dengan kategori baik,['L1'],,-,2016-10,,,id,kembang model dan perangkat kembang kurikulum di propinsi lampung tuju jangka panjang teliti ini adalah 1 bangun kerjasama antara dosendosen ip fkip unila sehingga dapat bantu atas masa yang hadap oleh kembang kurikulum di propinsi lampung 2 bangun kerjasama antara dosendosen ip fkip unila dengan kembang kurikulum di propinsi lampung sehingga dapat bantu atas masa yang hadap dan 3 beri altenatif kena model kembang kurikulum yang bisa jadi salah satu acu bagi selenggara diklat kembang kurikulum tuju jangka pendek teliti ini adalah hasil model dan perangkat ajar bagi mahasiswa s2 teknologi didik fkip unila produk cakup 1 model kembang kurikulum 2 buku ajar kembang kurikulum dan 3 instrumen kembang kurikulum metode yang pakai dalam kembang ini guna model r d yang diri dari tahapantahapan giat prosedur kembang dan uji coba produk prosedur kembang model dan perangkat kembang kurikulum tahun dua bagi dalam beberapa tahap yaitu tiga dan empat giat yang laku pada tahap tiga adalah uji orang dan kelompok kecil sedang giat yang laku pada tahap empat adalah uji lapang dan sosialisasi hasil dengan ikut seminar internasional di luar propinsi lampung buku ajar kembang kurikulum rupa salah satu sumber ajar yang kandung konten 1 landas filosofi kembang kurikulum 2 landas teoritis kembang kurikulum 3 peran teori ajar untuk rancang ajar 4 model kembang kurikulum 5 evaluasi dan uji dalam kembang kurikulum 6 sumber data subyek sumber data olah data populasi dan sampel dan 7 macammacam evaluasi hasil ajar buku ajar perlu milik baca dengan kategori baik dan tari dengan kategori baik buku ajar kembang kurikulum hasil teliti ini milik baca dan tari dengan kategori baik serta tingkat efisiensi dengan kategori baik
12137,12137,['FMIPA2'],potensi tumbuhan herba yang berkhasiat obat di area kampus universitas lampung,potensi tumbuhan obat mendapat perhatian dari pemerintah dengan memberikan dukungan dalam budidaya tanaman obat keluarga toga universitas lampung unila merupakan salah satu kampus dengan luas 65 ha memliki lahan yang terdiri dari taman hijau lapangan dan halaman terbuka yang terdiri dari tumbuhan yang dipelihara maupun liar penelitian kajian potensi herba sebagai tumbuhan yang berkhasiat obat di area kampus unila ini dilaksanakan pada bulan juni sampai bulan agustus 2016 metode yang digunakan adalah deskriptif melalui metode jelajah dan pengambilan spesies penelitian dilakukan dengan melakukan observasi yang terbagi ke dalam 13 titik kemudian herba tersebut diambil gambarnya sebagai bahan dokumentasi selanjutnya dilakukan pengambilan spesies untuk identifikasi denganmengacu pada beberapa literatur hasil penelitian diperoleh 52 jenis tumbuhan herba yang telah diidentifikasi terdiri dari 26 suku yang berpotensi sebagai tumbuhan yang berkhasiat obat bagian tumbuhan herba yang paling banyak digunakan adalah daun akar dan umbi jenis penyakit yang paling banyak dapat diobati dengan tumbuhan herba yang telah diidentifikasi padapenelitian iniadalah radang demam penyakit kulit susah buang air kecil rematik dan hepatitis,['QK'],Prosiding Seminar Nasional Sains Matematika Informatika dan Aplikasinya IV,FMIPA Universitas Lampung,2016-10-27,,,id,potensi tumbuh herba yang khasiat obat di area kampus universitas lampung potensi tumbuh obat dapat perhati dari perintah dengan beri dukung dalam budidaya tanam obat keluarga toga universitas lampung unila rupa salah satu kampus dengan luas 65 ha memliki lahan yang diri dari taman hijau lapang dan halaman buka yang diri dari tumbuh yang pelihara maupun liar teliti kaji potensi herba bagai tumbuh yang khasiat obat di area kampus unila ini laksana pada bulan juni sampai bulan agustus 2016 metode yang guna adalah deskriptif lalu metode jelajah dan ambil spesies teliti laku dengan laku observasi yang bagi ke dalam 13 titik kemudian herba sebut ambil gambar bagai bahan dokumentasi lanjut laku ambil spesies untuk identifikasi denganmengacu pada beberapa literatur hasil teliti oleh 52 jenis tumbuh herba yang telah identifikasi diri dari 26 suku yang potensi bagai tumbuh yang khasiat obat bagi tumbuh herba yang paling banyak guna adalah daun akar dan umbi jenis sakit yang paling banyak dapat obat dengan tumbuh herba yang telah identifikasi padapenelitian iniadalah radang demam sakit kulit susah buang air kecil rematik dan hepatitis
12138,12138,['FP20'],kajian isi lambung dan pertumbuhan ikan lais cryptopterus lais di way kiri tulang bawang barat lampung cek similarity,sungai way kiri memiliki spesies ikan yang beragam salah satunya adalah ikan lais cryptopterus lais populasi ikan lais di sungai way kiri terus mengalami penurunan hal ini disebabkan adanya penangkapan secara berlebih yang dilakukan oleh para nelayan salah satu cara untuk mengatasi agar populasi ikan ini tetap terjaga adalah dengan melakukan upaya domestikasi sebelum melakukan domestikasi ada beberapa kajian yang harus dilakukan diantaranya adalah kajian isi lambung gut content analysis tujuan dari penelitian ini yaitu untuk mengetahui pertumbuhan dan kebiasaan makan gut content analysis ikan lais di sungai way kiri penelitian ini dilakukan pada bulan juniseptember 2015 data yang di analisis dengan menggunakan index of preponderance ip hasil penelitian ini menunjukan bahwa ikan lais adalah ikan karnivora dengan kisaran nilai ip 26% -65 pola pertumbuhan ikan lais di way kiri pada bulan juni dan juli memiliki pola pertumbuhan alometri negatif sedangkan pola pertumbuhan ikan lais pada bulan agustus dan september memiliki pola pertumbuhan alometri positif,['SH'],,"Jurusan Perikanan dan Kelautan, Fakultas Pertanian, Universitas Lampung",2016-10,,,id,kaji isi lambung dan tumbuh ikan lais cryptopterus lais di way kiri tulang bawang barat lampung cek similarity sungai way kiri milik spesies ikan yang agam salah satu adalah ikan lais cryptopterus lais populasi ikan lais di sungai way kiri terus alami turun hal ini sebab ada tangkap cara lebih yang laku oleh para nelayan salah satu cara untuk atas agar populasi ikan ini tetap jaga adalah dengan laku upaya domestikasi belum laku domestikasi ada beberapa kaji yang harus laku antara adalah kaji isi lambung gut content analysis tuju dari teliti ini yaitu untuk tahu tumbuh dan biasa makan gut content analysis ikan lais di sungai way kiri teliti ini laku pada bulan juniseptember 2015 data yang di analisis dengan guna index of preponderance ip hasil teliti ini tunjuk bahwa ikan lais adalah ikan karnivora dengan kisar nilai ip 26 -65 pola tumbuh ikan lais di way kiri pada bulan juni dan juli milik pola tumbuh alometri negatif sedang pola tumbuh ikan lais pada bulan agustus dan september milik pola tumbuh alometri positif
12139,12139,['FKIP25'],muli dalam perpektif postcolonial feminism,posisi muli yang demikian dihargai masyarakat lampung membuatnya mendapat pandangan dari berbagai macam perspektif perpektif tersebut tidak hanya mengandung unsur positif tetapi juga ada pandangan lain yang justru tidak menguntungkan posisinya sebagai seorang perempuan tulisan ini mengupas kedua perpektif itu dengan pendekatan feminis poskolonial pendekatan feminis postkolonial akan digunakan untuk melihat posisi muli dalam kehidupan adat keluarga dan sosial ketiga aspek kehidupan itulah yang nantinya akan dijabarkan dengan melihat muli yang berada pada posisi ambivalen adapun lokasi penelitian adalah labuhan ratu kabupaten lampung timur fenomena yang dijabarkan hingga saat ini bahwa posisi muli masih berada pada posisi ambivalen meskipun muli sebagai objek tidak menyadari berada pada posisi itu,['H1'],,,2016-09-24,,,id,muli dalam perpektif postcolonial feminism posisi muli yang demikian harga masyarakat lampung buat dapat pandang dari bagai macam perspektif perpektif sebut tidak hanya kandung unsur positif tetapi juga ada pandang lain yang justru tidak untung posisi bagai orang perempuan tulis ini kupas dua perpektif itu dengan dekat finis poskolonial dekat finis postkolonial akan guna untuk lihat posisi muli dalam hidup adat keluarga dan sosial tiga aspek hidup itu yang nanti akan jabar dengan lihat muli yang ada pada posisi ambivalen adapun lokasi teliti adalah labuh ratu kabupaten lampung timur fenomena yang jabar hingga saat ini bahwa posisi muli masih ada pada posisi ambivalen meski muli bagai objek tidak sadar ada pada posisi itu
12140,12140,['FKIP8'],peran orangtua dalam membangun budaya komunikasi dan kesantunan berbahasa secara informal,peran orangtua dalam membangun budaya komunikasi dan kesantunan berbahasa secara informal oleh edi suyanto email doktor edy yahoo com abstrak pergeseran tata nilai dan kesantunan dalam berbudaya khususnya konkretasi dalam berinteraksi dengan lingkungan secara evolutif terus memudar salah satu penyebab riil karena rendahnya wawasan orangtua dalam berkomunikasi mendidik dan membangun mental anakanaknya secara informal tanpa disadari perkembangan jiwa anak akan terus berkembang atau akan tergerus oleh derasnya budaya asing yang dewasa ini dengan mudah diakses melalalui pemanfaan media berbasis teknologi inilah yang menjadi persoalan krusial sementara beragamnya wawasan dan pengetahuan orangtua tidak mudah diseragamkan salah satu solusi yang dapat dijadikan rujukan adalah menghidupkan sistem tata pamong secara formalinformal untuk itu tujuan dari tulisan ini adalah mendeskripsikan sistem tata pamong dan peran orangtua dalam membangun budaya komunikasi dan kesantunan berbahasa metode yang digunakan dalam penelitian ini bersifat deskriptifkualitatif melalui teknik penjaringan data yang bersifat nontes observasi kuesioner dan wawancara terhadap responden orangtua siswa di kecamatan gadingrejo pringsewu lampung hasil penelitian menunjukkan bahwa peran orangtua dalam membangun budaya komunikasi informal dengan guru berkontribusi positif terhadap mentalitas anakanaknya di sekolah kepedulian orangtua membangun budaya komunikasi dan kesantunan berbahasa secara informal juga mampu menumbuhkan mentalitas postif dalam masyarakat memiliki sikap percaya diri dalam menghadapi permasalahan belajar karena siswa merasa belajar di sekolah maupun di rumah kata kunci peran orangtua budaya komunikasi dan kesantunan berbahasa,['H1'],,,2016-09-26,,,id,peran orangtua dalam bangun budaya komunikasi dan santun bahasa cara informal peran orangtua dalam bangun budaya komunikasi dan santun bahasa cara informal oleh edi suyanto email doktor edy yahoo com abstrak geser tata nilai dan santun dalam budaya khusus konkretasi dalam interaksi dengan lingkung cara evolutif terus pudar salah satu sebab riil karena rendah wawas orangtua dalam komunikasi didik dan bangun mental anakanaknya cara informal tanpa sadar kembang jiwa anak akan terus kembang atau akan gerus oleh deras budaya asing yang dewasa ini dengan mudah akses melalalui pemanfaan media bas teknologi ini yang jadi soal krusial sementara agam wawas dan tahu orangtua tidak mudah seragam salah satu solusi yang dapat jadi rujuk adalah hidup sistem tata pamong cara formalinformal untuk itu tuju dari tulis ini adalah deskripsi sistem tata pamong dan peran orangtua dalam bangun budaya komunikasi dan santun bahasa metode yang guna dalam teliti ini sifat deskriptifkualitatif lalu teknik jaring data yang sifat nontes observasi kuesioner dan wawancara hadap responden orangtua siswa di camat gadingrejo pringsewu lampung hasil teliti tunjuk bahwa peran orangtua dalam bangun budaya komunikasi informal dengan guru kontribusi positif hadap mentalitas anakanaknya di sekolah peduli orangtua bangun budaya komunikasi dan santun bahasa cara informal juga mampu tumbuh mentalitas postif dalam masyarakat milik sikap percaya diri dalam hadap masalah ajar karena siswa rasa ajar di sekolah maupun di rumah kata kunci peran orangtua budaya komunikasi dan santun bahasa
12141,12141,['FK1'],pengaruh pemberian tempe terhadap fraksi lemak darah pada mencit obesitas,"pendahuluan obesitas merupakan penyakit multifaktorial antara interaksi faktor lingkungan dan genetik obesitas ditandai dengan kelebihan berat badan akibat penimbunan lemak abnormal dan akan diprediksikan akan meningkat serta menjadi masalah dimasa depan metode penelitian jenis analitik true expreimental posttest control group design menggunakan sampel mencit obesitas mus muscullus l galur ddy jika data parametric diolah menggunakan oneway annova sedangkan uji korelasi kruskal wallis digunakan pada data nonparametrik data signifikan jika p 0,05 hasil sampel yang dianalisis 20 mencit pemberian tempe dengan dosis 2 gr hari dan 4 gr hari dengan nilai ratarata 190,60 8,204 mg dl dan 184,20 12,337 mg dl pada kolesterol total menurunkan kadar low density lipoprotein ldl mencit obesitas pemberian tempe dengan dosis 2 gr hari dan 4 gr hari dengan nilai ratarata 123,00 12,309 mg dl dan 144,60 13,483 mg dl menurunkan kadar trigliserida mencit obesitas pada pemberian tempe dengan dosis 2 gr hari dan 4 gr hari dengan nilai ratarata 131,60 11,971 gg dl dan 112,20 13,424 mg dl meningkatkan kadar kolestrerol high density lipoprotein hdl mencit obesitas pada pemberian tempe dosis 2 gr hari dan 4 gr hari dengan nilai ratarata 72,40 10,550 mg dl dan 77,20 10,849 mg dl semua data bermakna secara signifikan p 0,009 kesimpulan terdapat pengaruh pemberian tempe terhadap fraksi lemak darah dengan menurunkan ldl dan trigliserida serta meningkatkan hdl",['RC1200'],"JIMKI Jurnal Ilmiah Mahasiswa Kedokteran Indonesia. Volume 4 Nomer 2, Juli-Desember 2016.",Ikatan Senat Mahasiswa Kedokteran Seluruh Indonesia,2016-12,,"['obesitas', 'tempe', 'fraksi lemak darah']",id,pengaruh beri tempe hadap fraksi lemak darah pada mencit obesitas dahulu obesitas rupa sakit multifaktorial antara interaksi faktor lingkung dan genetik obesitas tanda dengan lebih berat badan akibat timbun lemak abnormal dan akan prediksi akan tingkat serta jadi masalah masa depan metode teliti jenis analitik true expreimental posttest control group design guna sampel mencit obesitas mus muscullus l galur ddy jika data parametric olah guna oneway annova sedang uji korelasi kruskal wallis guna pada data nonparametrik data signifikan jika p 0 05 hasil sampel yang analis 20 mencit beri tempe dengan dosis 2 gr hari dan 4 gr hari dengan nilai ratarata 190 60 8 204 mg dl dan 184 20 12 337 mg dl pada kolesterol total turun kadar low density lipoprotein ldl mencit obesitas beri tempe dengan dosis 2 gr hari dan 4 gr hari dengan nilai ratarata 123 00 12 309 mg dl dan 144 60 13 483 mg dl turun kadar trigliserida mencit obesitas pada beri tempe dengan dosis 2 gr hari dan 4 gr hari dengan nilai ratarata 131 60 11 971 gg dl dan 112 20 13 424 mg dl tingkat kadar kolestrerol high density lipoprotein hdl mencit obesitas pada beri tempe dosis 2 gr hari dan 4 gr hari dengan nilai ratarata 72 40 10 550 mg dl dan 77 20 10 849 mg dl semua data makna cara signifikan p 0 009 simpul dapat pengaruh beri tempe hadap fraksi lemak darah dengan turun ldl dan trigliserida serta tingkat hdl
12142,12142,,uji efektivitas daun belimbing wuluh averrhoa bilimbi l sebagai pengobatan diabetes melitus,,['R1'],MAJORITY,Medical Journal of Lampung University,2016,,,?,uji efektivitas daun belimbing wuluh averrhoa bilimbi l bagai obat diabetes melitus
12143,12143,['FKIP14'],penguasaan kosakata bahasa lampung melalui lagu anakanak populer untuk tingkat pendidikan dasar,pengenalan dan pemerolehan kosakata dalam mempelajari sebuah bahasa tergolong ke dalam hal yang sangat krusial mengingat penguasaan kosakata bahasa lampung siswa pada tingkat pendidikan dasar akan lebih mudah hafal melalui strategi pemberian lagu lagu tersebut terkategorikan lagu anakanak populer data bersumber dari lagu anak populer yang dialihbahasakan ke dalam bahasa lampung terdapat 32 lagu kr-32 lagu anak populer tersebut identik sudah dekat dengan telinga anakanak sehingga diasumsikan anakanak akan mudah untuk menghafalnya hasil analisis menunjukkan bahwa melalui pengulangan kosakatakosakata yang sering diperdengarkan memudahkan siswasiswi tingkat dasar untuk menguasai kosakata bahasa lampung terdapat beberapa kosakata dasar yang diujicobakan pada lagu lihat kebunku di antaranya yaitu lamon banyak macommacom macammacam wat ada suluh merah eppak empat ditinjau dari pembelajaran metode ini efektif dalam meningkatkan kreativitas imajinasi dan kemampuan menguasai kosakata anak karena bersifat multi sensorik sehingga whole language pun tercapai yaitu kompetensi berbicara mendengar membaca dan menulis kata kunci bahasa lampung kosakata whole language lagu anak populer,['PZ'],,,2016-09-24,,,id,kuasa kosakata bahasa lampung lalu lagu anakanak populer untuk tingkat didik dasar kenal dan oleh kosakata dalam ajar buah bahasa golong ke dalam hal yang sangat krusial ingat kuasa kosakata bahasa lampung siswa pada tingkat didik dasar akan lebih mudah hafal lalu strategi beri lagu lagu sebut kategori lagu anakanak populer data sumber dari lagu anak populer yang dialihbahasakan ke dalam bahasa lampung dapat 32 lagu kr-32 lagu anak populer sebut identik sudah dekat dengan telinga anakanak sehingga asumsi anakanak akan mudah untuk hafal hasil analisis tunjuk bahwa lalu ulang kosakatakosakata yang sering dengar mudah siswasiswi tingkat dasar untuk kuasa kosakata bahasa lampung dapat beberapa kosakata dasar yang diujicobakan pada lagu lihat kebun di antara yaitu lamon banyak macommacom macammacam wat ada suluh merah eppak empat tinjau dari ajar metode ini efektif dalam tingkat kreativitas imajinasi dan mampu kuasa kosakata anak karena sifat multi sensorik sehingga whole language pun capai yaitu kompetensi bicara dengar baca dan tulis kata kunci bahasa lampung kosakata whole language lagu anak populer
